scrapping_date,review_author,review_title,one_reviews_text,review_date,review_rating,review_helpful,review_feedback
2022-05-28 14:54:28.832552,sigmanphi,performance issues lately,Great game but lately for some reason it hasn't been running as good as it used to,Jan 4 at 8:01 PM,3, 0,
2022-05-28 14:54:28.847512,JCat,The E-Ticket of Theme Park fun!,"I purchased this when it first came out - many moons ago, and since then, the devs have updated it so many times, adding more themed attractions. It's kind of an experience/game hybrid. Walk around the park, ride different attractions and play many of the boardwalk-style games. There's a decent amount of content to explore and it does give this immerservie feeling of being at a theme park. 

The two AAA must-see attractions: The RollerCoaster and and this underwater sub-type ride. The underwater attraction alone is worth the price of admission. You'll see what I mean.... (watch for the big surprise). The Rollercoaster is more fantasty than realistic, but it's smooth and  doesn't get you sick like some of the other badly made crappy VR coasters at there.  I love just standing in front of the park map to plot out my course. The only thing I don't care for are the other park folk. They're well animated, but a bit on the creepy side. At one point, I was looking at the park map, only to turn around and have this dude right up in my face. He scared the heck out of me, to the point I screamed WTF are you doing, man?","Nov 23, 2020 at 5:07 PM",5, 4,
2022-05-28 14:54:28.863469,BrittaMcMorran,The VR Gold Standard for Amusement Parks,"If you like the amusement park/county fair experience and all of the games and rides that go with it this is the place to go.  Hands down no other VR amusement park game comes anywhere near it for quality or the sheer number of games, rides and experiences available in the park. 

This is not the kind of thing you will play through in a few hours or even a few days, at least weeks i would think, if your like me and want to get perfect scores thru all of the mini games and challenges it will probably take months.  The games are easy to understand and fun to play but quite difficult to master, not all of them but enough to make you work for it.  There are several well done play throughs on YouTube you can watch to give you some tips.

A few of the games are very replay-able and could be stand alone games sold separately.  

The developers have added two free expansions to the game that i know of.

The underwater experience/ride is incredible, don’t miss that.

You won’t regret buying this.  It will take quite a while to earn all of the achievements and find all of the hidden easter eggs (and stuffed monsters.) but it will be fun.

*No i don’t work for the developers i just really enjoy the care they took with every single detail and wish there were more games like this.","Sep 16, 2020 at 6:04 AM",5, 4,
2022-05-28 14:54:28.877432,Severonic,Immediately has a UE4 when try to start,"Sadly, I couldn't get it to run. I've never had a problem with any other VR game and I have played a LOT of VR games.","Nov 26, 2020 at 11:32 AM",1, 0,
2022-05-28 14:54:28.892392,diVeRtedthoughts00,Was looking forward to it,"I played this game a couple of years ago and it fueled my desire for VR.  Now that I have the Rift S, I downloaded the game in full excitement only to discover that it won’t launch.  I have to request a refund and am sorely disappointed.","Sep 9, 2020 at 2:55 AM",1, 2,
2022-05-28 14:54:32.024123,miriam.aramburo,I enjoyed it!,"Love the amusement park atmosphere, feels like you're actually there, especially when you pick up popcorn to munch on along the paths. I really wish you could ride the Ferris Wheel since it's the first biggest attraction you see. I hope you can add that as a ride in a future update! Defintely missed a huge part of the amusement park feel by leaving that part out. Also, wish the rollercoaster had an intense mode without motion sickness protection. Lastly, there should be a trigger for the fireworks show once you unlock night mode. I just want to be able to lay back in my chair and enjoy it. Still a fun game, defintely recommend.","Jul 25, 2020 at 3:29 AM",4, 6,
2022-05-28 14:54:32.039083,Tlozzi,Oculus WORST Customer service ever!!,"Oculus WORST Customer service ever!!

Game is terrible because my Original Oculus Rift is broken. Cable broke & Oculus support will not replace or even sell me a headset cable. Now I have a $500 paper weight!!!","Jul 29, 2020 at 12:10 PM",1, 4,
2022-05-28 14:54:32.054043,GR7FF,Not working since last update,"I have owned this game for a while and it has worked great until the last update.
Now the game won’t even start! All i get is a pop up box saying “Crashed, FATAL ERROR click Ok”","May 5, 2020 at 4:15 AM",3, 1,
2022-05-28 14:54:32.070000,Spalman_yt,Above average game!,"I really like this game, every attraction is well thought out and has some interesting games. Only 4 stars, because some mechanics feel clunky/stiff. The other guests in the park seem very robotic and do not interact with the environment at all (except for staring at each other sometimes).
The newly added Sports Island is a great addtition, but the physics feel off in my opinion, but it's overall a great, free expansion to an already diverse game. I'd definitely pick it up for it's full price (about 20$ as of the date of this review), yet alone when it's on sale.","Mar 29, 2020 at 2:56 AM",4, 3,
2022-05-28 14:54:32.084960,qwertyflooss,Great fun!,This has the best VR roller coaster I’ve tried so far. The whole VR theme park experience is executed well with all the rides and experiences being better than I expected.,"Aug 15, 2020 at 12:49 AM",5, 0,
2022-05-28 14:54:35.185761,agulage,not good,cant setup language and movement,"Sep 3, 2020 at 9:21 PM",1, 0,
2022-05-28 14:54:35.200230,Linaloli,Lots of fun,Great game lots of fun! would buy again. Wish they make more games like this one.,"Apr 13, 2020 at 4:57 AM",5, 2,
2022-05-28 14:54:35.216187,terbiume65,Beautiful theme park with its flaws,"The game manages to build a dream theme park - way too dreamy and colourful to a point that it may make you feel creepy and motion sick at times. For the most part I enjoyed the game. You can tell that a lot of effort is being put into the environment and texture design. It puts you in a beautiful theme park with all the experiences that you would expect from one. You can play with theme park games, rides, fully interactive objects like popcorn, balloons and gumball machines. There's always a bit of fun here and there and the environment is very beautiful. Nevertheless, there are some flaws. I have experienced two bugs in my first 20 minutes of gameplay. One of the AI twitches in front of one of the entrances, and the shooting game doesn't work as three sets of gun showed up at the stall and none of them shoot! (I only saw a shooting cursor from one of the guns for a split of a second all so but ultimately nothing works despite my attempts of trying to walk in and out of it). And I would agree with others that some of the stars are too difficult to get as well. One more thing is that some of the places, for reasons unknown, give me motion sickness. I found that kind of weird as I have never experienced motion sickness in VR before. There's something with the colours of sports island that just mades me sick as soon as I walk around it for 2-3 minutes. Even the roller coaster didn't cause me that. I don't know if it's just me or if anyone else has this issue too.
A further suggestion to improve this game would be adding partial multiplayer so that you can hang out with your friends or even a date in this beautiful theme park.","Feb 10, 2020 at 6:30 PM",4, 4,
2022-05-28 14:54:35.231147,Th3rOuTwAiLa,i can not play it,1 star,"Apr 24, 2020 at 7:11 AM",1, 1,"Hello Th3rOuTwAiLa! Thank you for your feedback and information about issues with Summer Funland. Can you precisely write to us what happened? Does the game not launch at all or crashes during the gameplay? As the first step, to be sure, we would like to ask you to install the latest redist on your computer. Here is the official link:
https://aka.ms/vs/16/release/vc_redist.x64.exe - in the majority of cases, it's causing problems for some users. Kind regards, Monad Rock Team"
2022-05-28 14:54:35.246107,TimSpieltVR,Too hard.,The game has a very good graphic and the most levels are really fun! But sadly there are a few star levels that are way to hard and not even possible!,"Feb 4, 2020 at 3:04 AM",3, 4,
2022-05-28 14:54:38.353383,Cjjerrkk,"keeps giving me a fatal error code,","i bought this game because my son really wanted it above all other games we reviewed yesterday, and this morning when he tried to play it it kept giving an error code. so i have to request a refund.  Ive never had to request a refund before.  i hope you fix this game for  future purchaser's.  I have a republic of gamers laptop with a gtx geforce graphics card, an an oculus rift headset.","Feb 17, 2020 at 1:24 AM",1, 0,
2022-05-28 14:54:38.369340,Sarxis,Underrated VR game of the year,"Glad I didn't keep passing Summer Funland by anymore - a lot to do and some of the best looking visuals in a VR game I've seen.  Includes some of the standard faire games like Whack-A-Mole and pistol shooting, but also has some original content (beware the psychedilic unicorn!).  The underwater ride alone was worth the price of admission!","Nov 29, 2019 at 6:12 PM",5, 5,
2022-05-28 14:54:38.384300,warsongg,great game but,"cant exit out of games , go back to square doesnt work","May 22, 2020 at 12:41 AM",4, 0,
2022-05-28 14:54:38.399260,JenJen1616,Entertaining!,This is a fun game with plenty of games to enjoy!  I especially enjoyed the underwater ride and the Hot Pot game.  I couldn't get the gates to the maze to open up however.,"Jan 17, 2020 at 1:08 PM",4, 0,
2022-05-28 14:54:38.414725,tserna101,BEST GAmE evEr,MEH LOVE DIS GAME ISH LE BEST :3,"May 16, 2020 at 11:31 AM",5, 0,
2022-05-28 14:54:41.509079,DjLonewulf,"Lots of Choices, Great Game!",So many games and great game to show new VR players.  I would honestly pay just to get more experiences like the underwater one.  Great work devs!,"Dec 12, 2019 at 12:35 PM",5, 1,
2022-05-28 14:54:41.524039,broke123,add more content please,"great game ,just need more visual roller coasters and rides","Sep 30, 2019 at 12:17 AM",4, 3,
2022-05-28 14:54:41.538999,Jesusavesouls,What a fun experience...Praise Jesus !,Very cool escaping reality to a vr amusement park.Jesusavesouls !,"Sep 3, 2019 at 7:09 AM",5, 3,
2022-05-28 14:54:41.553959,BainPD,Lonliest Amusment Park Ever,"My title is going to seem counter to my review because I actually think this game is tops; just an overall fun experience.  The rides are fun, half the time my eyes are wide open in surprise/enjoyment.  The atmosphere is semi-great.  Only in the lacking of multiplayer.  This place feels like an amusement park that's about to shut down due to lack of patrons.  Virtually no AI, no MP, so nobody is present.  Who the heck goes to an amusment park ALONE?

Other than that, great job!","May 20, 2019 at 2:18 AM",3, 10,
2022-05-28 14:54:41.568919,slammy69,Fun game!,"Devs...please include more hot chicks walking around! There is only one in the whole game, at the shooting range?! Come on... :)","Apr 30, 2019 at 4:42 AM",4, 8,
2022-05-28 14:54:44.646299,Lunaste,"Worth It, but not all of it","Would like to start off with a very well put together experience and a thank you to the Developers.
My credentials for a reliable review is that im a connoisseur of the Disneylands.
The opening gates and ambient sounds of people enjoying themselves was fantastic. Felt excitement from the beginning. 
The inclusion of NPC's walking around was a fantastic idea because it would be very offputing if it was a ghost town.
But about the content.
You put almost a dozen well put together games into one. Like The Climb to name one. 
But after my joy and fun of this game, i don't feel like there was enough to it. I dont think it was quite worth the $20 I spent. It was lacking in putting depth into the attractions (the space one).
The Maze just felt like hard work with no rewards (visual, points, temporary apparel or gags).
 I think linking any of the scores of the mini games to a leaderboard would even add a nice touch.
I may be ignorant of the activity of the devs, but I hope my contribution is motivation to add more playable content instead of overpriced DLC.
TLDR:
I dont regret buying it, but the rides are a one time enjoyment, but to get its worth ill have to watch friends and family enjoy it until more content is released. 
Thank you for your hard work on this game!","Mar 12, 2019 at 12:59 PM",5, 13,
2022-05-28 14:54:44.662256,Dirckinator,"Definitely worth the price, lots of fun","My partner wanted a roller-coaster VR experience after reminiscing about the Tokyo SkyDeck/ SkyCircus VR experience, and after looking through the roller-coaster options we decided to buy this. Although the 'normal' rollercoaster is only fairly good (the speed seems off a couple of times), the rest of the experience is excellent (although maybe the 'steady-hands' maze thing could be improved). This game has been the most used VR game in our house so far, followed by Skyrim VR and Robo Recall. The semi-hidden rainbow unicorn ride is a great alternative to the 'standard' roller-coaster too. I hope the developers provide updates or even create expansions and I'd happily pay for them if they did.","Feb 18, 2019 at 10:21 AM",5, 5,
2022-05-28 14:54:44.677216,Drutten,Very versatile and well made game,I bought this game since it seemed to have some higher quality coasters than you normally see in the store. I wasn't disappointed and the regular coaster and under water one are the best looking ones I've tried so far. On top of that I got some real good mini games utilizing some good VR mecanics such as a shooting range and a fruit ninja style fruit cutting game to name a couple. All very well executed with graphics well above average.,"Dec 9, 2018 at 2:41 AM",5, 4,
2022-05-28 14:54:44.694171,nightcat.mau,Open Letter To Dev,"Since your website refuses to take my e-mail: 

To Whom It May Concern,

I'm wondering if it would be possible to unlock the night mode in the game. As I stated in a previous review via the Oculus Rift I have vertigo and other disabilities which make some aspects of the game unplayable. Try the shooting range with essential tremors (shaking hands) and you’ll see what I mean. There’s no way to control the tremors so it isn’t a case of me having to “get gud”. 

And my vertigo makes the tower impossible, I can’t even get on a step stool in real life and there’s really no fixes you can do on your end for either problem. So I’d appreciate it if you’d consider making night mode possible. I’d fix it myself to save you any effort but someone was smart enough to code the game in advanced gobbelydygook. 

Regards,
Nightcat","Oct 24, 2018 at 8:54 AM",2, 15,
2022-05-28 14:54:44.709131,Scooby-Doo,multiplayer,I would have given this game a 5 star but without multiplayer it's a little boring. Don't get me wrong the rides are FRICKEN amazing but with multiplayer it would be like you're in disneyland socialising with people. Other than that I don't have anything bad to say about it,"Sep 28, 2018 at 10:11 AM",4, 16,
2022-05-28 14:54:47.808477,Anubisheart,Fantastic,"I love this program. It really does have something for everyone.  My personal favourite is the Undersea Adventure as it has excellent graphics with a nice fantasy element added, something I wish the other undersea programs would do more. The Space Adeventure, while short, also has lovely graphics (they all do really), and if you're a Batman fan, you'll get to ride through Gotham on his Batbike. When I bought it I was happy with what it offered, but low and behold, they've kept updating it with new content farely regularly. I would thoroughly recommend this one, whether you like games and puzzles, or like me, prefer to sit back and experience things, this has it all.","Oct 23, 2018 at 12:38 AM",5, 4,
2022-05-28 14:54:47.823437,Kelpius,Immersive,"In love with the little details that make this a completely rounded out experience. It really feels like spending the day at a familiar amusement park, and the free locomotion/exploration is honestly what makes it perfect. One of my favorite games so far.","Sep 29, 2018 at 11:19 PM",5, 4,
2022-05-28 14:54:47.838397,Heart$,If you want a game filled with games...,"Sumer Funland is awesome!  The game was fun for me and my family.  I loved the  theater and rollercoasters; however, I disliked the Pony Ride.  A suugestion would be to add more roller coasters, puzzles, movies, etc...  I would love to see an arts and crafts area.  Thank you for an awesome game!","Aug 31, 2018 at 7:52 AM",5, 6,
2022-05-28 14:54:47.854354,Dirtyundies,my son loves it,"my son loves this game, he would love to see some dodge carts, race karts or vr golf :)

Edit: they always update this game, its great!","Aug 24, 2018 at 2:53 AM",5, 5,
2022-05-28 14:54:47.870311,PoolfanVr,"A polished, fun experience","This minute you start playing this game you can see it is a polished product, the graphics are great and the cartoon-ish feel and music/fx really give you a feeling of being in a theme park.   Essentilly this is collection of experiences/mini-games tied together and packaged into a theme park.   The sit back and enjoy rides are all pretty good and the games are all fun very varied. One minute I was bopping penguins on the head, the next trying to climb up the exterior of a light house.

The downside is that it won't take you a huge amount of time to complete and once you do there is perhaps little repeat value but it works well as a demo to show off to friends and if you have kids I think there is far more longevity as the games are reasonably difficult but would be challenging for kids.

Overall a charming experience and really enjoyed it.","Jun 26, 2018 at 4:14 AM",4, 5,
2022-05-28 14:54:50.960179,Lugan2005,Such a relaxing game!,"This game's great!  I always want a game, I can come from work,  take all my frustrantons out on it!!!","Jun 13, 2018 at 8:58 AM",5, 4,
2022-05-28 14:54:50.978131,mcfil,Oculus remote,"Oculus remote doesn't work when my touch ON or in standby!!!!
this is a problem that other developers have solved in one day. But Monad Rock refuse to make fix...","May 9, 2018 at 4:38 AM",1, 3,
2022-05-28 14:54:50.994089,FastLawyer,Updated game is much better,"UPDATED REVIEW:  

First of all, the underwater submarine ride has been updated and it's now better than ever.  The gotham bike ride is also better.  The rollercoaster ride is also much better and vastly different than the original.  The shooting game is still not so good, but it's better than what it was.  You get to punch squirrels.  Seriously.  You get to punch squirrels for points.  There's a climb tower game that looks awesome, but the climbing could have been done better.  You get to whack moles with two mallets!  You enter candyland and bat candies into huge targets.  It's a very beautifully rendered candy land.  You ride a unicorn while jousting in a retro neon style that may make you go colorblind or make you think you are tripping on shrooms!  Amazing ride.  You throw a ball into lava holes.  You look for lost toys.  And best of all ... .they took out PewDiePie!  WOAH!  I added one more star just for that.  

Old Review Below: 

1.  Underwater ride - You are in a an old-fashioned, small submarine taken on an epic, wild ride, where you tour an underwater world full of mystical creatures, plants, and ancient, mysterious structures.  You'll want to show this ride off to friends and family to show the power of VR.
2.  Gotham ride - you are in a batmobile like ride/vehicle where you zip across the streets and subterrenean areas of Gotham city.  This would have been awesome if you could actually drive it.
3.  Rollercoaster ride - a pretty well done rollercoaster experience across the amusement park
4. A below-average shooting gallery where you can finally use your Oculus Touch controllers to shoot some cardboard things that pop up and move around, you can also shoot the cowgirl next to you (but no damage to her)
5.  An awful VR cinema experience where you're basically watching YouTube ads for G2A.com and Pewdiepie ... Just avoid this altogether, they should pay you to watch this","Mar 4, 2018 at 3:49 AM",5, 9,
2022-05-28 14:54:51.009048,mysticqueen74,Strictly Awesome!,"I have NEVER seen anything this amazing in Virtual Reality. My mouth was open during the rides and I actually screamed a few times. The underwater ride was so scenic, suspenceful and majestic. I was really hoping for something like this to be created. The atmosphere reminded me of a classic, charmining amusement park mixed with the modernity of today. I want to thank the creators of this wonderful project. You guys rock!","Mar 17, 2018 at 5:18 PM",5, 4,
2022-05-28 14:54:51.025006,crooklynBUM,,very fun  all games are very good the under water experience is great except for the roller coaster its ok unfortunately but the deal breaker is the AI'S  that are with you on the ride they are very annoying cause they scream and its too loud and too much,"Apr 21, 2018 at 3:08 PM",4, 1,
2022-05-28 14:54:54.141729,Rosewyne,So much better now!,"All the G2A ads are gone and there's much more to do.  The new climbing attraction is cool.  Finding the little monsters is a fun addition too.  My favorite is still the underwater ride but I'm much happier with this game after the new update.
------------------------------------------------------------------------------------------


Original review:  The underwater ride and rollar coaster is good.  The theater was a disappointment.  It's an endless G2A commercial.  The G2A ads plastered everywhere within the game are annoying.","Mar 21, 2018 at 8:00 AM",5, 7,
2022-05-28 14:54:54.156689,edutrainer10,Highly developed immersive experience,"This game is absolutely fantastic.  With a nice sampling of games and activities, I have thoroughly been enjoying the experience.  While I feel it could use a couple more items to engage with, the offerings that are available are free from glitches, odd visual  artifacts, and garner some replayability.  I would love to see some increasing difficulty built in or a little more depth.  Great work with this!  The visuals are just stunning.  Do not hesitate on buying this one.","Mar 28, 2018 at 9:31 PM",4, 0,
2022-05-28 14:54:54.173644,supatrupa,Nice updates make it more worth it.,"It's a nice demo app for VR. Probably not a lot of replayability, but I spent an hour in it easily checking out all the experiences, and I've done them all 3-4 times. It is pretty decent graphics and it is fun to stroll through the tiny little park. There is a pretty awesome submarine ride and batman motorcyle ride. There is a climbing wall, shooting arcade, and several wack-a-mole type carnival games all with touch support. If you are looking for a fun roller coaster, don't bother. Coaster is totally unrealistic and in my opinion just ridiculous.","Mar 31, 2018 at 1:41 PM",4, 1,
2022-05-28 14:54:54.189601,pabe05,What an improvement!,"Graphics are outstanding.  (something off on the other review that knocked them)(mine 980ti)  Park is vast.  Cinema outstanding especially the underwater one.  Games are ok.  Climbing also outstanding trying to best your time.  One of my favorites.
 Also had trouble starting but got it to go by restarting the Oculus software.  Some games are easy to cheat on. Morphing is unpredictable at where and what direction you will land. 
Found a way to be able to walk out  to the balloons and beyond in the sky.","Feb 25, 2018 at 9:16 AM",5, 4,
2022-05-28 14:54:54.207553,ParadiseDecay,Review score changed from 1 - 5!,"My Original review of this game was 1 star as it was under the name of the scammer website G2A. However it has now been taken over by a reputable games company and gets 5 stars for all the added bonus attractions. This game features probably the best VR rollercoaster to date in its Underwater ride and this rollercoaster features in my TOP 10 VR coasters.... it's superb!

Below is my first impressions of this new revamp!
https://www.youtube.com/watch?v=JozYj4Qs9J4","Mar 17, 2018 at 2:03 AM",5, 0,
