scrapping_date,review_author,review_title,one_reviews_text,review_date,review_rating,review_helpful,review_feedback
2022-05-28 14:54:57.296343,MAJ161.RED,Can't get past loading screen UPDATED,"I loved the original version of this and was thrilled to see it was being updated with more content. When I tried to run it, I got the loading message but the screen froze.  It didn't load. UPDATE:  I deactivated the new Oculus Home and went back to the simpler Home menu (the room with the rug) and Summer Funland loaded with no problems. Since then there was an Oculus update - and I reactivated the new Home menu (with rooms and stuff). Summer Funland still loads fine. Whether that's because I restarted Home or because of the update, I dont know.
Well - what do I think of the experience? As I said I loved the original version. It was one of the first experiences I would show friends - after First Contact and The Blu. The rides were  a great way to introduce newbies to VR.
The underwater ride is still great but seems to have improved sharper and clearer graphics. I'm noticing things I didn't before. Same for the Batman bike ride. Also, the way they are presented -in a lobby, with models of the sub and batbike to look at, puts them into a much more interesting context. The roller coaster too benefits from clearer graphics and and a lobby. The new ride, set in space, is de;ightful - and the way it unfolds is spectacular.
The old, really bad, cinema experience is gone - replaced with a smaller cinema showing game credits. I think that's a wasted opportunity and the screen could be put to better use. Game or film trailers perhaps.
The shooting range is much the same but now the guns reload themselves.
The new funfair games are fun though you probably won't play them more than once or twice. Younger children might like them.The lighthouse game is interesting. I only tried it once and didn't reach the top yet. It could be a good ""beat your last score"" game. The Rainbow Unicorn ride is fun, though I won't play it again. 
All in all, it's much better.But is it worth the price? I got it as a free upgrade of G2A LAND. I like it.","Feb 26, 2018 at 4:28 AM",5, 4,
2022-05-28 14:54:57.311303,Worpath,Perfect for kids,My youngest (2 & 5) absolutely love the hot air ballon ride.,"Apr 5, 2018 at 2:09 PM",5, 2,
2022-05-28 14:54:57.327260,Anderas,Much better after the update,"I bougth this game/experiences on sales, then I was was like: why did I  buy this.
But now I´ve got the answer! After last update it's far away better, better graphics, resolution scale options, new little games and experiences...","Mar 17, 2018 at 8:36 AM",4, 0,
2022-05-28 14:54:57.344215,grekb,Its kinda old,"Most of the attractions are not interactive and the graphics are not that good. Even if you enable supersampling 2.0 from oculus tools its still not that good and gives you the impression its from an old graphics engine. The interactive minigames are ok but nothing special. Compared to NVIDIAfunhouse, witch is free, they are not that fun. It was also weird that in a fun park there were no kids, just adult ""babes"". Overall the ideas behind the minigames and the scenarios of the non-interactive attractions(especially the underworld and the batmobile) were good but it seems that they werent executed that well and they were lacking polishing. If you want some minigames for your kids get NvidiaVRfunhouse for free. It has better graphics, more games, more fun. If you want to see some non interactive scenes for 5-10 minutes i guess you have a reason to buy it.
Game: 2/5
Credits Music: 5/5 (amazing track!)","Feb 24, 2018 at 9:07 PM",3, 1,
2022-05-28 14:54:57.361170,Chetso,Not worth the money AT ALL,"Paid for this game thinking, ""Wow, this actually sounds cool"" didnt bother to read the reviews which i regret, i played everything in about 10 minutes, the cinema is bs, just an advert for their website, the underwater dive was boring, the rollercoaster was boring, the shooting range was the most interactive game and wasnt even that interactive nor fun to do and considering onward is free with the oculus, a half arsed shooting range isnt something we need, and the gotham city bike ride? My god... If you are considering buying this game, dont.. there are a lot of free games out there that are a lot more fun, and look a lot better.","Jan 12, 2018 at 6:48 AM",1, 7,"Hey!
We're continuously improving Summer Funland, basing on your feedback. We've just released a big new update, which not only fixes various bugs, but also features new attractions and improvements to the gameplay. Make sure you check them out! We are still working on new attractions that will be available in the future.
Hope you'll like the new update!
Monad Rock Team"
2022-05-28 14:55:00.468466,Nytek12110,Beautiful - Vast Improvement,"This new update added greater detail, clarity, and pixel density than most of the other VR titles that I've experienced so far. The underwater ride,  cycle, and rollercoaster were given a superb nip and tuck. The new unicorn joust is surreal and gorgeous. Being able to cram that much detail and smoothness into these brief experiences makes me wish the company would put out a full-fledged AAA title.

Update: What happened?! 
The update with the new attractions and graphic refresh (1.1.0.10737) was amazing. Then there was another update the next day (1.2.0.2524) which just put back the original version before the update. Please tell me you're going to put the updated version back. It was the best collection of experiences I've seen on the Oculus so far and when I went back to it again, they were gone.","Feb 11, 2018 at 3:48 AM",4, 5,"Thanks for the feedback, we're so happy you loved the update! We're still working on the game. Stay tuned and be patient – the new version will be out soon! �"
2022-05-28 14:55:00.486420,massimagnus,Lot of fun!,Killer app to play VR demo with friends. More attractions please!,"Mar 21, 2018 at 10:19 PM",5, 0,
2022-05-28 14:55:00.504369,becklarae,Fun game,"This is a fun game, underwater graphics are amazing. Good for the price.","Feb 24, 2018 at 7:07 AM",5, 2,
2022-05-28 14:55:00.521325,Meister93,"LowLevelFatalError"" bugs","hi, i using HTC Vive + revive to play this game. its work fine last year when i bought which call G2A Land, because i remember this game came out on oculus first but after the game change to Summer Land i have this issue LowLevelFatalError or Fatal Error came out, did reinstall the game & oculus + update revive didnt solve my problem. dev if you could help out this problem, i will change rating to 5star :)","Apr 11, 2018 at 4:43 AM",1, 2,
2022-05-28 14:55:00.539276,moabdave1,surprize,"I have had this for a while and havent tried it, what a mistake that was it was alot better than reviews were saying and even if there was short experiences. all 5 were great graphics that move fast so becareful for the motion sickness, I have gotten use to that from other vr","Dec 17, 2017 at 5:31 AM",5, 0,
2022-05-28 14:55:03.639559,7unnix,Paying for a 15 min advert? Really?,"Even at the sale price of £3.99, this 15 min long advert for G2A is terrible value. Yes the 3 min underwater scene is nice, but this whole 'game' is nothing but a quick sample of G2A's work and nothing more. Certainly not something we should be paying for?! DO NOT BUY.","Oct 1, 2017 at 8:06 AM",2, 12,"Hey! We're continuously improving Summer Funland, basing on your feedback. We've just released a big new update, which not only fixes various bugs, but also features new attractions and improvements to the gameplay. Make sure you check them out! Also, the game no longer features any kind of branding or product placement. We are still working on new attractions that will be available in the future. Hope you'll like the new update! 
Monad Rock Team"
2022-05-28 14:55:03.656513,sebrk,This should probably be free,This whole game is a stationary commercial for G2A. The Underwater experience was cool. The rest not worth looking at. I'm not going to refund this because I support VR. But this is not worth the money.,"Sep 30, 2017 at 6:28 AM",2, 11,"Hey! We're continuously improving Summer Funland, basing on your feedback. We've just released a big new update, which not only fixes various bugs, but also features new attractions and improvements to the gameplay. Make sure you check them out! Also, the game no longer features any kind of branding or product placement. We are still working on new attractions that will be available in the future. Hope you'll like the new update! 
Monad Rock Team"
2022-05-28 14:55:03.676460,tico_ssa,Doesn't work after update,"It was a perfect showcase for first users, now after the update it doesn't even enter the game anymore, fatal error! message. fix it or i call a refund.","Feb 26, 2018 at 8:07 AM",1, 3,"Hi tico_ssa, thank you for your report!
We are looking into this issue. Maybe it's similar to the problem user ""michaeljon"" had?
Check out his solution and see if it works for you:
""I deactivated the new Oculus Home and went back to the simpler Home menu (the room with the rug) and Summer Funland loaded with no problems. Since then there was an Oculus update - and I reactivated the new Home menu (with rooms and stuff). Summer Funland still loads fine. Whether that's because I restarted Home or because of the update, I dont know. ""
Please send us more details to office@monadrock.com.
Cheers,
Monad Rock Team"
2022-05-28 14:55:03.698401,Dot80,I liked most of it.,My favourite section is the underwater one with just one or two scary spots. Mostly it is quite calming. I also found the roller coaster module fun without making me feel sick. This is a good game to let your guests have a first experience of VR.,"Oct 23, 2017 at 3:41 PM",4, 0,
2022-05-28 14:55:03.715356,Jackspcs,agree should be free,whole experience can be done in less that 15 minutes and most is NOT interactive. one whole section is nothing but advertisment for G2A. the roller coaster is so so but there is only one. free would have been the only way I would recommend this title. if they want money they need to remove all of the adverts and branding throughout.,"Oct 3, 2017 at 2:06 PM",2, 4,"Hey! We're continuously improving Summer Funland, basing on your feedback. We've just released a big new update, which not only fixes various bugs, but also features new attractions and improvements to the gameplay. Make sure you check them out! Also, the game no longer features any kind of branding or product placement. We are still working on new attractions that will be available in the future. Hope you'll like the new update!
Monad Rock Team"
2022-05-28 14:55:06.833619,dunkleybt,Bad,"very short for the price, apart from the shooting gallery not at all interactive, and the 'great cinema' section is basically one giant advert - avoid.","Oct 30, 2017 at 9:21 AM",1, 1,"Hey!
We're continuously improving Summer Funland, basing on your feedback. We've just released a big new update, which not only fixes various bugs, but also features new attractions and improvements to the gameplay. Make sure you check them out! Also, the game no longer features any kind of branding or product placement. We are still working on new attractions that will be available in the future.
Hope you'll like the new update!
Monad Rock Team"
2022-05-28 14:55:06.850574,alrick3000,Underwater attraction is THE BOMB!,"If you are a sucker for VR experiences, then by all means get this (at it's current sale price of 4.99). The underwater attraction is THE bomb! Definitely one of the most immersive experiences I've had in VR. I daresay it may even be better than theBlu when it comes to eliciting awe. The sound design is topnotch and very well complements  the above average visuals (slightly inferior to theBlu's). Unfortunately, it is the only attraction worth paying for. The rest felt like free demos. At it's sale price, this title is a no brainer. Take note that this is more for people who enjoy VR experiences, not gamers. It is hardly interactive, if at all.","Sep 29, 2017 at 1:44 PM",4, 1,
2022-05-28 14:55:06.868526,Kevin_Brook,Good at the sale price,"Picked this up in the sale for a couple quid thinking it might be another Dreamdeck, Face Your Fears type VR experiences showcase that I can show off to people new to VR. That is pretty much what it is. The cinema and shooting range are rubbish but the rides are great. I enjoyed the roller coaster and Gotham ride scene but the star is the underwater scene. I've personally done it three times now and the big sea monster makes me jump every time. Not sure if I'd pay the standard price but in this weekend's sale if you're looking for a few quick experiences to demo VR to friends and family I've not come across much better than the underwater ride on this.","Oct 1, 2017 at 1:11 AM",4, 0,
2022-05-28 14:55:06.885481,davidtriune,You basically pay for 3 main attractions,"2 of which are are really short, 2 minutes each, like real rides, but the underwater one was fantastic, about 5 minutes long. Wouldve looked a lot better if they used the UT engine instead, but good animation nonetheless.","Sep 18, 2017 at 5:25 AM",5, 0,
2022-05-28 14:55:06.903433,ColinB,Not working,"Today just error messages !
Please beware of this when purchasing !
Wait until it has been fixed. Then buy it.



UPDATE......UPDATE...... 29/June 
All working again and even better !
New stuff and great quality.
Five stars","Jun 29, 2017 at 12:13 PM",5, 2,"The new version of G2A Land is now available! We solved the crash issue with the newest Oculus SDK and added a few other updates to the game. We are also planning to add new attractions to G2A Land soon, so keep an eye out for those. Until then, thanks for your patience and happy playing!"
2022-05-28 14:55:10.000815,ghewgley,Lots of fun stuff,This is a very solid game with each area a nice stand alone game being actually really good. Well woth buying.,"Jul 29, 2017 at 12:35 AM",5, 0,
2022-05-28 14:55:10.017280,JAMM411,,It's worth it just needs more attractions and the ability to walk around the park.,"Jul 28, 2017 at 6:15 AM",5, 0,
2022-05-28 14:55:10.034235,rrojasf,why??? game Crash,"fix g2a for 4 stars until

error:
LowLevelFatalError
Unreal Engine in exiting due to D3D device being lost Error : 0x887A0006-!HUNG

Only with this game","Jun 19, 2017 at 7:41 AM",1, 2,"Hey! We're continuously improving Summer Funland, basing on your feedback. We've just released a big new update, which not only fixes various bugs, but also features new attractions and improvements to the gameplay. Make sure you check them out! Also, the game no longer features any kind of branding or product placement. We are still working on new attractions that will be available in the future. Hope you'll like the new update! 
Monad Rock Team"
2022-05-28 14:55:10.053184,OhhGolly,Wasted money,Game keeps crashing,"Jun 14, 2017 at 12:05 PM",1, 2,"Hey! We're continuously improving Summer Funland, basing on your feedback. We've just released a big new update, which not only fixes various bugs, but also features new attractions and improvements to the gameplay. Make sure you check them out! Also, the game no longer features any kind of branding or product placement. We are still working on new attractions that will be available in the future. Hope you'll like the new update! 
Monad Rock Team"
2022-05-28 14:55:10.070139,Serendip,Amusement Park fun without the crowds,"Just picked this up: The rides are fast paced, it's a lot of fun and looks/feels like a real amusement park.

IMO: The controversy about stolen keys is like saying ""ebay is bad because some people sell stolen items.""

Complaining about G2A ads is ridiculous.","Apr 27, 2017 at 10:58 PM",5, 2,
2022-05-28 14:55:13.162457,Dondorius,fatal error since today,dont know why but the game crashes everytime since today...,"Jun 10, 2017 at 6:17 AM",4, 3,"The new version of G2A Land is now available! We solved the crash issue with the newest Oculus SDK and added a few other updates to the game. We are also planning to add new attractions to G2A Land soon, so keep an eye out for those. Until then, thanks for your patience and happy playing!"
2022-05-28 14:55:13.180409,ksn,Good VR stuff,"We have good quality VR experience.
But not sure it costs 10 bucks anyway, many products offer much more content for this price.","May 3, 2017 at 1:16 AM",4, 2,
2022-05-28 14:55:13.198361,Brian73,garbage!,"wasted $10 on this! Im sure pewdiepie is getting his cut. I thought the theater will play my own movies, but instead your forced to sit and watch a youtube video of pewdiepie! WTF 

 The graphics in the overall game arent that great either. This should be $3 max!","Jul 12, 2017 at 9:35 AM",1, 7,"Hey! We're continuously improving Summer Funland, basing on your feedback. We've just released a big new update, which not only fixes various bugs, but also features new attractions and improvements to the gameplay. Make sure you check them out! Also, the game no longer features any kind of branding or product placement. We are still working on new attractions that will be available in the future. Hope you'll like the new update! 
Monad Rock Team"
2022-05-28 14:55:13.215315,julezeve,Upset,"It's fun to play once and then that's it. The underwater ride is the only thing really worth doing. You can not walk through the park, you can not interact with anything or anyone. Very upset, not worth buying.","Mar 30, 2017 at 3:30 AM",2, 3,"Hey! We're continuously improving Summer Funland, basing on your feedback. We've just released a big new update, which not only fixes various bugs, but also features new attractions and improvements to the gameplay. Make sure you check them out! Also, the game no longer features any kind of branding or product placement. We are still working on new attractions that will be available in the future. Hope you'll like the new update! 
Monad Rock Team"
2022-05-28 14:55:13.233775,ManMythLegend,Fun Theme Park Adventure,Worth it for the Underwater ride alone.,"May 7, 2017 at 10:37 AM",5, 2,
2022-05-28 14:55:16.371980,Sendrr1,I don't believe in anything here,"Voices sound fake, motions feel fake, environment sounds don't match the environment. Main menu is good though","Apr 8, 2017 at 7:14 AM",1, 2,"Hey! We're continuously improving Summer Funland, basing on your feedback. We've just released a big new update, which not only fixes various bugs, but also features new attractions and improvements to the gameplay. Make sure you check them out! Also, the game no longer features any kind of branding or product placement. We are still working on new attractions that will be available in the future. Hope you'll like the new update! 
Monad Rock Team"
2022-05-28 14:55:16.390929,STLOculus,,What a pile of garbage this was. Lost $10. A one time play through. Can't walk through the park. There are a few different rides and it's over. Graphics aren't up to par either. Total fail. DEMAND REFUND!,"Mar 10, 2017 at 1:16 PM",1, 4,"Hey! We're continuously improving Summer Funland, basing on your feedback. We've just released a big new update, which not only fixes various bugs, but also features new attractions and improvements to the gameplay. Make sure you check them out! Also, the game no longer features any kind of branding or product placement. We are still working on new attractions that will be available in the future. Hope you'll like the new update! 
Monad Rock Team"
2022-05-28 14:55:16.408881,randito3,Experience good->Flashing icon bad,"I like the experience but have one issue.  There is a flashing icon in the middle of view that does not stop flashing through the entire experience.  I've tried everything and cant find a solution. 
Update: was contacted by the company and they stated that if using more than one sensor you can get the flashing icon nonstop.  They said to move closer would solve it.  I tried moving closer that did not work so I moved WAAAY back and the icon stop flashing and I was able to enjoy the experience.  Hope this helps others having same issue.  Also, the underwater experience is really well done and so is the Batmobile.  Looking forward to more stuff like the underwater experience.  Updating my stars from 3 to 4 because of the Underwater experience and quick assistance from the company.  THANKS!","Feb 21, 2017 at 2:15 AM",4, 5,
2022-05-28 14:55:16.427831,wlcling,It's actually pretty good!,"This is a great demo kit that by large has a great underwater adventure experience that you should definitely not miss, and other VR norms that you may want to demo (i.e, Cinema, roller-coaster, gotham ride, shooter).","Feb 16, 2017 at 11:04 PM",5, 1,
2022-05-28 14:55:16.445783,dalles5566,Very Good,"It is a good game for the guests in your house who trying to experience VR. It is not a game at all. You just following the path. Very detailed roller coster and exploring deep sea. It would be good, if it is free. But I don't mind to play 10 Dollars for my friends who trying to experience VR.","Jan 15, 2017 at 12:24 PM",5, 6,
2022-05-28 14:55:19.546095,delaser,,One of my favorites-never get tired of it.,"Mar 15, 2017 at 12:44 PM",5, 3,
2022-05-28 14:55:19.564553,Daxxinn,Absolutely Amazing!!,"One of my favorite experiences on the rift so far! Beautiful graphics, fun rides, It can only get better from here, best $10 spent in this store!!","Jan 12, 2017 at 5:41 AM",5, 10,
2022-05-28 14:55:19.583503,Roly_Poly,Dont lisen to Negatives,"Its a Experience. not a game.
It gets more atractions. can see that on g2a land site somting

the underwater atraction is incredible. if like theblu or any underwater vr games, the underwater atraction is we worth the 10,-

as other revieuwer stated. its indeed a must see all atractions, then its a perfect experience to show new ppl. to brag and showof

and indeed, the best 10,- i spend on oclus store

Just buy it. 
PS: yea the start menu is prety horible grapics.  but think its based on the GTX970 90 fps rule , if set sdk  tools thingy to higer its super good. alto its only the menu whats seems to be set to lower resolution, atractions themselfs are just good. but when set sdk tools to like 1.7. boy oh boy. didnet see anything near this good on vr:)","Jan 24, 2017 at 12:54 AM",5, 1,
2022-05-28 14:55:19.604447,vitualfiutare,No - just bad,"Poor graphics and ridiculous ""gameplay"". Very unrealistic Rollercoaster (compare to NoLimits2) Shooting is a joke - if you know ""Dead & Buried"", just this Gotham-Thing is a little bit -ehm - neat. 
Miss it. 10 Bucks for nearly nothing.","Jan 21, 2017 at 3:08 AM",1, 4,"Hey! We're continuously improving Summer Funland, basing on your feedback. We've just released a big new update, which not only fixes various bugs, but also features new attractions and improvements to the gameplay. Make sure you check them out! Also, the game no longer features any kind of branding or product placement. We are still working on new attractions that will be available in the future. Hope you'll like the new update! 
Monad Rock Team"
2022-05-28 14:55:19.623396,particle67,Short but great experience,"Nice surprise with this G2aLand. 
I liked the ride under the sea, very immersive and top quality
My friends will be happy...","Feb 6, 2017 at 12:04 AM",4, 4,
2022-05-28 14:55:22.768577,shanders845,brilliant,"brilliant little test game wish there was more to do the roller coaster ride is brilliant, actually better than no limits 2 hope they bring some kind of full theme park game out","Jan 27, 2017 at 12:24 AM",5, 2,
2022-05-28 14:55:22.784534,thekjun1,Great Graphics,"Good Job on Graphics, Pretty Quick Game Play though, Would like to see more interaction with touch controllers and be able to explore don't know if I would agree if this is worth the price as of right now","Jan 15, 2017 at 2:29 AM",3, 1,
2022-05-28 14:55:22.800491,qotsatcv,,pretty good 4 stars,"Jan 13, 2017 at 7:33 PM",4, 3,
