scrapping_date,review_author,review_title,one_reviews_text,review_date,review_rating,review_helpful,review_feedback
2022-05-28 11:33:34.996835,reallyfatrat,eaeaea,aeeaeae,"Mar 2, 2019 at 6:37 AM",5, 1,
2022-05-28 11:33:35.013789,TheInfinityGauntlet,REEEEWEE,Food,"Feb 18, 2019 at 6:10 AM",5, 5,
2022-05-28 11:33:38.121551,360turn,good for first time,"this is good for your first time playing vr, controls are amazing. When i was playing this, i got LOST in how realistic this was. a few times i thought i was actually doing these things. easly a five star game. 6 if possible.","Dec 27, 2018 at 7:22 AM",5, 4,
2022-05-28 11:33:38.139502,Spalman_yt,Probably the best game for VR,This game has a lot of hidden eastereggs and the details are amazing. You can almost interact with any object as the game gives you whole freedom. I love the fact that the night mode adds more stuff and counts your tasks done. Really hope that updates will add even more!,"Nov 12, 2018 at 5:05 AM",5, 12,
2022-05-28 11:33:38.155460,rokopro2331,god,god,"Jan 21, 2019 at 10:53 PM",5, 3,
2022-05-28 11:33:38.172414,jerdna1972,cool,great,"Jan 21, 2019 at 8:27 AM",5, 3,
2022-05-28 11:33:38.189369,Matthew18288,A MUST BUY,Just buy it now. you WILL NOT regret it,"Jan 16, 2019 at 1:17 PM",5, 1,
2022-05-28 11:33:41.280188,HexLonoi,Terrible mapping,I was always too y’all to play it but I’m actually smal so y am I going out the map,"Jan 5, 2019 at 10:55 AM",2, 1,
2022-05-28 11:33:41.297143,Milam06,Amazing,I would recommend this as the first game to play when getting VR,"Dec 27, 2018 at 7:18 AM",5, 3,
2022-05-28 11:33:41.313101,jordan553,my hight,hight was off by a little and could not recalabrat high,"Jan 6, 2019 at 12:04 PM",4, 1,
2022-05-28 11:33:41.329058,meuliano,Simply Incredible (beyond a game),"I have a cousin with Down Syndrome, so I put the headset on him and let him play this game. Not only was he able to understand what to do, this game gave him the ability to perform semi-realistic tasks that he is generally uncapable of doing outside of virtual reality. He once was playing that game for four hours straight. He was talking to the robots like he was actually there saying ""Your Welcome!"" after he would make them a fancy sandwich or fixed up their car, or what have you. I couldn't spend that much time in the game, but it is interesting and pretty funny what it lets you do. It just makes me so happy to see my cousing having so much fun in situations he would never be in otherwise.","Jul 11, 2018 at 2:26 AM",5, 683,
2022-05-28 11:33:41.347010,blimpslap,Yeah it's great!,"Great intro to VR. not super dependant on having a lot of room, just a bunch of dumb fun stuff to mess around with!","Sep 9, 2018 at 12:22 PM",5, 2,
2022-05-28 11:33:44.450780,YUmaTasTa,Fun,"My sister and I have fun taking turns playing the different jobs. Although there are not many hours of gameplay, it is one of those games that you can replay, or share with friends. Great game to get if you are new to vr. It has humor and the controls are flawless.","Jul 3, 2018 at 5:25 AM",5, 22,
2022-05-28 11:33:44.466738,FlerBaDer,Great,it good game,"Aug 29, 2018 at 5:40 AM",5, 16,
2022-05-28 11:33:44.483692,Netminder1976,good,its so fun!!!!,"Aug 24, 2018 at 5:21 AM",5, 11,
2022-05-28 11:33:44.499649,Bugomiter,its funny,funny game,"Aug 31, 2018 at 11:08 PM",5, 3,
2022-05-28 11:33:44.516604,mrwestbrook,Didn't get to play,"Launched for the first time on Oculus Rift. Even though I have  a large room, the lever is located behind the physical wall. I researched online for an hour, restarted my PC twice, uninstalled the game, bur every time positioning was wrong and not allowing me to reset my position. $20 spent for nothing.","Jun 2, 2018 at 11:53 AM",1, 17,
2022-05-28 11:33:47.627353,Tarbal,Didnt really find it entertaining,"I was hoping for a comedy driven, fun game but instead i found the jokes a bit dull and the tasks a little mundane. I think this will appeal more to people that havent had work experience or to a younger player that may find the humour in the game.","Jun 20, 2018 at 11:22 PM",3, 5,
2022-05-28 11:33:47.644307,zohar.yagiayev,Zoar yagiawv,Bwrrwi,"Nov 3, 2018 at 6:46 PM",5, 2,
2022-05-28 11:33:47.660265,astronautpanda,Catch it on sale,"The bots can be quite funny, the work is kinda lame after you repeat it time after time, but it can pass the time. Get it on sale if you can, otherwise it isn't really worth the full price.","Apr 22, 2018 at 1:25 PM",3, 13,
2022-05-28 11:33:47.676222,Real_Sw1f7,great game,I LOVE IT. i can't wait for more updates to come. I would love to see more jobs added .,"May 6, 2018 at 11:30 PM",5, 23,
2022-05-28 11:33:47.692179,bcolmorgen,Top Game,"The Game is awsome.
I like the Game because it shows VR in a good perspective and it is very simple.
But i have a question i know that the Vive version have Full room can i get Full room also on the Oculus version because i have 360 tracking and i think the Game is in 360 Full room better.","Apr 14, 2018 at 11:52 PM",5, 4,
2022-05-28 11:33:50.791966,Mouise,Too basic game,This must have been a nice demo at the launch of VR headsets but I'm sorry to say that trying it now if you are an adult will be disappointing. Some humor is amusing but there is not much more.,"Mar 15, 2018 at 5:54 AM",3, 8,
2022-05-28 11:33:50.807924,tortieMVH,,"My daughter's favorite game. The new ""Overtime"" shift makes her really happy!","Aug 3, 2018 at 7:35 AM",5, 5,
2022-05-28 11:33:50.824878,Alex Tran,,fun.,"May 16, 2018 at 12:58 PM",5, 7,
2022-05-28 11:33:50.842830,Heaney-555,,"Really fun game, with a lot of content. *Slightly* too expensive, but hey, it's VR.","Apr 20, 2018 at 7:41 PM",5, 3,
2022-05-28 11:33:50.858787,silverdragania,constant flow of work,i'd love to have the game a constant flow of work after i've taken the ticket it'll be a bit better,"Apr 24, 2018 at 4:21 PM",5, 5,
2022-05-28 11:33:53.973077,overzone,I Love It,"Ever since i got this game i haven't stopped playing it! All of my friends and family love it too. If you're into simulation game i would highly reccomend it. It is pretty pricey if you look at it but it's money worth spent, especialy with the infinate overtime feature.","Feb 20, 2018 at 2:24 AM",5, 11,
2022-05-28 11:33:53.989034,DaRealBigQ,Amazing,A classic,"Jul 15, 2019 at 6:30 AM",5, 0,
2022-05-28 11:33:54.005989,DaPoliceMasta,Why is this game just organicly awsome!!,"Love it, buy it, play it.","Apr 9, 2018 at 2:41 AM",5, 5,
2022-05-28 11:33:54.022944,transaffliction,,always worth buying,"Mar 17, 2018 at 1:37 AM",5, 12,
2022-05-28 11:33:54.039898,dallincurt,I think I'm ready to get a job xD,"This is one of the most fun games I have with the touch!  I really love doing all of the different jobs, especially in ""Infinite Overtime"" but my favorite job mode has got to be Gourmet Chef!  So much fun, I play it all the time!","Jan 28, 2018 at 11:09 AM",5, 13,
2022-05-28 11:33:57.153641,darkspark2000,Like being a kid again!,"This is one of the most simple and yet fun experiences on the Rift.

You are basically standing on a spot within a virtual toybox, role playing either a cook, mechanic, office worker or shop keeper.

There are some clever mechanics to make best use of the space you have available and some quests to introduce you to the different functionality. It's fun discovering the little things you can do.

It is great for kids too, and there is a mode select on the menu screen where you can reduce the height of the play area for the little ones. Enjoy!","Jan 3, 2018 at 4:13 AM",5, 4,
2022-05-28 11:33:57.170596,GAMESLAYERZZZ,Fun but the dial doesn't work.,"So, for some reason, I don't know if this is just my game or not, the dial doesn't work for gourmet chef and store clerk. The dial is crucial for both of these jobs in many tasks to switch between different appliances, and when I try to use it my touch controllers just vibrate softly. Otherwise, the game is pretty enjoyable, a bit easy and the jokes aren't very funny, but I think over all it was a positive experience.","Dec 30, 2017 at 8:57 AM",3, 4,
2022-05-28 11:33:57.186553,Face_puncherVR07,two millon stars,(it's only flaw is that it has too little content.... but that is somthing to look forward to!),"Jan 14, 2018 at 10:52 PM",5, 10,
2022-05-28 11:33:57.203508,Karan5196,,Helpful,"May 30, 2018 at 3:39 PM",4, 16,
2022-05-28 11:33:57.220462,AML60,great,"good but needs another job like teacher , athlete or evan stay at home mom or dad","Jan 6, 2018 at 7:46 AM",5, 11,
2022-05-28 11:34:00.315242,Slowbaltkoller,Needs more content,Fun but if you watched anyone on youtube play this game a year ago then you have seen it all which makes it kind of lame. they need to add more content but it seems like the devs just forgot about this game all together,"Jan 9, 2018 at 10:40 PM",3, 12,
2022-05-28 11:34:00.332197,Poetic7,switch trouble,"how come the swichs dont
 work in the chef and store levels","Jan 19, 2018 at 7:38 AM",3, 8,
2022-05-28 11:34:00.349152,Rezfamily,Amazing!,This is by far my favorite game I have ever played! Please create more jobs to play. :),"Jan 10, 2018 at 12:11 PM",5, 9,
2022-05-28 11:34:00.366106,StangGT325,Great game,"This game is probably the most innocent fun you'll have in VR. The game is very well developed and has a hilarious storyline. It's obvious the producers went through great lengths to make the story believable and the experience immersed. This is great for younger children. The game even has a ""short human"" mode that increases the rendering scale so that a smaller child can play.  Now if only we could get other developers to follow in the footsteps of this game, VR may actually compete with desktop and console games.","Nov 5, 2017 at 11:31 PM",5, 17,
2022-05-28 11:34:00.382063,ShadowQueen,Great game with a few problems .,"I really enjoy playing it and gives me something to do , It is a great game that views into jobs which is really fun but doesn't last long . The night shifts are great but my problem is that you basically repeat what your doing everytime . I wish there were a lot more jobs to enjoy playing , Many others have opinions but over all it is a great game and is worth the price .","Nov 20, 2017 at 7:49 AM",5, 11,
2022-05-28 11:34:03.475409,cqt_,Add more jobs pls!,I would absoloutly love it if you added more jobs ive played them all (including the add on's),"Jan 1, 2018 at 9:38 AM",4, 6,
2022-05-28 11:34:03.492363,gofa428,AWESOME,This game is amazing but I cannot figure out how to turn the switches for the different things to use. If anyone can help me that would be great!,"Jan 3, 2018 at 6:26 AM",4, 0,
2022-05-28 11:34:03.509318,Superattorney,Better VR experiences out there,"Accounting (VR) is free and is better than this game.  Rick and Morty Virtual Rickality is better than this game.  The jokes aren't that funny and neither are the memes.  The only job that was interesting was the mechanic job.  The chef job was the worst, so boring and monotonous that I wanted to quit less than 5 minutes into that mini-game and sadly it never got better.  Counter Fight (Ramen Shop) is way better than this experience.  There's just no challenge to these jobs and they tend to be repetitive quickly.  There's some nice moments, but it's mixed in between several more dull moments.  I don't understand all the positive reviews.  I don't understand the price tag.  There are so many better VR experiences out there.  I'm out 20 bucks and regret getting this on sale.  Maybe kids would like this, but there's just nothing but menial tasks here.  The worst parts of Rick & Morty without any of the good stuff is what this game is.","Oct 29, 2017 at 3:04 PM",2, 7,
2022-05-28 11:34:03.526272,OF_Bowzer,,My favorite game so  far on this! My kids LOVE it!,"Jan 3, 2018 at 9:05 AM",5, 2,
2022-05-28 11:34:03.543227,s.katborg,"Extremely fun, but pricey","This is a great game no matter if you are completely new to VR, or if you have tried VR a thousand times before. However, the asking price is a bit high compared to the amount of playtime. But you do get 4 brilliantly crafted jobs, that are joyus to play.

*UPDATE*
The game has recieved a new update, allowing for endless missions in all jobs. This adds emense amounts of replayability, and even though it got slightly boring after a few hours, as the missions became repetetive, this update is great, and has allowed me to put a few more hours, into one of my favorite VR games. At this point I can definetly recommend this game. Now lets hope we get more jobs in the future.","Oct 24, 2017 at 4:29 AM",5, 3,
2022-05-28 11:34:06.636035,becklarae,Great game,"grandkids loved this game, must buy game, fun and interactive","Dec 24, 2017 at 5:32 AM",5, 5,
2022-05-28 11:34:06.652496,Daniel-P.,They've legit thought about everythingXD,"I laughed my butt off, and with the new gamemode, and price i'm convinced that it's a must-have ;D","Dec 17, 2017 at 7:10 PM",5, 2,
2022-05-28 11:34:06.669451,Ultraft,amazing!!!,"the perfect game, had lots of fun with it!","Jan 30, 2018 at 2:22 AM",5, 1,
2022-05-28 11:34:06.685408,claisolais,"Great game, but..","Camera fixed on standing level from the beginning, but I started while sitting, now I cant reach lower level things because my floor. How to adjust base position?","Oct 25, 2017 at 2:10 AM",4, 6,
2022-05-28 11:34:06.702363,Nikorasu,"Love it, but this version?","Ok, I'm not sure if I'm doing something wrong.. But I've got a decently large tracking area, the largest I can get with in my room, with 3 cameras, at over 8ftx7ft.. Yet this Oculus version of the game seems to restrict me to the smallest play size possible in the game regardless. It just doesn't seem to account for all my extra space.
And as a result, while still remaining inside my guardian boarder, I can walk all the way outside of the play/work space, almost standing behind the robot-customers or job-bot. lol Kinda game breaking.
From what I've seen on yt, the SteamVR version seems to resize fine, and very dynamically.. So when I noticed I seem to have more space than some of those videos..
I feel like I'm missing out.. Tho maybe I'm just mistaken, and it needs EVEN MORE space before that takes effect. :/
So for now, 3 stars.. I'd give 5 overall, but this issue really bugs me.","Oct 26, 2017 at 2:52 AM",3, 5,
2022-05-28 11:34:09.812160,zimmerman5050,The best starter VR game.,"This is a must have for seeing what VR can do, and showing others what Vr can do. The 4 jobs offer a perfect 45 minute or so ""guided window"" where you get tasks to do. It really is perfect for showing VR to your friends and family. It's fun to do yourself too! But only for those guided sessions. The game is funny as well. Just because it's old does not mean it's out of date!","Oct 1, 2017 at 2:06 PM",5, 2,
2022-05-28 11:34:09.829114,Sp1cypoptart,its so fun,this game is realy good but i want them to add more jobs,"Nov 2, 2017 at 11:43 PM",5, 15,
2022-05-28 11:34:09.846069,vrtroopers82,Amazing,OMG BEST GAME I'VE EVER PLAYED (Besides the Climb),"Oct 28, 2017 at 9:59 AM",5, 5,
2022-05-28 11:34:09.864021,7unnix,A little pricey but a lot of fun!,"To mirror what others have said, this is more of an 'experience' than a game; you complete the given tasks whilst being a bit silly along the way. However, it is A LOT OF FUN.
The cartoon style graphics looks fantastic in VR and you do feel really immersed in your chosen role. There are plenty of laughs to be had and it's an excellent example of VR to show friends and family.
My only disappointment (and reason for 4 stars instead of 5) was the price Vs hours of gameplay. Realistically, once you've completed each of the 4 job roles, there's no reason to go back and so overall there's only an hour or two max game time per player and for the price paid (£18.99 at time of review) it doesn't feel like quite enough value for money. That being said, I'm hopeful that future updates will bring new job roles (so many potential jobs to simulate: Policeman, Doctor, Computer Technician, Builder).  I just hope that if this is the case, they add a few for free before charging for additional DLC. 
My advice: If don’t watch any YouTube clips of gameplay before you buy, as you’ll likely ruin all of the laughs for yourself. If you’ve got some cash to blow however, go for it. It’s a lot of fun!","Aug 20, 2017 at 10:45 AM",4, 5,
2022-05-28 11:34:09.880976,ICEMAN_2049,great for my son,not really for me but my son enjoys this very much and greatly the small mode. l wish there was a story mode.,"Oct 23, 2017 at 9:15 PM",4, 2,
2022-05-28 11:34:12.972330,SlashSteel,Great for kids !,"I bought this game for my children and they love it ! they always play this game, it's a must have ! BUT... give us more content / jobs please !","Oct 18, 2017 at 10:45 PM",5, 1,
2022-05-28 11:34:12.989283,1ce_man,,"Not a bad game, loved the overtime update. Adds to the replay value.","Oct 24, 2017 at 3:27 AM",4, 0,
2022-05-28 11:34:13.006238,PascaleSanchez,"Get Job, do Job.","An excellent and funny introduction to the world of VR for new players.  The graphics are solid with the scripting and humour overall excellent.  Replay value? not sure, but it is wonderful while it lasts.","Sep 1, 2017 at 6:04 PM",4, 3,
2022-05-28 11:34:13.024190,Brazeun,GoOD BuT,"NoT EnOuGh mEmEs





And I cant download the new update for whatever reason....","Oct 30, 2017 at 3:23 AM",4, 2,
2022-05-28 11:34:13.041145,Walts03,,I love it,"Oct 22, 2017 at 9:33 PM",5, 1,
2022-05-28 11:34:16.151439,Mikazz,It's not really a game...,"Well, it's more an ""experience"" than a game. You have to complete the tasks you are given, but there is no challenges and it gets boring really fast. I don't understand the hype behind that game.","Aug 18, 2017 at 12:27 PM",2, 5,
2022-05-28 11:34:16.171386,LiL_N3LyB0i,To Short,When i was playing it was so fun but i finished the game very soon i will love more jobs please plz add more jobs!!!!!!!,"Aug 8, 2017 at 2:04 AM",4, 8,
2022-05-28 11:34:16.189337,baarnis,Fun and optionous,It is the funniest thing ever! You can play with many sorts of jobs which keeps you busy for a long time! Definetley worth the price!,"Sep 9, 2017 at 4:27 AM",5, 1,
2022-05-28 11:34:16.207290,calicolake,Price,"The game was a lot of fun, yet it didn't have much and I completed the game in about 1 and a half hours. The Price was the bad thing, yet overall, the game was fun to play.","Aug 27, 2017 at 12:11 AM",4, 4,
2022-05-28 11:34:16.227245,OoaliceoO,Sweet but Short,"A 5 star for sure if it only wasn't so quickly played through. Instead of more Jobs which are likely complicated to add, why not at least some simpler, random orders for the existing jobs after the story-orders are done? With scores to hit, a leaderboard perhaps, it would surely last more than 2 hours playing time.","Jul 10, 2017 at 7:15 PM",4, 11,
2022-05-28 11:34:19.316619,Mr.Allthat,Entertaining Game,This is a very simplistic and fun game.  The interactions are wonderful and I highly recommend owning it.,"Aug 9, 2017 at 4:02 AM",5, 6,
2022-05-28 11:34:19.334570,VoodooCHF,What a fun...,...creative Title with a new perspective to work in differend jobs. Kind of a fun puzzle game. love it.,"Aug 21, 2017 at 2:47 AM",5, 2,
2022-05-28 11:34:19.352523,AndrewHawk,,great game to use when introducing people to VR,"Aug 2, 2017 at 10:50 AM",5, 3,
2022-05-28 11:34:19.369477,SleepyDubz,The accuracy is amazing!!,"Between throwing food at your customers and printing multiple staplers to shoot your boss with, this game is completely accurate to real life jobs xD. If only they had more jobs....","Jul 8, 2017 at 11:20 PM",5, 4,
2022-05-28 11:34:19.386432,Diablothe2nd,"Great, but short.","Great fun, and great humour. If only there were more jobs since this can be completed in only two or three hours. There's some additional entertainment in inviting friends over to play it though so I'm looking forward to that.","Jun 20, 2017 at 10:12 PM",4, 6,
2022-05-28 11:34:22.472788,Twan103,Absoulutely fantastic!,"The only thing this game needs is an update with more jobs! I WANT MORE! And that's a great thing. I felt a constant sense of presence. great job owlchemy labs, great job.","Aug 17, 2017 at 8:21 PM",5, 5,
2022-05-28 11:34:22.489742,Ziwdon,Great fun!,"Amazing game that is great to show the fun of VR.
Could have some more jobs though.","Jul 25, 2017 at 6:59 AM",4, 1,
2022-05-28 11:34:22.507695,Coll62632,,Really great but incredably short!,"Jul 29, 2017 at 8:04 AM",3, 2,
2022-05-28 11:34:22.524649,angel_of_entropy,Must-Have title,I have absolutely no idea why I find this game as fun as I do.,"Jul 4, 2017 at 1:40 PM",5, 8,
2022-05-28 11:34:22.542601,SPLARK,AMAZING!!,But it would be alot BETTER with MORE JOBS! Good activity to do when bored of other oculus/vive games. Very fun. I highly reccomend it!,"May 9, 2017 at 7:54 AM",5, 5,
2022-05-28 11:34:25.654869,fartking420,Short,it took me 5h to finish the game and needs more jobs :( :( :(,"May 16, 2017 at 12:44 AM",1, 12,
2022-05-28 11:34:25.672821,archarte,amazing!!!!!!!!!!!!!!!!!!,"this is the best game ive ever played!!! its really funny!! although we dont know why but we finished all levels and got all the gold cartriches and we only got the low-gravity mod and the bouncy mod. It would be awesome if you could add in new levels like ""work at a nuclear power plant""where you hope nothing goes wrong and work with complex machines. Or ""baby sitter""where you watch annoying kids and try to keep the house clean before there parents get home. Or ""factory worker"" where you build toys and fix machines.","Mar 24, 2017 at 11:06 PM",5, 7,
2022-05-28 11:34:25.689776,Stardrago,"amazing!!!!!!!,but needs more jobs","example, soldier, teacher, hotel receptionist, astronaut and maybe robotic engineer, etc","Apr 1, 2017 at 6:14 AM",5, 7,
2022-05-28 11:34:25.706730,tamborello,Not worth the money,"I'm quite upset I paid for this, It became dull fairly quickly and I think I would have been unimpressed even if it were a free app. Shame, it's a nice concept.","May 7, 2017 at 12:36 AM",2, 5,
2022-05-28 11:34:25.723685,Hassanelzayat,cool but needs more  jobs,i had alot of fun but needs  more jobs also if you complet every job their is 2 more option gravity and bouncing in a drow that you can add to the jobs when you play agian,"Apr 2, 2017 at 8:07 PM",4, 8,
2022-05-28 11:34:28.834554,julezeve,Fun but ends too fast,"Such a good game with great potential, but feels incomplete with no freeplay mode with customers. Please have a freeplay mode where customers actually come with tasks so we can continue to play the jobs. Feels more like a demo than a full game. I'm kinda upset.","Mar 14, 2017 at 12:45 PM",4, 4,
2022-05-28 11:34:28.852505,Deamon84,Fun for the whole family & friends,"It could use more jobs, but the 4 it already has have plenty to discover and lots of laughs :)","Mar 15, 2017 at 5:33 AM",5, 4,
2022-05-28 11:34:28.870458,paradoxqt,Comedic VR Experience,Enjoyed it but very short. Feels more like a tech demo for $15 instead of $30.,"Mar 5, 2017 at 11:09 AM",3, 6,
2022-05-28 11:34:28.888410,Virtuix_,A must-have for VR,"If you own a VR headset, you've no doubt heard of Job Simulator. Once I got through it, I was somewhat disappointed at how it only lasted me slightly more then 2 hours, and started regretting my desision. However, after spending a lot more time with other titles, it has come apparant to me that I actually enjoyed this game the most, even more then the games which can last 10+ hours, even despite it's short playtime and lack of replay value. I love it's fun, cartoon-like art style and it's humour. I love how you can pick up any item you want and throw it, smash it, or eat it. I was truly amazed at how many things you can do (If you put your head on the photocopier, you can copy your brain! And if you see a robot wearing a hat or glasses, you can actually steal them and put them on!). This game has made me LOL more then any other VR title, and it is a must have for all VR owners! I do, however, strongly recommend having a good 360 setup though, as any occlusion will drive you mad.","Feb 13, 2017 at 4:35 PM",5, 6,
2022-05-28 11:34:28.905364,jon,Grossly Overrated,"If you're looking to buy a demo game to use when showing people VR for the first time, it's a contender.  The game itself is very short, and more tech demo than game.","Mar 9, 2017 at 8:01 PM",3, 7,
2022-05-28 11:34:32.021689,dugthefreshest,Great extended VR demo,"Job Simulator is no more than an extensive VR demo. Which is fine as long as you know that going in. Its great to show new users, and funny as well.  Works really good with touch controllers, just make sure you have enough room all around as sometimes you have to reach behind you. Enjoy.","Feb 20, 2017 at 9:07 AM",5, 3,
2022-05-28 11:34:32.039642,thekjun1,would not say it's worth the price,"while yes its fun if you are a first time VR player, its lacking for others that have played other games similuar, kids will love it but does get repetitive for me. one time play then you are done, can't say I would play again.","Jan 28, 2017 at 1:01 PM",3, 4,
2022-05-28 11:34:32.057594,FarqueHD,Help,I cannot turn the knobs in the store clerk or chef please help me.,"Mar 5, 2017 at 9:08 AM",3, 3,
2022-05-28 11:34:32.074548,Rubyboat1207,Doll House mode is gone,"How do I get it, when I descovered it I realised I did not have it and it would be nice to talk with a developer to trobleshoot this.","Feb 27, 2017 at 6:58 AM",5, 2,
