scrapping_date,review_author,review_title,one_reviews_text,review_date,review_rating,review_helpful,review_feedback
2022-05-28 11:34:32.092500,Bel-garath,Excellent experience to show newcomers,"I think this was very well done. Perfect to show others. Roomscale would help sometimes as I did find myself turning around a few times and losing tracking. Something about the pointing and the controls seems off to me compared to other Touch titles...so Developers..fix that please so you aren't being non standard. Regardless, great title if a bit overpriced and I don't regret my purchase. This is not quite a demo, but it doesn't feel that deep. Finds a happy middle ground :-).

Edit: Got my 3rd sensor. Tracking is flawless for me at least with it and makes this game just a bit more enjoyable since I can turn in any direction :-)","Jan 15, 2017 at 4:20 PM",4, 3,
2022-05-28 11:34:35.186342,MrJosey,,"Some have complained it's too short for the price, but it's still a great VR title. Good variety of jobs and funny interactions. I'm happy with the purchase. If you have fun with it, there's several hours of content here. Also, it's a good game to demonstrate VR capabilities.","Feb 7, 2017 at 3:23 PM",5, 1,
2022-05-28 11:34:35.204294,Leonard_Powers,Fun game with lots to do and see,"This is a fun experience. You need to have a descent size space to play in. Some of the Job could easily continue endlessly with a different variety of customer, but they all end abruptly. It is not possible to play without the ""Instruction board"" or ""Supervisor BOT""","Dec 21, 2016 at 3:42 AM",4, 11,
2022-05-28 11:34:35.221248,Negchampa,Fun first time through,Fun cute game first time through but not alot a replay value. Great game to have in your library for demos though.,"Feb 16, 2017 at 10:30 AM",3, 3,
2022-05-28 11:34:35.239200,jackjack64,,Not a game where you should be looking to play a lot. But in the moment it is very funny and enjoyful.,"Mar 5, 2017 at 1:51 AM",5, 3,
2022-05-28 11:34:35.256155,shawnleeinc,Very Short Game,"Good concept, yet the game is lacking any real challenges.  Very short game, almost like them it's a tutorial they released.   Also, it lacked a scale mode so that my kids could play. Very dissappointed in the money I spent.  It might be worth 9.99 or so, not $30.","Dec 9, 2016 at 4:51 AM",2, 25,
2022-05-28 11:34:38.349015,Lodsiek,Bring friends over for this one,"This game is basically a toy that is meant to be messed with. It is at its best when you are playing around with it, not just doing whatever it tells you. It's a fantastic (and very hilarious) demo for friends and family, it's got some great humor and clever jokes -- but playing it by yourself isn't really the same. The price is a bit high but that's VR for you at the moment.","Dec 11, 2016 at 3:42 PM",4, 8,
2022-05-28 11:34:38.366967,Cars0419,Very fun game. It is short though.,"Job Simulator is a fun game to play. It has four jobs. Auto Mechanic, Gourmet Chef, Office Worker, and Convenince Store Clerk. Each job is kinda long taking about an hour. This game is one of those games where you have to take it slow. If you rush through the game, it is short. But, if you play around, the game lasts longer. The game is a little overpriced, but it is VR.  Also, roomscale is highly recommended for this game. In conclusion, the game is short, but is is super fun to play.","Jan 23, 2017 at 3:12 AM",4, 1,
2022-05-28 11:34:38.383922,HolyBabar,Getting job done is fun,"This game is fun, it has great humour and you have plenty of silly fun stuff to do.

Amazing to demo, great to play. 

I get one star out of my rating because it is a bit short to my liking and replayability is not great. You will have fun during your playthrough tough, and that's what matters and justifiy the price tag to me.","Dec 13, 2016 at 8:31 AM",4, 6,
2022-05-28 11:34:38.400876,Hyomoto,Have VR?  Play Job Simulator,"Job Simulator is a glorified VR experience: it's expensive and over far too quickly (three hours at most of content).  That said, it's one of the best.  It's genuinely funny, full of charm and a technical wonderland of interactivity.  This is what all other VR experiences should strive for: a ridiculous, yet believable place to play around for a little while and I strongly recommend it.","Dec 26, 2016 at 9:57 AM",5, 12,
2022-05-28 11:34:38.417832,GermanicusCaesar,"Fun for first timers, short for the pric","It's a great showcase of what VR could do. The amount of attention to detail is what makes this game truly immersive as you can interact with pretty much every object in the environment. Only complaint is that it is a bit short for it's price. I bought it for $30 and finished it in about 3 hours. Although, that's just the premium for buying anything in VR currently I guess.","Jan 18, 2017 at 9:10 AM",4, 0,
2022-05-28 11:34:41.508655,freinhar54,"Funny, but pretty one note","This is a very funny experience at first, but it does not have much depth and the novelty wears off quickly. Still enjoyable to check out though. As part of the launch bundle it was a good deal, it would be a little harder to recommend individually.","Dec 14, 2016 at 8:19 AM",3, 10,
2022-05-28 11:34:41.526607,OogieBoogie0000,"Expensive, but don't regret it at all!","At first, my kids pushed me to buy this. Is it a game, not really. More like very cool demo. But after some days, this is still the game my kids love the most and me too! Would I rebuy it again - absolutely!!","Dec 15, 2016 at 7:09 AM",5, 7,
2022-05-28 11:34:41.544559,Fatereaver,Fun,It's a fun first buy for any VR user.,"Jan 23, 2017 at 11:35 AM",4, 5,
2022-05-28 11:34:41.562511,JimJRE20,Great game!,So much fun playing this game. The humor is clever and well thought out and makes the game really fun. It is a great demo for anyone who isnt a gamer and wants something light.,"Dec 15, 2016 at 4:19 AM",5, 7,
2022-05-28 11:34:41.579466,freefirex,,Doesn't really hold up over time.  I wouldn't recommend it,"Dec 30, 2016 at 8:21 AM",2, 13,
2022-05-28 11:34:44.675805,algoprog,,Really fun! It has many things to mess up with.,"Jan 2, 2017 at 4:45 AM",5, 6,
2022-05-28 11:34:44.693757,Briannastatic,,Gets boring after an hour or so of gameplay. I would not recommend this to anyone.,"Dec 27, 2016 at 5:11 AM",1, 17,
2022-05-28 11:34:44.710712,kamiklase,Very good for quests,I was so surprised to see that all quests who have never used the hand controllers immidiatly start playing Job Simulator. And you have to do a lot of different tasks. It is so easy to learn and fun to play.,"Jan 7, 2017 at 1:23 AM",5, 1,
2022-05-28 11:34:44.727667,AliceTransWoman,Was Fun,"Was good game but i dont understand why you dont loop customers lots of objects we dont even use, please update the game so freeplay still has customers with new orders.","Jan 12, 2017 at 6:02 PM",4, 1,
