scrapping_date,review_author,review_title,one_reviews_text,review_date,review_rating,review_helpful,review_feedback
2022-05-28 11:32:47.547142,Bingo-Bango,Well done but boring,"The game is well made but it's just simply not fun. You basically just pick stuff up and fiddle with it. Maybe it is fun for kids, but you can download Toy Box for free and have more fun. Definitely not worth the price for this game. Maybe $5 would be worth it.","Mar 15, 2020 at 2:44 AM",2, 2,
2022-05-28 11:32:47.562102,T-Prime,A great Introduction to VR,"I got my Oculus Rift S for myself, but I wanted to find games that my wife would like too. I tried this one, and scored big. She also has some issues with motion sickness with VR, but is perfectly fine with Job Simulator. It's a simple and fun game with a lot of humor to it, and it's pretty easy to get involved in. Definitely a great game for people just starting out with VR, or for people who are not big gamers to begin with.","Jan 7, 2020 at 5:25 AM",5, 35,
2022-05-28 11:32:47.578060,taquitobuddy,"Don't get the appeal, boring","I just don't get the appeal of this, apart from maybe as a demo for people who have never used VR.  Was bored quite quickly.  Game seems well-made though, so giving it an extra star for that.  Just not for me.","Apr 5, 2020 at 10:18 AM",2, 1,
2022-05-28 11:32:47.593020,hao.tran.15689,COOL Game!,"I like this! I have a suggestion though. Maybe the creators can add a ""make your own job"" or something.","Mar 27, 2020 at 12:18 AM",4, 3,
2022-05-28 11:32:47.608977,NickeyPotato,Awesome game huge fun,Awesome game huge funAwesome game huge funAwesome game huge funAwesome game huge funAwesome game huge funAwesome game huge funAwesome game huge funAwesome game huge funAwesome game huge funAwesome game huge funAwesome game huge funAwesome game huge funAwesome game huge funAwesome game huge fun,"Jan 13, 2020 at 3:18 AM",5, 18,
2022-05-28 11:32:50.699820,amanda.n.leeson,Way overpriced,"The physics of the game were cool, some funny puns, and maybe 5 years ago this would have been worth the money but the fact that there's no story and no breaking out of the jobs makes it super boring after the first 3 tasks. You just have to do whatever the robots say.. and I've worked enough boring jobs in my life that I don't need to do it in virtual reality?","Jun 1, 2020 at 11:31 AM",2, 0,
2022-05-28 11:32:50.715778,sucky sucky,I tryed to buy and play,I bought it for 19.99 and when I looked for it on my Oculus Quest it wasnt there so please help me.,"Jun 23, 2020 at 12:02 AM",1, 2,Sorry to hear this! Oculus Support will help you. Reach out to them here: https://support.oculus.com/885981024820727/
2022-05-28 11:32:50.731735,mmiguy2103,Great VR game for beginners,I am semi new to VR and this was a great game to introduce you to the world of VR.  it helps build you hand skill up by grabbing objects and reacting with the job world around you ..  its pretty funny too the dumb stuff you can do while in the game.  I wish they would update and gt a few more jobs you can do in the near future.  I would def reccoment this game to everyone.  this was a great game to get family members to use right away and be able to do it.,"Nov 21, 2019 at 2:24 AM",5, 36,
2022-05-28 11:32:50.746695,MinskyBoo,PLEASE MAKE IT CROSS PLATFORM,"I really don’t want to buy this game again please make it CROSS PLATFORM for the quest. Same with vacation simulator. 

I’ll give a 5 star once this stupid problem is fixed. 🥺","Jan 16, 2020 at 9:50 AM",1, 9,
2022-05-28 11:32:50.762652,Coolplaya5,GREATE,This game is absalutly amazing few can top it i would ike new jobs though,"Feb 29, 2020 at 4:13 AM",4, 2,
2022-05-28 11:32:53.872443,Stone_vr,very good,i had i real good tim playing and but the bad think is that there is not alot of leavels i think thay should ad some more but very good game ive just started vr and its great,"Jan 4, 2020 at 10:14 PM",5, 8,
2022-05-28 11:32:53.888400,Foolz,Game paused update and I can't play it,"Ever since about 4 months ago, the game stopped updating. I can't even play it! I've been looking back on it for awhile and it just says 'ERROR'. I'm wondering if I could get refund so I can buy and play it again. Thank you.","Feb 3, 2020 at 8:18 AM",3, 0,"Sorry to hear this- thank you for letting us know! Oculus support would be the best people to reach out to for help with the updates or for information on refunds - https://support.oculus.com/. Also, we would be happy to take a closer look- just send this our way at owlchemysupport@google.com."
2022-05-28 11:32:53.904358,Rango1011,Wont Install,I've been trying to install this for 30 minutes and it wont even work,"Feb 26, 2020 at 10:15 AM",1, 0,Hi there- We are very sorry to hear that you are experiencing this problem during installation. Thank you for letting us know. Oculus support would be the best place to reach out to for installation issues - https://support.oculus.com/
2022-05-28 11:32:53.920315,creepylove,Just awesome,"Extremely fun and very amusing. I mean, where else can you throw coffee cups at your boss, explode fireworks in a store, drink gasoline or give people rotten and radioactive food to which they are alergic to.","May 6, 2020 at 4:37 PM",5, 0,
2022-05-28 11:32:53.936272,Chunkster231,Great game,"Super fun even if you are experienced in VR but very good VR intro game. Lots of free ability in this game, you can even make yourself vomit by eating expired food from the garbage. Totally woth it!","Jan 19, 2020 at 1:24 PM",5, 5,
2022-05-28 11:32:57.042016,CoolGuy1000,i love this game but,i cant play enymore it keeps loading and it wont let me play (sorry for my spelling),"Feb 17, 2020 at 10:53 AM",5, 1,We would be happy to help you! Email us at our support email: owlchemysupport@google.com so we can take a closer look. It means a lot to us that you love our game and thank you for reaching out to let us know about your experience!
2022-05-28 11:32:57.057974,Gato.Gidh,,"Can't even play the game no more, some how it got the Kid size enable or something and now I can't reach for the door to disable it, Tried unstall it and install it again but turns out the same, so fr*&#$# anoying","Jan 26, 2020 at 7:43 AM",1, 0,So sorry to hear that you are experiencing this! It sounds like you may need to reset up the Guardian. Here is a link with more information -  https://support.oculus.com/guardian/?locale=en_US. If you are still experiencing issues please email us at owlchemysupport@google.com so we can take a closer look.
2022-05-28 11:32:57.073931,GunnZeug,A must have for all VR users!,"This is truly one of the best VR experiences I have ever played! And since Job Simulator is available on all major VR headsets like Rift, Rift S, Quest, Vive, WMR and so on this is available for almost all VR players! The main game isn't very long, I finished it in maybe 4 hours, but there's Infinite Overtime and mods to play with too! I love showing this to friends and family coming over. Highly recommend Job Simulator, five fat stars!","Oct 19, 2019 at 11:30 PM",5, 24,
2022-05-28 11:32:57.089888,samulew,Unplayable,"I am not able to play the game at all. It fails to detect play area correctly. All the other games work fine. I have my sensor in fron of myself. Loading screen is ok, but play space is set about 2 meters in some direction. Moving sensor or adding another does not fix anything. There is no option to reset or move the play area. Asking for refund.","Nov 3, 2019 at 2:35 AM",1, 12,"Hi there, we're sorry to hear you're having trouble with the game. Can you send an email to owlchemysupport@google.com about this so we can help you out? Thanks!"
2022-05-28 11:32:57.105846,neuoc,do your job the worst you can!,"This game has endless possibilitys of what you can do and four jobs to choose from, this game is hilarious you can blend a fire extinguisher, shoot co workers with a stapler, throw a cup of coffe at your boss, take customers hats of and put them on! And the gameplay is extremely smooth and the controls are great. Honestly if you wanna just mess around and have fun then get this game! Not to mention your limit is your own creativity and you will be dying laughing the whole time. You cant go wrong with buying this game","Oct 13, 2019 at 8:43 AM",5, 22,
2022-05-28 11:33:00.199680,NoTimeToDie2020,i payed buit i wont install,i payed 21.00 dollars for an app that wont even install,"May 8, 2020 at 12:07 AM",1, 0,"Sorry to hear that you’re having trouble! Since you aren’t able to install the game, we suggest that you reach out to Oculus Support. We hope you're able to resolve the issue soon so you can start JOBBING. https://support.oculus.com/"
2022-05-28 11:33:00.215637,DenisF1976,The reset center doesn't work in this ap,The reset center doesn't work in this app!,"May 10, 2020 at 2:36 AM",3, 0,Sorry to hear you have been experiencing this. Thank you for letting us know. Please email us at owlchemysupport@google.com so we can take a closer look and get you back to JOB!
2022-05-28 11:33:00.234587,itsyagirlabby123,this game,this is one of  the coolest games i have ever played,"Dec 31, 2019 at 2:26 AM",5, 3,
2022-05-28 11:33:00.254533,CaptainRift,cant play,The game will not load at ALL and even if it did load The screen is black and I cant play it please fix this,"Jan 4, 2020 at 10:45 AM",2, 0,"Hi there, we're sorry to hear you're having trouble with the game. Can you send an email to owlchemysupport [at] google [dot] com about this so we can help you out? Thanks!"
2022-05-28 11:33:00.270491,MvSniper70,fun game,.,"Jan 18, 2020 at 3:00 PM",5, 1,
2022-05-28 11:33:03.347886,CharlieGrant,Great game,Its really entertaining,"Jan 11, 2020 at 5:22 AM",5, 1,
2022-05-28 11:33:03.363844,TheGhostStricker,,i love job sin,"Nov 29, 2019 at 8:07 PM",5, 5,
2022-05-28 11:33:03.380797,Dinoash2017,epic,its good and fun worth it,"Nov 25, 2019 at 11:32 AM",5, 5,
2022-05-28 11:33:03.395758,Cosmic_SquidYT,,This game was meh at best I think it is good for beginners for hand motion and getting used to it but I hope they add more stuff once you’re finished there’s not much to do,"Nov 26, 2019 at 7:07 AM",3, 2,
2022-05-28 11:33:03.411715,Soggy2,I only have one problem,This game is amazing and the must play VR game but I have one problem. The liquid physics aren't always good but I am still giving this game a five star review,"Mar 14, 2020 at 3:16 AM",5, 0,
2022-05-28 11:33:06.486098,Rickygmoney,,Software I need forks for oculus rift not quest be careful,"Dec 7, 2019 at 8:23 AM",1, 1,"Hi there! Sorry to hear you're running into issues. Are you looking for Job Simulator for Oculus Quest? If so, you can get a refund for the Rift version of the game, and purchase the Quest version here: https://www.oculus.com/experiences/quest/3235570703151406/"
2022-05-28 11:33:06.503052,VRloverEli,played but then broke,i started playing the game and finished it but when the update with the easier hand to pick up things came out i only got to play for 1 day  and then the app just wont open please help me fix this issue. thanks!,"Nov 3, 2019 at 4:20 AM",4, 1,"Hi there, we're sorry to hear you're having trouble with the game. Can you send an email to owlchemysupport@google.com about this so we can help you out? Thanks!"
2022-05-28 11:33:06.520007,Axalium,Don't buy,Doesnt reset the view. It's unplayable. I want a refund,"Jan 13, 2020 at 7:43 AM",1, 0,"Hi there, we're sorry to hear you're having trouble with the game. Can you send an email to owlchemysupport [at] google [dot] com about this so we can help you out? Thanks!"
2022-05-28 11:33:06.537959,RainbowDaddy,Great game - I wish it was cross buy,"My kids love this one. Well, me too. Lots of fun and surprises to discover. I only wish this was cross buy, so we could play it on Quest, too.","Oct 17, 2019 at 12:50 AM",5, 4,
2022-05-28 11:33:06.553916,Tolley,Great Game!,I got the game when i first got my CV1 Rift It was a great intro to vr and had great fun. Infinite Overtime is a nice touch for when you finish the base story. When someone whos new to vr has a go its agreat first game for them.,"Sep 3, 2019 at 2:10 AM",5, 8,
2022-05-28 11:33:09.687680,HadarVR,really good,ive played a lot o simulators but this is something else,"Nov 8, 2019 at 7:20 PM",5, 1,
2022-05-28 11:33:09.703637,cerrret,It was fun,The first few days I had this game I beat it. It was fun at the time but now its just dull. 20 bucks down the drain just to have fun for like 2 days. WE NEED MORE JOBS!!!!,"Aug 17, 2019 at 7:38 AM",2, 9,
2022-05-28 11:33:09.718597,nladd71010,a new update?,OMG A NEW UPDATE IM HYPED IM INSTALLING UPDATE,"Jul 31, 2019 at 12:37 AM",5, 12,
2022-05-28 11:33:09.734554,eyeguyninja,Cant pick up anything,I use to love this game but now im too tall to reach for anything all my other games are fine exept for this,"Aug 17, 2019 at 10:00 AM",1, 6,"Hi there, can you send an email to owlchemysupport@google.com about this so we can help you out? Thanks!"
2022-05-28 11:33:09.750511,StarrLord,Rift / Quest Rip Off !,You have to pay twice unlike all the other great title's  !!!,"Aug 15, 2019 at 7:46 AM",1, 3,
2022-05-28 11:33:12.827439,martin.oconnor.543,Good but....,We really liked this game but have been very disappointed that the developers see fit to charge another £15 for it on the Quest. We also own Vacation Sim but won't be buying anything else from these guys. This is what you get for buying into games at an early stage - thanks Owlchemy,"Jun 7, 2019 at 1:33 AM",2, 10,
2022-05-28 11:33:12.843396,XxspacecadetxX,,No let me play game,"Dec 9, 2019 at 5:30 AM",1, 2,"Hi there, we're sorry to hear you're having trouble with the game. Can you send an email to owlchemysupport@google.com about this so we can help you out? Thanks!"
2022-05-28 11:33:12.860351,P0sitiv1Ty,A Great Showing Of What Touch Can Do!,"The 4 jobs are short yes buy eventually you'll get modifications, then the rest of the game is just screwing around!","Jun 19, 2019 at 5:10 AM",3, 10,
2022-05-28 11:33:12.875311,Shanaflan,This was why I wanted VR,"When I saw this being played on Youtube I wanted to play it so badly and it is what convinced me to get the Oculus. I love funny, silly simulators games and this one is full of charm and humour.","May 2, 2019 at 5:07 AM",5, 38,
2022-05-28 11:33:12.891268,Ewizard,Could have been better,"Unfortunately, not making the game a cross buy for oculus quest has ended the lifecycle of the game for me. I can not spend additional money to buy it for the detached oculus. Wires limited my gameplay on oculus rift. Without wires games have been more fun and I could set up in a larger room to play. But I can’t justify spending money for the same game twice with nothing new being added to it. Pretty sad but it is what it is. I won’t re purchase hames I own on the rift for the quest. They will just collect dust and lesson learned. Will steer clear of developers who don’t permit cross buy, and this includes future games that are not expected to be cross buy. Will spend money in game for devs that do offer cross buy.","May 31, 2019 at 1:47 AM",1, 3,
2022-05-28 11:33:15.974647,Foxyrules1987,one huge problem,as soon as i spawn in i am in the wrong place and cant reset view.pls fix,"Jul 22, 2019 at 4:53 AM",1, 1,"Hi there, can you send an email to owlchemysupport@google.com about this so we can help you out? Thanks!"
2022-05-28 11:33:15.995591,ChickenManPK,Such a great game,It’s so fun and funny one thing it is short but fun,"Jul 4, 2019 at 5:35 AM",5, 7,
2022-05-28 11:33:16.015537,duolingo,can you add this job?,"heres a list of jobs i want firefighter, teacher and police so that means we have 7 jobs.","Jun 24, 2019 at 3:11 AM",5, 6,
2022-05-28 11:33:16.031495,Fenrir420,This was announced as crossplay,"It is bad business trying to make money off your customers by charging twice, this did not cost much or take much time. Also the sales will not make enough to make a difference but the sales on vacation sim can be hit by the same customers like me who will not buy it now based on you ripped off rift players on cross play. You also used to charge 40 dollars for this and on Psvr, which I also own it for Psvr. Due to Psvr having terrible tracking, I use rift and now also quest. Why try and charge twice to existing consumers who paid 40 dollars, espiecally the ones who went from Psvr to Rift or Vive.","May 24, 2019 at 7:35 PM",1, 7,
2022-05-28 11:33:16.047452,XtremeHardcoreGamer,Feel like this would be best for---,"new VR users and kids. Some of the humor was amusing. There was too much handholding in the different sections. After the sections, with mild wink humor, it is over and there is no reason to really play again. It is well produced so there is that. I guess my main issue is it's handholding and very scripted actions. Customer X comes in, you MUST do X,Y,Z to get them on their way. And that is that. Wish there was more to it. ----Wait a second, maybe this is simulating an actual job too well!","Apr 9, 2019 at 1:24 PM",3, 7,
2022-05-28 11:33:19.151778,Dank_Memes3104,Simply AMAZING!,Please make a third Simulator Experiance! This is so addicting and fun!,"Jun 23, 2019 at 2:28 PM",5, 1,
2022-05-28 11:33:19.168733,ShoutingHydra44,Not updating,Job sim wont update itslf and I am stuck on the old verson.(the 2016 verson),"Jun 15, 2019 at 12:45 AM",5, 0,
2022-05-28 11:33:19.185687,CyborgRazor05,plz help,add your own movement button i keep spawning in the wrong place please i  really want to play this but its impossible when im outside the counters and too far away from everything please help,"Aug 3, 2019 at 1:31 AM",1, 0,"Hi there, can you send an email to owlchemysupport@google.com about this so we can help you out? Thanks!"
2022-05-28 11:33:19.201644,xhadow,Could not reach the first carts,As title says could not reach the first carts and I have checked my oculus settings!,"Aug 7, 2019 at 7:48 AM",1, 0,"Hi there, can you send an email to owlchemysupport@google.com about this so we can help you out? Thanks!"
2022-05-28 11:33:19.217602,EliranChariker,must play,hours of fun,"Jun 14, 2019 at 4:55 AM",5, 0,
2022-05-28 11:33:22.291459,HelloAlice2019,Awesome game for VR headset!,"In-cre-di-ble! Me, my 7 year old and my 4 year old love this game. It is fun, highly interactive, beautifully designed, and works on the abilities and limitations of Oculus Rift to perfection.

Job Simulator creators did an amazing job. Well done, definitely the best family VR game so far created. Oh, and just discovered it has a ""short person"" setting, making it easy for kids to play and reach all items in the game high up and on the floor. Awesome option!","Mar 26, 2019 at 7:47 AM",5, 7,
2022-05-28 11:33:22.307416,NotaHumanResource,Entertaining and funny,"My children 12 and 14 wanted me to get this game. It looked cartoonish and dumb but I purchased at thier request.  This game had me laughing within seconds.  We have about 20 titles in our library but this one gets a lot of play and is even fun to watch others play it. The jobs last about 30 min a piece but you can stay longer and mess around. You can't get fired no matter how bad you perform and the bots love you. There are 4 jobs.  I would give it 5 stars but I would like to see more interaction with objects. (more songs on the boom box, throw computer over cubicle , use coffee cup and water to put out fire etc.) You can interact with almost every object in this game but not everything.  If the developers could have done exactly what they have done with this game but more of it so that the creativity and interaction was 100% this game would be 5 stars.  This game is a lot of fun and very funny.","Mar 18, 2019 at 1:47 AM",4, 2,
2022-05-28 11:33:22.324371,WildestWay,GREAT!!!,I thought this game was amazing but I just wish that they had more jobs. Other than that it was really fun.,"Apr 11, 2019 at 6:23 AM",5, 8,
2022-05-28 11:33:22.340328,Lio0904,Best game of the world,this is the best game of the world,"Apr 14, 2019 at 12:06 AM",5, 11,
2022-05-28 11:33:22.357283,CausingPants805,It's good,it funny,"May 5, 2019 at 4:29 AM",5, 2,
2022-05-28 11:33:25.442110,smartvisionvr,problem,"i bought it before for oculus rift , when i bout oculus quest,  they asked me to buy again 🙃","Jul 22, 2019 at 12:38 PM",2, 3,
2022-05-28 11:33:25.458067,Stvie_Ray_Vaughn,The reset,I am frustrated that I can’t reset my headset. You should’ve at least allowed us to change position. But we can’t do that. I would like to get closer to my sensors so I can at least turn on my animated computer but I can’t even do that. When you fix this problem I will delete my review.,"Feb 16, 2019 at 9:06 AM",1, 4,
2022-05-28 11:33:25.475022,SLEEPYYY,A Wonderful Game! but...,"I think for first time experiences, and also new to Vr its great with its interaction,smoothness and just overall great game! I like to point out that ive only played this a few times and rarely ever return to it, but thats just me. theres a overtime mode for each one to work 24/7 :)","Feb 25, 2019 at 11:14 AM",4, 3,
2022-05-28 11:33:25.490979,WidowGirl,Its a pretty good game... but...,"I love the sense of humor this game has. Lately, I havn't been able to play because when I enter the game, I spawn far from the area im supposed to. Since this game does not support position resetting, I cannot play because I cannot reach the disks to put them in the slot to play. It's incredibly frustrating. I would really appriciate if you would allow resetting position. Or, if you were to recommend a solution. Thanks!","Dec 2, 2018 at 2:53 AM",4, 77,
2022-05-28 11:33:25.507934,markymark2508,really good,i love to play game it is my faver game,"Apr 6, 2019 at 9:15 AM",5, 5,
2022-05-28 11:33:28.594756,McProwen,great game,just stop scrolling through the reviews just get the game,"Mar 24, 2019 at 10:41 AM",5, 7,
2022-05-28 11:33:28.610713,BoV,,great game one of my fav rift games :),"Apr 4, 2019 at 4:07 AM",5, 3,
2022-05-28 11:33:28.626670,There_Is_No_God,Quite an amazing experience for vr,"Such a great game to introduce people to virtual reality and the commentary is quite funny, its a great game to let your girlfriend/ fiance/ wife play if she isn’t into video games. Because you are working! Who doesn’t like working right? Lol wish there was more to do i find myself not picking up the game after playing all jobs. Hope theres still more to come!","Feb 16, 2019 at 1:21 PM",4, 0,
2022-05-28 11:33:28.642628,Chrimson,,"Was a great game, now I always get a black screen","Apr 11, 2019 at 11:33 PM",1, 3,
2022-05-28 11:33:28.658585,AZSuperman01,"Great, especially for the younger crowd.","Ever wonder what life will be like looking after the robot overlords have taken over the planet and human jobs are no longer necessary? Wonder no more! Step into the museum and Job Bot will be your guide as you experience daily life as a human in a number of various vocations.

You can interact with almost everything, with some surprising results!

It's so realistic you'll be waiting by the mailbox for your paycheck. (Ok, i might have exaggerated that last bit.)

I find the game silly and amusing, but my daughter absolutely loves this game. She will play it for hours looking for additional achievements or hidden Easter eggs.

It's well made and fun.","Dec 24, 2018 at 10:52 PM",5, 24,
2022-05-28 11:33:31.794786,olivier.pelerin.3,this game must be updated but...,with vacation simulator coming they need to update job simulator into a multiplayer game and also vacation simulator,"Mar 16, 2019 at 1:08 AM",3, 0,
2022-05-28 11:33:31.810743,LakeTree,this game is supper fun but short,I loved playing this game and it is very funny but the game is a little bit short. There is only 4 levels in the game that you play and each one is about 20 to 30 minutes long. you can play the levels again and once you play them all you can put in things like low gravity and there is and endless mode to each level but I just wish there were more levels. all in all it's a great and supper fun to play game and it runs great.,"Jan 3, 2019 at 5:39 AM",4, 15,
2022-05-28 11:33:31.826700,Or1cat0,This game is AMAZING,"This game is so fun for people to enjoy i finnaly found everything and thats hard to do when you cant look at your achievments (you probally can im just dumb) my 4 year old brother didn't even get past the job museum and still loved the game! I wanted him to feel better and he managed to explore a whole lot

5 STARS


I totaly recommend this game for newcomers.","Jan 3, 2019 at 4:09 AM",5, 13,
2022-05-28 11:33:31.842657,tcwnitro,"GREAT first time experience, not replay","The game is FANTASTIC for running a VR experience for either your (or someone elses) first time. The tracking is excellent, it has 3rd person PC perspective for fun viewing, and it's pretty funny. An excellent introduction to VR games.

Everything is pretty linear, so expect very little replayability. For what it is though, its GREAT.","Dec 17, 2018 at 8:44 AM",4, 7,
2022-05-28 11:33:31.859612,clinicalia,"Great, however...","I really wish Infinite Overtime let you be more creative in some areas, like the gourmet chef. I don't wanna have to make toast every three minutes. Let me do my own thing, you know?","Jan 31, 2019 at 10:35 AM",4, 4,
2022-05-28 11:33:34.948963,Dommeb,Fun but very short.,"After you finish all levels, which I did in 1 day, theres really not much else to do, yes, I can play it again but its not fun like that for me. Only 4 levels is a bit short, looking forward to better things in Vacation Simulator.","Jan 16, 2019 at 10:22 PM",3, 4,
2022-05-28 11:33:34.964920,jere.karppinen,One of the best games for VR.,"Very silly humor. I have had many friends play it too. This definitely needs a dentist, surgeon and a doctor sim too.","Feb 9, 2019 at 4:37 AM",5, 3,
2022-05-28 11:33:34.980877,Ravenous_One,Great game!,You have nearly endless choices in what you want to do. Great game would reccomend to anyone!,"Feb 16, 2019 at 11:07 AM",5, 1,
