scrapping_date,review_author,review_title,one_reviews_text,review_date,review_rating,review_helpful,review_feedback
2022-05-28 14:55:55.540991,decimatedpie,"Best VR Dungeon Crawler, but Swinging!","Honestly I have been waiting for a VR adventure game like this. It is a weird but awesome mix of a zelda like world and the swinging mechanics of a PS spider-man game. The boss fights are pretty challenging. A boss requires a skilling mix of bow shooting,  moving on the ground, and swinging to get away. The multiplayer is great, which handled surprisingly well for just coming out today. It gives real fear of falling when you miss a shot and fall into lava. It is in my top VR games just based on original gameplay and a very artistic world. It is further awesome based on the world size, which is huge!

My only issue I had was the destination marker would dissapear. I think it happened because I was on a gathering mission, but I still got a little confused on what I had to do. I recommend maybe adding a 'journal' or something to indicate what the current mission is. I think it is sometimes on the right hand, but it would be nice if it was in the menu as well or something. Overall a great game though, highly recommend.","Sep 13, 2018 at 1:26 PM",5, 8,
2022-05-28 14:55:58.655660,Khaazzam,Please fix this game,"Behind the flashy swinging and cool mechanics of shooting arrows at enemies in mid air, this game completely failed to improve upon the flaws that plagued the first game. For starters, why can't I stop on a dime? WHY IS THERE NO DEDICATED BUTTON THAT ALLOWS TO STICK A LANDING? It is completely impossible to control your momentum when landing. Secondly, Why did the devs remove the ability to hook anything? The most fun ive had in vr is swinging in windlands on easy mode, which gives you complete freedom to fly wherever you want, independent of bushes needing to be there. That freedom was the best experience. it makes you feel like spiderman. seriously. Why am I forced to only hook trees? The puzzle element to the game gets so annoying after a while, I just want to be able to hook what ever I want. Lastly, I am stuck in the desert map because I think I entered the portal too early. There is no objective that tells me where to go. I started exploring and now I cant find the portal, or a menu option that takes me back to the hubworld. This button existed in the original windlands but you guys stripped that away too. So after putting 4 hours into the game, I have to start it over because you guys didn't put a fail safe mechanism in case the player gets lost. Last of all, the bow is flawed completely. When I try to use it quickly to open the doors, half of the time it does not work properly. After restarting the game, and making it to the last door, you guys mount the player with the impossible task of hitting 20 panels in 15 seconds to open the last door. The bow is unreliable. 360 degree triple sensor set up. Its not my equiptment. You  cannot shoot quick enought with it because it confuses the controls 50% of the time. It also just straight up glitches. *tries to take a quick shot with the bow and literally nothing happens. I CANNOT PLAY THE FINAL LEVEL. The flawed bow mechanics make it too hard. Take a hint from sairento VR and let us pull the bow off our back","Nov 1, 2018 at 12:46 AM",2, 0,"Hi Khaazzam,

We're really sorry to hear that some parts of the game didn't meet your expectations.

You can enable hook anything in the advance options menu before starting a new game, we will look into making this more obvious.

The feedback you have provided is extremely valuable to us and will assist in helping us balance the game in terms of difficulty. We are always listening to feedback and look to improve with every patch.

Many thanks,

- Psytec Games"
2022-05-28 14:55:58.671618,Folo88,A VR MUST HAVE,I loved the first game back when it came out but this one is sooo much better. The boss fights are incredibly satisfying when you fly around and shoot arrows at them at the same time. WINDLANDS 2 DELIVERED and is now one of my vr best of the best experiences. Hope they'll keep pushing and polishing the series with future iterations of the Windlands universe! Fingers crossed!,"Sep 15, 2018 at 6:01 AM",5, 6,
2022-05-28 14:55:58.688572,lil_sandwich,This Isn't Windlands,"I feel like this sequal lacks any of the character the first Windlands has. Yes, the grappling hook gameplay is improved, and some areas look pretty, but that's about it for me. For starters, the insentive to explore feels artificial. The worlds in Windlands 2 are much bigger than its predecessor, but they lack any real landmarks. Instead, Windlands 2 has these markers that indicate excactly where you should go. This completely breaks the immersion for me because I feel like I'm just being being told where to go instead of having any real motivation to explore. The landmarks in Windlands 1, however, stand out amongst everything else due to their interesting, detail-rich structures; they have a very iconic feel to them. Because of that, the landmarks inspire true curiosity in the player, unlike the markers used in Windlands 2. The markers also make Windlands 2 very linear. On the exterior, Windlands 2 is an open world game, but it really isn't. You could explore all the boss areanas out of sequential order, but nothing will happen if you don't defeat the other bosses first. Windlands 1, on the other hand, starts each world off with a forking path, allowing for the player choose which location to explore first based on what they find the most intriguing. Also, the addition of combat to Windlands 2 in general takes away the exploration aspect for me. It feels more like I'm playing a robot killing game with hints of exploration than I am playing an exploration game. This sounds nitpicky, but exploration is what makes Windlands Windlands. Not only that, but the bosses suck. They are way too hard, and there is no real punishment for dying, making them extremely tedious for them to defeat. So what's the point of having them, or having enemies in the first place? I also think that the addition of npcs takes away the mysterious vibe. Windlands 1 feels more mature without actually being mature due to the lack of cliche plotlines. I just can't take Windlands 2 seriously.","Sep 28, 2018 at 9:47 AM",1, 3,"Hi lil_sandwhich.

If you would like to switch off the markers, this can be done in the options panel > settings. We understand that some players want to enjoy a pure experience and took extra care to build these features in. There are plenty of hidden secrets and landmarks that stay true to the original Windlands formula which are still yet to be found and we can’t wait to see who gets to them first. 

Thank you for your support and comments! - Psytec Games"
2022-05-28 14:55:58.704529,LuluViBritannia,"Excellent, perfect sequel!","Windlands 2 is a perfect step forward from the first game. It takes everything good from the first game and even improves it, and also adds multiplayer and battles (which makes the game much more than just a platform game).
Once again, we get to soar through the sky under low gravity, which is an incredible feeling! But now we also have a bow to fight machines. We get to fight while soaring, Attack on Titan style. That alone makes this game incredible and unique!
On top of that, the mechanics have been reviewed: the devs have added the ""slide"" motion (whenever we get to a floor at high speed, the character slides on it which makes it speed up instead of slowing down) and the ability to pull ourselves forward with the ropes. Those make the game even more fluid than before!

As for the story, I don't really care for it, I barely even listen to the characters so I can't say anything about it. That said, it feels more complete than the first game, with some stakes and an actual storyline. But really the story is just an excuse.

Now, I have to point out a few flaws, which you may consider major, or not.
- First, the game is clearly designed for multiplayer. As such, some objectives are extremely hard to take on on single player. This is frustrating, because usually, the difficulty should be adapted to the number of players. Here it's not the case.
- Then, the graphics are clearly a huge step down compared to the first. The colors are less beautiful and makes no sense: orange juice can OHKO... that's right, orange juice ; the sky is colored with a horrible cyan or orange color ; ...
- The level design of the boss battles is not only repetitive, it's also badly done.
- I don't find the voices really... professional. Though that's an usual problem in indie games.

In the end, the game is not perfect, of course. But for each tiny flaw, it makes up for with yet again a wonderful soundtrack, an exceptional gameplay, and a huge amount of fun with multiplayer and battles!","Sep 17, 2018 at 5:28 PM",5, 4,
2022-05-28 14:55:58.720487,Squadaloo,A Tale of Two Games,"I had the original for PSVR but found it mediocre due to the dualshock controls.  I decided to pick up the sequel anyways due to the new features and Oculus Touch, and found it slightly better but for reasons I didn't expect.

For those worried about missing out on the original, the story in 2 is completely new and you can hop into this game without prior knowledge.  The story is fairly generic:  it's not bad, it just exists to move the game along.  The voice acting is done mostly well although all but one of the characters is forgettable or cliche.

The swinging mechanic is by far the game's strongest tool.  It can take time to get used to the way momentum works but once you do you'll find yourself zipping along at top speed and it's exhilerating.  The level design is also mostly good for rewarding momentum although it does slip here and there by forcing slower platforming at points.  Also, the second area in the game doesn't play well with the game's waypoint system so it can be very easy to get lost.

The combat, on the other hand, is weak.  Facing off against smaller foes works fine, but the boss battles are just horribly designed.  The difficulty is all over the place with the first boss being harder than most of the bosses in the game.  The approach the devs took to designing these fights seems to have been make them as difficult as possible, but give you infinite lives and don't reset the boss between deaths.  This has the strange effect of making bosses incredibly frustrating to beat but also makes their death inevitable.  I found the easiest way to take out some bosses was to not even try to stay alive and to instead to just throw myself high in the air and fire arrows at them wildly as I fell to my death.  Beating them feels more like a sigh of relief than an accomplishment since you can't lose.

Overall, I'd actually give the game 3.5 stars since it's pretty good: I opted for 3 stars though since 4 seems like too strong of a recommendation.","Sep 15, 2018 at 11:22 AM",3, 16,
2022-05-28 14:56:01.812218,urugon,This is NOT Windlands,"Windlands 1 is one of my favorite VR Game. Everything i like in Windlands 1 disappeared here. In Windlands 1, one challenge is to find the right course and the best way to progress inside the course. Here, course are easy, linear and guided ! Just follow the mark right in front of you :-( Another challenge in Windlands 1 is to find hidden artefacts which make little noise when you are closed to them. Here, artefacts are nearly disappeared with no noise :-(
Music is very good in Windlands 1 and appears when it's the right time. In Windlands 2 , music is always on and repetitive :-( 
There's a real atmosphere in Windlands 1, a kind of magic. Not in Windlands 2. 
Because Windlands 2 is intended to FPS fan. This is the new challenge and the main activity in Windlands 2 : kill the Boss and kill the atmosphere in the same time.","Oct 13, 2018 at 6:41 PM",1, 1,
2022-05-28 14:56:01.828175,murray21,I cant join a room,"When i get in the game and click multiplayer, i have never been able to join a match because nobodys ever playing.

Over all it is a very good game and i would suggest buying it.","Nov 9, 2018 at 5:21 AM",4, 0,
2022-05-28 14:56:01.844132,Hanover,From Relaxing to Frustrating,"The first Windlands was such a great chill game.  You got to explore huge environments.  You would try to figure out how high you could scale.  It had a bit of a story too.  It was a nice place to visit to get away from real life for a bit.

Windlands 2 ditches that and in the first 15 minutes has you go up against a boss that took me over an hour to beat.  It also features a new shooting mechanic.  This was not what I was expecting from the sequel.  Gone is the exploration of huge vistas and it's been replaced by a Bionic Commando clone with lots of shooting.","Oct 7, 2018 at 2:04 PM",2, 2,
2022-05-28 14:56:01.860090,JigabooWarrior,Better than the old one,"Suggestions: Make all of the enemies shoot maybe 25% faster and make their projectiles move 25% faster, or at maybe make that an option in the advanced settings part of the menu. Allow us to hook onto other players as an option that the host can enable, would be very fun & allow for slingshot scenarios. Allow the host to teleport to other players, this causes difficulty. Make it an option for the host to make the host teleport button teleport directly to the host instead of their last checkpoint. Maybe make a gamemode where players can pvp eachother, maybe this is already a thing and I haven't checked. Make the spawn boat drivable. Otherwise awesome game, definitely exceeded my expectations based on experience with the old one.","Oct 9, 2018 at 7:43 AM",5, 1,
2022-05-28 14:56:01.876047,jagfirerwalker,Pff who needs the new Spiderman game,"This game is unbelievable incredible! The swings, the desperate tried to grab on to trees that are out of reach, and just making it in the last minute before you fall to your demise. WOW! This game is such a must have. 
I even convinced my wife to play this! That means something right? Right?","Sep 18, 2018 at 7:33 AM",5, 3,
2022-05-28 14:56:04.967777,ChaseDragonfury,Awesome! ...but I'm stuck.,"Game is fantastic, just like the first one and better in a bunch of ways. However, pretty sure I've ran into a bug where the objective marker totally disappears. Tried a few things but to no avail. The thoughts of either wandering around for hours or starting a new save both kinda suck.","Oct 8, 2018 at 11:46 AM",5, 2,
2022-05-28 14:56:04.982738,aidan_wolf,Not that fun,"Unfortunately this game just isn't that fun. Most everything feels like a grind  (especially the bosses), your first quest is a fetch quest, the characters are extremely lifeless, death feels entirely inconsequential making me care little how well I swung or how well I planned my route, there's little to no player agency (everything is non-interactive), most every grapple target felt just a tiny bit too far away,  if you miss a character's dialogue you can't ever hear it again, the bosses feel at odds with the swinging, the menu is infuriatingly hard to interact with (buttons need to be pressed deep, dials don't spin as you would expect them to), the sense of speed and gravity disappeared before the tutorial was over, and it's the only VR game so far that's given me eye strain.

On a positive note, it gave me one of the coolest, most immersive moments I've had in VR, when the giant sandworm jumped over our ship in the intro sequence. Never felt such scale before! 3 stars for sandworm.","Oct 6, 2018 at 2:33 PM",3, 1,
2022-05-28 14:56:04.998695,BenMusak,The game is well worth the price!,"I just wrote a long review of how amazing this game feels and then my computer crashes...
So a long review short: This game makes you feel like a hero when everything goes right. The controls are smooth, the way of transport is amazing and really clever, the environment looks really crisp (even though they are quite simple) and the bosses and enemies are really interesting to fight with the provided bow!","Sep 13, 2018 at 9:14 PM",5, 3,
2022-05-28 14:56:05.015650,ChrispyBurgers,Everything I wanted in Windlands!,"If you enjoyed Windlands you'll love this! The additon of npc's, multiplayer, and a more engaging story than its predecessor made this game worth the buy!
                                                     HOWEVER
There are still a few game breaking bugs most of them happen around boss battles which have you restart the game and boss battle. One boss took me and a stranger 3 tries because the boss kept freezing and would't go to the next phase.

Some of the visuals looked better on windlands 1 and the movment on foot is a little janky but once you get use to it, it's not so bad
                                               OTHER THAN THAT
this game is simply amazing especially for an idie game! 7/10","Sep 21, 2018 at 10:04 PM",4, 2,"Hi ChrispyBurgers.

We are actively working on our second post launch patch to address the boss battle issues, if you experience any other issues during play, please do not hesitate to send us a feedback form in game, this creates a ticket directly to us with your current location in the world too.

Many thanks for your kind words and support! - Psytec Games"
2022-05-28 14:56:05.031607,p00ky,,"A real improvement over the first game which although well executed, suffered a little from a lack of direction. I've only played a little of the single player experience but I can imagine co op boss battles would be a blast.","Sep 13, 2018 at 4:48 PM",5, 5,
2022-05-28 14:56:08.145279,Dknighter,Amazing game - minor bugs,The game is amazing however I ran into some frustrating bugs however the Devs have contacted me and are working on fixing them asap. I feel this game would be so much better if it had smaller mobs scattered around in between the missions instead of just bosses.,"Sep 14, 2018 at 9:16 AM",5, 4,
2022-05-28 14:56:08.162233,motoracer10975,Awesome!!!,"I have played the first Windlands... I don't know how many times.  My favorite game of all time.   Windlands 2 is just massive in comparison.  I love that they put the artifacts in again, although I wish they would make noise when I was near.  Some of my favorite parts of windlands 1 were hearing that and spending sometimes hours finding and collecting the artifacts.  I had a hard time picking up the bow actions.  I am better at it now but it took some learning.  Jumping is what I miss the most.  Part of what made the 1st one so much fun was the parkour style interaction and challenges and I feel like that is missing now, although I am getting used to the new style of jumping.  Overall this is an amazing game though.  Thanks to the devs for creating this time vampire.","Sep 19, 2018 at 8:06 PM",5, 6,
2022-05-28 14:56:08.178191,RuneSR2,Best VR game ever! A dream come true!,"It's a tough job being VR game designer, many aspects have to be considered - from getting perfect controls, making breathtaking graphics, pushing adrenaline-inducing gameplay and not to forget getting those magic 90 fps also on the previous generation af video cards. Can it really be done? Windlands 2 just did! Admitted, I haven't finished the game yet, but I don't remember seeing a more polished VR game: I know the devs are proud to call themselves ""indie"", but this game beats all the AAA games I can think of - and it does it in spades. 
If Windlands was awesome, then Windlands 2 is easily beyond description, although one word springs to mind: Reference. My top 3 of best ever VR games has just been changed to Lone Echo, Moss and Windlands 2.
I gave the game the worst conditions I could think of and started the game forcing super-sampling (ss) 2.0 - and I got perfect 90 fps. Ok, in the start, later I had to reduce antialiasing to 2x and kept view distance to 1.2 (couldn't see any difference between 1.2 and 5 anyway), and got solid 90 fps using an oc'ed GTX 1080, i7 7700K and 16GB 3200MHz. Controls are better than Windlands, love the bow, and the world is now filled with animated life. Textures get extra detail when you're close, just awesome. The graphics are extremely beautiful and so much better than Windlands, graphics feel and look like art. This isn't just Windlands 2, it's a dream come true!","Sep 29, 2018 at 6:31 AM",5, 1,
2022-05-28 14:56:08.194148,Zenthar,A Solid Challenging Experience,"A great game that capitalizes on freedom of movement.  Zip through trees, fling up cliff faces, pass up your friends as they try to figure out how you got to a specific area.  Offers a decent challenge and the co-op is well integrated.","Sep 20, 2018 at 7:31 AM",5, 3,
2022-05-28 14:56:08.210106,krum666,Windlands 2 is a fantastic experience,"Windlands 2 is a fantastic experience. Amazing swing mechanics, I can play with my friends. Check out my video review on Youtube https://youtu.be/25vx31vPRVM 

Windlands is definetely in my top 3 VR games. : )","Sep 13, 2018 at 1:50 PM",5, 5,
2022-05-28 14:56:11.287873,SayBass,A Unique and  Enjoyable Experience,"A great concept and well executed. Some learning curve on swinging and shooting, but man, is it fun. Lovely graphics, physics and controls smooth.

You die a lot at first - especially getting used to combat - but luckily, you keep respawing infinitely. Checkpoints are used in lieu of game saves.

I haven't played in Co-Op yet, so no thoughts. Combat would be easier with friends. 

Settings offers some good comfort options - otherwise I would be getting pretty dizzy. Need more time to get my VR legs :)

Definitely worth adding to your library.","Sep 23, 2018 at 2:15 PM",5, 2,
2022-05-28 14:56:11.304828,danebramager,Lots of fun and improves on the original,"Loving it but theres a bug where the initial draw on the bow doesn't have an aiming dot or fire properly... really frustrating during boss battles.

Also the characters and animations are pretty lacking which I can easily overlook but yeah if the dev fixes the issue with the bow i'll update to 5 stars :)","Sep 22, 2018 at 2:02 PM",4, 1,"Hi Dave82.

We are actively working on our second post launch patch to address reported bow and boss battle issues. if you experience any other issues during play, please do not hesitate to send us a feedback form in game, this creates a ticket directly to us with your current location in the world too.

Many thanks for your kind words and support! - Psytec Games"
2022-05-28 14:56:11.321783,TAH78,WOW,"Updating review: I changed to ""hook everything"" the game was much more fun. Still some parts are even on ""easy"" difficult (boss fightings, bow). But with ""hook everything"" (a bit hidden in configuration) you can really enjoy the game when you want it more for relaxing like me. So i updating my review, 5 stars cause the game ist really made very beautiful, great graphics and great sound. I still think its made to difficult, especially comparing to windlands (1) but most people seem to enjoy this. I wished (already in windlands 1) there would be some kind of radar to find fragments, some are very hard to find. I found some easter eggs (?) but i am not sure what they mean (little hidden graphics, some are strange).
Old review: Wow, you really did it! You changed a nice relaxing game into a stupid fighting game like 1000 others already existing. I really was happy for the sequel. But already your first boss fight is frutrating that i don't like to play any longer. Sad. This game could be really good. One star for very good graphics, nice story and good sound but bad gameplay.","Nov 13, 2018 at 5:37 AM",5, 1,"TAH78

Hi TAH78.

I’m really sorry to hear this. If the boss battles are too challenging, we recommend switching to the easy difficulty first which gives you some extra hits from enemies before respawning. You can also head into the advanced options when starting a new game to reduce the weak points on bosses.

Many thanks for your comments and support! - Psytec Games"
2022-05-28 14:56:11.338738,zkosn,immersive game in a very empty world,"I really like how you can get caught up simply in trying to figure out if you can climb higher.    I'm mostly going to talk about the tree cave after the first boss, finding 8 parts.  I've completed the 2nd boss.  This tree cave is so big, I spent about 1-2 hours in it just playing around, and with so many nooks, crannies, and hard to reach places that it felt really strange that they were almost all empty.  I was thinking a Mario game would never let you find a cool hard to get to area and not be rewarded.   Strangely, if you look wayyyy up, you can see a glowing waypoint.  I have no idea if it's possible to reach it (I concluded it was not despite getting within 2 or 3 ""layers""), and if I did reach it, it probably was totally empty.   So, I gave up; not knowing.  I figure I can turn on the hook anywhere option, but that's cheating.      Oh, and the bosses are really difficult, which is jarring in comparison to the 99% of the time things are peaceful.    (I guess they are bosses of an army of 1?)      I hope the missions get more creative too, but I'm thinking this is more of an ""experience"" than a game.    (The swinging around is really fun  though....so I'd give it an extra 1/2 star)","Sep 20, 2018 at 12:05 PM",3, 2,
2022-05-28 14:56:11.353697,Jeenboy,"Great Game But,","I really enjoyed this game, the story, characters, mechanics, customization, it's all good. Yet, there is still one thing that caused the reason why I'm still not finished with the game. It's nearly impossible at some parts, the grippable parts are sometimes too far from each other, or just too high up. And It's probably just me being bad at the game, but I'm playing on Easy Mode. No problem with fighting, just what I'm expected to do when it comes to swinging on certain parts of the game (such as most of the volcano [which I'm still on] ) is out of my limits.","Sep 23, 2018 at 3:03 AM",4, 0,
