scrapping_date,review_author,review_title,one_reviews_text,review_date,review_rating,review_helpful,review_feedback
2022-05-28 14:56:14.465376,jac,"Good, but short. A great Sequel.","Windlands 2 is a great follow up to windlands 2, improving on the gameplay in several ways. Aside from its short length, a few gameplay issues hold it back. That said, its a must play for any vr enthusiast.

From windlands 1, there have been several tweaks. For instance, movement in your room effects your charcter position, and if your upper body makes iton to a ledge, you will land on the ledge. There is also this new mechanic where if you land from high up, you dip down a bit more, almost like a roll, and jumping out of this gives your jump a boost. Wall jumping has been reworked a bit so you can't get the crazy ultra jumps from the first game, but theyve also been nerfed pretty hard. Wall jumping is almost useless in this game.

Expanding on that, the platforming is way, way easier. The difficulty curve felt a lot more natural than windlands 1, but its a shame it wasn't long enough to get to where windlands 1 did. It would have been nice to see some more difficult sections in the game.

And that brings me to combat. Dudes, work on that bow. Several times, I would try to pull up the bow, only for just the strings to appear, and not allow me to shoot anything. This did kill me several times. Next, difficulty only effects combat in a platforming game, you should be explicite about that. You die to easily and there is no punishment for dying. The ground of many of the combat arenas instant kill you. Turning around, shooting a homing missile, and turning back around to grab a bush thats wizzing past your head is extremely hard. It should be more forgiving, either by having bigger bushes or a safer floor. Since there is no punishment for dying, and living is so hard, it encourages users to just run in, chip some health, and let yourself die. Which is not fun, its frustrating.

All that said, windlands 1 & 2 are amazingly fun. Soaring around is a blast and the moments when you lunge in the air, shoot an enemy with your bow, then swing away are fantastic.","Sep 18, 2018 at 1:33 PM",5, 2,
2022-05-28 14:56:14.483327,nazK1LL,So much yes!,"The mechanics and the first boss fight will get you so hyped on the future of VR (not just this game). I've only played solo thus far but it was so enjoyable. i kept getting wrecked by the first boss and noticed myself getting better and better as it progressed. It's simple yet complex, the best way for a game to be.","Sep 14, 2018 at 4:54 AM",5, 3,
2022-05-28 14:56:14.500282,PixelTrips,,"Windlands 1 was one of the first VR games I bought on Steam and I loved it, so for me this game was an automatic buy,

This game improves on the soaring aspect tenfold.  The Devs defiinity wanted a smooth nearly non-stop Spiderman swinging type of adventure.   To me this differs a bit from the first game because I stopped many times to try to plot my way through before I started soaring.  In W2 you really don't have to do that because there are an (over) abundance of places you can grapple to.   When you are following the story It almost feels like you are on a tour of the world.

It's nice to see NPCs and have some ""quests"" to go on.  There are still artifacts to collect, although I really miss the cracking/creeking sound they made in W1.   

The combat is ok. nothing too difficult to master.  I have yet to play a multiplayer game but I think PVP would be a great (mod) addition to this game and perhaps give it additional longevity.","Sep 17, 2018 at 9:20 AM",4, 1,
2022-05-28 14:56:14.516239,drevil1988,Second best VR Game by now,"Only Lone Echo can beat this Masterpeace. 
The swingging is by far one of the best gameplay mechanics i ever had.","Oct 2, 2018 at 4:54 AM",5, 3,
2022-05-28 14:56:14.532196,tacomcca,Solid Title,A very good VR title. I did not play the first game but found the second challenging and entertaining. I have not tried the multiplayer yet. Will update review  once that is done.,"Sep 27, 2018 at 10:30 AM",4, 2,
2022-05-28 14:56:17.620935,TheUKRifter,I'm Back and now with Friends,"Windlands was a fantastic experience, now I am happy to see this lovingly produced sequal, 3 years in the making. Somehow they have improved on the swing mechanics, I can play with my friends and the story builds on the original and vast universe. Well done devs!","Sep 13, 2018 at 2:09 AM",5, 6,
2022-05-28 14:56:17.636892,MJASP,Very good game!,"This is the most fun i've had in vr! This game lets you explore and play with friends and I love that! 

The gliches and bugs I had are now fixed! This game quickly fixed all the bugs I had which makes me happy! =] Now I can fully enjoy this game!   







Also this is a must buy!","Sep 19, 2018 at 6:53 AM",5, 2,
2022-05-28 14:56:17.653847,Antares7019,AWESOME,this game (in my opinion) is one of the best vr games i have played and one of my favorite games i have and i like this style of game and hope there are more to come.,"Sep 14, 2018 at 8:50 AM",5, 4,
2022-05-28 14:56:17.669804,Vaelant,Overall Improvement makes for VR Bliss,Everything Windlands 1 was with Quality of Life improvements. I missed swinging through the treetops. It has been wonderful watching this developer grow alongside VR.,"Sep 13, 2018 at 1:15 PM",5, 4,
2022-05-28 14:56:17.686759,jellybeanking2,Amazing,"This game is great and super super satisfying. It is like a spiderman game for vr. I would love to see more control options and maybe a custom map mode, otherwise a great game.","Sep 15, 2018 at 11:08 AM",5, 3,
2022-05-28 14:56:20.797439,RedBeardOfDeath,Instantly my favorite VR game,"Loved the first Windlands, and this is better. Flinging yourself through the air and landing a mid-flight shot with your bow and arrow is so satisfying. This is what VR is for. More games like this please!","Sep 13, 2018 at 11:03 AM",5, 5,
2022-05-28 14:56:20.813396,Zapp_Legrand,Stunning Game,"Hooks are very satisfying, you can custom them to fit your style of gameplay, the addition of the bow is a great idea,  and the coop works great. What more to ask ? :)","Sep 15, 2018 at 2:57 PM",5, 2,
2022-05-28 14:56:20.829353,EthanAC,A deam come true.,"The graphics are stunning, the visuals are breathtaking, the missions are hard, fun bosses, good story, I recommend this game to anybody who comes across it!","Sep 22, 2018 at 6:24 PM",5, 3,
2022-05-28 14:56:20.846308,BROHONKY,Windlands 1 on steroids!,"Take everything good from Windlands, remove the worst parts of Windlands, tie it together with a new combat system. You get one of the VR games ever.","Sep 13, 2018 at 8:56 PM",5, 8,
2022-05-28 14:56:20.863263,vz1123,Everything,I'll just be repeating all the great things already mentioned so I'll just leave the review. Love the game!,"Sep 21, 2018 at 1:10 AM",5, 2,
2022-05-28 14:56:23.949009,Gaudette233,Breathtaking,"I finished the game, it was so satisfying to do!","Oct 15, 2018 at 1:19 PM",5, 1,
2022-05-28 14:56:23.964967,AfterXDeath,Was well worth the wait,"played the original.... liked it
played the sequel...... LOVE IT!!!","Sep 13, 2018 at 12:53 PM",5, 4,
2022-05-28 14:56:23.981921,Michał Wróblewski,This is epic!,I played it a year ago at an event - it was awesome. Now it's even better. It was worth waiting. My son is also doing great and he loves the game.,"Sep 15, 2018 at 8:27 PM",5, 5,
2022-05-28 14:56:23.998876,skinder899,Really Fun!,"First I was hesitant about getting the game for $30, and it also being rated as intense comfort, but it is worth the amount and it hasn't made me feel dizzy at all!","Sep 14, 2018 at 7:15 AM",5, 4,
2022-05-28 14:56:24.014833,Whittty,Excellent!,This is an incredible experience. I definitely recommend this game. Very fun with the swinging and bow mechanic combined.,"Sep 22, 2018 at 11:22 AM",5, 1,
2022-05-28 14:56:27.126511,obeler,Excellent game :D,"Windlands 2 is  very smooth.  Once you adjust to swinging around and aiming with bow , get ready for perfect adventure","Sep 18, 2018 at 3:17 AM",5, 0,
2022-05-28 14:56:27.142468,Memeruf,Absolutely Amazing.,"Improved swinging, multiplayer and boss fights all made this game great to play. Definitely a good buy.","Sep 13, 2018 at 1:30 PM",5, 4,
2022-05-28 14:56:27.158425,DakDirtbiker,Amazing,This Game is Truely next level its so much fun soaring with your bow is ureal A MUST BUY!,"Sep 18, 2018 at 10:36 AM",5, 1,
2022-05-28 14:56:27.174383,coolguy1076,Absolutely fantastic!,"Loved the first, love the second even more.  Load times are pretty long but it's worth it!","Sep 15, 2018 at 10:38 AM",5, 2,
2022-05-28 14:56:27.190340,AlexLen,Amazing game,Thumbs up! It was worth the wait :),"Sep 13, 2018 at 1:03 AM",5, 10,
2022-05-28 14:56:30.299026,Abindvi,,rest,"Sep 17, 2018 at 6:15 PM",2, 0,
