scrapping_date,review_author,review_title,one_reviews_text,review_date,review_rating,review_helpful,review_feedback
2022-05-28 14:55:33.343658,Soulsea,Took away all the good stuff.,"This sequel is a totall bust, there is not really any parkour, you cannot acheive the high flying crazy jumps without hooks, and the story line is mediocre. You spend all your time going back and forth on paths that you have already traversed a plethora of times; these paths however are quite gorgeous and the graphics of the game have improved since the first(hence the three stars rather than 1).","Jan 2, 2021 at 12:16 PM",3, 7,
2022-05-28 14:55:33.358617,Neithrantulre,Buy it elsewhere,"You should definitely play this game, but Facebook will soon brick your device unless you are constantly connected to Facebook while in VR, so you should get this game on Steam or any other platform so you can continue to play it on your new, non-oculus headset.","Oct 12, 2020 at 5:13 AM",3, 11,
2022-05-28 14:55:33.373578,RJHeard1117,top fun,"this is by far one of my favorites, but at begining you must go to advanced settings and switch to grab anything to really get the full effect","Oct 22, 2020 at 10:09 AM",5, 3,
2022-05-28 14:55:33.388537,thoiter,Mostly great.,"There's not much room for criticism, but the game sometimes ""cheats"". By this I mean that you can spend a lot of time and effort manuevering into a position where you know you're easily in range of hooking a bush, only to be left unable to attach to it, presumably because the devs don't want you to take that route.
If i'm in range I want to be able to attach my hook, anything less is down to poor level design and is very frustrating for the player especially at critical points in the game.","May 6, 2020 at 12:18 AM",4, 16,
2022-05-28 14:55:33.403498,Bryce Bentley,A favorite!,"One of my favorite VR games. I used to play it all the time on my Cv1. I now have a Quest and no pc. I wish it was possible to play a version of this game on a standalone Quest. Even though, still one of my favorites.","May 25, 2020 at 10:41 AM",5, 4,
2022-05-28 14:55:36.510329,JackDiddley,Pointlessly Swinging Around,"I read reviews for the game giving it one star because people were unable to install it.  I thought, that's not fair.  I downloaded the game and it installed flawlessly.

It just isnt very fun.  The levels are poorly designed and there is no direction to the game.  It is fun to swing around for a little while until you come to a point where you are hanging from a green thing and there aren't any other green things within reach of your grappling hook.  So fall into the lava, respawn, rinse, repeat...

I don't know what I am supposed to be doing, or why I am doing it.  Just swiging around trying to get to these goal markers which seem to be just out of reach of any of the things I can swing from.  The whole thing seems kind of pointless and the average playtime is about 8 minutes before boredom sets in.

Good mechanic for a Spider-man game.  Needs more things to swing from.","May 6, 2020 at 1:19 AM",2, 4,
2022-05-28 14:55:36.526286,FrogFrogFrog,Motionsickness & Limiting,Why can I only attach to the green stuff when it would be more fun to swing like spiderman.,"Mar 1, 2020 at 10:22 AM",2, 2,
2022-05-28 14:55:36.540249,Azelroth,Windlands 2 is very fun!,Finally got the game working and played for quite a while. The game makes you feel like Spiderman swinging around. It's awesome. I didn't get any motion sickness either. The bosses are challenging and it felt rewarding beating them. I'd recommend this game to others.,"Dec 29, 2019 at 8:24 AM",4, 3,
2022-05-28 14:55:36.556207,zimi_animations,Can't install,"Devs ar u gonna do something about this? And even if you will, think about refunds from PR perspective ;)","Feb 11, 2020 at 9:19 PM",1, 3,
2022-05-28 14:55:36.572164,SuperHazenVR,can't even install it,"title says it all. it just says ""sorry we couldn't install windlands 2"" or something.
and every other game works, i installed vrchat and minecraft with no issues.
but here i had to repair my oculus app and make a new games folder location.
so i cant even enjoy the game...","Feb 9, 2020 at 7:29 AM",1, 6,
2022-05-28 14:55:39.654482,91Patches,Would be great if I could install,only putting a 1 star review because out of the 30 games I have installed from the Oculus store this is the only one that refuses to install. gets to almost finished then I get an error. Have tried everything from restarting my pc to disabling anti virus. Nothing will make this game install.,"Feb 11, 2020 at 9:23 AM",1, 3,
2022-05-28 14:55:39.679415,treydogg27,Can't Install,"Normally wouldn't leave this for a review but clearly i'm not the only one having this issue. Pay for the game, adds to library, error message when downloading. I play other things on here all the time though.","Feb 11, 2020 at 10:51 AM",1, 3,
2022-05-28 14:55:39.693377,Manydoors,Won't install.,"Great advert for the game when it won't even install.
What do we do now, refund it or wait for a fix?","Feb 12, 2020 at 12:55 AM",1, 2,
2022-05-28 14:55:39.709335,roman_sup,"""Changelog"" isn't much... EDIT: Fixed :)","I like this game and have completed it several times, but I find it pretty annoying that the changelog isn't used for anything other than stating the new version. I'd like to know what has improved in the game so I can use that as an incentive to play the game and explore with whatever was fixed.

EDIT: The developers now include notes in the updates. Great game!","Sep 15, 2019 at 1:47 AM",5, 11,"Hi roman_sup, Thank you for brining this to our attention, looks like the Oculus platform has not been updated with the release notes for the latest version, We have updated them and we will add checks to make sure release notes are indeed present."
2022-05-28 14:55:39.724295,YoavReisner,Multiplayer is broken,"** I am writing this review after asking for help on the Windlands 2 forums on steam and being ignored by the dev **

To be honest, I don't know how the game is. Might be great. 
My friends and I bought this game wanting to play together, as this is supposed to be a great coop game. However, when we tried to connect together the game not only did not let us, it did stuff which are unacceptable. 
For example, one time we were trying to connect and it kept us in an entirely dark waiting screen forever. Probably got stuck. Eventually I had to kill the game and restart it to try again. Between getting stuck in dark loading screen, or none-dark loading screen, nothing work. 
One time somehow one of us managed to join the other, but it was only one time, and even that time the 3rd player simply got stuck trying to connect every time. Usually we couldn't even connect 2 people to the same place. 
We are long time gamers, we know our stuff. This was hell, and after around an hour we gave up. I gave the devs the chance to help out, but it doesn't seem like they care. 
Anyway, if you want to play alone, this might be a fun game, sounds like it is from others. If you want to do multiplayer, I would recommend to avoid this game.","Sep 11, 2019 at 3:13 AM",1, 2,"Hi YoavReisner,

Both Steam and Oculus use the platform's multiplayer services and we can confirm these do work for each individual platforms, however firewalls can cause issues, we don't have any actual servers, we use a method called punch through that uses Oculus, Steam or our Own Servers to facilitate connections peer to peer.

Our own cross play service is in beta and occasionally has issues, I can confirm it's working as I write this, and I hope you don't experience problems going forwards, if you do find an issue we do have a support form http://support.psytecgames.com and endeavour to fix issues quickly."
2022-05-28 14:55:42.836969,DanielYehezkeli,Extreamly Dissapointed,"I bought the game with an intention to play it with my friends. Yet, when any of us try to connect to co-op inside the game, the game sends up to an eternal black screen.
When we tried  to contact the developers there was not response.
If no response will be provided in a few days I'll have no choice but to ask for a refund. I want to like this game, but it's co-op is currently unplayable","Sep 11, 2019 at 3:06 AM",1, 1,"Hi DanielYehezkeli, the networking used is peer to peer (no central services) and uses the Oculus Matchmaking servers to pair friends and then we use a technique called punch through, to create a connection between your self and friends, sometimes firewalls or networks cause issues (they try and stop incoming traffic), but for most people this should work fine, we also have a beta of our own cross play server so Oculus and Steam players can bridge the gap, this is in beta and thus isn't always perfect, we will strive to find issues and do what we can to fix them, if you experience any further issues please contact support at http://support.psytecgames.com"
2022-05-28 14:55:42.851930,taquitobuddy,"Great movement, not so much the rest","First, the swinging around in this game feels fantastic once you get the hang of it.  Really cool.  The graphics are also basic but suit the overall game style, and the music is relaxing.  There's a big world to explore, solo, coop, race, and collect modes.  On the cons side, combat is extremely basic, boring, and often frustrating.  Also while the world is huge and looks very nice, there is no map, and the waypoint markers are essentially useless.  There's a difference between exploring and wandering around lost, and this definately falls into the later category.  A map or optional guide line would have made this so much better.  Overall, pick up the first one for a much lower price, as it is just as good as this one if you just want to swing around and relax because there's not much else worth doing.","Jul 18, 2019 at 2:07 AM",3, 8,
2022-05-28 14:55:42.866890,klumpfluff,Fun!,"As mentioned in a few other reviews here, this is not as ground breaking as WL1 but as an advancement it is great. The bow, simple story and the insanse skill cap that the combination of this games simple tools allow is insane. Keeping momentum was fun in WL1, same here. Now ad a bow and target shooting. Sick fun, kinda unique skillset required maybe, which perhaps gives it a smaller audience but for me this is so much fun. There are some things that aren't perfect but the pleasure I get from this game makes this review a clear 5.","Sep 26, 2019 at 6:50 PM",5, 3,
2022-05-28 14:55:42.881850,TravStur,Great Adventure Game,"Great game with super fun swinging. I give the boss fights a 3/5, but the other parts of the game are a great vr experience.","Sep 5, 2019 at 4:40 PM",5, 1,
2022-05-28 14:55:42.896810,IBfrasy,A must have in your library,highly recomend buying this. i would give it 6 stars if i could,"Sep 12, 2019 at 5:29 AM",5, 2,
2022-05-28 14:55:45.984551,a_gilling,Web Slinging Adventure game,"Video review can be found here: https://youtu.be/xwWDLoKwd44

Summary: unique web slinging movement makes you feel like spiderman but not for the weak stomach.

This is a great game that can be played single player or up to 4 player co op with about 5-6 hours of single player plus multiplayer races. Love the feel of this game its movement that can take a little getting used to but once you do makes you feel like no other game can. 

For a more in depth review check link to video review at the top.","Jun 4, 2019 at 11:43 PM",5, 6,
2022-05-28 14:55:45.999511,manbearpig400,Runs & looks perfect!!!,"This is a major upgrade from windlands 1. I LOVE the multiplayer feature, it's so fun exploring this open world game with a few buddies. 100% recommend.","Jul 7, 2019 at 2:13 AM",5, 1,
2022-05-28 14:55:46.014471,thumbtackVR,Makes you feel like an absolute Beast,"Windlands 2 has great, fun looking cartoon graphics and an awesome soundtrack. You swing through enviornments to kill evil robots and collect crystals that progress the game. If you can hit a monster or any other target mid-air and keep your momentum going, it really does make you feel like a god. Five stars.","May 3, 2019 at 7:49 PM",5, 11,
2022-05-28 14:55:46.029431,beaulima9933,,best game eve!,"Sep 26, 2019 at 12:18 AM",5, 1,
2022-05-28 14:55:46.044391,jim1709,This is fine,My previous review wasnt accurate. This game gets repetitive real fast. I cant actually post my other review because it has swears in it? Not really but sure. I cant be bothered to quess anymore what that swear is. Just be careful with this one. There is a review somewhere in there that has given 1 star to the game. I dont agree with the 1 star but the info below it is spot on! Go read that,"Mar 9, 2019 at 1:49 AM",3, 0,
2022-05-28 14:55:49.156068,CarloFromMilkyWay,The second best gaming experience,"... after Windlands 1. 
Windlands ""1"" was exhilarating, frustrating, fulfilling. At the end of a level I felt exhausted and trembling, but truly happy . Sometimes I had to take off my vr headset for the fear to fall down. This game is better in many ways: the graphics, the story, the addition of a very easy to use and spectacular bow, the structure of the levels. But it is not fun as his predecessor. He misses the sense of magical vertigo that had the original. It is however a unique experience, which makes understand what VR can give compared to traditional games. In these days it seemed to me that is slower than some time ago, as if it were not optimized for my gtx 1080.","Dec 24, 2018 at 11:17 PM",5, 12,
2022-05-28 14:55:49.171028,tonyfromsyracuse,not as beautiful as the first Windlands,"I was suprised to see how short and lacking in level design there is. you fairly quickly see how it somehow pales compared to the first Windlands in beauty and replayability.  if only the game looked like the store avatar for WindLands2. quite frankly while you are initially impressed with there are far more swinging trees, somehow the game just doesnt seem to have the replay value the first one did. you begin to miss those breathtakingly high platform goals. and the drab and dreary look of the new game world gets to me, and somehow....looks more hazier than the first WindLands which looked like heaven itself. this one however the sky looks like a boring hue and drab aqua. yes there seems to be more features such as NPC's afterawhile it gets old with the constant reswinging over already treaded ground. back and forth, back and forth you go it seems always after some diamond shaped yellow distance marker which dissapears inconviently at key moments. this game is another case of how sometimes when something is upgraded in some areas, it gets downgraded in others. notice my thumbs up is grayed out so no one can agree? interesting","Dec 8, 2018 at 11:09 PM",1, 13,
2022-05-28 14:55:49.190976,Fortytwoish,"Frustrating bosses, lazy quest design","Just quit at the fourth boss.
You are required to fly around constantly, otherwise you instantly get hit and die. When the bosses use their laser beam attack with little to no hint, you also probably instantly die.
Hitting anything with the bow while flying is nearly impossible without aiming for a second or two, which is time you need to find the next spot to grapple to. So all bosses - for me, solo - went like fly in, fly up, shoot a bit, die, repeat.

It didn't feel satisfying to beat bosses this way.

The fourth boss is especially bad because the target reticles don't turn blue on its arena's grappling spots, making it even harder to grab on to something in a split second. I also wish there were grappling length (or any) upgrades. But maybe they're still coming?

-------------------------------------

As for the second point: You're being led in circles constantly, very noticeably. And while the gliding itself is the best part, it gets old fast. It doesn't help that the story itself is nothing special. 

Loved the first one, thought combat was a genius addition, wish it was executed far better.","Dec 8, 2018 at 5:38 AM",3, 0,
2022-05-28 14:55:49.207929,M-Hanzo,"Fun, but nothing like the first game","I'm giving this game 5 stars because it's fantastic fun that I do recommend, despite the problems I have with it. 

In the game, you're playing a ""Guardian""; a warrior who defends this semi-floating civilization from a robot invasion using grappling hooks and a bow. 

Having just come from Windlands (which I really like), I'm a little bummed that this sequel is so different. The style, objectives, mechanics, and even lore all seem entirely unrelated to the first game (are Titans still a thing??). The biggest surprise came with there being characters--part of the original's charm, I found, was how desolate and empty it was, and the addition of characters (pretty cheesy ones, at that) kinda snuffs the world's mystique.
I was also annoyed by the weird running/jumping mechanics. For some reason, if you fall from a higher distance, you sink into the ground (up to your neck), and spring back up. And everything is super ""slippery"" too. Once you pick up running speed, it's pretty hard to slow back down in time to avoid sliding off a cliff :P

On the bright side, the environments are just MASSIVE compared to the first one. Plus, you're given a whole lot more to do. It feels far closer to a full game than the first one (which felt more like a jungle gym), as well. Not to mention the music is great, and certain environments can be intensely atmospheric. Most of (if not all) the problems I have with the game are directed towards its being a sequel, opposed to a standalone game. If this is your first time playing either, once you overcome the motion sickness, you'll have a blast.","Nov 29, 2018 at 10:33 AM",5, 4,
2022-05-28 14:55:49.224884,marco,It's soaring time again!,"I loved the first one, right through the first time I played it as small demo on the DK1 until I finished all of the final game. The second installation does not disappoint, as a matter of fact it adds a lot to the formula that made the first one the standout title it was.
Playing in multiplayer feels like another level and the levels are even more beautiful than before.

If you need to buy one title, this is the one!","Sep 13, 2018 at 2:55 AM",5, 36,
2022-05-28 14:55:52.327586,SwashBlade,Improving on an already good original,"Windlands and Windlands 2 were both on sale a little while ago so I picked up both.  With the original game completed but not really leaving much of a mark on me I waited a bit to start this one, not wanting to burn myself out.  I needn't have worried - the gameplay varies from the original significantly.

The biggest difference is the addition of enemies and a bow and arrow to combat them.  The enemies vary from simple one-hit kill beasties that shoot back at you to complex ""destroy each weak point to trigger the next phase"" bosses that you'll ideally fight while swinging around the arena rather than standing in place.  The shooting is straightforward enough and the nature of bow and arrow use in VR means there's a satisfying level of skill in it - adding the hookshot swinging into the mix just makes you feel thoroughly accomplished when you pull off a clutch weak point hit while soaring through the air between anchor points.

The swinging, the mainstay of the original game, has had a few welcome upgrades as well.  Level design gives you well defined hookshot highways for getting from place to place, with visible destination markers so you know what direction to head.  Hunting down hidden collectables will require a skillful mix of precision swings, slingshotting and parkour.  The physics of swinging is also much more responsive - the ""advanced"" controls of the original game are now baseline, so you can lock or extend your cable length at the push of a button.  Extra momentum can be added to a swing by moving your arms just the right way at the right moment in a swing, something you'll learn intuitively by traversing the more windy highways.

The voice acting isn't flawless but isn't bad enough to be painful.  The scenery is colourful, varied and generally at least a little awe inspiring.  Honestly, all up, this goes on my list as one of the defining VR experiences.  Congratulations to the developers on making a good concept so much better.","Nov 22, 2018 at 12:56 PM",5, 1,
2022-05-28 14:55:52.343544,Kazznaz,A ton of fun,a ton of fun but the one thing is please make checkpoints only availible in the direction you need to go or make the ones you need to go to a different colour me and 2 other people got super lost and couldnt find the way to a simple mission we are idiots but thats besides the point :) thanks,"Sep 14, 2018 at 4:49 AM",5, 36,
2022-05-28 14:55:52.358503,DisplayVRC,First windlands was better,"I loved windlands 1.
I like windlands 2.
Dunno about the shooting and stuff. Not my thing.
Its harder to swing between all.
The graphics from wl1 was alot better imo.
I like the game but i dont love it as i did with the first game.
I played it as a relaxing game.
Swinging and searching for those things everywhere. no fight ,  just reach ur points.
Now u have endbosses who are really hard sometimes.
No more relaxing.","Nov 20, 2018 at 5:17 AM",3, 0,
2022-05-28 14:55:52.373463,Tiddles451,lava level too hard,"Would be 5 stars if the lava level wasn't so ridiculously difficult.  It just became a chore dieing yet again. 50+ deaths on just one sequence is torture, especially when a few jumps a way is what feels like another 50+ one (I gave up after 10).   I was seconds away from an uninstall but have decided to wait til the new year and hope for an update.  Earlier levels are awesome, and I dont mind a bit of difficulty but balance/difficulty on the laval level looks un-play tested or was play tested by an aim bot.  

Ps. Fix the feedback panel so at least ppl can let you know when its killing them!","Oct 26, 2018 at 8:30 PM",3, 9,
2022-05-28 14:55:52.388423,Conejeros,Great VR experience,"This is a great VR experience, the gameplay is fantastic and it has some good 4 hours of pure joy. However, and since the game itself is short, the developers made it frustratingly difficult in the last (and only third) level. The developers should add at least one more level to make it look like a full game, hopefully, a differnt looking level. Also, they could use current levels longer in the game story, by i.e. make the player look for other stuff or killing more boses (which is amazing). Also, they should allow to replay some key checkpoints, such as the great battles against bosses.","Oct 28, 2018 at 11:50 PM",4, 4,
2022-05-28 14:55:55.480153,wolf5665,I was decieved and lied too,"I was going to buy this game last month and it was 25 dollars and then it became 30 DOLLARS!!!! This is just the worst, and I hope that everyone who got this game for 25 dollars is satified with your dirty dealings. My final note, 10/10 would be decieved again. (I love this game no hate)","Nov 8, 2018 at 12:24 PM",5, 0,Sorry you missed out on the Launch Discount :-(
2022-05-28 14:55:55.495114,Fredrix,Mediocre but has its moments,"The swinging mechanic is pretty good and really makes you feel like Spiderman. But only when you are in the ""flow"". I found it pretty annoying when they sometimes removed the green parts just to make the game harder. And sure, it is harder to jump from platform to platform or swing only from one green part to another with no other optional paths while you often need the ""perfect swing"" to be able to reach. But I found that incredible boring and frustrating. Besides, the story was not exactly interesting, so when I got frustrated at the last level I sometimes wondered if it was worth continuing... But I liked the voices. 

I just think that they should have come up with another idea of ""making the game harder towards the end"" instead of removing the ""freedom"" and therefore the ""flow"". But what do I know? Some people may be incredible at this and therefore don't get stuck and frustrated at the harder parts towards the end. Sure looks like that by the rating. However, I can not give this game 5 stars if I did not find it fun enough","Oct 21, 2018 at 12:09 AM",3, 2,
2022-05-28 14:55:55.510073,Brentastic,Improves upon the original in every way,"Swinging feel much more precise and fluid. Bow combat is satisfying and fun. The world design is well thought out and gorgeous. Multi-player has strong potential, but I personally experienced some pretty bad stuttering that wasn't present in singleplayer while playing with a friend. Highly recommended, just make sure you have your VR legs!","Sep 16, 2018 at 6:27 AM",5, 10,
2022-05-28 14:55:55.525033,AtlasP,Best co-op title yet; Instant favorite,"While I was already a big fan of the first Windlands, one could argue it was a relatively simple indie title merely ""good for what it is"", and I understand that it wasn't for everyone. Windlands 2 however is the real deal. The locomotion is rich and deep with a high skill ceiling (like rocket jumping in a classic FPS) and genuinely fun; the combat of hitting mid-air shots with the bow in between swings is *super* satisfying and one of the single best combat mechanics I've played in VR yet (which really rests on the first point--again high skill ceiling and rewarding to master); the world is larger, more alive, and even more beautiful than the first one; and to top it off playing this in co-op with friends is by far one of the best co-op experiences I've ever had (VR or no)--seeing them hit crazy shots or see when you hit crazy shots, laughing when they miss a swing and fall to their death, just incredibly enjoyable. It even has excellent and extensive options menus for all manner of control preferences. I can see myself putting hundreds of hours into this game with friends. 10/10.","Sep 13, 2018 at 1:39 PM",5, 11,
