scrapping_date,review_author,review_title,one_reviews_text,review_date,review_rating,review_helpful,review_feedback
2022-05-28 14:22:59.008097,McNabb,One of my most used apps,"I f'n love this app. There's something so peaceful and calming about flying your own ship through space (cozy 1-seater or more roomy 5-seater - the SUV of spaceships, and if my dad who lives far away could sit in the passenger seat I'd buy him his own PC and rift just for that). Lots of nice details add to the immersion, like blue shift at high speed and condensation on the windows when you emerge from the dark side of a planet.  You can also take tours on autopilot and just relax, and actually learn something from the narration. There are even a few surprises. UPDATE: There are warp gates! You have to go through them manually, and 'Mode' doesn't seem to work on the big ship, but it's a big help for the smaller one. Also, you can switch seats! In the little ship it puts you outside which is neat but terrifying, but in the big one it's breathtaking, being able to see the view through the canopy or monitors. Just minor issues now - autopilot sometimes sends you into a planet and can't navigate around them, and if you set 'Body' to off in settings, it's still there, morbidly flailing its handless arms your direction looking for its own while you pop about the cabin. Other than that, an immersive masterpiece and the kind of thing VR is made for; I'm hoping for updates to improve the experience even further.","Mar 12, 2018 at 3:11 PM",5, 7,"Thanks for the comments.  To help with the long distance travel, go searching for the jump gates.  These are dotted around various planets and form a network of jumps to allow you to quickly hop around.  You can find them using the navigation menu ... use the ""mode"" button to select ""nearest"", which will show you the nearest objects around you, which will include the jump gates.  Find one, enter slowly, and hold on !!!"
2022-05-28 14:22:59.024055,RisCoe,,Wasted credits. Game won't install.,"May 18, 2018 at 8:45 AM",1, 4,
2022-05-28 14:23:02.152829,VirtuaLieven,Wonderful and scientifically accurate,"This app can be used to search the solar system, but also as a relax tool. Go onto autopilot and just stare into the vast nothingness of space. I also enjoy flying on/over planet surfaces, and some more details would be appreciated (hint: Moon and Mars have been completely cartographed).
There's nothing that needs to be changed, but I'm looking forward to see improvements: Like walking around in the start menue hall. I'm missing a backwards gear (could be included in the speed reducer key). Some more buttons in the cockpit to click on with small (even useless) functions would be nice (such as closing windows, set up a light filter making windows darker, show the real computer time). Maybe an entirely new cockpit? Note: sometimes stars have a huge halo of brightness around them, which I think does not look natural. German reader really needs improvement, but I can live with it. (although the automatic speaker skips German ß (&szlig;), which is quite annoying).","Feb 20, 2018 at 9:12 PM",5, 5,
2022-05-28 14:23:02.169784,John_Hugo,Can't turn off the annoying music,I have tried for an hour to turn off the music to no avail. I want peace and quiet out there in space. I go to the sound settings  and set the music to zero but when I start the game the music is still there. This should be a simple thing to fix.,"Feb 12, 2018 at 5:52 PM",3, 8,Thanks for highlighting the issue.  This has now been fixed with release R18.
2022-05-28 14:23:02.184743,rdl2727,ABSOLUTELY INCREDIBLE,This app is my favorite VR experience .. the developers of this deserve a lot of credit  .. The updates that have been made to this program are fantastic .,"Mar 14, 2018 at 11:15 AM",5, 4,
2022-05-28 14:23:02.201698,Milestugo,Minor issues with settings,"Update ! - Thank you for making the changes by fixing the passenger s for the larger ship and removing(although it was beautiful to look at) the LM return portion to make the Apollo tour accurate as to how it would look today. I also love the improvements on the ""surprises"" sprinkled around the solar system. As an educator of Science I would LOVE it if this could be expanded to allow real VR passengers. I can imagine parking the craft, with several of my stduents (in VR) as passengers, hovering above the rings of a gas giant or  with in the Mariner Valley on Mars and discussing their key features and then flying off to the next site of interest. Adding to this ""wish list"" ; expanding the program to include the ability (through jump gates) to visit some of the Kepler probe star systems and or Nebulae, Black Holes, Neutron stars, and so on. Again, thank you for the upgrades.","Jan 3, 2018 at 6:32 AM",5, 14,
2022-05-28 14:23:02.217655,funnywheeno,Fun!,"Just the right amount of complexity to enjoy exploring the solar system without having to study up on controls forever. Ships look nice and are relatively easy to control. Did come across some bugs. When approaching a planet, sometimes the controls get stuck and I have to press the thumbsticks in to regain control. I've gotten sucked into a planet that way once and didn't know how to get back out. pressing the left thumbstick in seems to sometimes push the POV camera backwards. Being really close to the surface of a planet or moon tends to mess with the throttle control in a way that doesn't feel like gravity influence. Autopilot sometimes fails to approach a jump portal correctly and keeps looping around. Most planets look quite nice and even have nicely animated surface textures but getting really close keeps me wanting for more detail (procedural as in SpaceEngine?) in texture and depth. Engine sounds are wonderfully massaged in along with the seamless throttle up to light speed, but the visual effect of light speed looks a little bit like a bug. I don't know if it's scientifically more accurate than what we are used to from Sci-Fi, but if the rear becomes dark and there is reduced field of view on the sides, shouldn't the front get much brighter instead of turning dark blue and shifting away? Looking forward to updates!","Feb 13, 2018 at 3:23 AM",4, 2,
2022-05-28 14:23:05.317482,PodMach,Cant download the game,Could anyone help me with the issue of downloading the game ? i will change my review when i fix the problem and actually get a chance to try the game !,"May 25, 2018 at 8:41 AM",1, 7,
2022-05-28 14:23:05.333439,NewtyNG5,Recommended,"A great title. The tours are enjoyable, and could be great for use in education.
Having been into astronomy for 35years, i was grateful that the stars you could see from the cockpit are accurate (unlike some other apps i could mention). Seeing Orion , and the Pleiades (to name just two), in virtual space was great!","Jan 20, 2018 at 6:16 PM",5, 4,
2022-05-28 14:23:05.349397,Tyrthemis,Now thats a great space experience!,You will not be disappointed in it for the price!,"Mar 20, 2018 at 3:53 PM",5, 2,
2022-05-28 14:23:05.364357,grekb,Better than i was expecting,"This is a well made experience. Tours and free flights are both awesome. Especially the free flight is by far the best space sim i have played so far, you really feel like you are in a spaceship. Not to mention its educational. I suggest it!","Jan 24, 2018 at 7:29 AM",4, 3,
2022-05-28 14:23:05.380314,Falcon_DS_,Brilliant Experience,"This is a great experience for those who like space and the wonder of the Solar system.  The free flight mode is where it's at for me; the freedom to seek out the ISS, Hubble and the moon landing site then shoot off through a Star Gate to the outer planets to porpoise throught the rings of Saturn.   Just amazing...","Jan 17, 2018 at 6:03 AM",5, 2,
2022-05-28 14:23:08.471158,H3LLI0T-1-,awesome space simulation,"This game is only for people interested in space. There is free flight and tours of the solar system. You can  go through the atmosphere of 3 planets for example venus. This is a sort of walking sim for  space. There is the event horizon space ship next to neptune i believe and other unknown object. There are space loop drives. You are only limited to the solar system. There is no action in this game. If you like walking sims you will like space sims otherwise stay away this is not for you. Get x-rebirth.

Another good game like discovering space is unhearting mars. It has more content 11gb of space. I got it on steam cuz it cost less. Discovering space cost less on oculus store.","Jan 2, 2018 at 3:22 AM",5, 3,
2022-05-28 14:23:08.487115,Mancomb_Seepgood,Epic VR Space exploration experience!,"I wasnt expecting too much from this on the first go, but wow did it not dissapoint. Take out your own spaceship which you can explore on your own or take a guided tour around our Solar System. I was hooked when the ship would take you down to the planet and fly through the landscape. Well done!","Dec 1, 2017 at 6:04 AM",5, 12,
2022-05-28 14:23:08.508059,ColombianBum,problem installing game,"would enjoy to watch this experience but problems with installing the game,  would like a refund if this problem isnt fixed.","May 18, 2018 at 10:33 AM",1, 4,
2022-05-28 14:23:08.528005,Gonzaxpain,Fantastic experience,"If you like space and the universe and would like to feel like you're there in the middle of space, this is for you. You get a free mode that allows you to fly around to planets. Just get close to Saturn or any other, grab a beer, sit on your couch and enjoy the immense pleasure of being in outer space with those wonderful views, doing nothing at all. Incredibly relaxing and immersive.
That being said, the Tour mode is where this app really shines, it will take you around and over planets with the best possible views, you will learn about them and enjoy seeing the solar system in a way you only dreamed about. For me, a really wonderful experience. I hope they will include more planets or longer tours to those already included, I would happily pay for more.","Dec 20, 2017 at 10:44 PM",5, 4,
2022-05-28 14:23:08.544960,KingGelbin,Best Solar system exploration,"Of all the similar programs I bought or acquired for free, this is the one I kept. You can fly in a big ship or a small ship and either way it will be breathtaking your first time.","Jan 29, 2018 at 8:30 AM",5, 1,
2022-05-28 14:23:11.643831,PsychoticSloth,Absolutely Amazing.,"This is a great experience. Highly recommended, and at a great price too.","Jan 24, 2018 at 2:53 PM",5, 3,
2022-05-28 14:23:11.659788,Golgothlt,A wonderful space adventure,"Just like going to space with your own ship, it's beautiful and awesome. When you go very close form the surface of planets, of course the resolution is not perfect, but it's well enough to have a lot of real-life experience!","Jan 2, 2018 at 7:31 AM",5, 2,
2022-05-28 14:23:11.675745,Krash_42,Amazing,"At first I thougt it's just some space sandbox game, but no, it has some awasome tours that takes you around a very nicely built solar system, with vioce over explaining many details. It's a must have! (Chances are you have a $15 coupon after recent Oculus soft ware glitch, I recommend getting this)","Apr 8, 2018 at 3:28 PM",5, 1,
2022-05-28 14:23:11.691703,PurgeComplete,Nearly awesome....,"Firstly, it's fantastic being able to fly around/in/about our solar system! The inside of the ship is great and you really get a sence of the sheer size and wonder of the planets and our Sun. 
I'd love to see the Earth in more detail, hitting the atmosphere is great but thats it. Imagine if you could add Google Earth to this!!!!! I'd love to have more ships added (From films!) It's amazing to find the Event Horizon in orbit over Neptune! I really hope that the devs add more features, this really has huge potential. 
Worth the money and with a few patches this could be outstanding. :)","Oct 30, 2017 at 4:44 AM",4, 12,
2022-05-28 14:23:11.707660,Frankos_I,,Beautiful!!!!,"Feb 11, 2018 at 12:45 AM",5, 1,
2022-05-28 14:23:14.802013,cndshullaw,Awesome,"Complete control of ship, awesome navigation, supreme views and graphics. Totally worth it. I did not experience any motion sickness... which was nice.","Nov 27, 2017 at 7:18 AM",5, 5,
2022-05-28 14:23:14.817970,SniperSloan,hated it,want a full refund its boring and not real enough AVOID AVOID,"Jan 2, 2018 at 3:07 AM",1, 3,
2022-05-28 14:23:14.834925,Jesusavesouls,The best vr game and experience,The game is loaded with stuff and the updates always are full of excellent surprises.I supported this game early on and it is well worth it.Praise Jesus!,"Nov 15, 2017 at 10:26 PM",5, 4,
2022-05-28 14:23:14.850882,Harklina,,"I would say I am a pretty tough critic, but this experience is wonderful! Some of the views are just spectacular! Great Job!","Oct 30, 2017 at 10:42 PM",4, 4,
2022-05-28 14:23:14.867837,Grizzley1978,Your Own Personal Planetarium,"I've been looking for different VR experiences.  Google Earth is an awesome expereince, but I wanted something more in terms of exploring our solar system.  I then found this app during my search.  I am reminded of when I was a kid at the planetarium, looking up at the stars and being bewildered.  Fast forward to today, you are in a VR ship and can choose between solo flight, or a tour of various locations.  I selected the tour and immediately I got the same feeling I did when I was a kid.  My only complaint was my arms, while resting were bent pointing up, which made for a slight distraction of the enjoyable experience.

If you are a fan of space, enjoy looking up at the stars or interested in the planets in our solar system, then I suggest you click on the Install button RIGHT NOW.  You will not be disappointed in the experience.","Aug 14, 2017 at 12:03 AM",5, 4,
2022-05-28 14:23:17.956715,Lazer-1,Great simulator with minor issues,"First, I love this. Beautiful graphics and really nice spaceships to fly in. Found myself getting a little uneasy flying alone in space. A few minor issues with autodocking and the one person ship. Instead of docking the ship began to spin out of control. Made me a bit sick. A few of the settings don't work. Like the ones mentioned by Milestugo. Over all it is allot of fun. I hope the developers sell add on upgrades that will let us visit places like moon base Alpha or the Star Wars Death Star or Star Trek Enterprise. Looking forward to any upgrades they have.","Aug 6, 2017 at 10:35 AM",5, 3,
2022-05-28 14:23:17.973669,BulletMagnetEd,Utterly amazing experience!,"I love the ability to tour the solar system in reasonable amounts of time. I found going up to .9999c particularlyt cool! I just have a couple of quibbles.
(a) At the Apollo 11 site, the ascent stage should be gone. If it remained there on the lunar surface, there'd be two dead astronauts somewhere around as well. :/
(b) Will there be planetary details added? I went atmospheric at Earth, and everything is just brown and blue. While I found it cool to go in and out of atmsophere, I was hoping to see some cities or something.
Definitely recommended though!","Aug 15, 2017 at 1:40 AM",5, 2,
2022-05-28 14:23:17.989627,aG3nt_oRanGe,Fantastic!,"Though not as polished as Elite: Dangerous, this is great fun and quite relaxing.
You can travel at incredible speed and the controls are quite easy.
Tip: I found The Discovery (from 2001: A Space Odyssey) in orbit around Jupiter, and flew around her. Worth the asking price alone.. =)","May 7, 2017 at 11:20 PM",5, 2,
2022-05-28 14:23:18.006581,scyoc,this is very good experience!,this is a fantastic experiencebut every time i try to land i fall through the ground,"May 21, 2017 at 2:41 PM",5, 3,
2022-05-28 14:23:18.022538,cyrusjameskhan,This is a fantastic experience!,"It's like a small scaled Space Engine. With less detail in terrain, but more fleshed out in terms of immersion. (space ship, flying mechanics, interior etc..)

If you're looking for a feeling of travelling through space and seemlessly flying to planets in VR without wanting to having to buy/play a full game like Elite, I highly recommend this one!","Apr 14, 2017 at 3:38 PM",5, 1,
2022-05-28 14:23:21.111210,KenpoClaus,"Higher resolution graphics, please!","Absolutely my favorite VR app! Because it is a Space sim (not space game!) and the controls are very well laid out. Even my non-tech/non-gaming wife quickly got the hang of it. I'd really like some better graphics here and there and perhaps some way to explorer the Solar system together with other VR users. Recommended!

Wish list:
- Add Pluto to the list of Solar bodies to be explored
- Higher resolution textures
- Improved Sun (not so realistic)
- Some space ships here & there for the fun of it (Enterprise, Millenium Falcon etc)
- 67P is very well done, more like this :)
- Distant objects to visit? Like say the Gliese system, Orion nebula, LMC/SMC... ?","Jan 21, 2017 at 6:39 PM",5, 11,
2022-05-28 14:23:21.127167,AUJIK,Best experience since DK2,"Been playing this since an early stage and stoked how it been evolved. Just got this release and it blow my mind how detailed all the textures become and how smooth it runs. Of all ca 100 games and demos I've been playing on the Rift, this is the one I recommend most.

Need to add that I'm running it with the Oculus debug tool with 1.5 supersample and it runs perfect on a 1070gtx with super crisp resolution and details.","Jan 30, 2017 at 11:22 AM",5, 7,
2022-05-28 14:23:21.143124,grim310,Might become a killer title one day.,"I don't know how every review for the game is dated from before the game came out. I pretty much bought it as soon as it was on the store and there were reviews from weeks ago. Anyway, one day this could become a must buy, but for now its the only way to tour our solar system casually in vr and stands as a great foundation for something potentially bigger. The game is obviously meant to be educational, but its full of potential. The fact that you can customize a crew to fly with you  already gives me hopes this may become something a little more lively one day.","Jan 19, 2017 at 2:49 PM",3, 8,
2022-05-28 14:23:21.159082,mysolarsystem,It's good space sim,"IT's best space-explore game. It's better than Titan of Space. But texture must be more detailed, and maybe more objects in Solar System you able to explore. Best TOUR in game - Comet 67P, Saturn, Mars, Jupiter. Sometimes is breathtaking look.","Feb 20, 2017 at 5:05 AM",5, 3,
2022-05-28 14:23:21.175039,WavePub,Great experience!,A great way to explore the solar system with an amazing amount of detail and even easter eggs to discover!,"Mar 28, 2017 at 4:31 AM",5, 1,
2022-05-28 14:23:24.298823,Spyder561,A Visual Treat,I have to say this was a surprise. Great graphics and also the ability to fly around the solar system in two different ships as well as some things thrown in for Sci Fi  fans. Great Job...can't wait to see if more is added.,"Jan 21, 2017 at 1:19 PM",5, 6,
2022-05-28 14:23:24.314780,BluePilot,Awesome!! Awesome!! Awesome!!,"I love this VR stuff, I can't get enough of it and if you go buy this experience (becasue that is what it is - NOT a game) you will be totally blown away.  F...ing brilliant, please keep this one going.","Feb 3, 2017 at 7:28 PM",5, 4,
2022-05-28 14:23:24.330737,jezfvee,get it,"amazing tour around the solar system, educational and good VR","Mar 15, 2017 at 5:08 AM",4, 2,
2022-05-28 14:23:24.346695,karrtoon,Underrated,"Excellent experience if you are a space fan. Feels like a smaller version of ""space engine"" in a way.","Mar 15, 2017 at 5:49 PM",5, 1,
2022-05-28 14:23:24.363649,Mr.M0S,Best Flight/Space Sim on the Rift,What an amazing VR flight simulator. By far the only thing on my Rift im always coming back to play. Trust me on this its worth every penny of your money. if you wanna spend wisely...heres your chance,"Jan 30, 2017 at 3:44 AM",5, 3,
2022-05-28 14:23:27.474435,Xeno2014,Incredible,A truely amazing experience.,"Mar 11, 2017 at 12:52 AM",5, 2,
2022-05-28 14:23:27.491390,Ostermalm,My go-to Rift experience,"This is the one Rift experience I keep coming back to. Hovering above Mars in my little spaceship, or going around the dark side of the moon...a must have.","Jan 12, 2017 at 6:04 PM",5, 7,
2022-05-28 14:23:27.507347,Dangual,Almost perfect,If you like space... You need it,"Jan 2, 2017 at 2:11 AM",5, 1,
2022-05-28 14:23:27.523811,TimeIsFading,Amazing Space Experience,This is one the best VR experiences I've ever had and I've been playing everything since the early Rift development kit 1 days. A must have in my books and always looking forward to updates with this game. Do you yourself a favor and try this game out!,"Jan 2, 2017 at 2:24 AM",5, 5,
