scrapping_date,review_author,review_title,one_reviews_text,review_date,review_rating,review_helpful,review_feedback
2022-05-28 14:22:30.474403,joseemipg,"tour goes OK, But free flight does not¡","The moment I leave the hangar, my ship does an about turn and I'm just stuck there, with no control, and wondering why the game insists I return to the hangar without letting me explore the solar system as promised.
I've tried rift controller and I just cannot get beyond the hangar exit.",Dec 26 at 4:17 AM,3, 9,
2022-05-28 14:22:30.488366,afn,Its fine,It Does NOT Look REAL PLZ Make It More Real..................................,Jan 4 at 6:29 AM,3, 3,
2022-05-28 14:22:30.503326,chris.inder.509,want install,Help please game want install,Dec 15 at 3:55 AM,1, 6,
2022-05-28 14:22:30.518285,Septimus_68,No control,"The moment I leave the hangar, my ship does an about turn and I'm just stuck there, with no control, and wondering why the game insists I return to the hangar without letting me explore the solar system as promised.
I've tried rift controller, xbox controller, disabling autopilot - nothing seems to make any difference. I just cannot get beyond the hangar exit.
Nil points. Sucky. Will be uninstalling if I don't find out what's going on soon.","May 27, 2021 at 8:16 PM",1, 19,
2022-05-28 14:22:30.534243,Xilaba,Fantastic,The care about details makes this game everything. Scary,"Feb 4, 2021 at 4:08 AM",5, 14,
2022-05-28 14:22:33.652042,cexino,Space Experience👍👌😎,I have LOVED this game from the first time it released. I really hope the developer and Oculus would make this available and compatible with the Oculus Quest and Quest 2. More people MUST experience the thrill and the sheer pleasure of navigating our solar system in the experience. I hope my request is noticed to port this to the Quest.,"Sep 25, 2020 at 9:56 PM",5, 49,
2022-05-28 14:22:33.667001,Ojkar,Awesome Experience,"I can´t wait for another sequel whereas you add more hd textures and level of close detail. Still, I had a blast for a couple of bucks. If you love astronomy you must play this!","Nov 27, 2020 at 8:17 AM",5, 5,
2022-05-28 14:22:33.681961,TREofWAR,Question to the DEVS,"EDIT - first, i dont know if it's been pointed out, but if you put your controller up to your head, it zooms into wherever you are looking, i did not see any videos of anyone pointing that out, i figured it out by accident. 

question 1) what is INSTAJUMP I found it out around uranus moons.. it's a small purplle star but it's very strange.. I can find no information about it online.. just wondering what it is, I thought it might have been a portal or wormhole or something lol 

question to devs-
would it be possible to get texture packs or something like reshade working with VR games? I have not played this yet, it's downloading and from what i have seen it looks absolutely breath taking, i will update my review once I play it. But, it seems some of the moons when up close aren't as hi def and i'm just curious, for anyone that has a beefy enough pc to handle it, if it would be possible for you to create and we install OPTIONAL texture packs. I think that would be amazing. Maybe even a version where all stars not render in, and only the planet so you could pull more rendering power for viewing the planets/moons?","Sep 16, 2020 at 6:02 AM",5, 22,
2022-05-28 14:22:33.696921,ghostOfDaniel,"Solid concept, could use improvements","I was hoping this would feel like real space, but I didn't feel like I was in a massive environment. The controls are pretty good. Visually there are some graphical limitations that really take you out of the experience, like low resolution planet surfaces and weird transitions. A great effort by the developer.","Sep 18, 2020 at 3:21 PM",3, 7,
2022-05-28 14:22:33.711881,jbecknell,Stunning,"The views and presentation are breathtaking.  Looking out the side of the window as you pass through the rings of Saturn and visit one of its moons is the best of vr.  Sure, I love the games too, but this one's a no-brainer.  Amazing.","Jun 24, 2020 at 10:05 AM",5, 10,
2022-05-28 14:22:36.849581,Ap0c4lyps3,,AMAZING..yea there are some low poly graphics near planets surfaces but just the sheer feeling it gives you its like being on a ride at a theme park. Learn some new things and enjoy the feeling of space travel and exploring planets and other things i highly suggest Discovering Space for all you do not even have to be a young kid to enjoy.,"Mar 14, 2020 at 7:30 AM",4, 15,
2022-05-28 14:22:36.865538,VRPhantom,An Engaging Tour of the Solar System,"I've always been an astronomy fan so when I purchased my Rift S and started perusing the library this title immediately piqued my curiosity. The premise is a natural for VR: you are in a spaceship and can either fly to any planet in the solar system or sit back and enjoy several guided tours of different planets and other heavenly objects.

Graphically, the game looks quite good. Some of the terrain when you do flybys close to the surface of planets or moons could be a little more detailed but the sense of scale is outstanding and some of the vistas, like travelling thru the rings of Saturn are downright breathtaking.

For $9.99 the experience is a great value if you are into astronomy or space exploration. It's one of my favorite titles so far.","Jul 30, 2019 at 10:04 AM",5, 28,
2022-05-28 14:22:36.879501,megacrazy,Excellent,"This is by far my favorite space app...and I love space. Buy it and go for a tour around the solar system. Today I flew for 2 hours and 1.8 mil Km. 

I want to see some updates for it. Improve the passenger models, add more details to the ships etc.","Aug 3, 2019 at 6:11 AM",5, 20,
2022-05-28 14:22:36.895458,MVShaw111,Ok,"I am a little dissappointed with this title. This feels like an early beta that could have been done better. 
The graphics are pretty nice but I just don't get the sense of scale I was anticipating. The planets just feel small and are not textured with much detail at all when you go near the surface. The lighting is done well, texture and scale lacking.","Apr 6, 2019 at 10:37 AM",3, 18,
2022-05-28 14:22:36.910419,Angelina Starr,Explanation please...,"Could someone please explain the flashes of light zipping past the shuttle craft?  I know a bit about astronomy and I can't think of anything that would cause that.  They can't be meteors as meteors don't light up until they enter the atmosphere (from friction in the air).  They can't be cosmic rays because the astronauts said they only noticed them when their eyes were shut because they were so faint.  Are these a graphic rendering artefact?  Whaaaa???

It really detracts from the immersion.

Addendum - I emailed the devs days ago, asking this same question with no response as of yet.   Come on devs.","Mar 12, 2019 at 10:12 PM",3, 25,
2022-05-28 14:22:40.003266,FastLawyer,Makes a thinking person question life,"So I took a space tour of the earth.  I think I almost cried at the end.  It doesn't have the best graphics.  But if you have ever wondered what it would be like to be on a small spaceship on your own and auto-pilot around our planet and towards the sun and back, then this is for you.  This is as close to a realistic simulation of the that experience as you'll find.  Something about the vastness of the space, the warmth of the sun, the cold of it's shadow, seeing how tiny our planet is, seeing your country in a different light or in darkness, and imagining that you're but a speck from the view up above ... and you will lose yourself.  Question life, and death, your priorities, your beliefs, and everything.  .  Realize your non-importance and do the best you can with that knowledge.

Watch my review & gameplay here: https://youtu.be/J2H0apu_zEI","Feb 14, 2019 at 10:26 AM",5, 10,
2022-05-28 14:22:40.018227,Towserdog,Great!!!,Top experience very informative and good fun.  Really enjoyed it thanks!,"Apr 7, 2019 at 10:40 PM",5, 3,
2022-05-28 14:22:40.032189,Haines126,5 stars,I am enjoying this experience very much. You can choose to just sit back and relax and take a guided narrated tour of the Solar System or take control of your own starship and pilot yourself. The comet encounter is my personal favorite so far. Really impressive.,"Jan 22, 2019 at 10:24 AM",5, 8,
2022-05-28 14:22:40.051138,goonie,This is why you bought your Oculus Rift,"This experience hits home what virtual reality is all about. This is an experience that cannot be duplicated as a movie, a painting, a seminar, concert, videogame... and, instead, it combines all of these things into one whole experience. Moreover, it reaches newfound levels that cannot be reached inside fictitious worlds and, especially, within linear games and Hollywood movies, because this allows for free exploration and it is based on our REAL surroundings. Think Google Earth but for our solar system.

The controls are just right. The menus are easy to understand. The narration, although a bit too computer like, is timed very well. Excellent music and polish...

But put all technicalities aside for a moment. What matters most is the emotional response. Nothing can prepare you for the feeling of discoving an ominous comet hurtling silently through the vastness of space, for observing Saturn rise above the horizon of one of its moons, for soaring across the wavy surfaces of Neptune, or launching through the stormy atmosphere of Venus. What you're observing here is our greater surroundings outside of Earth's atmosphere. This experience is all about PERSPECTIVE and you will perceive Earth and the rest of the solar system as you have never experienced it before. If you always dreamed of being an astronaut you will find interest in this title.

Remember that feeling you get when you watched a movie for the first time, or read a book for the first time, or even experienced VR for the first time... well, this brings back that feeling. The more I soared around, the better it got, and I noticed the developer threw in a few things for fun as well, but I won't spoil the surprises here.

Well worth the cost and I hope the developers continue to add to this experience, even beyond Pluto and Charon, as NASA continues to provide back data from its observations. Thank you for making this extraordinary experience. I can only imagine what it will be in 5 or 10 more years.","Nov 26, 2018 at 2:14 PM",5, 17,
2022-05-28 14:22:40.066098,KonradDE,A must-have for everybody with VR,"The journey into Space, in a beautiful, futuristic spaceship. It feels like being there alone on that Journey through Cosmos and Time. I especially love the exploration of Comet. I could fly over fumes from ground, see how huge it is, yet barely visible in Space. I wish this experience was updated in 2019, with more detailed textures, better particle effects, more ships, more details on space objects and... the ability to fly over Earth and other planets. Currently there is no such possibility. I hope the creators do not abandon this product. Please update this, to 2019 quality levels.","Apr 5, 2019 at 8:46 AM",5, 3,
2022-05-28 14:22:43.167940,Kanedog,Superb!,"I honestly am delighted  with this many VR apps that don't come as close to how good this is.
The narration is excellent and the planet models are fabulous, the atmosphere of Jupiter took myu breath away with the boiling, rolling cloud belts and storms.
Add to that the little easter eggs that add some fun to the whole thing spent 3 hours on my first go and look forward to getting back in and seeing more.
Can't recommend this highly enough.","Dec 10, 2018 at 10:12 AM",5, 3,
2022-05-28 14:22:43.182900,philip99ga,Unexceptional,Nothing to see close up,"Dec 13, 2018 at 8:48 AM",2, 4,
2022-05-28 14:22:43.198858,Daniraw,Spiritual,"Never write reviews or any comment for that matter, but this is a project that is so beautiful and touching. You get to pilot a spaceship freely in the solar system without any plan or mission but your own desire for exploration. This is not a game but an experience. Support this awesome experience so that the developers can polish this amazing escape from reality.","Aug 31, 2018 at 1:38 PM",5, 15,
2022-05-28 14:22:43.213818,I-M_BlackShaddow,Very enjoyable and (educational?),"Much impressed.

The Breath feature and Window frosting, are good/effective/immersive ...
once I realised what they were.  (Not sinking with my resperation cycle, at firs I was looking for a cracked window.)  An option to turn Breath and Frosting off would be liked by me.  Also I am not a great fan of LENS/Cinamatic/DOF features.  I Just don't Percive like that)

Don't delete items or option but perhaps an options sub menu for effects?

Thanks for a really great app.","Sep 27, 2018 at 12:41 AM",4, 2,
2022-05-28 14:22:43.229775,UglyFish819,,"Decent game with good graphic and information. The biggest problem with it though is the fact that when flying around space the fastest you can go is the speed of light. This means if you want to fly to Neptune for example you get to sit in the game and watch the stars go by for 15 minutes .. very booring! Its cool that this is built to scale, but who wants to sit still for 15 minutes? They should have a 'warp speed' option for easy exploration.","Jul 19, 2018 at 3:53 AM",3, 21,
2022-05-28 14:22:46.339043,Pete8593,High quality VR travel to the planets!,This program is quite likely the best reality based VR space simulator that is presently available.   It gives one an accurate idea of how far the planets and moons of our Solar System are from Earth as well as from each other.  The graphics are very good and permit one to view the planets from any desired angle and at any desired size in a 3D format.  The only thing I'd like to see added are some real named stars positioned in such a way as to teach people where the Constellations of the sky are located as one travels through space.,"Aug 25, 2018 at 1:27 PM",5, 3,
2022-05-28 14:22:46.354003,Juangavioto,Educational and well developed,Exellent way to show kids our universe . Exellentn work.,"Nov 3, 2018 at 8:35 PM",5, 1,
2022-05-28 14:22:46.369960,Tomatenmann,Great space tour for VR beginners,"My favorite educational space experience in VR. Almost all the tours are very interesting and well executed. My favorites are the ones around Jupiter and the ""Rosetta"" asteroid. There is also a nice free flight mode. And it might be a good appetizer for people who are interested in Elite Dangerous.

A few things that prevent 5 stars:

- Free flight is too slow. Traveling at the speed of light is nice but still not fast enough to get to the outer planets in under 20 minutes.

- The english narrator is ok, but the german one is just horrible. Many sentences don't make any sense. Like some really bad google translation.

- The cockpit and especially the player model could use more finetuning.


But still it's a very impressive piece of work for such a small developer.","Jul 22, 2018 at 12:24 PM",4, 7,
2022-05-28 14:22:46.387913,tuomaspap,This is the epitomy of space VR,Any developer such as UBISOFT for  (Star Trek : Bridge Crew) etc should have this game as point of reference for a space game . The graphics and feeling you are in space and on a shuttle are like no other . Take the Free roam option and fly yourself around . Everything is real size and detailed down to craters. You can fly on to a planet and sit in its craters and the detail is still there . Trully exceptional . I wish you would make a game with this as a base . I would pay good money for anything you make if it is like this ! Thank you,"Jul 28, 2018 at 8:24 AM",5, 5,
2022-05-28 14:22:46.405864,Sl0thz,Amazing,"Visiuals are quite stunning.  Motion sickness wasnt that bad considering I'm very susceptible to it.  Only thing is when you get close to a planet, especially earth, there is no detail...only vague forms of land. Astronomers will bet a big kick out of it.","Jul 28, 2018 at 2:09 PM",4, 2,
2022-05-28 14:22:49.491226,musicman1972,Can't reinstall the program,I recently had a crash et tried to reinstall the game. But it doesn't work. What can I do? Thank you!,"Sep 12, 2018 at 11:39 AM",5, 1,
2022-05-28 14:22:49.507184,noozled,"If you love space, or are a geek, get it","I have played Elite Dangerous before which I loved, but I felt it is more for the content and missions, less for the VR Immersiveness (I still do love it, but I was looking for slightly more made for VR). If you have been looking to explore space in VR but not be working on missions, this is the app for you. It also on top of being awesome to explore our Solar System (yes, only our Solar System), is pretty educational. I actually learned a lot of fun facts about planets and moons I never knew before. And it truly is mindblowing kicking back in some of the premade tours watching some of the prepared views. I also LOVE how some of the planets have moving weather (Jupiter in particular). It really has some convincing graphics. My absolute favorite moment in this simulator was the 2001 Easter Egg. I wont tell you how to get there because it will spoil the surprise, but spend some time observing Jupiter's satellites... I am a huge fan of 2001 so when I saw this easter egg I nearly s**t myself. Let's just say it caught me off guard. The only things I can say would improve the game are if the planets were solid (flying through the planets is a bit immersion breaking), and instead of flying through them you maybe bounce off of the surface if you contact it, or if you touch it softly you can land, and if Earth in particular had more detail. 3D rendered buildings or nature would be pretty awesome. I know it is a lot of work, but maybe just something more to Earth and it would be soo cool. Thanks for the awesome VR experience.","May 14, 2018 at 3:17 AM",5, 13,
2022-05-28 14:22:49.522143,jere.karppinen,,"I had  a hunch of things when I watched the planetary guides, but the one with a comet just blew my mind. How complex! How big! I have never seen a space documentary before that introduces us to a comet like that. I paid full 10e for this app and not a second have I regret it. More please!","Jun 9, 2018 at 5:09 AM",5, 4,
2022-05-28 14:22:49.537104,sleahymusic,WOW - WELL WORTH GETTING!,"I really didn't expect much for the price I paid as I've paid more for games/experiences that were just blah.  This is incredible.  BEYOND what I could imagine even.  I have just messed around with it a little and I'm already SO impressed.  I took off in some way cool space ship, quickly got comfortable with navigating, and headed for Jupiter.  When I got there my JAW DROPPED.  I was literally in shock.  Not only was it just cool as anything to be flying in space orbiting a planet (I felt like I was on a star trek mission to some strange planet) but the planet was HUGE and MOVING... I mean like weather!  I even went to the moons and decided to get down to the surface and there's mountains, and terrain and it seems to scale even.  Wow wow wow.  Even the narration is well done and informative.   Hey Developers... how about teaming up with Google Earth so you can explore planet earth, or land your spaceship in your back yard!  GREAT APP","May 11, 2018 at 10:55 PM",5, 13,
2022-05-28 14:22:49.553061,ayayu0209,Amazing!,"This VR is very very wonderful! I want many people to experience it. For me who is not very good at English, I am anxious for Japanese version.","Aug 1, 2018 at 9:01 PM",5, 1,
2022-05-28 14:22:52.653901,S4Pilot,Fantastic,"This is amazing.   Please support this dev.   Would be awesome to have even more details and depth, and length but as it is it's really really good.   Awe inspiring.    Could use a way to pause/resume or go back in case you miss a few words while gawking at everything.","May 28, 2018 at 9:00 AM",5, 4,
2022-05-28 14:22:52.670856,HELL_FIRE,,"very cool experience and visuals are ok, Using the mid-tourer spaceship has a split screen when looking through the front windows which makes this feature broken. only use the solo ship. Currently there is no support through steam and or the website they have provided to help resolve issues. Buy only when it is on sale, for lack of support it is not worth full price.","May 19, 2018 at 4:47 AM",3, 4,
2022-05-28 14:22:52.685816,SpaceCoastSteve,"Beautiful, fun, and terrifying.","I've only had my Oculus a few days, so I'm going through and trying stuff out. I'm a huge space nut, so naturally, I expected to like this. I do really like it for all the reasons others have listed, but also, because it scares me to death! Flying around in space far from Earth is exhilerating/unnerving in and of itself, but approaching a massive planets like Jupiter was downright terrifying.","May 11, 2018 at 1:52 PM",5, 4,
2022-05-28 14:22:52.701774,Spitfyah,Wow,"Wow this experience is amazing, even touching at times! Got it for 3 euros on sale, I would have never tought it was so rich in the exploration and deep in the explanations! Really educational!
And piloting the spaceship is fun too!!!","May 29, 2018 at 6:58 PM",5, 2,
2022-05-28 14:22:52.716733,CaptainScarlet,Awesome Simulator!,"Simple and fun to fly. Really  nice concept and execution.  Visuals are great (like when you're entering the Earth's atmosphere). Love the music! Sets the mood. 
The only things that I hope will be added are: 
1. being able to manipulate the cockpit controls using Touch controllers to simulte button presses. 
2.  A damage model (if you hit an object i.e. lunar surface you damage your ship).
3. Some random ships, objects (satellites, debris, etc) populating the area.
Aside from these little details, this is well worth the price..
BTW, if you line yourelf up correctly you can dock your ship at the Starcarrier. Cool!","Apr 19, 2018 at 10:29 AM",4, 5,
2022-05-28 14:22:55.792085,thoiter,Flawed gem.,Nice immersive experience somewhat ruined by the awful computer generated narration.  It really needs a human voice to lift it from good to great.,"May 18, 2018 at 3:44 AM",3, 4,
2022-05-28 14:22:55.808042,cercata,Totaly Amazing,"It's worth only for the first guided trip, and there are like 6 more, and free roaming","May 19, 2018 at 8:53 PM",5, 4,
2022-05-28 14:22:55.824000,ronmoes80,Best experience ever! period!,"The developer knows how to make a very good vr experience, the first game that was released was 10/10 for me and this one even surpasses that! unbelievable.. If you own a Rift and you haven't got this one your mother should spank your butt!

I see loads of crappy shooting games sold for 30-40 dollar, this is a humble 10 dollars, but really it should be the other way around. I can see the time that has gone into this project. Information, art,coding everything. again 10/10.","Mar 24, 2018 at 11:09 AM",5, 6,
2022-05-28 14:22:55.839957,harrykimju,"Amazing, a gem, deserves to be top list.","I came across this somewhat by accident. Wow, after mission ISS and a number of other similar games this tops the tree. This developer deserves a very hefty pat on the back and a high five. A couple of things that aren't obvious when you start playing;
- You can lift your touch controller upto your face to zoom in.
- Joystick is supported, turn off 'touch controller in flight' in the controller config menu.
This has to be the best few pounds I've spent so far since owning a Rift and I have allsorts on Oculus (and Steam). Traversing the solar system and stopping to admire when you want is an absolute pleasure, and if you can't be bothered to pilot, take the guided (fully narrated) tours and sit back and relax. 
I truly think we all need to support this developer. The work he must have put into this is epic and if this is what he can do at this price, who knows what he will come up with next. A total gem. Superb.","Apr 7, 2018 at 1:09 AM",5, 3,
2022-05-28 14:22:55.854917,oldestman,excellence,this is what i have been looking for. very good.  hope you make more. would like to see renderings of entire galaxy. bought with my credits but will buy more with my own money. this was great. try it!. used excellence for title as to me it means the best of what we can strive for.  excellent is what you can do. good luck to developer.,"Apr 11, 2018 at 2:20 PM",5, 2,
2022-05-28 14:22:58.960225,redgunner,Game wont download,Game wont download - CANT PLAY at all :(,"May 25, 2018 at 11:55 AM",1, 4,
2022-05-28 14:22:58.975186,gjelliott,Beyond Amazing,"I have had my Rift for about 2 months now, downloaded free software and purchased software.  Having used VR in numerous programs and software, I have to say that this one tops them all.  THIS is what I got into VR for and I wish I could give it more than 5 stars.  So much work has gone into this title, I can't believe I could purchase it on the cheap!  I highly recommend this to anyone that would like to know more about our solar system.  The educational aspect alone is worth the buy.  Wish I could say more without boring everyone, but this thing is GREAT!","Apr 11, 2018 at 5:12 AM",5, 2,
2022-05-28 14:22:58.992140,DGK2800,Love it!   :),Not as polished as Elite Dangerous but still worth it,"Jun 13, 2018 at 1:45 AM",4, 1,
