scrapping_date,review_author,review_title,one_reviews_text,review_date,review_rating,review_helpful,review_feedback
2022-05-28 13:36:01.329554,Devastatin_Dave,,"Decent fun, bow mechanic isn't very realistic but it's still fun.  Add me if you'd like to play co-op some time!","Mar 19, 2017 at 7:56 PM",4, 0,
2022-05-28 13:36:01.346509,Negchampa,Well worth the price,"Sure it has an ""indie"" feel to it but for the price it is well worht it. Lots of replay value with MP and worth every penny. This is the one bow game all Oculus Touch users should have.","Feb 16, 2017 at 10:44 AM",4, 2,
2022-05-28 13:36:01.362466,vahdyx,Graphics are decent at least,"This game reminds me of a less cool version of Steam's The Lab's ""Longbow"". Steam I'm sure has a lot more money and development prowess, so I shouldn't expect that much, but this game cost money where as The Lab is free. This games content is about as diverse as The Lab's Longbow. 

Meaning as everyone else said, it's a tech demo that cost money.","Feb 6, 2017 at 4:32 AM",2, 0,"Hi!

Thank you for this comment. We want to inform you that the game has changed since then. We have added new spells, enriched multiplayer mode, improved graphics, enhanced game performance, and much more. I can reveal that we are planning even more changes in the near future. If you want, try it out and let us know what you think.

Best regards,
Kamil, Wenkly Studio"
2022-05-28 13:36:04.451832,jrbm2,,"for me this is the most immersive singleplayer experience so far with Touch. It's fun, intense, and I really feel like I'm ""there"".
Once I learned how to switch to alternate places to shoot from, it added some strategy to the gameplay as I had to decide where to shoot from and when, to be succesful at stopping the waves of invaders. It's simple fun and it is my favorite touch game right now!","Dec 26, 2016 at 7:37 PM",5, 5,
2022-05-28 13:36:04.467790,jcolandrea89,Great Game But...,"the only thing is that its a small game i hope they add way more to it, i would not mind spending more then 10.00$ for that because the game is just that fun. i play it every day, just wish there was like more maps other than the 2 especially for single player just to see how many waves you can last alone. or some kind of upgrade system.","Jan 27, 2017 at 1:37 AM",4, 0,
2022-05-28 13:36:04.483748,mattyj1974,Good game,Keen to try multiplayer with someone. Add me and I will try this in multiplayer with you.,"Feb 24, 2017 at 10:02 AM",4, 2,
2022-05-28 13:36:04.499704,KarlRoe,Updates are on there way,Thais is a fun but short game at the moment and not as well fleshed out as the steam version but the devs has said there will be a significant update soon Fingers crossed it adds the features of the Steam version,"Feb 7, 2017 at 5:04 AM",4, 2,
2022-05-28 13:36:04.516659,angelapraise,fun and good work out.,Pretty fun and it's tiring XD,"Mar 22, 2017 at 5:34 AM",3, 0,
2022-05-28 13:36:07.630938,aaronedmistone,Very ehh...,"There is not enough content and the gameplay is repetitive. In a market currently flooded with what feels like technical demos at full price, this is disappointing. At least the price tag is not terrible. I've seen phone apps with better playability though at lower prices.","Jan 29, 2017 at 1:10 AM",2, 3,"Hi!

Thank you for your feedback. We are sorry to hear that you did not quite like Elven Assassin. Since the publication of this review, we have added some things to the game that may interest you. New spells, better visuals, and enhanced performance are already waiting for you. In addition, multiplayer mode now offers co-op and PvP deathmatch. If you want, check the game and let us know what you think.

Best regards,
Kamil, Wenkly Studio"
2022-05-28 13:36:07.648890,Arcradin,fun but needs a lot of work,"I like the interaction with the orcs, dragon, and ogre.. It really makes you feel like you are part of the game when they start attacking and that is important for VR because we all want to feel like we matter in the VR world and actually have a purpose for being in the VR world. There needs to be a difficulty option because single player is WAY too hard and its hard to find other players for multiplayer. The platforms you are standing on are big and it makes it very difficult to play if you dont have a lot of space. Also the aiming and speed of arrows seem off and should be looked at by the devs (Look for user N01773H review, he/she explains it better). This game is in alpha stage that was brought over here from steam. Just be careful when buying games on the oculus store because they dont tell you the status of the game. Lastly make sure to set up your sensors correctly for 360 tracking. Here is a guide made by oculus to set up 360 tracking: https://scontent.xx.fbcdn.net/t39.2365-6/15397552_232732683816172_4121045365602385920_n.pdf","Dec 17, 2016 at 3:18 AM",2, 3,"Hi!

Thank you for your feedback. We are sorry that Elven Assassin did not fully meet your expectations. The size of the platforms depends on the map you are on and most of them are small, but we will discuss it with the team. The difficulty level is also something I will pass on to the team, but I can't promise if that will change. You also mentioned the shooting mechanics. Now the flight distance of the arrow changes depending on how much you pull the string. Moreover, we would like to inform you that we have managed to expand our game in other ways. Elven Assassin now offers much more interesting content. Now you can use ice spells, play PvP deathmatch on multiplayer and enjoy better graphics! Maybe give it a second chance and let us know what you think.

Best regards,
Kamil, Wenkly Studio"
2022-05-28 13:36:07.666841,thekjun1,Good Game Fun to Play,"Fun Game for sure, lots of nfun in Multiplayer when not Lagging. Use of Tracking is great if your sensors are set up right, do think this Game can be great with more scenes or levels. maybe think about Quest for groups??","Jan 20, 2017 at 5:26 AM",3, 0,
2022-05-28 13:36:07.682799,KyaFox,Pretty Fun and Good Starter Game,I thought this was really fun and a good starter game to help you with mechanics.  It's a blast and one of the only choices for that RPG feel.  :),"Dec 15, 2016 at 12:22 PM",4, 25,
2022-05-28 13:36:07.702747,ericm,Looking Forward To Updates,"Great multiplayer archery action.  The game itself plays like more of a demo than a full fledged game, but it seems the devs have plenty of fun updates planned.  Check out the steam page for more details.","Jan 4, 2017 at 2:03 AM",4, 2,
2022-05-28 13:36:10.814021,wilyrhino,Unsophisticated but addictive and smooth,I was rather bit smitten by The Lab's Longbow castle defense - this is basically exactly the same thing with a bit more complexity and much more elaborate graphics.  It's very very simple as a game but also really challenging and drives me to go again and again.  It was what I was hoping for and I hope they keep evolving the single player game and don't focus exclusively on MP.,"Dec 16, 2016 at 8:13 PM",4, 2,
2022-05-28 13:36:10.831973,N01773H,"Arrow physics lacking, no locomotion.","If you like archery games, consider skipping this one: especially if you only have a small play area. Plaforms you shoot from are too broad and with no way in game locamotion you can only fire at what you can see.

Arrows move at the same speed regardless of how hard you pull the string. All the string does is lob the arrow further. And I do mean lob, you will find you need to aim low as you will find your arrows travel slightly up as they leave the bow, even if you barely pull the string back.","Dec 19, 2016 at 10:41 AM",2, 3,"Hi!

Thank you for this opinion. Since your comment was made, the physics of the arrows has been changed. Now the distance to which the arrow flies depends on how tight the string is stretched. This does not apply to the Oculus Quest version due to hardware limitations. The size of the platforms depends on the map you are on. Some are larger, some are smaller. But thank you for this observation, we will discuss it with the team. In addition, many improvements and new features have been added to the game. We have added new spells, enhanced visuals, improved performance, and expanded multiplayer. So if you want to, you can check if you like the game more now.

Best regards,
Kamil, Wenkly Studio"
2022-05-28 13:36:10.848927,MAsSIVrOOM,Great replay game,"It's a really cool game, the shooting is great, they have to keep improving it tho. There's only one level for single player (for now?) and two levels for multiplayer. Multi is also really cool, but people aren't playing much yet (one time I played with group of 3). 
You keep on trying to beat your own score, so it's really nice.","Dec 20, 2016 at 3:09 AM",5, 1,
2022-05-28 13:36:10.864884,aeidian,"Simplistic, but well crafted","On the face it's a basic bow and arrow shooter, but the developers have taken the time to craft the layout. It requires good communication and attention to be able to progress very far. VR is designed to be multiplayer, and this game pulls that off. It's obvious they're in their beginning stages, but the potential is astounding. I can't wait to see what other elements they add, but even now it's addicting as hell for me and a couple other guys. It was a good find. Don't hesitate if you have friends that will play the game with you.","Dec 17, 2016 at 2:43 PM",5, 1,
2022-05-28 13:36:10.880842,abclark4321,Sorta Fun,"Have to update my review after trying multiplayer. Single player is just boring, but multiplayer is amazing. So much fun to work together and get far. Built in chat works great! Can be a little laggy at time and could use more than 2 levels, but overall one of my favorite rift experiences.","Dec 17, 2016 at 11:54 AM",5, 0,
2022-05-28 13:36:13.995559,pushpain,pain,i must say if u want rely enjoy it u must play online with ppl even its hard to find ppl me myself tried by luck got two ppl and got real fun by defending from orcs orge dragons and maby theres more   my point is these game have feeling of joy if theres  ppl to play  with online for example unspoken i cant find ppl to play against so am not playing it till i got some friends had the vr and game,"Dec 17, 2016 at 10:08 PM",4, 1,
2022-05-28 13:36:14.012514,jeffreymaster8,"great,looking for more tho","i really like this game and think that if u thinking on getting it,do it, it would be better with more modes and things to do","Jan 15, 2017 at 12:27 AM",4, 0,
2022-05-28 13:36:14.029469,AliceTransWoman,Good Game,If Your Looking For Archer Game its fun just to stand and shoot orcs for about a hour or so.,"Jan 12, 2017 at 7:03 PM",3, 1,
2022-05-28 13:36:14.047421,BuckleyB,Bland,"I really liked Valve's archery demo, it was exciting and fast paced. This game just feels slow and boring in comparison.","Dec 17, 2016 at 10:58 AM",1, 5,"Hi!

Thank you for this comment. The game is not as slow as it used to be. Also, the game has gained many improvements. We added new spells, expanded multiplayer mode with dynamic PvP deathmatch and tournaments, improved graphics, and increased performance. Moreover, we plan to add even more maps, enemies, and interesting mechanics in the future! Maybe you would like to try out all the new features? Let us know what do you think.

Best regards,
Kamil, Wenkly Studio"
2022-05-28 13:36:14.064376,Belgor,Really fun RPG feeling in multiplayer.,"Very fun in multiplayer. Closest thing I have been to RPG yet. The version on oculus home has better support for touch than the one on steam, but the steam version have a bigger crowd for multiplayer.","Dec 17, 2016 at 7:42 AM",5, 0,
2022-05-28 13:36:17.200123,thecrow91,At the moment a nice mini game!,"Looking forward to some updates for more content, modes, maps, ...","Jan 8, 2017 at 8:11 PM",4, 0,
2022-05-28 13:36:17.216080,TheUKRifter,Enjoyable Archery Romp,"Nice mechanics, simple gameplay, great fun with friends.","Jan 2, 2017 at 5:11 AM",4, 0,
2022-05-28 13:36:17.233035,Rafau666,Triggering,To say the least,"Dec 16, 2016 at 7:49 PM",2, 0,"Hi!

We are sorry that you did not like Elven Assassin. Could you tell us what you didn't like? This is very important for us because we want to develop our game in the right direction. Since then our game has changed a lot, so there is a chance that this has already been fixed. The multiplayer mode has been expanded, we added more spells, fixed tons of bugs, and changed a lot of other things. Would you like to check what you think about Elven Assassin now?

Best regards,
Kamil, Wenkly Studio"
