scrapping_date,review_author,review_title,one_reviews_text,review_date,review_rating,review_helpful,review_feedback
2022-05-28 13:35:32.744114,crazyprsn,so-so singleplayer experience,"But a GREAT multiplayer experience! The waves of orcs falling in the field as me and 3 other elves fill them full of arrows is very satisfying, friendly banter and gestures between us. I got a decent workout from dodging the thrown axes and my arms and shoulders felt like they got a workout as well. A lot of value and replayability for the price!","May 3, 2018 at 2:26 PM",5, 3,
2022-05-28 13:35:32.760071,JessXe,One big problem,"So this game is mostly great for the price, it could be a lot of fun. But the draw hand does not line up with where your controller is irl (Yes I have tried the offset option), which is pretty terrible in a game where you are trying to be accurate. I use my cheek as an anchor point when shooting, so when I have my controller resting on my cheek and in game I see my hand floating 6 inches higher that is a huge problem.","Mar 28, 2018 at 6:59 AM",3, 14,
2022-05-28 13:35:32.775032,EviLorD,Great PvP,I bought this a LONG time ago. and a friend told me about the PvP mode.  It is ALOT of fun!!  Plus there is a tournament coming up!,"May 4, 2018 at 1:28 AM",5, 3,
2022-05-28 13:35:32.789991,jiggets,Perfect Game Experience for VR,This is the reason we all wanted VR. Like playing a scene from ESO. Loads of fun with multiplayer. I hope the developer continues to expand the maps and depth of gameplay.,"May 1, 2018 at 5:28 AM",5, 1,
2022-05-28 13:35:32.804951,jaydeepd,,Helpful,"May 16, 2018 at 8:12 PM",5, 2,
2022-05-28 13:35:35.909773,Silverlynx35,Not bad,"Kind of boring after a bit. While the motion and graphics are fun, the game itself just kind of drags at a certain point.","Apr 8, 2018 at 12:22 PM",3, 6,
2022-05-28 13:35:35.925730,iJBi,Needs Better Bow Mechanics,This game wouldn't be too bad with better mechanics. Hard to play with how clunky it is compaired to other bow games.,"Apr 10, 2018 at 10:44 PM",3, 7,
2022-05-28 13:35:35.941688,xKarm4,love this game so much fun!,love this game so much fun!,"Mar 12, 2018 at 9:22 AM",5, 3,
2022-05-28 13:35:35.956647,alejandro.marcu,Engaging game,"It's very engaging and fun.  Very good graphics.  Seems a bit limited in what you can do (shot arrows, teletransport, avoid axes), but that also makes it simpler","Feb 24, 2018 at 6:42 AM",5, 1,
2022-05-28 13:35:35.972605,Disafect,,"My wife and I keep coming back to this little gem.  If you like the idea of defending a keep as an archer, than you will enjoy this game.","Jan 29, 2018 at 2:54 AM",4, 7,
2022-05-28 13:35:39.090395,Hogpig,Brilliant,"I've had this game since Oculus Touch first came out. It is the best VR game I've played, and the only one that I play to any extent. Don't listen to any reviews that criticise it for lack of content or polish - it's still early access.","Jan 14, 2018 at 11:25 PM",5, 2,
2022-05-28 13:35:39.108348,Arranox,Worst bow shooting game/demo.,"I love bow shooting in VR and i love tower defence games. this game has both but they slacked of at imersion/ good bow mechanics.

A game that is dedicated to bow shooting should do better than this.
you have a bow stuck in one hand and a arrow stuck in the other, so no quiver.
no special arrows or anything during or between the waves, so you can only uppgrade in the main menu store. Kinda kills the tower defence part of the game.

The rest of the game is clunky and scripted and does not at all make up for the poor bow mechanics, sounds and tower defence.

examples of games with more fun bow shooting mechanics:
The Lab,
Gorn,
Oculus Home (core 2.0),
Nvidia VR Funhouse,
Dead and Buried,
Rec Room (quest rooms),","Dec 30, 2017 at 9:18 PM",2, 3,"Hi!

Thank you for your comment. We are sorry to hear that you are not satisfied. We think that switching the ""arrow offset"" option in settings should help with shooting problems. Also, a lot has changed since the publication of this comment. New skills, PvP deathmatch, online tournaments and much more have been added to the game. The game is still being developed and we plan to add even more elements that will enhance the gameplay. Maybe you should try Elven Assassin again?

Best regards,
Kamil, Wenkly Studio"
2022-05-28 13:35:39.124305,Monstarach,What is tracking?,"I really want to like this game, but, like MANY others have said in reviews, the hand you are pulling back the arrow with teleports about 6 inches upwards when you knock an arrow.  This makes aiming at all a pain.  I tried playing left and right handed, as well as turning the hand offset on and off, and it's the same no matter what.  Not going to refund in hopes of this being fixed in the future.","Dec 19, 2017 at 6:45 AM",2, 0,"Hi!

Thank you for your comment. We are sorry that you are not happy with the game. It's been a long time since you wrote that opinion, so there is a chance that your problem has been solved. If not, we would appreciate it if you could explain to us more precisely what your problem looks like. We will gladly help you.

Best regards,
Kamil, Wenkly Studio"
2022-05-28 13:35:39.139265,Simonmmm,A Solid Simple Proper VR Game,"There's not a lot to it, and the bow tracking seems a bit off, but at least it really uses the touch controllers and your body movement a little bit and actually is a VR game.","Jan 4, 2018 at 6:32 PM",3, 0,
2022-05-28 13:35:39.155223,Rorymcdonald,Great game,Had Elven Assasin for several months now. No problem ever with the tracking. Spot on with my system and I have gone from 1 to 3 sensors and works fine all times.,"Dec 27, 2017 at 5:22 AM",5, 0,
2022-05-28 13:35:42.254527,bboydastyck,"Fun but, that tracking...","So far it was a fun game but even when I got the hang of it, I still had issues with the tracking and knocking the arrows. I'd position my hand in the same exact spot as my last shot and it would shoot somewhere completely different. As for knocking the arrows  if you are trying to knock quick for the giants, you have to do it perfectly or you miss the opportunity and waste precious time preventing them from getting into the castle. I've played other archery games such as HoloPoint and the tracking is no where near as accurate as that. Until the physics/tracking of the bow, arrows, and knocking are updated it's just meh.","Dec 7, 2017 at 3:05 PM",3, 1,
2022-05-28 13:35:42.270485,jim1709,Meh,Good game but the tracking was way off point.Also if you are looking for a solo experience then stay away from this game.If you like multiplayer though then give it a try.,"Dec 23, 2017 at 7:30 PM",3, 0,
2022-05-28 13:35:42.287943,OculusArtemis,Great Game But Updates Needed,"Love this game 100%.  Lots of fun and have met some great people on-line.  By far my favorite VR game.  The sound effects are spot on and the image quality is really good.  I enjoy BOTH the single player and multi player option to the fullest.  New updates are fantastic (third terrain), but once you get to the higher ""waves"", the game now becomes jittery, the arrows move slow, spells aren't working, the new castle flips from day to night and hitting the targets on point does not assure their death.  Likely another update to happen soon if not some patches to fix these problems. Looking forward to future options - so hope these findings are helpful!!","Nov 2, 2017 at 7:09 AM",5, 1,"Do you experience this issues on all maps or only on Human Village. 
Could you send us (support@wenklystudio.com) the output.log file after the game session that had the mentioned issues."
2022-05-28 13:35:42.303901,Apohcalypse,It's okay,"I just bought this game, tried single player and I don't like the feel of it as much as the archer game in ""The Lab"". As soon as I use the trigger to pull back an arrow, it teleports my hand higher than where it was just at...so if i was aiming straight, as soon as I use the trigger button on the arrow, I am suddenly aiming downward... it's kind of odd to have to readjust constantly and it just doesn't feel right to me.","Nov 6, 2017 at 7:02 AM",3, 1,
2022-05-28 13:35:42.319858,Ti-Joe43,great game,"awesome but I still cant lvl up even on multiplayer, is there any way I could delete my save file ?","Dec 8, 2017 at 11:35 AM",5, 0,
2022-05-28 13:35:45.454577,OculusCentric,Refreshing,A solid archery game.,"Dec 20, 2017 at 8:51 PM",5, 1,
2022-05-28 13:35:45.470534,Dr.Walnuss,"Great, but too long wating times","I think this is a really great game! But every wave one has to wait longer and longer for the next wave. Why? I am sure there is no good reason for this. Please fix this, this destroys multiplay for me because we all just have to wait for a minute or so each wave (because you reach higher waves in multiplayer).","Oct 18, 2017 at 1:50 AM",3, 1,
2022-05-28 13:35:45.486491,Cullinarn,The One You'll Keep Coming Back For,"This is the game that convinced me to get the Oculus Touch controllers when they came out last year. The bow mechanics are great once you get used to them, and the haptic feedback is spot on. The scenery is beautiful, and the waves are designed well. When the Devs added spells last February, it became a full fledged game. When they added in the shop in August, it added another level of RPG fun. When they added the ability for the servers to handle more than one game recently, it became a social event. Hop into a game with any of us who have been playing from the beginning, and you will find that we'll help you with any questions you might have. I would have added this written review to my initial 5 star rating earlier, but I was too busy shooting Orcs. ;)","Sep 25, 2017 at 10:09 PM",5, 6,
2022-05-28 13:35:45.502449,Bromatoast,Hoping a dev reads this ;(,"So this game is great! The bow feels great to use, its fairly accurate for the most part, sometimes arrows dont seem to register but its nothing gamebreaking. Definitly puts some strain on your bow arm though having ot hold it up all the time, so be aware of that! Single player could use a little bit of love with the one map, but the multiplayer has like 4 or so. I would definitly reccomend playing online whenever you can. Theres a convenient PTT option too if you dont want people hearing you.

Only reason Im not giving a higher score is because I feel like im only experiencing half the game. There is a level system that lets you unlock spells for mulitiplayer, only Im not leveling up what so ever. I seem to be stuck at level 1. Ive played idk, 10-15 matches between single/multiplayer. Have like 400 coins, but still level 1 and I see no progress being made on my level. I tried a reinstall hoping that would help but no luck there. I cant find a way to contact the devs either so im hoping they respond here.

Everything working as intended though, defnitly 5 stars!!","Sep 14, 2017 at 9:15 AM",3, 3,
2022-05-28 13:35:45.518406,StangGT325,Decent Wave Shooter,"The physics are slightly off in this game and it has no story, but if you're looking for a ""get in quick and shoot stuff"", this is your jam.","Nov 5, 2017 at 11:34 PM",3, 0,
2022-05-28 13:35:48.610256,VRPecs,Can NOT level up and reach achivments,"Hello!
The game is cool, but i have a BIG problem: My character is not leveling up, my XP Bar has no progress altought I played 4-5 hours. Do anyone know a solution for this?","Sep 22, 2017 at 11:43 PM",4, 6,
2022-05-28 13:35:48.626214,iturnbolts,Great fun,"Bought this late as a recommendation from a friend, and it's been one of my go to's ever since.  It feels good, always fun, has some depth and always enjoy it.  It completely surprised me, thought it would suck but I love it","Sep 18, 2017 at 7:30 AM",5, 1,
2022-05-28 13:35:48.643169,angelo.cavelli,Great game,"Just worked up an actual sweat killin' orcs.
Giving my arms a rest before I go back and do it again.
So far the most fun I've had with a game for the Rift.
Great full room, 360° action. 
Good targeting mechanics (having shot a horse bow it ""feels"" the same - but of course with 0 draw weight. You're an elf, it's magic) 
The graphics, while not super realistic, are high quality. 
And shooting orcs is just super fun. 
Even dodging axes when they get mad and throw them at you is fun.","Aug 21, 2017 at 7:30 AM",5, 2,
2022-05-28 13:35:48.660123,GibStorm,Has potential,"Game is fun and all, but could need a few additions so it could be really excellent. The pull hand seems a bit ""off"" location wise. Sorely needs some kind of HUD so you can see village health etc, which is hard depending on your placement. How to use skills/spells isn't entirely clear to me, despite the controls overview. Also, the game sorely needs some kind of dedicated server, so there is always a multiplayer game to join. I have yet to see any games being available. The game seems to use the Windows default microphone setting, not the preference set in Oculus Home. Please fix that, or allow me to choose in game. I often find out I had it set wrong in Windows on start of the game, which means I can't use mic until I restart the game. Last but not least, the game could use some supersampling/graphics settings. I feel like my computer can easily run this game with better graphics.","Aug 5, 2017 at 7:09 AM",3, 3,
2022-05-28 13:35:48.678076,Grizzley1978,Wow! What a rip off!,"Seriously have we been duped into believing that this game was seriously worth the price they were asking for?  Quivr on Steam has a demo so you can at least try it.  Now their graphics isn't as nice, but it has a little more to offer than this piece of ... People who have given this a 4+ stars, seriously?  

Con:
- Mecanics are poor...you always have a bow in hand
- Audio is a joke...'They're breaking in'...No their not, they just are walking in...There is no breaking.
- Can only use magic in Multiplayer?
- One map..that's all you get, deal with it!
- Boring

Pro:
- Graphics are nice","Aug 23, 2017 at 10:39 AM",1, 8,"Thanks for the review. As for the sounds, we have plans to improve it. If you mean that you would like to grab the bow on the start of the game, and you can't as the bow is automatically in your hand it was done that way to make the game easy to start and hard to master. 

Indeed there was no magic in SinglePlayer but we have already added in the last update. As for the maps, there is currently 1 map on SinglePlayer and 2 maps on Multiplayer. We are very close to releasing the new location for both SinglePlayer and Multiplayer.

Hopefully, you will like the next update. It will have a new map with improved audio as you mentioned."
2022-05-28 13:35:51.754428,DreamShaper,Keep coming back to this,"I like this game.  Usually play it for around an hour at a time.  Not an epic campaign, just some good old fashioned fun filling orcs with arrows.  Challenging enough to put you in the zone.  Latest update added the ability to earn new equipment and spells, maybe some other features.  

The thing about this game is that it's compelling enough to keep me coming back on a regular basis, even after several months of playing it.  Definitely a solid addition to the collection.  [EDIT] Also, see a few comments comparing this to Longbow in ""The Lab"".  Got a chance to try that recently, not even close, Elven Assassin is far superior as far as archery games go.","Sep 10, 2017 at 4:20 AM",4, 1,
2022-05-28 13:35:51.770385,jsin01,More Fun Than Most Games,Pretty basic premise... shoot creatures with your bow and arrow before they wreck your village. Multi player mode adds spells to your arrows in addition to other village defenders. Defintely more fun. Replayability is high although the game is very repetitive. I still find myself playing every time I put my headset on.,"Jun 25, 2017 at 10:37 AM",4, 1,
2022-05-28 13:35:51.789335,H202,Good start,"This game is totally addictive. I've probably spent more time playing this than any other VR game. 

The game is still in need of some improvements (glitchy now and then, more maps are needed, etc.) but it's a decent start.","Jun 18, 2017 at 1:58 PM",5, 2,
2022-05-28 13:35:51.812273,FA1CO,Great Game,I very much enjoyed the Multiplayer in this game.  I have played several Bow & Arrow Games in VR and the Multiplayer in this is the best. Defending a Castle Co-op.... if i knew about this earlier I would of bought this months ago!!,"Jun 18, 2017 at 1:59 PM",4, 1,
2022-05-28 13:35:51.828230,pyroth309,Enjoyable,I personally enjoyed this game and found it quite challenging alone. The multiplayer is kind of dead though which is a shame because it's alot of fun multi. Overall a solid arrowshooter that I keep coming back to for some quick fun.,"Jun 21, 2017 at 1:33 PM",4, 0,
2022-05-28 13:35:54.950932,MclovinDanny,Closer to Early Access,Absolutley no Servers were Available. Could not find a game to play with anyone. Also couldnt figure out how to teleport to neiboring wall areas to actually see the gate. Parts of the game still say Coming Soon in the game like upgrades for Bows. Expect as much as it is worth; as a price to game comparison. Expect like a Very Early Access Game. Better off with Rec Room or Quiver,"May 3, 2017 at 11:23 AM",2, 3,"Hi MclovinDanny. Thank you for that comment. I would like to inform you that we are still working on the game and since the publication of this comment a lot has changed in the game. We added some new features. We have added new spells, improved graphics, performance, and much more. Moreover, we have even more content such as new maps and mechanics in our plans. Multiplayer is also doing well, so there is a good opportunity to test it. Maybe it's time to dust off Elven Assassin and give it a second chance. 
Best regards,
Kamil, Wenkly Studio"
2022-05-28 13:35:54.966889,Thain11,The Lab is Free and Better,"Online servers dead. Or not working. 
(Who knows?)

This game has no heart, and is so rigid. The game seems so mechanical and rough around the edges. 

Just play the arrow game in The Lab.","Jun 5, 2017 at 1:06 PM",1, 3,"Hi!

Thank you for this review. Since the publication of your comment the game has changed a lot. We have added new skills, improved visuals and performance, and expanded multiplayer mode with deathmatch and introduced tons of smaller and bigger changes. In the future we plan to add new content such as new maps, interesting enemies and fresh mechanics. Maybe you should give Elven Assassin a second chance?

Best regards,
Kamil, Wenkly Studio"
2022-05-28 13:35:54.983845,snowdog,,"Only giving 4 stars because your character can only level up by playing an online multiplayer game. Otherwise the game is excellent and has had regular additions and updates since the game launched. Very easy for anyone to pick up and play, my Mum even managed to bag a good few Orcs on her first go which is REALLY saying something! lol","Mar 17, 2017 at 10:10 AM",4, 4,Thank for feedback. We have included character leveling in Singleplayer mode in this update as you suggested.
2022-05-28 13:35:55.000799,CoffeeOD,Game that should be in early access,"Basic but working bow mechanics, but that's about it. ""coming soon"" sections at lobby/home shows that this game should not be considered ""released"", but early access with price discount. 

Multiplayer was working fine and it was fun for short time,  after 10 minutes it did not feel very exciting anymore and game play felt slow, also very generic enemy models do not really help to spice up things. 

First spell I got (fire) was very disappointing when it comes to visuals, like I was throwing a matchstick. Does not really give motivation to grind.

Steam version of this very same game is (at least currently) updated before Oculus Home  version, this leaves feeling like a secondary target audience, lesser valued customer.

Is it worth 10 dollars? If you are fine with waiting until more content comes or/and enjoy doing quick multiplayer matches. That said, it's still a ""good start"" and can be fun in short bursts, no doubt.

With few content updates and tweaks to spells (first level ones) could bring game to 4 stars easily,. Currently it's just too short and in early state to justice the asking price.","Apr 4, 2017 at 7:54 AM",2, 2,"Hi!

Thank you for your review. I have good news for you. Since the publication of the review, we have made progress and our game has changed significantly. We have added new skills, updated the old ones, enriched the multiplayer mode, fixed tons of bugs, and changed even more. We are currently working on new content that will add some variety to the game. Expect new maps, enemies, and mechanics! We hope you give Elven Assassin a second chance and change your opinion about this game!

Best regards,
Kamil, Wenkly Studio"
2022-05-28 13:35:55.018751,teq,back to longbow (the lab),"bad animations, bad physics, abysmal sound 0 atmosphere and no fun. Potential is high, and the developer is active and tries to improve though.","May 10, 2017 at 4:00 AM",1, 2,"Hi!

Thank you for this comment. We are constantly trying to improve and develop our game. Since the publication of this comment the game has changed significantly. We have enhanced the game in terms of performance, fixed a lot of bugs, and expanded the multiplayer with deathmatch and occasional tournaments. There were a lot of changes, so it's hard to mention them all. We have more maps, new opponents, and interesting mechanics planned. Maybe you will give Elven Assassin a second chance? 

Best regards,
Kamil, Wenkly Studio"
2022-05-28 13:35:58.109049,treeml,Kind of sucks. Poorly done.,"Maybe worth 2 dollars. Not 15.

That said I am giving it one more star that I previously did, because they are updating it and I think it might be almost good if they keep doing that.","Apr 7, 2017 at 9:08 AM",2, 4,"Hi treeml. We are still updating it ;). The game has changed since you published this comment. We've added new spells to the game, improved graphics, expanded multiplayer mode, improved performance, and fixed tons of bugs. Soon we will add new maps, enemies, and mechanics to make the game more interesting. Maybe it's time to try the game again and refresh your review. 
Best regards,
Kamil, Wenkly Studio"
2022-05-28 13:35:58.125007,mike306121,,i enjoy this game easy to play yet hard to master,"May 14, 2017 at 8:45 PM",4, 0,
2022-05-28 13:35:58.140964,Scarecrow5,Even the skeptics are loving it,"I love this game, my wife loves this game, and everyone we've shown it to loves this game (even the I-hate-fantasy-game skeptics!). 

It does take a few rounds to get used to how to notch your arrow quickly and how best to aim, but it's very satisfying once you get it down. You can shoot the blue areas to teleport to them (strangely the instructions don't tell you this!) and that is key to stopping the later waves of monsters.

I've only played multi-player once but it was super fun. Push-to-talk works intuitively and you get a real sense of teamwork when defending the castle.

I highly recommend  having a room-scale setup and three sensors for this one. You can play without it but it is oh so much better with it. Incredibly immersive!

The game does have some very minor glitches from time to time and we would love to see a local leaderboard (like when we have parties and show off the Rift) and would love more locations to defend but even as it is now we highly recommend this one!","Mar 9, 2017 at 7:19 AM",5, 4,
2022-05-28 13:35:58.158915,Zaga93,Game bow nothing like real-life archery,"Having practiced archery as a sport, the way this bow handles makes the game unplayable. Dead & Buried has an excellent virtual bow, which matches your hands 1:1, however far back you draw the arrow, allowing for natural draw & aim. This bow feels off, doesn't aim right, and the arrow gets stuck before I've drawn my hand to my default position.

If the developers were to make this bow behave more like a real bow, with inspiration freely available in Dead & Buried, this game would be a 5/5. Really, really hoping that this will happen as I *really* want a good archery game, which this seems to be sans bow mechanics.","Mar 18, 2017 at 7:50 AM",2, 1,"Hi!

Thank you for this comment. We are sorry to hear that the game did not meet your expectations. Since then, the bow handling in our game has been improved. Also, “arrow offset” setting in the options menu should change the feeling of the bow. Please check this and let us know if you like it more. Besides that, the game is regularly updated and enriched with new content. We are planning even more updates that you should like. We hope you give Elven Assassin a second chance!

Best regards,
Kamil, Wenkly Studio"
2022-05-28 13:35:58.174873,mayjune,Updated but with flaw,"* ADD ME IF YOU WANNA PLAY CO-OP (  From Sydney AUS)
----------------------------------------
can only level up your character by playing online. 
wasn't even mentioned and i've been playing this game a few times not knowing. 
Also kinda hard when no ones playing the game in my area.","Mar 13, 2017 at 10:58 PM",3, 1,
2022-05-28 13:36:01.296138,Beylan,Would be an incredible game,"If the hits always registered. I've watched arrows fly through center mass of several orcs, with no damage at all. This holds true every single time I try to play the game. Really want to like this game, but it's super frustrating.","Mar 20, 2017 at 2:46 AM",1, 0,"Hi!

Thank you for this comment. Since its publication, this bug has already been fixed. Moreover, the game has been enhanced with many interesting features. It is hard to list all of them, but more interesting are the new spells and PvP deathmatch mode in the multiplayer game. Of course, I don't mention the tones of fixed bugs and performance improvements. Maybe you want to give our game a second chance?

Best regards,
Kamil, Wenkly Studio"
2022-05-28 13:36:01.312599,Antioch,Really fun and difficult,This is not an easy game... You want to keep trying to do better.  Seems like the developer   plans to keep adding content.,"Mar 26, 2017 at 2:27 AM",4, 0,
