scrapping_date,review_author,review_title,one_reviews_text,review_date,review_rating,review_helpful,review_feedback
2022-05-28 13:35:10.582986,Critikal28,Hoping for Crossplay,I do love playing this game. Great game to show to people that are new to VR. My only issue is I did just buy the new Quest 2 to play with people at my house while I play the rift but cross play is not a thing yet with the Quest. Hoping they come out with a way soon so I can actually play with people in my own home. Please find a way to cross play rift and quest please.,Jan 14 at 1:40 AM,4, 12,
2022-05-28 13:35:10.597946,kovacblack,cross play pl0x,make gaem crossplay please its very good thank youou!!,Nov 29 at 8:49 AM,4, 9,
2022-05-28 13:35:10.612906,Dustyeh,Needs cross play,This game is amazing one of my favorite games on VR.  Do not buy it though if you own a rift s and plan on playing it with your friends that have a quest or quest 2. There is no cross play across the rift s and Oculus quest 2. If it had cross play I would give it 5 stars easy. Hopefully it's comming soon.,"Mar 12, 2021 at 8:55 AM",4, 76,
2022-05-28 13:35:10.627866,Ant-On-Knee,Issues over time,"I really do love this game BUT ... I wish you could respec after a while as you learn what the spells do and which you really want. I wasn't able to play for a year, when I came back my 10,000 gold ice bow was gone, back to basic. I had only 5,000 in gold. level was 52. I'd just as soon been put back to newbie all around. Expensive bows should have additional abilities over basic. Targeting seems a lot better than I remember.","Jan 31, 2021 at 2:54 AM",4, 11,
2022-05-28 13:35:10.643823,bikemiddle,"Fun, but...","I've played 32 hours of the game, shooting endless orcs is great and the player gear looks sick in the equipment store, but for some reason the gold I've earned from each game disappears from my name in the store. I've purchased the 200 gold bow ""Iron Defender"" twice now and I'll have -200 gold and then 0 when I had over 200 gold to begin with. I just wanna be able to save up for the white armor :( I've looked at multiple forums online and other people have this problem  but nobody knows what to do, I'm probably gonna rebuy it on Steam and see how well that works. Either way I'm gonna keep playing lol","Jan 27, 2021 at 3:41 AM",5, 11,"Hi!
Thank you for your feedback. 
The issue you are referring to is a bug that appeared with the latest update.
We are working on resolving it. Everything should work fine in a next update.
We apologize for the inconvenience.
Best regards, Kamil, Wenkly Studio"
2022-05-28 13:35:13.783548,Grimravven,Fix the BUG and THEN 5 stars,"Since the update I can no longer move on the score board, save gold, or use armor I bought in the past. The ""use"" button does not work and says i need to buy them when selected. When i do have gold and buy to select and use, same thing. Stuck in clunky beginners outfit and no way to break my high score. 

BEFORE the update, my favorite game ever. This is a game of fine motor skill and agility. Some dislike the fact that armor doesn't add kill points but I think of it more as a social thing when playing with friends. Strategy is required for harder maps and you work to protect your kind through as many levels as skill and determination allow.","Feb 2, 2021 at 7:03 AM",3, 1,Hi! We recently released an update with new content in which we also fixed the bugs you mentioned. Now everything should work properly.
2022-05-28 13:35:13.798508,Exarkun451,Lots of fun!!,"This game is very fun! Highly recommend.  The graphics quality is excellent and the challenge is real! Couple of dev notes - currency seems to be broken and will not save in-between plays. Additionally, the multiplayer is disconnected between Rift S and Quest. My wife and I have different systems and both bought the game hoping to play together, but neither of our games would show on the others board.","Dec 29, 2020 at 1:51 AM",5, 3,
2022-05-28 13:35:13.814465,Name110,Its good but 1 spell could do better,The game is great with the spells  places and custumation but theres 1 spell that could do a re work. Its the ice shield spell iot should be able to block fire from the dragon. overall the game is good  and the community is awsome.,"Nov 30, 2020 at 1:03 PM",4, 2,
2022-05-28 13:35:13.829425,DukeSuckem,Cross buy,Good game but no cross buy quest2 and rift s. Pay again? Why?,"Dec 9, 2020 at 7:35 PM",2, 6,"Hi! Elven Assassin on Quest 2 and Rift S are two different versions of the game. Therefore, we do not support cross-buy and cross-play between these platforms so far. This may change in the future, but we don't know if such changes will happen, and if so, when. Best regards, Kamil, Wenkly Studio"
2022-05-28 13:35:13.844385,TERRYT56,,I would give this a 5+ stars if they would fix the DEFAULT NAME issue and the leveleling up issue and the spellpoint issue and the keeping gold issue for the Oculus Platform.  Maybe Oculus needs to put pressure on them.,"Oct 17, 2020 at 5:11 AM",4, 6,
2022-05-28 13:35:16.950213,Daffelaffe,Good But,"Do not buy this game. Cant update my ticket properly, saying it is 'profound' - for what? not recommending the game ..?  Devs said 'give it another chance' - then the 2 Hours marker was ticked in - and now I cant get a refund... Bad way to do business and sad too - to fraud people like that - when I specifically asked in the first review "" where can I get a refund"".. Then the answer should not be ""give it a second chance""...

There is no Difficulty Level to play - you just start it and the waves keep coming - endlessly it seems.
After 11 Waves, and the huge Dragon Comes in - you just die - no gold to get upgrades, no getting better gear.

When you die - the ""revive"" take TOO loooong..... Sitting around with a blood red screen, waiting to re-spawn while your Town just gets lower adn lower Health.

It seems fun - but - yeah...
Where can I please get a refund for this ??","Nov 11, 2020 at 5:07 AM",1, 1,"Hi! We are very sorry that you did not like Elven Assassin. As far as the difficulty level of the game is concerned, as you start to unlock spells, you'll be able to get to a higher and higher wave. Spells make the game much easier, but first, you have to unlock them. We also recommend you to test the multiplayer mode. It offers co-op mode and a more dynamic PvP deathmatch. We hope you give Elven Assassin a second chance! Best regards,
Kamil, Wenkly Studio"
2022-05-28 13:35:16.966171,JJJBlaze,Needs Work,"Bow and arrow placement with the hands is based on the pointer rather than the grip, so holding the bow is slightly off position of where it should be.  Defeats the purpose of VR without natural hand placement.  

Also, arrow accuracy was a bit randomly off, but not in the way an actual longbow would be.  It seemed based more on a compound bow.

Gold and items system did not work at all.  Gold dissappears after each match.  All items were listed as already purchased, but could not be used.  Etc.  By Etc., I mean the issues involved multiple different combinations of these issues which changed after a match was played.

End of Review

Developer Notes-

I doubt the pointer sersus grip issue can be fixed without remaking the game controls.  It may be possible to add an offset for the targeting and change the bow/hand placement to where it should be.  That may allow for using the pointer to target while making it seem natural.

As for the item issues, lack of a character data separation may have caused some kind of issue.  Or maybe the install was bad.  Or maybe this bug is common.  Don't know.  However, I have rarely seen an item, stat, and character progression system break like that.  I had only just started, so it is difficult to guess at any possible consequences if the bug is repeated by current players when they reinstall the game after a break.  Goodluck though.","Sep 16, 2020 at 11:46 AM",1, 3,"Hi! Thank you for your opinion. We are sorry that you encountered some problems with the game. When it comes to bow handling, maybe you should try the ""Arrow hand offset"" option. This very often helps with a better feeling of the bow. You also mentioned a problem with saving progress. I want to assure you that this is a fresh bug and we are working hard to fix it. We hope that in time you will return to Elven Assassin and change your mind about it. If you still have any comments or questions, let us know. Best regards,
Kamil, Wenkly Studio"
2022-05-28 13:35:16.982128,Moe-Rex,Alot of Fun but currently has an issue,"It's a very fun game, especially the multiplayer part, although it currently has a bug where your progress doesn't save.","Oct 23, 2020 at 6:54 AM",3, 1,"Hello. The bug you wrote about is being fixed by us. Our team is still working hard to solve this problem. We didn't think it would take so much time, but I assure you that the error has not been abandoned and is still being solved. Best regards,
Kamil, Wenkly Studio"
2022-05-28 13:35:16.998086,Cavediver,Has improved tremendously,"Now that the game has gotten popular and it's easy to find people to play with, this is a hands-down STEAL from the Oculus store.","Oct 3, 2020 at 1:10 AM",5, 1,"Hi! Thank you for this opinion! We are very pleased that you are satisfied with Elven Assassin. Soon we will be adding more maps and enemies to the game to make the game more interesting. If you have any suggestions about the game, please share them with us. 
Best regards,
Kamil, Wenkly Studio"
2022-05-28 13:35:17.014043,Janzen.M.R,a game from 20 yrs ago,"meh, thats about all i have to say about it","Dec 27, 2020 at 8:19 AM",2, 0,"Hi! Thank you for that opinion. We would like to know why you think so. Maybe it will help us to develop Elven Assassin further. Best regards,
Kamil, Wenkly Studio"
2022-05-28 13:35:20.113857,bankruptvermin,Awful doesn't begin to cover it.,"The game is unintuitive and difficult to control. For starters, there is no movement controls, as far as I could find. The hands the game provides you with are placed at a funky angle, giving the already unweildy bow an unnatural feeling (I realize it's VR). I don't mean to be cruel or awful, but I do have to say what it was like. The game shows promise, but feels like it was made for tech that doesn't exist yet. I can't say I enjoyed the few minutes I was able to play before I gave up, but I do want to end on a positive note. The game dev's did a great job on the graphics. If the game didn't show the promise it does, I would give it one star, but I can't exactly give it more than two. I'll leave this with one final note: I'm not sure the game is worth buying in it's current state, but I can only speak for the single player. To the archers out there, good luck!","Feb 5, 2020 at 4:38 AM",2, 10,"Hi!

Thank you for your feedback. We are sorry to hear that Elven Assassin did not meet your expectations. 

Can you explain what do you mean by ""The hands the game provides you with are placed at a funky angle""? Have you tried to adjust the ""arrow offset"" setting? Very often it helps with hand positioning. 

You also mentioned control problems. We have some tutorial information that appears with the first launch of the game on how to teleport for example. You can also find some information on how to use spells in the lobby or a controllers guide which is available from in-game settings. Would you mind telling us what tutorial aspects we should consider adding? That way we can improve in the future. 

Additionally, maybe you should give a try to multiplayer. Elven Assassin offers fun CO-OP and dynamic PvP deathmatch! 

I hope you will give Elven Assassin a second chance and change your mind about this game.

Best regards,
Kamil, Wenkly Studio"
2022-05-28 13:35:20.128818,losno420,Good but needs work,"I actually enjoy this game for what it is.  You stand in towers and shoot at hordes of enemies.  This can be a difficult task at times as you need to lead your targets.
There's some unlockables and also magic fire arrows etc.
Pros: 1.Cool physics for the arrows.
2. The graphics aren't bad at all.(not the greatest but the game runs smooth)
3.  You can purchase upgrades bows and magic even helmets.
Cons:  1.  As far as I could tell quest and rift s can't play together.
2. Sometimes my bow won't knock an Arrow very annoying possibly the worst part.
3. There is replayability but content did seem scarce.

All in all if you can catch this on sale I recommend it!","Dec 28, 2019 at 9:09 AM",3, 4,
2022-05-28 13:35:20.144774,goesBang,Boring tower defense / wave shooter,"I can only speak for single player - and it's rather boring.

It feals clunky to change defense position by shooting at them with the bow - and you have to change a lot in later waves where the enemies come from different directions.

You cannot do anything for multiple seconds when you get hit by a thrown axe etc. The thrown axes also always come in at middle high / body center, dodging such perfect throws is hard and you don't really have the time for this (or you change position super fast).

You always start over at the first wave - like usual in such games - and start very slow and boring, just to get overwhelmed real fast because multiple effects add up: more incoming enemies, that throw this axes, and harder enemies that take multiple shots or even fly around. This effects add up very fast. From super boring to super hard in like 3 minutes...

With friends you could go into multiplayer and have fun as novices, but with strange guys I would first try to get some experience / get better - and than this single player mode isn't really fun enough to practice this stuff.

For me: Not worth the money, even on sale. To one-dimensional and boring.","Oct 23, 2019 at 1:51 PM",2, 15,"Hi!

Thank you for sharing this opinion with us. We are sorry to hear that you are not completely satisfied with our game, but we want to assure you that we are still working on Elven Assassin. 

In the future, we are going to add more content to make the game more interesting. You can expect new maps, new enemies, and fresh mechanics. 

Axes thrown by Orcs should fly straight into the player's head so that they can be avoided by bending or leaning to the sides. If this was not the case, it is very possible that you incorrectly set the floor level in Oculus. Please make sure that your floor level was set correctly. If so, let us know and we will try to solve this problem.

As for balancing the difficulty level, we will discuss it with the team. 

Also, we highly recommend trying out the multiplayer mode even with strangers. Multiplayer offers the possibility to play in co-op or PvP deathmatch mode. We hope you give Elven Assassin a second chance!

Best regards,
Kamil, Wenkly Studio"
2022-05-28 13:35:20.160240,bouzgarrou,Can you fix the cam angle like beatsaber,I whant to fix the wierd angle,"Oct 30, 2019 at 9:15 PM",2, 5,"Hi bouzgarrou. Could you describe exactly what you mean? We would like to investigate this problem. Maybe adjusting the ""arrow offset"" in the settings will help. If not, please let us know.

Best regards,
Kamil, Wenkly Studio"
2022-05-28 13:35:20.176197,Hero_killa559,dope!,great archery game. would be better if they added stages and different foes. but if you like shooting orcs youl love it.,"Nov 6, 2019 at 4:07 PM",5, 5,
2022-05-28 13:35:23.268571,JohnnyDioxin,Good Fun But Not Disabled-friendly,"The game is great fun, especially with the Rift S. However, being disabled I am being killed far too often due to my inability to duck very far. There needs to be an optional button press for ducking. I know many VR enthusiasts have the same problem with ducking or crouching as I do, so it needs to be implemented in as many games as possible.  I can't see why such a mechanic could not be put into Elven Assassin - and if it were, this would be a 5 star rating.","May 24, 2019 at 7:52 AM",3, 32,
2022-05-28 13:35:23.284528,LazyGingie,Where do I begin?,"When grabbing the bowstring it locks different to the real world placement of you hand, thought it was my bad tracking but it works fine untill grabbing the bowstring, as someone who uses a real bow and arrow, this is god-awful! The sound effects are boring and repetitive, it is just in general an awful experience.","Apr 20, 2019 at 5:47 AM",1, 6,"Hi!

Thank you for your comment. 

Have you tried to change the ""arrow offset"" option? It can help you with the right hand behavior when holding an arrow. If it doesn't help, could you tell us more about your problem?  We'd like to find out what could be the cause of improper hand behavior and fix this issue. We would be very grateful for your answer.

In addition, we plan to expand our game with new content in the future. We want to add new maps, more interesting enemies, and fresh mechanics. If you want to know more, you can take a look at Elven Assassin's Facebook. We hope you give Elven Assassin a second chance!

Best regards,
Kamil, Wenkly Studio"
2022-05-28 13:35:23.300485,FastLawyer,"Online Co-op is fun, SP not so much","This can be a fun game, especially playing online with a group of buddies or even a good group of 3 strangers and you (if you they use voice chat & are chill). However, there is very limited content. There's only 3 environments. There's really only a few enemy types. The higher level spells & any nice bow / armor takes a long time to unlock, so it does feel like a grind. However, the bow & arrow mechanic feels really good & polished. The graphics are nice. Runs smoothly on my 1060GTX. I recommend buying it on sale.

Watch my review & gameplay here: 
https://youtu.be/8ZdOTB5cMqI","Mar 4, 2019 at 2:25 PM",3, 4,
2022-05-28 13:35:23.316448,Nonebetter,Super fun - arcade style,"Great defender game, you can change your vantage point anytime.
The devs have added so much since i first got this game, its all great.
Spells are super fun to learn to use
Get a workout grinding for gold to buy cool items","Mar 26, 2019 at 6:55 AM",5, 8,
2022-05-28 13:35:23.331403,lyanne.regimbal,Very well made,"Played this for a short while thus far , (Until my arm was tired of holding up the bow) and i can say that this is one of the best games i have bought thus far. Love the RPG mode and the spells/items you can buy to pimp out so to speak your character! Will be playing more! Multiplayer mode has players on it as well. Great buy for under 20$!","Jan 17, 2019 at 7:50 PM",5, 2,
2022-05-28 13:35:26.419268,taquitobuddy,Not terrible but needs far more features,"This game is functional, with what seems like the start of some decent features (spells, equipment, progression) that just never got finished.  Unfortunately, without far, far more content/features this game is too repetitive and bare-bones to recommend, especially with so many other better VR archery games.","Jan 6, 2019 at 4:05 AM",2, 1,"Hi!

Thank you for your comment. We are sorry to hear that you didn't quite like our game. Elven Assassin is still in development and we are working hard to make this game better. We want to assure you that in the future the game will contain much more interesting content. We plan to add new maps, enemies, and mechanics to make the game more interesting. For more info, you can check our Facebook profile or Discord.

Best regards,
Kamil, Wenkly Studio"
2022-05-28 13:35:26.434228,KevinNelson906,Awesome Game,This is an awesome game. I wish they would level up bows and the arrows. A few new levels would be great as well,"Jan 27, 2019 at 1:54 PM",4, 0,
2022-05-28 13:35:26.450185,Cellardoor,Complete waste of time.,"The game is extremely clunky and you cannot move or turn any directions. Instead you have to shoot another post that turns you? And if you're hit once, you basically have to just sit there for 5 seconds and do nothing then keep trying. Literally no fun was had while playing this game. Awful mechanics and an awful game.","Feb 17, 2019 at 7:50 AM",1, 0,"Hi!

Thank you for your opinion. We are sorry to hear that you do not like our game.

You said about the inability of turning and moving. For now, you cannot rotate and move by using controllers, because you have to do it in real life, but we will discuss this problem with the team. 

A few seconds in which you can't move is a punishment for not avoiding damage. This is the only punishment you can get in singleplayer mode for not avoiding an axe or dragon.

We also highly recommend trying out the multiplayer mode. You can play in co-op mode or a more dynamic PvP deathmatch. Maybe you will like it more. We are hoping that you will give the game a second chance.

Best regards,
Kamil, Wenkly Studio"
2022-05-28 13:35:26.466142,empirebeige,Poor Oculus Touch support,"Please note that Oculus Touch controllers are apparently not well supported in this game. The hands are tracked well but as soon as you use your hand to grab an arrow, the hand jumps up and no longer matches its actual position. The bow is then suddenly pointed downward. This makes shooting arrows awful, and since that is all you do in this game, it breaks the whole experience. Plenty of games do Touch support well for bows and arrows, but this is not one of them.

The gameplay is alright, though gets repetitive easily. But due to poor controller support I will be asking for a refund.","Nov 4, 2018 at 8:49 PM",2, 7,"Hi!

Thank you for your feedback. We are sorry to hear that your first contact with the game was not exactly what you expected. The ""arrow offset"" option should help you with hand problems in the game. If not, please let us know. Besides, the game has changed since your review was published and there are plans to add new elements to the game such as maps, enemies, and mechanics. So maybe you should try Elven Assassin again!

Best regards,
Kamil, Wenkly Studio"
2022-05-28 13:35:26.482100,beastjnl7,Won't Load,I bought this game months ago and haven't been able to play it once. It will not load. I've re downloaded it multiple times but still won't work. Waste of money,"Jan 3, 2019 at 10:07 AM",1, 0,"Hi beastjnl7. Can you explain what do you mean? Game is crashing after loading or the game isn't even loading? If you could describe what exactly is going on we would appreciate that. A lot has changed since the publication of this review. We have fixed a lot of bugs, so there is a chance that your problem has been solved. If not, please feel free to contact us at support@wenklystudio.com.
Best regards,
Kamil, Wenkly Studio"
2022-05-28 13:35:29.571462,Barnesm72,Excellent Multiplayer,Have really enjoyed this game!  I don't have any issues with the controls listed in some of these reviews.  There is an option to change the hand spacing adjustment.  Overall one of the best and easiest to get into multiplayer games so far.,"Nov 26, 2018 at 8:47 AM",5, 5,
2022-05-28 13:35:29.587420,Slick1984,,"This was one of the 1st games that I bought for the Rift. I've had the Rift for nearly a year and I find myself coming back to this game. I don't play it a lot, but when I do, there are people playing it. The game is done very well and is a good shoulder workout. I liked this game so much, that I wanted another archery game.  So, I bought QuiVR on steam. I really do not see why that game is getting such positive reviews. I found it to be boring. Elven Assassin is fun and the enemy fights back.","Jun 18, 2018 at 9:40 AM",5, 8,
2022-05-28 13:35:29.603377,o.O.Womb.Raider,"RIFT ""EXPERIENCES""=RETARTED","Stupid Rift ""Experiences"" - I read a constant flow of players on this game through vrlfg.net  and steam charts, yet after purchase I find it hard to find others to play with. Why?? Because RIFT IS SO STUPID SEGREGATING THE COMMUNITY AND CONFUSING IT! I do not like to play alone, I like playing together. This game has cheesy artwork and doesn't look appealing, but after playing it IS FUN! The bow controls well and it is aimed through the bow and the arrow, while there is gear to upgrade, the beauty of the game comes from the fun of playing with others. But Rift Experiences ruins that. Get this through STEAM WHERE THERE ARE MANY PEOPLE TO PLAY WITH AND YOU WON'T BE ALONE!","May 30, 2018 at 1:46 AM",1, 12,"Hi!

Thank you for this comment. A lot has changed since its publication. We have improved graphics, added new spells, added crossplay between Steam and Oculus Rift, and much more. Would you like to try the game again and let us know if everything is okay this time? We hope you will like it more.

Best regards,
Kamil, Wenkly Studio"
2022-05-28 13:35:29.619334,venomyst1c,Great multiplayer experience,"Very smooth gameplay, and lots of fun shooting arrows at orcs.
The multiplayer mode is the best part about it, being able to shoot down waves of orcs along side other archers for countless hours (If you can handle holding your arm up that long!!!) 
I personally play this game standing, and by the end of it... dodging axes and holding my arm up shooting arrows....it takes a lot out of you but its a Great shoulder and leg workout!
A must have for anyone looking for some Top 10 games.","May 28, 2018 at 10:55 PM",5, 4,
2022-05-28 13:35:29.634294,dvdnzl,4P Multiplayer arcade defence,"I played this on the free weekend. Loved it. 4 games were available to join on the NA server, 0 available for asia/europe. Had a sweat up after an hour of game play, put me in a good mood for the rest of the afternoon, felt like I'd been for a run and my shoulders were feeling pumped. I hope the developers continue to expand on this game as there is much value yet to be added. 

I gave it 5 stars as I've yet to find such a fluid easy to play multiplayer game.... 

Kudos to the developers and game designers.","Apr 30, 2018 at 1:29 PM",5, 5,
