scrapping_date,review_author,review_title,one_reviews_text,review_date,review_rating,review_helpful,review_feedback
2022-05-28 18:38:21.765241,Noxasa,"No, no, no, no...","Why make a political VR experience.  This should have been done with the White House historian not a politician that a huge number of people don't like.   Six stars for the quality, -5 for the actors.","Aug 12, 2017 at 6:42 AM",1, 40,
2022-05-28 18:38:21.781199,Ciclopezinho,Horror version,"They could do now a horror version with Trump, maybe for Halloween.","May 2, 2017 at 5:26 PM",4, 29,
2022-05-28 18:38:21.796158,naries,Hosted by the Obama crooks,But good to see the inside of the white house.,"Sep 19, 2017 at 12:30 PM",1, 38,
2022-05-28 18:38:21.812116,ddropski,since there is politics in VR why this,"1)The hillary Clinton e Mail Shred Game


2)The clintons murder mystery game (SPOILER) it was them


3)Obama game where you have to grab the nobel prizes and throw money to the Insurance Companys game 


4)The bernie sanders game where your surporters run up to you and you have to turn your back on them while catching money ...then when you get enough To buy a brand new Audi R8

5) or the Liberal Media fake news shuffle game

6) but my fave is the AL Gore Flight simulator where you avoiding the hot global warming spots and  fly your air liner all over (causing more hot spots) while collecting money
 
oh boy hours of fun :)","Jul 15, 2017 at 10:36 PM",1, 50,
2022-05-28 18:38:21.828073,boocraft1992,Life of a serial killer. Obama's house,"I thought his was just a tour but it turns out a rare inside look at a mass murderer in his home. 

I could hear the crys of every dead solider that was caused by a rules of engagement set by Obama. The lies of an affordable care act which is OBAMACARE that turns out to not by affordable since costs have went up over x3 from when it was implimented. But... Obama... the one who was apparently so loved by the people because Beyonce said so... and turned out to be wrong because Obama was the one who let his special interests set the pricing and rip off americans under his Obamacare. Obama later gave amnesty to illegals with DACA which has an average age of people at 25 years old and goes against the constitution. It also turns out he wiretapped Trump and everyone called Trump crazy for saying so but it's on a breaking story on CNN so you know it has to be real dems.","Sep 22, 2017 at 1:04 PM",1, 44,
2022-05-28 18:38:24.917809,oracle347,This guy is not the President.,Update needed with President Donald J. Trump.,"Jul 13, 2017 at 8:40 AM",1, 59,
2022-05-28 18:38:24.933767,Tollero,This is the Killer App!,"Obama spent his 8 years in power at war! Under his leadership the Unitated States drop 3 bomb EVERY HOUR! It's 72 bombs a day and 504 bombs a week!
The next app should be how he get his Noble Peace Price...","May 9, 2017 at 1:57 AM",1, 32,
2022-05-28 18:38:24.948727,kk19115,,Obama is the worst president in history.,"Sep 9, 2017 at 9:27 PM",1, 55,
2022-05-28 18:38:24.964684,Spar7an,Obama was worst president in history,this should be removed due to the presidents special needs,"May 28, 2017 at 2:59 PM",1, 45,
2022-05-28 18:38:24.979644,MedievalDesigns,over it,"Obama will go down as the worst President in U.S. history. This propagada piece is worthless and a waste of time.
KEEP POLITICS OUT OF VR!","May 26, 2017 at 4:44 AM",1, 46,
2022-05-28 18:38:28.085338,oracle347,This guy is not the President.,Update needed with President Donald J. Trump.,"Jul 13, 2017 at 8:40 AM",1, 59,
2022-05-28 18:38:28.101295,Tollero,This is the Killer App!,"Obama spent his 8 years in power at war! Under his leadership the Unitated States drop 3 bomb EVERY HOUR! It's 72 bombs a day and 504 bombs a week!
The next app should be how he get his Noble Peace Price...","May 9, 2017 at 1:57 AM",1, 32,
2022-05-28 18:38:28.116254,kk19115,,Obama is the worst president in history.,"Sep 9, 2017 at 9:27 PM",1, 55,
2022-05-28 18:38:28.130217,Spar7an,Obama was worst president in history,this should be removed due to the presidents special needs,"May 28, 2017 at 2:59 PM",1, 45,
2022-05-28 18:38:28.146174,MedievalDesigns,over it,"Obama will go down as the worst President in U.S. history. This propagada piece is worthless and a waste of time.
KEEP POLITICS OUT OF VR!","May 26, 2017 at 4:44 AM",1, 46,
