scrapping_date,review_author,review_title,one_reviews_text,review_date,review_rating,review_helpful,review_feedback
2022-05-28 14:45:58.257636,JuicyFruit40,A truely immersive VR dungeon crawler.,"This game is by far one of the better visually stunning VR games i have played so far. The level of detail they put in to this title is amazing. You get a sense of real danger not knowing whats around the corner until a goblin runs up on you and its literally a jump scare if you happen to be turned away at the moment. Make sure to shoot every single pottery that you see, in fact if you think you can shoot it, do it because you will gather up a lot of coins that way. Ok, now to get to the reasons im only leaving a 4 star review instead of 5. First off, im not sure if this is tracking issue with my rift sensors but sometimes while playing archery the bow and arrow tends to slip off to the right even when im in plain few of the sensors. Secondly, the lack of co-op multiplayer population. I have only had the game for about 2 days but i have tried joining co-op to no avail. I have even hosted an open lobby for over 1 whole hour and not one single person joined. Yes, im sure its better if you just invite a friend but randoms arent a bad thing id say when it comes to this game. Id glady update my review to full 5 stars if these few minor things changed for the better but other than that, this is a great game to own on Oculus or on Steam.","Dec 18, 2018 at 2:09 PM",4, 3,
2022-05-28 14:45:58.273593,jimbobz,Not happy!,So angry........ With myself for not buying sooner ! Alpha??? Could have fooled me. Been playing solo and loving every minute of the game.,"Feb 10, 2019 at 10:27 PM",5, 1,
2022-05-28 14:45:58.291053,Probably_ISIS,A masterpiece,"I absolutely love it.  Such a well made, beautiful dungeon crawler.  Wish I had found it earlier.","Feb 10, 2019 at 5:35 PM",5, 1,
2022-05-28 14:46:01.371429,Dropla,Super disappointed. *update*,"I was having a blast, doing the tutorial, dug a little through the dungeon, killed trolls~ SO happy! Getting super excited to play co-op with my boyfriend as he is finishing the tutorial too! 
 
 So...we tried all methods of joining eachothers game, hosting, each one of us tried, both in public and friends only. Just says no ones around, well I know he's around because he's literally playing it in the same house. I can see him. So 50.00 wasted on a game that is now useless. I should have totally gotten dungeon knight. This is what I get.

*So, I was really suprised to hear back from the developer and fast!! It seems they really DO care about our experience! We did buy it on separate platforms, he bought on steam I bought on oculus. I had even tried adding a non steam game to my steam library to see if I could add him to game from chat messages and now it makes sense why it didn't work. Thanks for the help. Not sure what to do now. It speaks volumes that you responded so soon. The game is great, maybe one of us can requerst a refund and buy on the same platform. 

 I still had fun myself, just now knowing that we might be able at some point to play together, im excited again!

 *Second Update!
 The developer was able to make it so we could play together! We have been having SO much fun! So far, out of the 3 I purchased, the wizards, dungeon Knight and Karnage ~ Karnage is the one I feel has the best polish. Better inventory system, movement and combat! I am really happy with my purchase! Can't wait to see more games from these Dev's!","Nov 6, 2018 at 12:32 AM",5, 24,"Hi Dropla, please join us on the Steam forums for Karnage Chronicles and let us help you sort out this problem. We use the Oculus Matchmaking system in order to setup matches and we would of course like to figure out why this didn't work for you. We take all these issues quite seriously, and generally speaking there are very few issues with the multiplayer matchmaking. Two things off the top of our heads we can mention here which is likely not your problem but still; 1. Did you both buy Karnage on Oculus Store. It does not support cross-platform yet. 2. Did you both agree to any firewall popups to give Karnage access? I am also trying to add you to my friendslist (Braccar or Thorbjørn Olsen) so we can figure this out."
2022-05-28 14:46:01.388384,kadoh,,"Great game.... now better with the new update.  I really love it. ;).... dev. You should add a dragon. Everyone loves killing dragons.  Just saying
Anybody looking to play multiplayer feel free to add me.","Jan 15, 2019 at 1:28 PM",5, 1,
2022-05-28 14:46:01.405338,TeddyFlippsi,Top tier vr game with little issues,"The sp mode is awesome, can’t argue with that. But I couldn’t play the mp due to the fact that my buddy got his version from steam. A note tot the dev: could you upload a workaround to make coop possible? I wouldn’t particularly mind buying the game a second time, but that would be the last solution I’m willing to take.
Happy to hear from you and keep up with the good work!
P.s.: I already added you on steam (Mister Fister) after I read that other post from you.","Dec 13, 2018 at 7:59 PM",5, 1,
2022-05-28 14:46:01.423291,DustyinLVNV,Love it,I've clocked nearly 20 hours on this game and I love it! Can't wait for more!,"Sep 1, 2019 at 2:38 PM",5, 0,
2022-05-28 14:46:01.440245,PsiStar,Can't Create Multiplayer with Friend,"I (PsiStar) seem to be having the same problem that Dropla mentioned.  I can't find my friend in game even though we are grouped in Oculus Home.  I purchased my game through Oculus and he (Allaran) purchased his game through Steam.  Any assistance would be most appreciated.

I would be happy to raise my rating to five stars if we can solve this problem.  We specifically purchased Karnage so that we could play together.","Dec 6, 2018 at 11:24 PM",3, 0,"Hi PsiStar, let's solve this issue. Kindly add me on Steam like Dropla did so we can communicate more easily :) Username: Braccar"
2022-05-28 14:46:04.531111,Smartypants,,"Excellent game and the design/environment is amazing to walk around in. Only drawback is it takes several tries before you get a multiplayer game going with friends, but once you get in its great so its worth persisting. Can't wait to see what you have planned for the future 10/10","Oct 19, 2018 at 4:31 PM",5, 2,
2022-05-28 14:46:04.549063,AsaBjorn,Beautiful,"Visually pleasing, fun and amusing dungeon crawler. Is in alpha stages but is really enjoyable to play. Has different modes (easy, hard, etc). Cons: bag space, having to buy a portal home each time you return, in my 'home' I cannot reach the scroll on top of the fireplace (I am 5'2"", but i could try a stool irl to reach a virtual piece of paper....just hold my beer). >< Also....and I have not reached the end yet....what the hell am I? I cannot see me. Continual development can make this really over the top, but this game is really great as-is.

update: the scroll on top of my fireplace has mysteriouslly fell to the floor...must be those drafty dungeons (ty)....really enjoyed the story line, would love to see more expansions, improved npc graphics (troll). maybe even a 'return to death' and re-awakened for next quest line. a multi player battlefield,  and more armor choices. good game.","Nov 19, 2018 at 2:41 PM",5, 2,"Thanks for your review AsaBjorn. Glad you are having fun :) More bag space will be added in the next content update, there is a portal in the beginning of each dungeon that takes you back to your home, and the scroll on top of your fireplace can easily be looted by using the tip of your weapon. Hope this helps."
2022-05-28 14:46:04.568013,Vyne,Great game.,"Its a great game,love it so far, the only thing whats bothring me is how to use this bow. In other games i do it like i would in real life, here i need to bend my hands like i wanna use a tiny bow or something. I like archery irl,so i know how to do it. Other than this, it would be a perfect game.

Edit: Hi Braccar. I can only suggest that u try Sacralith: The archer`s tale. That is how you use a bow, and i dont mean the part where you have to get the arrow from your back(although thats cool as well) But how u pull out the whole string and how far. Thanks.","Oct 19, 2018 at 11:39 PM",4, 3,"Hi Vyne, I am Braccar. One of the three developers behind Karnage, not sure why you are bending your hand to use the bow. I am a huge fan of archery and we have pretty much made this the way it would be in real using an old style bow with pull strength. So you can draw your bowstring pretty far back to get more power to the shot. You have two angles, one for the bow angle and one for the arrow angle which can be controlled individually (just because this makes it more fun in-game, wouldn't work well in real of course). Would be really interested to hear more details about what you are experiencing, cause I am confused right now :) :) If you add me we can try to sort out this problem to make sure you have the perfect bow experience. All I can think about is that there is a mismatch between the angle of the bow in-game and the angle of your controller.*UPDATE: cool, will check it out! I am really thinking that what you experienced is some kind of bug."
2022-05-28 14:46:04.584967,Jacobdavis90,Just what I wanted.,Thanks guys!,"Nov 14, 2018 at 12:42 PM",5, 0,
2022-05-28 14:46:04.601922,VoidWolfe,Great title for an early access game.,Can't wait for them to finish more. I noticed they have a multiplayer beta test now... but it's only accessible via steam when you enable the experimental branch of the game... what about us Rift users? We will just have to wait until all that is final? :( I'm afraid that might be a while considering they have a small team. Anyways great potential!,"Aug 13, 2018 at 11:57 AM",4, 4,"Thanks for your review, VoidWolfe. We have always used Steam for testing and hammering out issues since the platform have a much bigger player community and much better channels for communicating with players than the Oculus platform. Multiplayer will be coming to Karnage Chronicles on the Oculus store very soon. We are putting all efforts into finishing the matchmaking system for the Oculus Store and are very close to being done. Stay tuned for multiplayer fun! :)"
2022-05-28 14:46:07.688818,jim1709,Great Dungeon Crawler,"And also very good as an rpg game. The combat feels great even though I have tried only 1 of the 2 classes. The enemy reactions to your hits feel very natural but  I just wish that when you got a killing blow on someone with your sword they would be dismembered or something similar to that. I pretty much want more gore .That would make this game the perfect 5 star game for me. I finished just now the game and I gotta say that... i was very dissapointed with the ending. The boss battle was cool and all but the dungeons were very misleading. What i mean is that It took me almost 2-3 hours to finish the first dungeon and less then 1 to finish the second and third together! I thought this whole thing was gone last more + the ending was so weird I didnt even realise the game was over and after looking at other reviews most people need some time to realise this as well. I had to look it up to actually believe it. Anyway, still giving this 4 stars because its early access and i am hoping that more story is coming out soon since so many things were brought up in those huge dialogs but some never showed up. Just hope the devs keep up with updates and stuff and dont give up on the game.","Sep 5, 2018 at 10:19 PM",4, 3,"Thanks for your review. Unfortunately there are no tools for us to communicate information well to players here on the Oculus Store, except for saying this is Early Access. For players who play this on Steam they know that we are continuing to put more content into the game (upgrading the size of dungeon 2 and 3 is in the works, multiplayer is coming, etc.). The ending of the game isn't done yet, neither is player progression. Thanks a lot for your support and hope you return for more when major updates arrive :)"
2022-05-28 14:46:07.705773,chaoscode,Loving this game,The game is very playable as it is. The graphic are good. Needs random stats and drops like D3.  Maybe some bigger bosses with bigger drops.,"Oct 4, 2018 at 7:28 AM",5, 1,"Big thanks for your positive review. We absolutely have plans for adding more loot and bosses with special drops. The loot part will be coming once we release an update with more player progression related things, like stats and special powers that more easily ties into the kind of drops you are looking for :)"
2022-05-28 14:46:07.722727,Tarbal,Loved it!,Now this is why I got VR. Loved every moment. I've dropped one star just because it was only 3 hours game play and I really wanted more.,"Sep 4, 2018 at 1:55 AM",4, 2,"Thanks for your review, Tarbal :) We have more content in the pipeline to release into the game during this Early Access period. Just out of curiosity, you did play through all 3 adventure dungeons? Most players spend 5-7 hours completing the whole game so you are fast! :)"
2022-05-28 14:46:07.740679,DanielHagbi,Great game!,"Great game, Maybe you would like making and open world mmo rpg multiplayer  game?","Aug 29, 2018 at 10:54 PM",5, 2,
2022-05-28 14:46:07.757634,MagicCR,"Slightly cartoonish, but well done.","I hope the devs know that 'Chronicle(s)' is plural...so if you're not planning to add another chapter, please stop misleading everyone.

Thanks","Aug 6, 2018 at 1:20 PM",4, 2,"Appreciate your concern. We have clearly communicated from the beginning, even though this information is unfortunately not easily communicated through the Oculus platform, that we are tirelessly working towards releasing more content. Karnage Chronicles is still in Early Access, and right now we are finishing up multiplayer, and after that we will finish Content Update 2 which will add several hours of gameplay. Fear not, there is more to come :)"
2022-05-28 14:46:10.883359,NordicTrolls,From Nordic Trolls: Information,"(This is not a review. Keeping this post updated for information visibility.)

2-4 player co-op is here! Play through the campaign together with friends or with random people. Karnage multiplayer comes with full drop-in/drop-out support and can be started at any time after creating a hero and going through the tutorial. Monster strength and number of spawns scale automatically based on how many players are in the party, so feel free to go about your adventures while at the same time hosting a multiplayer game, monsters won't become tougher or more numerous until someone joins your game and it will scale down again when someone leaves. Friendly fire is turned on so be careful when you swing your weapons and lob arrows into melee.

For more information on the current version + patch notes kindly follow this link to the Oculus Forums. We will read feedback and answer questions posted in the thread.

https://forums.oculusvr.com/community/discussion/69870/karnage-chronicles-multiplayer-announcement

About the devs: We are 3 very passionate guys making Karnage Chronicles and we hope you will have fun playing what we are putting together. More is coming.","Oct 2, 2018 at 4:05 PM",4, 7,
2022-05-28 14:46:10.901312,garybrain,Impressed.,"Nice looking game, great atmosphire and like a lot of games, spiders ( man I hate them ) jumping out of no where. Gets the old heart pumping. Can't wait to play a bit more.","Jul 1, 2018 at 6:02 AM",4, 2,Glad to hear you are enjoying our game. Have fun on your adventures! :)
2022-05-28 14:46:10.918266,EllGavhi,,Worth every penny.,"Jun 20, 2018 at 10:52 PM",5, 4,
2022-05-28 14:46:10.937215,econvr,Bad Zelda Clone,"Looks beautiful, but the gameplay is atrocious.  Combat is cumbersome, the way enemies react and parry makes it feel like a turn-based game, despite this being a action-RPG.  Enemies do not face and attack the player head on, but seem to be attacking 45 degrees away from the player.  At one point, the game suggests leaving one hand empty with no weapon equiped to interact with the gameworld, but gives you a sword and shield.  What am I supposed to do with the shield!!!  Developer needs to figure out how to let players interact with the environment with their weapons equiped.  This game is a total mess.  There are better action-RPGs available on Valve's store.","Jan 3, 2018 at 10:09 AM",2, 6,"Hi there econvr.

It is suggested that you leave 1 hand free on a preset, not all presets. You can switch between presets at any time to reveal a free hand (like you would switch between Sword and Crossbow) 
The 45 degree angle is a bug with Oculus right now, and we are working on a fix for that. Thanks you for your feedback!"
2022-05-28 14:46:10.955672,mr_daemon,Strictly ok,"It is a good looking game, has some very interesting concepts in regards to interfaces, but controls and core mechanics are a bit bland. Combat interactions feel extremely detached and very Traditional RPG, which in VR is not that great of a thing.","Jan 18, 2018 at 9:06 AM",2, 1,
2022-05-28 14:46:14.055980,WrothBog,looks pretty,best looking game i've played yet on rift.  sadly the the options for this game are non-existent. i can't play this because the devs have decided i must do 180 turns everytime my right thumbstick recenters. pulling the stick fully backwards i could understand. having the stick slightly behind the centre deadzone is a horrible design flaw and leads to me constantly flipping on the spot during fights,"Dec 28, 2017 at 6:09 PM",3, 5,"Hi WrothBog, this problem was fixed in version 0.6.5.5 that went live on February 14th. The activation point was moved further back and we added an option in settings to toggle 180 on/off. Thanks for pointing it out, this is what Early Access is all about, gathering feedback and fixing issues."
2022-05-28 14:46:14.074930,Painface95,Don't buy if you want a good Melee Game,"I got the game with the christmas bundle and thought it would be a nice game, since I like melee games in vr. 

But if you are looking for a good Vr Game with melee fights then you should skip this one. 
Altough the game seems to focus on hand to hand combat (along with ranged combat) all you can do - or better - all you are able to do is to wave your weapon in the enemies general direction.

 Sure there is Blocking but due to the attack animations of the eniemies its more or less pure luck for that the enemies weapons are likely to just clip through your shield and hit you anyways. 
The Fights arent very responsive as well. NPCs have fixed ""Hit"" animations in which they stumble for a second and then go back to their attack rotation. 

It should be said, though, that the game is still in development and everything I mentioned might be changed in future updates.

If you want a Vr game with good Melee Combat, try ""Gorn"". Thats what I call Responsive Combat!","Dec 21, 2017 at 2:35 AM",3, 9,Melee combat and melee AI has been rewritten. We think you would find it much more fun now :)
2022-05-28 14:46:14.093879,JohnInAk,Updated my review...,"If you like Mages Tale, you will like this one. It has some similar elements but has a few added advantages. One is the option to choose between a couple of different classes. Ranger and Fighter. (I think they need to add a third class of Mage) There are also difficulty settings, which initially did not seem to work but since an update that seems to have been resolved.  The enviroment and fighting and story are all wonderfully done and really enjoyable with the exception of the differences between the two classes. So as a ranger i would expect to have the ability to kill targets from a distance without them seeing me. This however does not seem to be the case as most enemies will sense/see/? you and charge you right when you are in range of your bow. This of course makes it challenging trying to run and shoot but it does work to a degree.  The fighter class works well though.  I played all the way through, at least I think I was at the end although the story doesn't make you think its the end....?  It was a fun and challenging adventure. I'm hoping it continues soon....","Nov 18, 2017 at 11:32 AM",5, 7,
2022-05-28 14:46:14.112828,washad.jacksons,Tremendous Potential -- with some flaws,"When I first started the game, I found myself making sweeping absolutisms such as ""This may be the best game I have ever played."" and ""I wish I could give it six stars."" The visual experience is stunnig but arguably second to the audio. The combination is the closest thing to reality I have ever experienced in a game. The pattering feet of approaching spiders quite literally had me gasping on occasion - and I'm a former Marine. Like dating a hot chick though, some flaws begin to show through with time. 

Seems like the developers are really receptive so hopefully they will take some of these to heart and address them.
- It is too hard; I'm a decent gamer and some of the bosses are near impossible. A dozen tries per boss (on easy level) converts challenging into tedious. 

- Need a map; Getting lost in circles trying to find that left turn hidden in the dark just stops being fun. If you have explored it, map it.
- Need free teleport back home; There is no entertainment value in walking through room after room to get back home so you can buy a new weapon. 
- Conversation with the collector is way too long, I wanted to shoot myself (or it)
- Need to level up; Once you buy all the gear you can buy, there is no way to beat the boss other than trying over and over again. It becomes hopeless. Give me the option of grinding a while, leveling up, and coming back to the boss when I am more prepared. 
- Bow dynamics are great, but the sword dynamics are poor. I'm hitting the enemy over and over again with zero damage. 

As it stands now -- the boredom factor of the game after some play time isn't worth my moving forward. Address these issues,  and I'm back on board. 

Great start nonetheles -- don't mean to sound too critical.","Nov 11, 2017 at 1:20 PM",4, 20,"Hey Washad, thanks for the review! We can ensure you that this game is just getting better step by step. This is a real passion project and every update we release is with focus on addressing selected issues plus introducing new content. We are taking a very careful and deliberate approach to VR game production, with a lot of time sifting through feedback from our supportive fan base. For example, a map is coming (although some players don't want a map because they would rather get lost, this we know from feedback). About the difficulty of the bosses. We have players that chew through the bosses without breaking a sweat, we have players that loves throwing themselves against the bosses time and time again until they beat them, and we have players who would like for the bosses to be a walk in the park. It's hard balancing for everyone's taste :) :)
About the sword wielding mechanics, they are what they are because of feedback from our player base during the past 6 months. It's velocity based, the speed of your swing determines damage from 0 to max. 
Conversations with NPCs is a personal preference, some like it long, some like it short, some doesn't like it at all. That is why we have a SKIP button and later we will introduce subtitles as well.
Again, thanks for your feedback and a big thanks for your positive review. Expect many improvements and much more content during Early Access, and we hope you will come back with every big update and give it a try. Your feedback is valuable :)
Cheers!"
2022-05-28 14:46:14.130780,RobagoN,Great RPG,"!!Turn off thumbstick straffing and turn ON HMD tracked motion for a no VR sickness experience!!!  This was a ton of fun, but I have only played for an hour or so.  I have been waiting for more games like this to be released.  Lots of call backs to the old style RPGs.  It is kind of like a cross between Vanishing Realms, Diablo, and WOW.                                         

***UPDATE: After another 1.5hrs of playing on hard mode this game is now on my Top 5 VR games List.","Nov 4, 2017 at 10:43 AM",5, 8,
2022-05-28 14:46:17.234585,BeastyBaiter,Not the worst but not very good either.,"Graphically, it's ok. Better than a lot of VR games but nothing terribly exciting. Sound is surprisingly good though, better than I'd expect from a $10 game. Unfortunately, that's where the good parts end. Melee combat is shockingly crude for this type of game. It doesn't have the fidget the sword back and forth problem but it goes to the other extreme where you have to do absurd swings no one would ever make with a real sword and even then, it does pretty much nothing most of the time. Blocking is all kinds of glitchy too. It's early access, so some issues are expected. But this strikes me as a more fundemental issue. Combat just isn't fun, and it doesn't seem to have anything else in it since after about an hour or so and a very sore arm, I still hadn't finished the first quest.","Dec 7, 2017 at 4:08 PM",3, 6,Melee combat and melee AI has been rewritten. We think you would find it much more fun now than we you tried it back in 2017 :)
2022-05-28 14:46:17.252537,DRock,Best VR Action RPG Yet!,"Love this game and can't wait to see it develop more. I'm not into shooters but love sword and shield combat stuff, so hope to see more of these type of games in the future. Only thing missing for me was an ""in between"" comfort mode where you don't teleport, but can do sharp 90 deg turns with the thumbstick. That method seems to work well for me anyway to not get motion sick.","Oct 27, 2017 at 11:50 PM",4, 10,"Thanks for the feedback and the suggestion. We will take the sharp degrees turn to heart and release it together with an update shortly. Cheers!

UPDATE: From version 0.6.2.5 that went live Nov 3rd, additional comfort mode options can be found in ""Controller Options"". They include both 45 and 90 degrees turning."
