scrapping_date,review_author,review_title,one_reviews_text,review_date,review_rating,review_helpful,review_feedback
2022-05-28 14:44:54.880537,Vinnrir,BANNED,lol these creators are pretty soft. they release the game on different platforms and expect people to be perfectly fine with buying the game and not allowing cross platform. they are also very quick to bann people. thank you for stealing my money! crybabies,Mar 17 at 4:07 AM,1, 5,
2022-05-28 14:44:54.895497,Frosttty,Coop not working,The coop is fun but we can only play for like 5 mins before it kicks one of us out of the game. This game would be a 5 star if it would work.,Dec 23 at 9:44 AM,2, 4,
2022-05-28 14:44:54.910456,GilRift,What a pity : to much lag to play coop,"I try to play with a friend in Coop and we experienced too much lag to continue.
We have both oculus version (we have oculus quest 2 connected to pc with oculus link) with direct line to internet (no wifi). We read on steam forum that devs recommanded to come back to oculus home and resume game but it did nothing.
This issue is known apparently but isn't corrected yet.
We experiment this issue only in this game : no issue with Arizona sunshine, no issue with Trickster VR coop, no issue with star trek bridge crew, no issue with Wands.

Please dev, help us!
Your game is amazing, it works perfectly in solo and it is so immersive but we would like to play in coop... we buy it to play coop !
We count on your support !
PS : if you only want to play solo, this game is incredible (I will give it a FIVE STARS), in coop, we can't play... We are so sad !","May 25, 2021 at 7:46 PM",1, 5,
2022-05-28 14:44:54.927411,KarbunclePrime,"Wonderful game, a few minor issues.","Have been playing this game CoOp with my older brother and have been having an fun time with it.  First few hours played wonderful, later on we had the guest player experiencing horrible lag we could not fix.

>>Pros<<
~ Aiming with bows is pretty realistic and satisfying, even when its difficult to land shots sometimes.
~ Game has good atmosphere, I hate spiders, they creeped me out, I screeched like a girl when a certain Mini-boss appeared... this is a Pro, cause it was immersive.
~ The games got length to it.  We've played for several hours now and am probably only about ~60% through with the game.   Definitely a good value, double so if you get it on sale. 
~ Difficult, but mostly fair, can use cover to your advantage on archers and you can block all Melee attacks with proper positioning and timing. 
~ Decent enough enemy variety and interesting and challenging bosses.  
~ CoOp is a blast, and how they handle money/gold split is very nice.  

>>Cons<<
~ I wish Items were more than what they are.  They're stat sticks, one does 100 dmg and the other does 50, or one has 300HP and the other has 250HP. 
~ Some areas are cruel lol.  Archers EVERYWHERE, all angles, perfect accuracy, can sometimes shoot at you while they are unseen/behind cover.  At certain times in stage 2 I felt like i was playing an Arcade game designed to suck $$ out of you.
~ Exploding Mushroom enemies are the worst.  If you don't see them coming you're pretty much dead.  
~ Wish the two classes felt more unique.  Currently the only purpose to classes seems to be one gets a bow and the other a crossbow... and thats where the variety ends.
~ But honestly, the 4 rating is almost entirely due bad lag in Coop we could not fix.  Soiled an otherwise very soild game experience which is a huge shame.  That said, your mileage may vary on this issue.","May 8, 2021 at 1:20 PM",4, 12,
2022-05-28 14:44:54.941374,wicks2129,Wow!,Top 5 VR game easily. Beautiful incredible scenery. Incredible action and scares.,"Apr 12, 2021 at 1:37 AM",5, 7,
2022-05-28 14:44:58.068654,Agromer,Great update - Best VR Multiplayer game,"This game is so much fun with a group of friends. We played the old 3 levels and it were hours of great gaming on hard and even impossible, but the new redesigned level -Eye of the dwarfs - is gorgeous. This whole scenery has so much details, from tiny little things to giant sculptures,  so many enemies, new armors, treasures etc. etc.  Please please please dev´s go on and continue to create another level or any kind of add-on. What about an arena or competition mode? Two teams in an empty dungeon? Looking feverishly to any update !!!","Oct 26, 2020 at 4:46 AM",5, 15,
2022-05-28 14:44:58.082616,Dahbeanz,Amazing Co-op Experience,"The Solo play is there, and still a blast on it's own.
As with most games, this one is really brought to life with a friend or two.
Has A decent amount of content to keep you busy 15+ hours (On Easy)
This has been the best, most immersive RPG experience I've had in VR yet.","Sep 7, 2020 at 7:03 AM",4, 12,
2022-05-28 14:44:58.097576,Majik60,A Few Things Could Be Improved,"I thoroughly enjoyed playing this game, right up to the point where it became insanely difficult for a single player on ""Normal"" mode to continue. The scenery is gorgeous, and most of the encounters are lots of fun. There are just a few things that should be tweaked to make the game more enjoyable:

Difficulty:

I am playing on ""Normal"" difficulty as a single player decked out in top gear, and find some of the encounters to be way too chaotic for one player. I would expect these types of encounters on a much higher difficulty level.

Awkward controls:

The controls for your inventory and weapons take some getting use to. If you open your inventory on your belt, your weapons should be temporarily hidden so you can grab things unencumbered. I've often found myself reaching for something and firing off a shot from my crossbow by accident. Or grabbing with my sword hand and choosing the wrong slot because the sword blocked my view. 

If you are just trying to organize things and move a potion too close to your face while doing so, you will end up unintentionally consuming the potion. 

If you are in your room and standing in front of your storage chest to stash things, and your right side is too close to the trash can mouth, and you pick something up from your inventory with your right hand... say goodby!

Crossbow aim:

There are times when I know my aim was dead on, and the arrow missed my target to the left or right, even at close range. This is very frustrating and happens more often than not. A game breaker IMO.","Aug 26, 2020 at 1:29 AM",4, 19,
2022-05-28 14:44:58.112536,AusseyL,"Good,",The game is good but i feel like it would be better with a mage path and wands or spells as wepons.,"Sep 22, 2020 at 9:00 PM",5, 11,
2022-05-28 14:44:58.128493,Desynchronize,Excellent Co-op fun,"Started playing this game with a friend before the current update.  It was really cool, but nearly unplayable at the time because we'd disconnect constantly, despite our other multiplayer games not having issues.  We ultimately took a break and came back after the content 3 update.  The disconnect issue has been resolved.  We tore through the rest of the game and just wish there was more!  

Very immersive and breathtakingly gorgeous environments.  Challenging, awesome boss fights, and the combat is spot on.  You must slash around blocking weapons and can block incoming attacks, and the bow feels authentic.  I do wish there was another store with better gear or that your homebase store got better gear in as you advanced.  

A side thought: it would be cool if there was a public pub or something you could hang out in.  Maybe play a card game with your collected cards and meet other players who might want to join your party.","Jul 28, 2020 at 2:24 AM",5, 26,
2022-05-28 14:45:01.229805,Glockler,GREAT!!!,"Loved this game!!!

Played solo on normal and had a blast. Loved spinnig around and taking on lots of enimies at once. Great job can't wait for a DLC or a #2.","Sep 23, 2020 at 12:13 PM",5, 2,
2022-05-28 14:45:01.245763,cybernettr,Okay,"The positive ratings for this game heavily lean on multiplayer. If you play single player, it’s less impressive. Repetitive gameplay, limited sound effects, no ability to bash opponents with bows, somewhat wonky thumb stick movement￼, Little atmospheric music, no in game map, limited battle options, lack of sneak ability, and enemies that sometimes seem to run right into—or through you￼—detract from this. I guess I’m spoiled by Skyrim with its huge open world, multitude of combat options, spells, followers and all the rest.￼￼","Aug 17, 2020 at 1:30 PM",2, 1,
2022-05-28 14:45:01.260723,Dizzzie,"Great game, a must-play with friends.","Good job to the devs for the latest chapter. It's more of a real ending now. The first time I beat it with my friend it crashed for him so he didn't get the boss weapon or final chest. We played the new update last night, enjoyed the new level, new enemies (especially the creepy fast crawler guys), and beat it again. This time I let him get the Boss item and we enjoyed the extension of the level after the final boss and of course the new proper ending. Will you continue to update and add more or are you moving onto another title? Also, what's with the new Runic cards?","Jun 26, 2020 at 2:35 AM",5, 7,
2022-05-28 14:45:01.275201,pyeeye,So much fun!,"So immersive!  I love love love this game!   Every time i turn a corner, i literally say wow! out loud.","Aug 30, 2020 at 7:31 AM",5, 1,
2022-05-28 14:45:01.291150,AncientShimarra-S,"Great Game, Get Rid of Naked Monsters!",The game is fantastic but my 8 and 10 year old boys were playing and saw the flying shirtless female monsters. That is NOT appropriate for a T rated game! Change it to male monsters or re-rate to M rating because that is wholly unacceptable when you expect a fun adventure game.,"Aug 10, 2020 at 12:31 AM",2, 0,"Glad you like the game. However, the age rating clearly states this is a game for teens and that it has partial nudity. As developers we follow all the age restriction regulations and have it clearly marked. If you don't agree that this is appropriate for a T for Teens rated games, which your kids are clearly not, then you need to bring it up with the rating boards and the government of your country of residence as they are the ones making these regulations that we follow. I have to reinforce that we as developers DO NOT set the rating ourselves."
2022-05-28 14:45:04.401485,ParadiseDecay,"Just gets better, and better!","CHAPTER 2 Impressions Video with Commentary // Oculus Rift S // GTX 1060 (6GB):
https://www.youtube.com/watch?v=POAGlE7P5HM

My Initial Impressions:
This game just gets better and better with each update. The devs for this title really know how to step up their game.
If you are into Dungeon Crawlers, this is probably one of the best ones out there! And in VR it's even better.
To say this game is still in EARLY ACCESS it's shaping up to be one of the best RPG style games available for VR.
The game oozes quality and attention to detail, it now has a cool story mode, new locations and new enemies. The story starts when a strange alien wizard creature asks you to embark on a perilous journey to seek out items he needs. Like any traditional RPG you'll find loot, armour, items and cool weapons to aid your adventures.

MORE Impressions Videos:
(November 2017) https://www.youtube.com/watch?v=P9Vx2lwgvmg 

(June 2017)  https://www.youtube.com/watch?v=RBDPK_cTmo4","Jun 25, 2020 at 1:48 AM",5, 4,
2022-05-28 14:45:04.418440,BillBoss2008,if you have a fear of spiders dont buy,im sorry but the first mission i couldn't play because the spiders and i have a great fear of spiders. so the fact that they where as big as my foot does not help. everything is great besides that if there were a mode where you can turn off the spiders i would give 5 stars. in boneworks it is not as bad but it is bad but that is because there robots.but i cant give this a good rating until a setting like that is in place.,"Jul 5, 2020 at 9:25 PM",1, 6,
2022-05-28 14:45:04.432402,GRANATA,Best dungeon crawler,"polished gameplay, beautiful dungeon, fun puzzles. opportunity to be an archer (crossbowman) or have fun with a sword. Probably the best in its genre. And most importantly: cooperative multiplayer. (note, both players must be oculus or both steam). Thanks to the developers for the amazing game.","Jun 10, 2020 at 4:10 PM",5, 6,
2022-05-28 14:45:04.447363,CreamCheese1,Anyone want to party up?,I hear that the game is much more fun with some buddies to help you out so if you want to play add me and we can group :),"Jul 6, 2020 at 4:50 AM",5, 3,
2022-05-28 14:45:04.462323,REKAP,Really good game,"fun, sometime difficult, it just need more op stuff and weapons 'cause i have 20 000 and i dunno what to do with it","Jun 27, 2020 at 12:14 AM",4, 2,
2022-05-28 14:45:07.555683,Shifty79,Great Game,I only just bought it and I'm hooked.  Tons of fun in Co Op too. Highly Recommended,"Oct 18, 2020 at 10:54 PM",5, 0,
2022-05-28 14:45:07.571640,Keghog,Very good dungeon crawl.  Love it...,I bought this like 2 years ago and never played it.  Tried it like 2-3 weeks ago and couldn't put it down.  Shooting the bow is a hoot!  Shooting Gobo's and Mushrooms is a good time.  Dungeons are big and immersive.  The monsters will literally scare the heck out of you.  Did I mention spiders :)  Anyhow I am eager to try Multi-player.  Very addictive.  I just wish I knew what to do in the room with the darn puzzle.....Mumbles to self getting shocked is fun....  Good job devs I love it.  Played for like 8 hours straight then couldn't wait til next day.  Wife got pissed so haven't played in a bit.  Clear your schedule if you get started.  Will draw ya in.  Love it.,"Apr 25, 2020 at 3:39 PM",5, 8,"Thanks for the nice review, Keghog. Hope your wife is happy again and let you play ;D"
2022-05-28 14:45:07.587597,randmh1,"Ok graphics, poor controls","The graphics are great and the game promises much, but the controls did not work.  Forward moves in the direction you are pointing the controler, so when you defend with a shield or are cranking the crossbow forward changes direction.   The sword mechanics did not work for me.  It seemed like the sword only randomly hit.  I was swining for all my might and was only hitting about every 3rd swing even when the goblin was right in front of me and not blocking.  If the controls were improved I would definetly want to try again.  I also was missing much of the loot, as  the color of the coins blends in with the cave walls.  I had to retread the same ground multiple times to find all the loot floating in the air.","Aug 19, 2020 at 1:13 PM",2, 0,"You can change the controller options in settings in-game. Don't like controller controlled direction? Choose something else, it is all there :)

Sword mechanics are a velocity based and there is an anti-wiggle system in place. Your sword need to properly exit the enemy mesh before you can hit again. Wildly swinging your sword around will usually lead to exactly what you are describing.

We suggest practicing a bit on the target dummies to get the hang of it."
2022-05-28 14:45:07.603554,yharnam,Motion Sickness,"The intro is just me walking around for 30 minutes.  Sadly, I had to stop playing because the game chooses to use stick motion instead of teleportation.  At least give the option to teleport.","Apr 13, 2020 at 11:15 PM",3, 4,"The option to use teleport is there. Just go into settings and choose your own preferred locomotion. It's all there, always been."
2022-05-28 14:45:07.618021,Atilak,Beautiful and immersive. Incredibly fun,"I rediscovered this game thanks to multiplayer. Lightning fast loading, very nice graphics and excellent AI of the enemies. I hope the updates continue, perhaps adding two more character classes and new levels. Congratulations to the whole team!","Mar 18, 2020 at 9:13 PM",5, 5,
2022-05-28 14:45:10.755259,robert.durham2,Seems like it's dead in developement,this game came out in 2017 and they're boasting 2 major updates since?  The concept is ok but without more to do it's a really short experience,"Apr 3, 2020 at 9:35 PM",1, 6,Definitely not dead in development. The next big update is right around the corner. In between these updates there have been several smaller updates to the game that have improved upon and introduced new features.
2022-05-28 14:45:10.771215,Scheletro,bug,"hi I bought the game on oculus, instead my friend on steem, we can't play in co-op.
I saw that it happened to other players from the posts and they solved the problem by putting the key on the steem so as not to buy the game twice.
can you help me please.

thank you.

if you solve the problem I put 5 stars","Mar 13, 2020 at 3:36 PM",1, 0,
2022-05-28 14:45:10.787172,trkm22,Fatal error solution,"All you need to do in this situation(mostly)is just to wait before you enter your game. You overwork it and it dies. In game? Simply slow down. like i said, it needs time to load all the amaaaaaaazing material, graphics, and sounds. Also for the developers, please update with extra storage backpacks, better swords, crossbows, bows, and daggers, as well as the chest in the study i need to see whats in it plzlzlzlzlzlzzzzzzzz.  Great game, amazing, you are doing very well, encore :).P.S Braccar is very nice, so be nice to him and his company. Respond please devs and tell when update comes out. Have 40k gold and nothing to spend it on. Also approx. how many months/days/hours/years till big said update comes out? 
PS. Why isnt multiplayer working Thor? It might be just because no one is playing but maybe not?","Dec 24, 2019 at 1:47 AM",5, 3,Definitely working. Just few people doing public games when you are playing is my assumption :)
2022-05-28 14:45:10.802133,Brauks,This game is great,"This game is really cool. Graphics, sound, items, loot, boss, how we use items etc.. It's nicely immersive and a lot of things are well done !","Jan 16, 2020 at 7:01 AM",5, 2,
2022-05-28 14:45:10.818090,Sokart1976,Great feedback and great game,"Hi,

You are quicker than oculus support team ;-)
I will test as soos as will come back home and give feed back to yourself.
Thank you so much, i really appreciatte the effort.
Regards,
Oscar

UPDATE
Thank you so much for the info and also your effort for making things works again, unfortunately the problrm still persist but I am so 
glad that Oculus focus on the resolution :-)","Dec 19, 2019 at 3:54 PM",5, 1,"Thank you so much Oscar! Best regards, Thor. UPDATE: Seems like Oculus have started reacting as it is killing performance for a lot of games across the board. Here's a link to a post where Oculus Support is also involved, it mentions an opt-in for PTC to receive a possible fix (doesn't work for everyone): ""https://www.reddit.com/r/oculus/comments/eahj7a/are_we_gonna_get_fix_for_the_stutter_issues_from/"""
2022-05-28 14:45:13.905457,justalexisfine,If only multiplayer worked well...,"The game itself is gorgeous. Graphics and set design are incredible for a VR game. Combat mechanics are pretty good, melee combat is a bit futzy, enemies frequently move through me to my other side, so that gets a little troublesome and breaks immersion. I'm more of a ranged fighter anyway, though, so not too mad at that.

The real bummer here is that the multiplayer is and has been pretty much unusable for as long as I've been playing. Apparently this has something to do with the Oculus matchmaking, according to a previous post I saw from the developers. Hopefully it eventually gets resolved... That's all I really wanted from this game. I'm not looking for more solo gaming experiences, I'm looking ways to have fun with my friends.

Now, when the multiplayer HAS worked, it's been a blast. The enemies scale well and it's great fun to shoot and slash your way through a boss fight with your friends.

It's my understanding that this game is made by a studio that is essentially just five people going it on their own, so what they've achieved knowing that is quite remarkable, I just hope that these issues can get resolved so that I can enjoy the experience I thought I was paying for when I bought it.

TL;DR - if you want a solo dungeon crawler, this is for you. If you want coop play, I'd wait until things progress to full release, if it ever gets there (I bought this game like a year ago, and there doesn't seem to be any progress.)","Oct 10, 2019 at 2:31 AM",4, 16,The multiplayer issue should have been addressed now :)
2022-05-28 14:45:13.921414,Mafiki,"LOVE it, controls could be better","I think this game is absolutely fantastic. I've been playing for a few days with my friend and we've been having a blast. 

On day 1 we played and I got incredibly motion sick. The biggest issue was whenever I was facing away from my sensors in real life, my bow ""shorted out"" and wouldn't get tracked properly, causing me to switch to the analog stick in a panic to avoid death, which I much prefer the teleport. 

Once I set up my 3rd sensor for 360 play, it was much better. However I think the controller menu is a bit confusing and not all the settings are explained well. I REALLY wish more games would adopt the control style of Robo-Recall, specifically teleporting, but aiming the direction you will face when you land with the analog stick. I have found that to be the least nauseating VR control style for movement.","Dec 5, 2019 at 1:55 AM",4, 1,"Hi Mafiki, thanks for your review. We released another update today which might address your concerns about the confusing controller menu."
2022-05-28 14:45:13.936374,EpicSith2020,great game,fix multiplayer and thats the oly issues oh and mabye a map of the dungon and were to go,"Dec 30, 2019 at 1:05 AM",5, 1,
2022-05-28 14:45:13.951334,Yannick93,good game but coop hard to find,i like this game but can't see any community on it.... you can ad me if you want to play :),"Jan 7, 2020 at 11:02 PM",4, 1,
2022-05-28 14:45:13.967291,nightfire621,Coop gameplay Review,"I have put in many hours into this game playing cooperatively with either my wife or my 7 yr old daughther. That's right 7 yr old, she loves this game and I'll gladly tell you why. 
My daughter loves the fact that she can play it with me, not me telling her step by step what to do but just being beside her and talking about what we saw or just did as a team. She loves the control. She started off as an  archer but really took to useing the dagger and shield. The controlls seem natual to her once she understood wiggling did nothing. Collecting loot was by far the biggest attraction. She got richer the more she played and with that she was able to buy her own stuff, and that was a new experience for her. As her coop partner and father I was amazed how she reacted to each enemy, brave and at some times tictical. She would tell me to take on the archers and she'll handle sword wielding enemies and dogs. She understood the enemies an approced them as types, arrow types, sword types, plant types and dogs (they're wolves by she calls them dogs.) Now there is one character later part of the game that is topless and I was prepaired to have a discussion with her about nudity in games but to my naive daughter she just saw a flying enemy and proceeded to shoot her down, a conversation for another day. 
      Setting up coop was also easy for her as well. She had two choices host or join then we always chose friends to avoid any unwelcome guest. The only time we had joining issues was when my character was way overpower compaired to hers. In that case I didn't mind starting a new character, the game was fun and fair. If there is one thing I do wish the developers would add (other than the other classes) is aggro system. That way she can continue to slash away at ""dogs"" while I can assist with my arrows and not steal her opponent. Good Job so far divs, can't wait for new content.","Aug 28, 2019 at 4:33 AM",5, 35,
2022-05-28 14:45:17.093125,Ksword5,innapropiate,we where having fun playing this game when we came across the the harpeas and we saw they were showing their tops naked. we do not recomend this game if you are not a pervert and whant to see nude monsters in a game. we cant play this game any more thats all i whant to say,"Jan 6, 2020 at 8:18 AM",1, 3,"Sorry to hear you feel this way. The ESRB rating have ""Partial Nudity"" in the descriptor."
2022-05-28 14:45:17.109083,N4tty33,:),Yeah its pretty good :),"Dec 23, 2019 at 1:02 AM",5, 1,
2022-05-28 14:45:17.125041,FoxyWaifu,Problems here and there,"I'll start out with the good things:
1. Good Graphics
2. Great Voices
3. Beautiful Armor and Jewelry
4. Great Story Line
Bad things that need a'fixin:
1. Bow gets stuck on other players bow then random shots
2. Enemies are unbearably hard to kill despite being on easy mode
3. Archery Aim is horrible. Takes at least 30 shots to kill one little minion
DEVELOPERS!
Please fix the bow problem. Please make enemies easier to kill, especially if we are playing it on easy mode.
Please fix aim problem. 
Problems Game has caused:
Arm and back issues due to the amount of rapid firing on the archery part due to lack of enemies actually dying due to lack of aim and high HP for enemies.","Sep 4, 2019 at 11:09 AM",3, 13,
2022-05-28 14:45:17.140998,crombies,,It's a good game. The game looks really good but I wish the AI were a little better at fighting. It also needs more people playing but it's just a early access game right now.,"Nov 9, 2019 at 11:58 AM",5, 1,
