scrapping_date,review_author,review_title,one_reviews_text,review_date,review_rating,review_helpful,review_feedback
2022-05-28 14:45:17.156954,H3rm3s,Great game... except multiplayer,"I would love to give this game 5 stars, but unfortunately there are a couple of issues that need fixing. First, I have never been able to join a multiplayer game. I have tried hosting my own and joining another game, but each time I try to join it says ""No game found"". I have tried at various times of the day thinking that might be the issue, but no luck. Second, once you beat the game, you should be allowed to keep your gear and try again at a higher difficulty level. I hate earning / buying gear just to have to start over if I play again. 3rd, you can't change the difficulty when hosting your own game (not that anyone's ever joined a game I try to host). That should be a option. Overall, in single player, the game was a blast. The graphics were great, the controls were intuitive, and the immersion was flawless. The problem is, I bought this game because I was looking for a great multi-player dungeon crawler.","Aug 23, 2019 at 3:42 AM",4, 7,
2022-05-28 14:45:20.246858,Oldbolt,,"I recently bought VR for a game I'd been playing in Pancake mode for some time.  I was amazed at the coolness of VR and I thought the game I bought it for was pretty good, until I purchased this game.  I am in awe at the talent and minute details that has gone in to making this game.  To say it is in 'Early Access' brings shame to other developers who claim their game is in 'Early Access.' It is so well polished from what little I have seen. I had to write a review and give it 5 stars so other players on the fence don't miss out on this game at the bargain price it is being sold for at the moment.  Well done, Sirs/Madams, on a gorgeous VR creation and thank you.","Sep 3, 2019 at 4:23 AM",5, 1,
2022-05-28 14:45:20.261818,MakiGei,a couple questions and some new ideas,"First of all let me say this game is AMAZING, especially for an early access game, its so beautiful and well done.
1: My main question is about the third dungeon, is that going to be the whole thing? i assumed not but since you get the ""eye of the Dwarves"" after that fight it seems like the end. 
2: Also will you be adding some form of aim assist to thie game? i can land my shots most of the time but with really high up enemies its hard to hit them without missing 100 times.

As for my ideas, 
3: it would be great if you could give arcgers the ability to turn off the dagger spin if we want to because there have been many fights where its either goten me killed or almost gotten me killed because i wasnt doing damage
4: I love the archer and the warrior but theres a lot of talk about magic in the game but i dont see a mage? is a third class coming? If not i think it would be an awesome idea. Perhaps the mage's melee weapon would be a staff, and the ranged some kind of wand or gauntlet that equips over the gloves. as with most games i feel like the mage could be more versatile and powerful but perhaps with lower health and not as good armor. In order to add this versatility i speak of, you could utilize both trigger buttons (on the same controller) for different attacks, maybe one as a fireball of some kind for long range that behaves like an arrow, and the other as a close range area lightning attack or poison (because of the fungus enemies).
itd be great if you could take my questions and ideas into consideration :)","Jul 23, 2019 at 5:08 AM",5, 19,
2022-05-28 14:45:20.277775,MaverickODonovan,Multiplayer and Contacting Devs...,"I've tried to connect to other players, as I've seen is a common issue with other reviewers, and have been unable to connect to anyone. I've tried at different points of the day and week and had no sucess. A few minutes ago I went to the website provided above to attempt to contact the Devs to see if I had something wrong in my settings... but when I hit the ""Contact Us"" and any other option on the bottom of the page, I was sent to a page that was NOT AT ALL RELATED to this game, that was also in a different language.

I'm going to be honest here and say that I've only gotten past the tutorial and not gone into the main of the game YET because of the inability to connect to other players. This is the reason I'm giving a 3 star and not more.

*UPDATED*
Braccar, I can't seem to add you without a ""friend code""... my friend code is: 83200299","Aug 23, 2019 at 10:48 AM",3, 0,UPDATE: With the latest updates this should not be an issue anymore.
2022-05-28 14:45:20.293733,adam.temple.353,Unplayable on Oculus rift s,"losses tracking bad, can't aim for bow and the swords fly around. 
Wish I could get a refund but I bought it in a pack","Sep 13, 2019 at 10:51 PM",1, 2,Sorry to hear about your troubles. We have just updated to version 0.8.7.1 which includes the latest platform SDK. This should take care of the issues you were experiencing.
2022-05-28 14:45:20.309690,Ulfdrak,Good game with a few minor annoyances,"The game is pretty fun for the most part. However, using the daggers as an Archer seems to have some hit detection issues. While dual wielding the daggers I noticed that quite a lot of my hits wouldn’t register when using both weapons simultaneously. Now I’m not sure if this is intended (which kind of is an immersion breaker if you are trading defense for more offense) but it’s very annoying and have found myself having to work harder to get a kill than when using sword and shield. I restarted the game as a warrior and have had a much easier time using sword and shield. Also, the crossbow is much less tiring than just shooting a barrage of arrows.","Aug 10, 2019 at 7:41 PM",4, 0,
2022-05-28 14:45:23.396045,System76,Fantastic Game,"Standard dungeon crawler game, very well executed. The developers gave great attention to detail while making this game, and it shows. 

I'm rating it 5 stars, but there are a couple of things which could be improved (it's still early access, so we will probably see improvments in the future), namely the combat. Your options for combat are ""shoot enemy with arrow"" or ""swing weapon at enemy."" It would be nice to be able to use magic, or buff your weapon, but even with the limited combat options the fighting is incredibly fun.

(Note: I am only about halfway through with my first character, I just HAD to write a 5 star review because its so dang good).","Aug 9, 2019 at 8:08 AM",5, 0,
2022-05-28 14:45:23.412508,grem99,me and my brother enjoy it but,so me and my brother love playing this game together i am a tanky warrior and he's an archter in the back i have the rift s and he has the rift he has no problems with anything i cant use anything that shoots projectiles in this game not the crossbow or the long bow when i try to the tracking freaks out and i know this is just an issue with this game becuase i have no problem in outher games,"Aug 2, 2019 at 7:36 AM",3, 1,"UPDATE: Would be interesting to know if our updates have taken care of your tracking issue :) OLD ANSWER: We will be coming out with a minor update soon, hopefully that will help with the tracking issue you are experiencing."
2022-05-28 14:45:23.430461,Baker1kenobi,Possibly the best game in VR ATM!,"I've played dozens and dozens of games in VR and I'm always looking for the one that keeps me captivated and allows me to enjoy it with friends. Karnage Chronicles is that game. As someone who played World of Warcraft in the early days pretty avidly I find myself mesmerized in the dungeons in awe of the detail the devs have included. At first I thought this was going to a hack n slash through waves of mobs to the quick end. Boy was I wrong. This game is full of puzzles and tactical approaches that continue to wow me. I can't wait to see what else they add. I'm hoping for additional classes like a mage and a healer. I would pay over and over again for this game if they add DLC content and expansion packs.  The multiplayer has been a blast with friends. We've had hours of entertainment. 

It is early access so of course there are quirks here and there but the devs are engaged and none of it is a show stopper whatsoever. Some things I'd like to see implemented are:

Ability to turn off friendly fire - I know it adds to the realism but 3 or 4 guys in tight quarters swinging and launching arrows wildly just trying to survive ends up in a lot of unintentional team kills. 

Ability to turn off and/or control volume for in-game voice chat.  

Ability to put all weapons away with a button. - Currently I use one of my 3 weapon ""loadouts"" with nothing equipped to accomplish this but I'd rather not have to sacrifice those slots. It is much easier to take potions and manage inventory with empty hands so something needs to be done here. 

Ability to shied bash - this could inflict small damage or at least knock back enemies. 

I think this might be coming based on the satchel in the store with the ""coming soon"" label but we need the ability to get a bigger inventory. 

The archer could use just a little work. - sometimes with an arrow drawn back if I strafe to avoid an incoming arrow the aiming gets cocked to the side and you cannot re-center it until you release that arrow.","Aug 2, 2019 at 9:20 AM",5, 5,
2022-05-28 14:45:23.447415,aolshove,Was fun.. then became physically painful,"Update:  I think this app is dead.  No word of updates for months and their web site is dead.

Fix the archer.  The warrior's crossbow, with its ability to fire 5 shots while holding one position and ""zeroing"" in on the target with subsequent shots, made it superior to the archer's ability to consistently hit his/her target between shots.  The archer has to draw the bow for every shot which, when fatigued after about an hour or two of twanging the bow, makes it impossible to keep aim and string-pull consistent between shots.  If the developer's goal was to make it realistically difficult to be an archer at the expense of the enjoyment of the class, then mission accomplished.  It's supposed to be FUN, not fatiguing and frustrating.","Dec 6, 2019 at 2:29 AM",2, 0,"Not dead, just working on a crucial engine upgrade as communicated here and there. This is finally done and as a result we have released a small update today, bringing the Oculus Store version on par with the Steam version."
2022-05-28 14:45:23.465367,Psychobabbler95,A Dungeon Crawler's Dream,"Grab your sword and shield! Grab your bow and arrows! Prepare to delve into the cavernous depths of Karnage Chronicles! 

The immersion of the environment and the visceral combat are the best aspects of this game. There are many other great things about KC that I won't go into. It's best you experience them for yourself. I LOVE the sword combat. You can parry, block, riposte, slash and stab. So can your opponent. The enemy AI is very good. As a warrior, the only one of the two classes I've played so far, you have a sword and shield and a crossbow. Most enemies are smart enough to dodge and/or block your ranged attacks, so no matter how well you aim, a headshot isn't always guaranteed.

OK. I'd like to write more praise, but I want to wrap up this review and get back to playing! Here's my nitpick items: Only two classes, and VERY limited inventory space. I'm holding onto hope the developers will add a storage chest, or backpack expansions... and maybe a spell caster class? 

In summary, this game is great! One of the best high fantasy VR games I've played. Thank you to the creators of this wonderful work of art.","Jul 24, 2019 at 2:37 PM",4, 0,Storage Chest and additional backpack added. Things put in your chest is shared between all your characters.
2022-05-28 14:45:26.563202,braemear,Best Multiplayer VR Game Yet,So far I have been greatly disappointed in rift and multiplayer. Either the graphics look like a five year old made them or there are problems with the networking aspect. This game is the best multiplayer game I have played to date and should be the bar that all games rise to. The graphics are epic and the game in comparision to other vr games is HUGE. I wish there could be more games like this one. I wish Karnage would make a MMORPG out of this game or add a magician and healer. Tons of fun!!!!,"Jul 7, 2019 at 7:57 AM",5, 5,
2022-05-28 14:45:26.580158,superpozition,"If I could give this 1k stars, I would","- This game is so unbelievably mind blowing, I don’t even have the words to describe it. I have never experienced a more immersive game in my entire life (not just VR, but ever)
- Also, unlike pretty much every VR game on the planet, the graphics are AAA. Absolutely stunning. 
- there was so much thought and detail put into this game, you will always be asking yourself “what else can I do?”. For example, if an arrow gets stuck in you, you physically can pull it out and throw it back at the enemy. Bravo devs. Seriously, bravo. You can physically hand other players anything in your inventory, and so much more. 

Conclusion: I just (accidentally) played 6 hrs of this game and didn’t realize it. You can play alone, but it’s way more fun with one more person due to what you can do. But to close the loop, this game will pummel everything else out there. It has set the bar so high for VR that I truly believe it’s going to make a real impact on VR devs; no more half a**ing it. No more low quality graphics. This is setting the stage for VR forever to come. Bring it on.

Response to the devs response below: DONT even worry about it. I was just learning things. Had to get a handle on it. All you need to do is add labels below the inventory bubbles so people have some affordance on what each one does. But once I learned it, I didn’t even care. Also, add a persistent tooltip above the relevant bubbles with an accelerator saying “press (B) to toggle weapons”. Small changes, big impact. But omg, doesn’t even matter. This game. Woo!!! If you guys don’t swim in VR gaming awards this year, I will be surprised.","Jul 20, 2019 at 7:46 AM",5, 0,Thanks for the review! The UX upgrade is all in the plans for a future update. Wish we could have done it already but we are only 3 friends making Karnage together so things tend to take a bit more time than for bigger teams :) but it's coming!
2022-05-28 14:45:26.596114,fastfang,Multiplayer does not work!,Gave me a headache  trying to play with friends..,"Sep 2, 2019 at 1:23 PM",1, 0,Since you say multiplayer does not work we assume you were not able to connect to your friend's game. With the latest update this should be fixed.
2022-05-28 14:45:26.613069,Fainie,Could not find any games,"I really like this game (only 3 stars because of issues below, would be five without the issues ;D), but have a few issues..
When I try to join any games (friend or public) it just say: could not find any games. Is there a port to be opened in my router? Other games work without hassle online. Does it support cross-platform? I have oculus version and my friend has Steam. :)","Jul 12, 2019 at 3:36 AM",3, 0,Karnage does not yet support cross-platform play.
2022-05-28 14:45:26.630023,ubelsteiner,Best co-op experience,"I don't normally bother with reviews, but this game is amazing.  It's truly impressive due to the size of the team working on it, and I really hope it's success enables them to add more content or create new games in the near future!  This game does so many thing right, and everything from shooting a bow to grabbing an apple out of your inventory and shoving it into your partners face (to heal them) just feels natural.  From the moment you launch the game, everything about the interface/controls just makes sense and works well.  Played through on hard difficulty in co-op mode with a friend and we had a blast!  The only bad part about the game is that it ends!  It ended sooner than I thought, because the third level is kinda short.  But we got a lot of enjoyable hours out of it, and plan to play through it again on the ""impossible"" difficulty level.","Jul 1, 2019 at 10:23 PM",5, 4,"Thank you for your really nice review. We are working on an upgrade of the third level, making it into a proper sized dungeon crawl with all that entails :)"
2022-05-28 14:45:29.697984,Cadwalader,Oculus is the red headed step child?,"I've tried repeatedly reaching out to the Karnage Chronicles developers with absolutely NO response whatsoever. Here's the rub: Karnage Chronicles on Oculus Store is AWFUL if you want to play multiplayer. Constant crashes and dumps. You'll be in restart/reconfig hell. But there is good news! The developers hunted down those multiplayer bugs and resolved them... in the Steam version of their game. On Oculus we're several versions behind with no solution in sight. At this point we have to assume that the Oculus store version has been abandoned. fact 1, do NOT buy this game from the Oculus store. fact 2, do you really want to spend money on a game which the developers simply abandon if inconvenient? I'm absolutely shocked to see a two tiered system, a Steam version and an Oculus version. It has been MONTHS since they fixed the multiplayer issues on Steam. Shame - shame - shame.","Jul 1, 2019 at 11:02 PM",1, 2,"UPDATE: The issues you have been experiencing should now be a thing of the past with the latest updates. OLD ANSWER: Hi Catwalader, sorry for the inconvenience, what you are experiencing doesn't happen to everyone. Where and when have you tried reaching out to us? NO, the Oculus Store version is NOT ABONDENED. The fix for the crashes you are experiencing cannot be deployed to Oculus Store due to a bug that was introduced in the Oculus Multiplayer Matchmaking and VOIP backend that our current engine version is using. This bug was introduced by Oculus themselves and they haven't fixed it, so we are waiting for an engine version which lets us circumvent the issue. Once we have that we will fix it and deploy a new version. And don't just look at the number of versions, on Steam new versions sometimes comes out because on Steam we have to support more than just one VR HMD, meaning they might only contain new VR HMD support. Please contact me on Steam and I will try to help you with a temporary fix, add Braccar."
2022-05-28 14:45:29.713942,KawaiiGoofyGoober,So much fun dude,Grab a friend and enjoy this gem. OMG. I had so much fun exploring and probably the most fun and immersive VR game I have ever played. It is gorgeous. I hope more classes come out like a mage class. It would be dope!,"Jul 21, 2019 at 9:17 AM",5, 0,
2022-05-28 14:45:29.729899,Maxw311,great game but...,the teen rating does not fit one of the enimes on the game the half woman half bird monster has no top and it is reviling the honkers,"Aug 5, 2019 at 4:30 AM",2, 0,"That was a good feedback, Max. We just checked this with the rating board by submitting a new rating request. We received an answer where they keep the current Teen rating as harpies without a top is not considered enough to push it above Teen rating, but ""partial nudity"" will be added to the descriptor. Thanks again for pointing it out."
2022-05-28 14:45:29.746853,JohnnyGun,Game is awesome!,"There is nothing wrong with this game! This game works great! 5 stars all the way. The lack of knowledge on how to maintian your computers is the problem. Man use google, youtube to learn how to update your computers. Dont go post that this game is broken when its Not its YOU! hahah. Will you have an Oculus Quest version come out?","Jun 30, 2019 at 1:51 AM",5, 1,"We would love to release Karnage on Oculus Quest. However, this requires a special publishing approval from Oculus which they don't seem keen on giving."
2022-05-28 14:45:29.762811,Null_Pointer,"Small, but great","It's obvious that the best VR RPG  is Skyrim and until now, it seemed like it's the only good one. Until now! 
Karnage is a small but really well executed game. Graphics are really nice, mysterious, fairy tail like, weapons few, but feel nice when using them. I especially like the fact that you actually have to put some effort into cutting, otherwise you won't do damage.
Voice acting contributes to the atmosphere and there are both ways of moving implemented (direct and teleport). Honestly, the only thing that kinda bothers me is the lack of visible body. Just hands. I do understand that kinematic is a hard thing to do so I don’t hold it against the devs, but dammm, it would contribute to overall feel of the game so much! 
I do highly recommend this game. Worth a price and fun.","Jun 22, 2019 at 2:01 AM",5, 3,
2022-05-28 14:45:32.867164,JackJC95,"Promising, but some frustrating issues","Pros:
- Melee combat is quite satisfying when it works, damage being based off the velocity of your swing and the hit location makes for some satisfying, somewhat strategic fights.
- Archery is solid, took some getting used to but by the final boss fight I was pinging off arrows without even looking, that learning curve is one of my favourite parts about the game.
- The level design often forces you to think strategically about how to approach a room which, combined with the great atmosphere (sound design is excellent) and consistently themed areas, makes for a tense immersive experience.
- Smooth movement and turning was really well done, I never got any motion sickness.

Cons:
- Melee combat does not always work as intended, sometimes sword swings will not register which can be devastating when surrounded by enemies. Parrying can also be a bit inconsistent, enemy sword swings would sometimes look like they went through my shield, though I'm 6'4"" so my height may have played a part.
- Pacing is really bad at times, the 2nd dungeon was far too long (especially compared to the others) and certain rooms (I'm looking at you harpy bridge) were just painful and time consuming instead of challenging. Also, I felt like my gear barely improved throughout the first dungeon and most of the second, then I suddenly received an influx of much better gear, and then nothing for the rest of the game. A more steady flow of gear improvements would have been nice.
- The game did crash once when going through a portal. Only happened once and didn't ruin the game for me but still worth mentioning, particularly as I have seen others say the same.

Overall:
A fun fantasy experience with mostly satisfying combat and RPG mechanics, hampered by a few frustrating issues. Length is okay at 5 hours, would prefer more (obviously) and it looks like more may be coming based on a closed off path in the dungeon portals room.","Jun 21, 2019 at 2:40 AM",4, 3,
2022-05-28 14:45:32.884118,MykoGaming,Fatal Error (solved),"This game is in my opinion freakin awesome! I love it, it feels so good, everything perfect.

Except for the fact, that I can not play it anymore ... I am constantly getting fatal errors resulting in a game crash. This happens either at the very beginning, when I select my game and want to go through the portal. Or it happens when I want to enter a dungeon. Today I tried to play for 10 min and got 12 fatal errors :(  Unplayable!

My Setup: nvidia 1080 ti, i7-8700k, 32gb ram, rift s

If you can answer my post, devs, I can delet it! I just want to know, whether you are working on that issue?! I want to play this game, its so much fun!

Edit: I talked to the devs via Steam! Really friendly! He gave me some suggestions in order to prevent it, but as soon as Oculus lets the fix deploy it, the game is siimply fantastic. So far my best experience!","Jun 26, 2019 at 6:50 PM",5, 0,"Hi MykoGaming, so sorry to hear you are having this issue! We know about this one, it is a deeply embedded render issue in the Unreal Engine version that you are currently running on. We do have a fix for it, but we cannot deploy it yet to the Oculus Store. The reason for this is that the engine version that has the fix, which we have switched to has a conflict with Oculus Store Multiplayer stuff, resulting in connection losses and unplayable co-op sessions. It is really frustrating for us as well. We will deploy the fix as soon as we can, we just don't know when it will be possible. Contact me on Steam and I will try to help you getting past the error. Look for Braccar. You could also try rolling back your nvidia driver if you have recently updated, it might help a little."
2022-05-28 14:45:32.900076,andach,Realistic,"When I played this game, I was so immersed and it felt so real that when I first saw the spiders in the first dungeon, I forgot I was playing and I was afraid for my life. I recommend this game to almost everybody who likes rpg and wants to take it to the next level by playing in vr. 
P.S the only problem I have with this game is the long dialog (You can skip though).","Jun 18, 2019 at 3:25 AM",5, 0,
2022-05-28 14:45:32.916034,RichardTB,Best game ever.,Ive beaten game on all levels. Beautiful graphics. Devs please get rid of the empty bottle in the final storage. You cant sell it or even drop it. If there is a reason for the bottle being there please tell me what it is. Sometimes the game crashes when i go through a portal. When will you update with more gameplay?,"Jun 6, 2019 at 12:53 AM",5, 8,
2022-05-28 14:45:32.931990,messina86,Sunk some time into this one.,Solid start! Can’t wait for this game to develop fully.,"Aug 1, 2019 at 7:02 AM",5, 0,
2022-05-28 14:45:36.037328,Lemicks,Fantastic,What a blast to play!,"Aug 2, 2019 at 3:30 PM",5, 0,
2022-05-28 14:45:36.054284,GreenSquid772,Good stuff!,"This title is in Early Access, so it needs more content and some polishing. However, even in its current state it’s still a really fun and satisfying dungeon crawler! There is a great foundation here and I can't wait to see what the developers add.","May 22, 2019 at 2:02 PM",4, 3,
