scrapping_date,review_author,review_title,one_reviews_text,review_date,review_rating,review_helpful,review_feedback
2022-05-28 14:45:36.072235,Josche,"Can't continue on, Fatal Error crashes","I reached a point that I am taking a boat. As it tried to load up into the next zone, the game crashes with a fatal error. Now I can't even load back up into that save point :/","Jun 22, 2019 at 5:07 AM",2, 1,"UPDATE: With the latest update the crashes on zoning will no longer happen. OLD ANSWER: Hi Josche, please contact me on Steam since there isn't anyway for us to have a chat here. Look for Braccar, I will try to help you sort this out in a good way."
2022-05-28 14:45:36.087195,Madcat81,The way VR should be!,"This game is a pure blast! The level of detail is nothing short of amazing. You can tell it was designed for VR by people who actually play VR.

My wife and I play this together and enjoy every moment. It is by far our #1 VR game to date.

Few things I would love to see improved / added:
1. Bow offset option.
2. Quiver!!
3. More vendors throughout the dungeons.
4. Ability to toggle off/on friendly fire – my wife keeps “accidently” smacking me with her weapon.
5. Mage class!

Bugs to note:
1. Sometimes enemies just walk through you, while hitting you, and keep walking. Walking back makes them turn around, face away from you and somehow still hit you.
2. Getting rid of “important items” – I have 3 of these in bag, no clue what / where to use them and can’t drop them.

Bottom line – I have quite a few games in my library and tried quite a few others. When it comes to content, quality and plain fun – Karnage takes the crown. Easily.

If you have someone to play coop with – stop waiting and staring at reviews – get it!","Mar 29, 2019 at 10:30 AM",5, 17,
2022-05-28 14:45:36.104150,myrrh404,"High quality fun, multiplayer works!","Excellent graphics and audio, and the multiplayer actually works! Nice game.","Jun 26, 2019 at 10:14 AM",5, 1,
2022-05-28 14:45:39.181522,meatballsaucey,Great Game,This dungeon crawler is awesome. The first dungeon allows you to learn the mechanics and level up your gear. The second dungeon has a steep difficulty curve and requires high level gear and feels 2x bigger than the first and adds puzzles to the mix. The third and final dungeon is small but is EPIC!!! Already worth the price of admission and more is being developed. Buy this game.,"Apr 1, 2019 at 6:28 AM",5, 6,
2022-05-28 14:45:39.197479,thejamesshow00,,such a great dungeon crawl and coop to boot!,"Jun 22, 2019 at 4:53 AM",5, 2,
2022-05-28 14:45:39.214434,CuisineTournante,I hope the devs will read,"First of all, I like this game ! I don't comment often. There is so much potential, good atmosphere, spooky, items, etc. The multiplayer is a mess, I assume it will be fixed soon. The main issues I had was : 
- I was stuck at a checkpoint, dying again and again. We need a way to go back to  your room but at a cost, like you lost your money and the only way to get it back is to go back where you were (a bit like dark souls)
- The item is the only stats you have. It would be fun to have a level that increase your damage, health, so that way you could farm to level up and become stronger. Even spells, heals, boost, stealth, etc.
-","Apr 25, 2019 at 5:20 AM",4, 1,Thanks for the feedback! Player progression is something we plan on having :)
2022-05-28 14:45:39.231389,RuneSR2,Awesome experience - not to be missed!,"I just tried the game and I was greatly surprised. This game doesn't really feel like Early Access, I've seen many v. 1.0+ games with less polish than this game.
Also this is UE4, I'm convinced ASW 2.0 is working. There're no video settings in-game, so super sampling is the only option (Oculus Tray Tool). Had to switch to controller-oriented locomotion and then back to HMD-directed to get the latter working, but then controls worked perfectly. Graphics are great, although textures could be better - textures aren't Mage's Tale or Lone Echo quality, but probably more like Torn (slightly PSVR-ish). Some textures are awesome though - try to take a close look at your weapons. Water looks great, I even saw a fish in a lake etc. Levels of polys are nice too - at least better than unmodded Skyrim ;-) 
I'm a chicken in VR, no way I'll play as the usual warrior and having to stand face to face with all sort of horrible creatures, so I went for the bow :-) 
The lighting and atmosphere are amazing, but I've only played the game for about 1 hour. Using super sampling 2.0 and a heavily oc'ed GTX 1080 I mostly got 90 fps, ok maybe 60 to 70 % of the time, but unless I waved my hands I didn't notice if fps were slightly lower than 90. But do put the belt away when you're no using it, it may be the difference between 87 or 91 fps ;-)","Apr 22, 2019 at 12:30 AM",5, 1,
2022-05-28 14:45:39.247346,mindcola,Our Co-op Game of Choice,"This game is the golden standard in regards to how a VR game should be made (graphics, UI) and how co-op VR can be both fun and approachable for VR neophyte and master alike.  Sense of presence in the world is high, colors are vibrant, and the sounds crisp.  I would happily pay for multiple episodic co-op adventures that use this game engine.  I would happily pay for DLC additions to Karnage that give my wife and I more adventures - new maps, new classes, etc.  This game is my favorite non-exercise app for the Rift!","Jul 8, 2019 at 6:52 AM",5, 0,
2022-05-28 14:45:42.358639,DeefaDogs,Crashes alot.,"So I bought this while it was on sale because I wanted to play with others once I was somewhat good at it, but it keeps crashing, I hope it will be fixed. Other than that the game plays nicely though it would be nice to have other options for combat styles, for example as a warrior you could choose to wield a spear and a rectangular shield like roman soldiers.","Mar 23, 2019 at 2:42 AM",3, 3,"Hi DeefaDogs, apologies for the crashes. With the latest update this will no longer happen."
2022-05-28 14:45:42.380580,adko111,A very well made and entertaining game.,Very well made with atmospheric areas and good AI.  Got to say I enjoyed the whole experience.,"May 26, 2019 at 1:24 AM",5, 1,
2022-05-28 14:45:42.398040,Bucky_Warp,Love the mechanics but not the errors,"I love this game, the graphics, the mechanics, everything. However, only a few hours in I keep getting a lowlevelfatalerror and fatal error forcing me to restart the game. I can't even get back into the dungeons. I really hope that this is fixed soon because I want to see everything this game has to offer.","Apr 4, 2019 at 2:21 PM",3, 0,"Hi Bucky_Warp, with the latest updates these errors will no longer happen."
2022-05-28 14:45:42.414994,Nonebetter,"Great dungeon crawl, maybe best VR game?","This game is great, would give more stars if I could. its the real deal...
Not a fan of VR archery? well then play the warrior, I have done both and they are both super fun and have ways to win on any difficulty setting. Both classes have both ranged and melee.
Puzzles, traps, boss fights, cool story, this game has it all, and everything is easily playable and the difficulty settings make it even more fun. cant wait to see what they add too.
Like playing a specific level? you can reset them and go back with better gear.","Mar 26, 2019 at 6:52 AM",5, 3,
2022-05-28 14:45:42.430952,KingGelbin,Meh,"I played as a archer and as a warrior and overall the experience was disappointing. The graphics are nice and that's the initial attraction. I bought the game to join others but NOBODY ELSE IS PLAYING!!! When playing as a warrior you waste so many swings of your sword to do no damage. You basically have to sit there and wait for your target to attack you, you parry and then you swing your sword doing damage, etc, etc, etc. This game was yet another waste of money. I don't understand where all the high ratings are coming from? This game is seriously weak.","Mar 21, 2019 at 7:28 AM",2, 3,
2022-05-28 14:45:45.501326,JeremyC85,OK I'm Impressed!,"I've played now for almost 3 hours and color me impressed! Had decent hopes for this game but around every turn my jaw was on the ground with the level of detail and polish. This game was made for VR from the ground up. Any fan of dungeon crawlers, RPG's or action games NEEDS to try this out. Reminds me of Mage's Tale but I'll reserve comparisons until I've beaten it. 4.5/5

UPDATE: Beat the game twice now, and I have to say its one of my favorite VR games ever. If you're on the fence about this one, BUY IT!","Mar 13, 2019 at 3:15 PM",5, 5,
2022-05-28 14:45:45.517788,theemarkhumenik,Love this game.,"I have many hours into it. Fun dungeon crawler. I was a bit disappointed  today ad I hit a level where I get on a boat and click navigate. Kind of like a Disney ride. Went through the level up door... and got the hourglass from hell. Never stopped. System crash. Now... no more Karnage? But is a blast. Never tried multiplayer... but guessing that'd be a blast too.
I can't wait for the hourglass to stop. :)","Mar 17, 2019 at 10:34 PM",5, 2,
2022-05-28 14:45:45.533745,GuitarzanWIZ,Get it. Period.,"I was super impressed with this game when I first got it, and after playing for a while, and still. I thought after I had completed the game that I would just pop in occasionally and beat it again and get no surprizes. Not the case -they are actively adding to it. I poped in a couple of weeks ago to play with my brother and it was like having a whole new game...because they added a whole new section. I also felt the need to say, the game was incredible before they improved it. The last update really upped the antee. It went from awesome to awesome squared. Can't wait to see what's coming.

Update: I have been playing this game for a LONG time...I have decided that these developers are, simply put, my saviors. If I was a religious guy, I would pray to them. I eagarly await any new games they develope and will purchase without hesitation if I see their brand on the game.","Aug 4, 2019 at 6:30 AM",5, 19,
2022-05-28 14:45:45.550700,JelatonSkeleton,very nice.,"I did just get this game but after a hour of game play i am hooked for sure and for 25 dollars you cant really beat it with the lack of another good mmo out there (orbus is not one of them) not bashing just saying next to skirm vr this is the best vr mmo out there..... That all being said i do super sample the game at 1.5 through the pculus tray tool was just mildly upset about no in game graphics tweaks (anti aliasing,shadows,ambeint oculusion) all that sort of stuff but hands down 5 stars!!!","Mar 4, 2019 at 10:22 AM",5, 1,
2022-05-28 14:45:45.566657,taquitobuddy,"Amazing quality, hope they finish it","Just completed this game in coop multiplayer.  First, the overall quality is top-notch.  The graphics are among the best I've seen in VR, and I've played everything.  The entire experience is polished.  Multiplayer works great.  Everything pretty much works great.  Voice work is excellent, as is the VR implementation, inventory, controls, options, everything.

So why 3 stars?  Well, the game currently has 2 major drawbacks.  The first is simply lack of content.  There are 2 good size dungeons, and then a really short one, and that's it.  For the price it isn't terrible, but I'd much rather pay $60 (or more!) for a full version of this game with at least 5 times the content.  The other downside is general balance.  There are 2 ""classes"" but the warrior is pointless, the game is extremely ranged-focused.  You can do the entire game ranged and never melee anything, and in 95%+ of the fights, this is the best choice anyway.  In many/most of the fights, you couldn't even melee if you wanted to.  Also, there needs to be more RPG progression.  There's loot, but only super basic stats (damage and HP mostly), and no leveling, no skills, etc.  

I hope the devs manage to complete this game one day, it would be a VR masterpiece.","Apr 11, 2019 at 6:41 AM",3, 1,
2022-05-28 14:45:48.681400,Aivo33,Problem with co-op,I buyed with my friend Karnage and this is amazing game but we cant play co-op and we want play co-op because we only buy this game. All time game disconected or cant find each other in lobby.In steam is now out version 0.8.6.5 where is fixed this problem.When we get here in oculus this fixed versioon ??? Realy hope fast answer or here too this this new Fix. I put 5 stars because game is very good .,"Feb 9, 2019 at 6:32 PM",5, 2,"Hi Aivo33, apologies for the troubles you are having. It only happens with a few but there are a couple of ways to fix them temporary. The newer Steam version fixes part of the issues but unfortunately we cannot update Oculus Store with this as there is a conflict between Oculus and Unreal Engine that would make multiplayer not work at all if we gave you the update right now. It's a mistake caused by Oculus in their multiplayer matchmaking backend. We are trying find a workaround :) For now, please get in touch with me on Steam, my user name is Braccar, and I will help you with solving the issue."
2022-05-28 14:45:48.698354,Tehcly,"Great quality, just needs content","Finished the game and was fun, but needs a lot more content.","Apr 11, 2019 at 6:29 AM",3, 0,
2022-05-28 14:45:48.714312,Grease,Pretty Good for Co-Op,"The game is quite fun in co-op mode (as it's one of the only dungeon crawlers) but after being 3-4 hours in, it's a bit repetitive in nature. The monsters aren't more difficult, they're just tankier so it takes more time to kill them. My friend plays the warrior class and it seems pointless when we basically only use ranged combat to prevent dying. The bosses are quite easy compared to being mobbed by 5-6 monsters. Due to the nature of ranged combat being much better, a little bit of aim assist would be nice for long ranged shooting as it can take 2-3 minutes to clear a few guys up if they're far away + aim-botting.

This game gets 4 stars instead of 5 for these reasons. 4 instead of 3 because of the co-op working pretty well.","Feb 21, 2019 at 3:12 PM",4, 0,
2022-05-28 14:45:48.731770,CarloFromMilkyWay,One of the best in this store,"This game must be known and loved, and in this store Karnage Chronicles could be used to define the standard of excellence. The graphics is beautiful, and with the unreal engine this game is awesome and also fluid. The game interface is clean and the mechanics are simple but fulfilling. The difficulty level is very well weighed. the maps are well studied. this game made me experience the magic of oculus rift again. Thanks to the developers for having developed a title worthy of being among the best games of these years.","Feb 10, 2019 at 4:33 AM",5, 3,
2022-05-28 14:45:48.748725,Doum76,Makes me feel like i'm living in WoW :),"Wasn't sure at first. Then, one day it was in special, and decided to give it a try. Wanted to finish another game before starting this one... Started it a few days ago. All i can say is, i just love it, i wouldn't even regret if i'd bought it full price.

The graphic style reminds me when i first got in World of Warcraft decades ago specialy when i've met the Ogre.  Love the environment, the AI of the mobs is just great, at the point you swaer at them for didging your arrows requiring you to reload your crossbow. I'm playing as a Warrior, love the fact you can either block their attacks with your shield or even with your sword, the collision of objet is awesome. I personaly had issues with the Archer class, my aiming was bad, but, got to say, i never really liked playing archers in any games.

Love the changed made from last patches, versus how the game was from the video i've watched from Man of the Antz. Love the small details, as small as how to reset dungeons, even the inventory is cool. :) My only worries is, the game is so fun, i don't know how long it is, but to last the fun, i reseted the first dungeon to get more golds to buy new gears.

Just love the dialog selection/interaction with NPC, feels so muhc different then clicking on choices with a mouse with normal games.

Devs: I was wondering, the game is a year old etc. i was wondering if there is still support for it, can we expect DLCS or new contents eventualy? I do hope so. :)
This is so far my best RPG in VR, beated Mage's Tales by a tons :) Good job!","Feb 7, 2019 at 11:12 AM",5, 1,"Thank you Doum76 for your really nice review. To answer your question, we are still making more content for Karnage Chronicles, including new classes and a level system with talents."
2022-05-28 14:45:51.849027,b-twice,I just LOVE this game!,"Got this 4 days ago and it is such a polished fun game to play.  The graphics are eye candy, the foes are varied and fun to battle, the story is nice... just an all around fun 'dungeon crawler' type of game.  Smooth locomotion is awesome.  I wish the option for controller-based direction as opposed to look-based direction for locomotion was there...maybe devs can add this?  Cool fun game!","Jan 16, 2019 at 12:07 AM",5, 3,"Thanks for the nice review, we are so glad you are having a great time. About the controller-based direction, it is there in settings. Accessible from your belt. Always had it :)"
2022-05-28 14:45:51.865982,Sollith,"Nice Game so far, but...","The bow angle is off by several degrees, which makes it difficult to aim (have to rotate wrist forward about as much as I can just to have the bow aim straight). Checked it through the nose gap on the headset too and the bow model definitely isn't properly aligned with the grip position. They should also make the weapon slots clearer (left and right hand, etc.), because it's a bit of guessing the first time playing (the armor slots are pretty self explanatory with the icons on them). 

Otherwise, the little I have played so far seems like a good dungeon crawler; stylized graphics, which age well, animations are solid, seems like there are a variety of upgrade paths, etc. I will have to try multiplayer at some point too. If the grip angle was fixed, I would rate it a five star for the bit I have played so far.","Feb 7, 2019 at 7:17 PM",4, 0,Thanks for the feedback Sollith. We will definitely have a look at the alignment of the bow for the Oculus compared to where your controller is. Haven't experienced this issue ourselves (we have two Oculus sets in the office) but it might be that we are just used to how it is and not noticing. Will check! :)
2022-05-28 14:45:51.881939,Gamesalo,Love the game,"Really nice graphics,love co-op mode,sadly not so many players to make a team with.Add me as friend guys,so we can play together.Thanks!

One question I have,
I am no finding any players to play with,there are always no rooms found.
When the game looks for other open rooms,it looks only for ""oculus"" or for players that use ""steam"" as well?","Jan 11, 2019 at 3:22 AM",5, 12,
2022-05-28 14:45:51.899891,SliceDeath,Really impressed by this game!!!,"into the world is beautiful and fantasy without to much doing, there are some green glitch between textures in lvl design in rare case. but in general, it's really well done, as weapons, creatures, objects and all. 

the game play, menus and inventory mechanics are good thought. It’s a game build for the VR, not like any others games that make only a simple addon for VR)) 

I don't regret my purchase, i know you add free locomotion, smooth view etc. Although, there are only one missing things, the sitting mode for me to make longer session...

Good job dev continue like this

ZH","Jan 31, 2019 at 7:59 AM",5, 1,Thank you so much for your support. We will continue adding to Karnage and improving it! :)
2022-05-28 14:45:51.916845,DrOculusVR,,i loved this playing with friends or alone. there should be a giant spider warning but other than that its great. trawling the dungeons fighting the boss and making it home with your prize is extreamly satisfying. i did have a few issues that im not sure if it was because the game is EA or i was doing something wrong but a 3 hour play session means it cant be bad. i look forward to returning again in a few updates time,"Jan 15, 2019 at 8:49 PM",5, 2,"Hi wufuss, thanks for your review :) Please feel free to hop over to our Steam forum and discuss any issues you might be having. There are many other players there to help out as well. How many of the dungeons did you finish?"
2022-05-28 14:45:55.035628,UglyFish819,Great game .. when it does not crash,"When I first got this game it was great, I really liked it and thought it was a lot of fun. Now however it constantly crashes within a minute of starting it is totally unplayable and unfortunatlly Im just over 2 hours of play time so I cant get a refund. This could have been a great game instead it was a total rip off and waste of money.","Jan 31, 2019 at 9:05 AM",1, 1,This have been fixed with the latest update. No more crashes.
2022-05-28 14:45:55.053580,vegron,Multiplayer is broken after latest patch,"Edit: I hope it's fixed soon. Updated my rating. It's a great game and I just want to play it. a lot.
My brother and I can't connect together after this latest patch, which sucks because there's some great content in the new edition. Is there a fix for this yet?","Jan 21, 2019 at 10:27 AM",5, 2,"We have noticed that some players are having a few issues lately and are looking into why this is happening. Since we haven't changed a thing in the matchmaking and multiplayer code it is a bit baffling, but we will figure it out. Rest assured :)
UPDATE: We are still working on the fix. It requires an engine version upgrade, and making sure everything is working as it should after the upgrade is just backbreaking, but we should soon be done. Crossing fingers!"
2022-05-28 14:45:55.070534,gleep52,So awesome!!!!,"I forgot I was playing an early access game.  Very polished and great mechanics.  Loot was slow going at first but picked up very well and I was happy to see better loot drops than you could buy in the store.  

The first TP scroll was free and I was hoping there were more identifiable spots to use the scrolls or there would be break points with more TP scrolls available.  I never knew where the next boss or checkpoint would be.  So I ended up only using 3 scrolls and beat the whole game.  

I thought that after the first cave/dungeon I’d get to return to the shop but there was always another portal to keep going and it turns out I beat the early access game without knowing it.  I played as an archer originally and I look forward to playing as a warrior a second time.  

It would be nice if there was a stash system in place for extra equipment I don’t want to take with me into the dungeon.  

I think instead of the end portals progressing us to the next cave/shimmer, that it returns us to the shop so we can understand we’ve completed that portion of the game...

I’m writing this more for the developer than for players to read - the game is so fantastic and I’m craving to play it again.  Will there be a magi class in addition to the warrior and archer classes?  

Man I have so many questions for the developer of this game... how can I get in touch?","Jan 7, 2019 at 10:00 AM",5, 9,"Hi gleep52 :) There will be a mage class and a healer class in a future update. The chest in the player room will soon become available as well, as your stash ;) We have had that one in our backlog for a while, haha. The best place to get in touch with us is on the Steam Forums and through our Steam Chat. There are many other players there to communicate with as well :) Hope to see you there! PS: big content update is very very close to being released."
2022-05-28 14:45:55.087489,mattsinger,great! but..,"for some reason... I can't join multiplayer... friends, or public... plz fix this.","Mar 8, 2019 at 4:42 AM",5, 0,
2022-05-28 14:45:55.105441,ToXiCRomeo,Amazing game!Great community!,"I have had a blast playing this game ! I constantly invite friends ove and ask them to play and by the time they come out the usually say (I've been playing for an hour now i think i'm gonna take a break) and i look at them an say bruh its been 5 hours... They usually just put the headset on after that. 
XD Also i need some battle buddies add me up!","Jan 15, 2019 at 1:05 PM",5, 3,That was a very touching review. Thank you :)
2022-05-28 14:45:58.222730,spandrel53,,"This is a great VR title. If you like the genre, it is worth the price. Looking forward to the next update.","Feb 19, 2019 at 2:14 AM",5, 2,
2022-05-28 14:45:58.240682,elaineah,great game but multiplayer a bit broken,"I really like what ive played so far in this game. But i tried to play coop with a friend (both on oculus) it just kept crashing or not finding me as the host . 
But it seems like the developer is responsive going by other posts, so im sure it will be sorted out soon.
I bought this in the sale and wont be refunding as im enjoying the solo player mode.  P.s to develper, ive added you on steam so see if you can help

UPDATE- The Dev has helped us so I can now play multiplayer with no problems.
love this game and like the art style . Thanks Dev.","Jan 10, 2019 at 9:17 AM",4, 1,Glad we could be of help and thanks for reaching out to us so we could be of assistance in solving the problem! :)
