scrapping_date,review_author,review_title,one_reviews_text,review_date,review_rating,review_helpful,review_feedback
2022-05-28 15:06:43.570744,Roly_Poly,Awsome Price + AI awsome,Get On Discord ASAP. Youl have the best fun for a long time!,"Mar 25, 2018 at 7:18 PM",5, 4,
2022-05-28 15:06:43.586700,Destruct0r,Great game.  Poor vr execution.,I keep placing roads in the wrong spot. Control scheme is not great.  No online community that I am aware of.  Please update the app and I will update my review.,"Mar 23, 2018 at 12:23 AM",1, 2,"Hi RamRaj95,

We're sorry to hear you had a bad experience. One thing that might help is that we have three different control schemes you can try, to see if you can get a better fit (Touch Controls, Laser Pointer and Gaze Controls, accessible through the settings menu). 

Regarding the online community, we have a great group of people on our Discord channel who are waiting to play games! You can find the link to that channel on our website (www.experiment7.com).

Thanks,

Producer Coray"
2022-05-28 15:06:43.602658,ShocksVR,Fun little board game,Plays great on Rift and GO.,"Jul 24, 2018 at 3:28 PM",5, 0,Glad that you're enjoying it!
2022-05-28 15:06:43.617618,Bang_Rajan,,the instructions are bad and used by a computer voice. Go to https://www.youtube.com/watch?v=hY2KnwfEBkA to learn how to play.,"Mar 22, 2018 at 8:57 PM",5, 2,
2022-05-28 15:06:46.737274,8BitMissingno,"Great app, needs more players","I am writing this the day the app has released. It is a great app from a gameplay standpoint, but playing with the AI feels like you are being cheated. Red numbers are not rolled as often as you'd think, your opponents will place the robber on your best hex when you are not winning, and one AI player seems to dominate in terms of resource rolls. I was not able to match with anybody after waiting about 5 minutes. If this app becomes popular, it will be by far the best way to virtually play Catan with others.","Mar 22, 2018 at 7:40 AM",5, 6,
2022-05-28 15:06:46.753231,PixelMonster,,Wasn't a board game player and rarely used my VR headset. Met the E7 team and fell in love with the concept and game.,"Mar 25, 2018 at 8:10 PM",5, 5,
