scrapping_date,review_author,review_title,one_reviews_text,review_date,review_rating,review_helpful,review_feedback
2022-05-28 14:52:39.035906,DiamondDepth,"Still Good, even to this day","One of the reasons I originally got this game was because it ran really well on older hardware. I have a computer with an i5 4670, 16gb ddr3 ram, and a gtx 1650 super, and it runs INCREDIBLY smoothly on my Quest 2 via link cable. The storyline is kinda short, but it is really good, with some major plot twists. Honestly a better storyline than most recent DC movies. I just wish it was longer and that there was more interaction with the game. If this game was remade to the modern VR standards, it would me amazing.",Mar 20 at 8:19 AM,4, 6,
2022-05-28 14:52:39.050866,failDD_GameR,Rocksteady,Rocksteady really needs to come out with another VR game my only complaints are is it isn't long and definitely leaves the player wanting more,Apr 7 at 8:29 AM,4, 3,
2022-05-28 14:52:39.065826,salemkitty,not a good game,It was a alright game but short it only lasted it for 5 minutes not worth spending the money.,Apr 3 at 9:11 AM,1, 5,
2022-05-28 14:52:39.079789,talrashha,One more of those 0.5 GBP / min game,"I mean, yeah, i'm done with the game... Play time: 42 minutes. Wasn't too bad, wasn't too good either. The story just... stops at some point and you get a final credits... and you feel like ""here is another 20 quids i'm not seeing again...""",Jan 16 at 3:38 AM,2, 11,
2022-05-28 14:52:39.094749,Icee_Ice,An actual honest review,"NO SPOILERS


Wow, so many people bomb this game....and for what?

1- gameplay
Pros
I ran this game really smoothly on my quest 1 connected to my pc, no problems, no jankiness, easily adjustable graphics in the games menu that actually make sense
Gameplay with controllers makes sense, works perfectly, the system with the utility belt holding gadgets is great
In the segment where Robin is talking to you, he doesn’t look too cartoonish, or lag the game at all
Solving riddler riddles and trophies is just the right amount of challenging
Cons
No fighting mechanics
Only three main items you use to interact with things, although the forensic scanner is multi use

2- story
Pros
The story is phenomenal if you know the Arkham games. If you don’t, look up their stories or try the game trilogy yourself, it’s a masterpiece. It’s a dream sequence (not really a spoiler you’ll know when you play it almost right away) feels like a bad lsd trip in a good way, and gets the job done. Perfect.
Cons
Honestly I don’t have any, keeps you on the edge of your seat the whole time


3- addressing the main problems 
Yes, this game could be longer. But it ends on a great place, and the detail......blew me away. The attention to streak marks from a mop on the floor, light shading, a fully playable piano with sheet music that ties to the game, subtle hints, including many trophies you can get, and SO much detail. I have played many games, and yes, this one is short, but wow I have never seen a game where creators bothered with this much accuracy and detail, down to rendering so many things they didn’t even need too. Yes, there isn’t combat. But this game focuses more on the detective side of Batman with amazing precision and great story beats. Also, the collectibles are awesome. 


Overall-
10/10
Really, if you’re an Arkham fan, do it",Nov 21 at 10:04 PM,5, 54,
2022-05-28 14:52:42.219468,SilentKnight28,"Fun, but short","This is a fun little game, feels like a demo. It is definitely not worth paying more than $5.00 for it. Hopefully this is just a taste of more to come.",Dec 6 at 9:09 AM,3, 6,
2022-05-28 14:52:42.234935,acideanime ,game at one dollar per minute,game at one dollar per minute of playing time. the price does not shorten your playing time.,Apr 8 at 4:54 AM,3, 0,
2022-05-28 14:52:42.248898,Redron357,Quest 2 from Rift,"I purchase your app for my Rift, works great.  I replaced my Rift with a new Quest 2. it is mental to think someone is going to repurchase your app for a newer hardware, but same system (Facebook). I refuse to purchase it again due to newer version of the quest 2 I have. I would like my purchase moved to my lol same Facebook account under my quest 2. BTW I had to replace my rift due to Oculus not supporting the purchase of new Headset cables.",Sep 6 at 5:52 AM,1, 18,
2022-05-28 14:52:42.263858,Keystone814,"Great game, terrible story",I thought the game was really cool. The ending of the game really got my attention and really cool! But the story at the end made no sense......Great game....lowsy story...,Oct 29 at 1:05 PM,4, 3,
2022-05-28 14:52:42.278818,willieboy999,VERY SHORT !!!!,its a very short game its realy just a demo but sum parts make up for it like the bit with  killer crock  its price should be low not high,Jul 4 at 8:00 PM,2, 9,
2022-05-28 14:52:45.367188,Rex,Angry,This is the shortest game ever It makes me so furios because of what I payed DONT BUY ITS A SCAM.,Jul 6 at 4:32 AM,1, 12,
2022-05-28 14:52:45.382148,Joeldt,"The VR is nice, but is way too short","I liked the game, but as the story started getting going it just ends. For 20 dollars I wasn’t expecting just a small chapter. Even though they break it up into three acts. Not worth the money but fun.","Feb 19, 2021 at 11:44 PM",2, 18,
2022-05-28 14:52:45.398105,KilljoyCassie,An absolute delight!,the vr is super immersive and detailed. the world feels so fleshed out and dark and the story is exciting with a crazy twist! If youre the kind of person who thinks all a video game is is fighting this isnt for you. There isnt much fighting its about the world and being present. It really felt like i was in there!,"Jan 15, 2021 at 4:20 PM",5, 12,
2022-05-28 14:52:45.413065,JaiDogMoney,"Not Immersive, heavily disappointed","When I saw arkham in this title I assumed it would be a tactical stealth takedown game with a detective aspect to it. Instead I got the most non-immersive game I've ever played. I've dreamed about being Batman and taking down enemies with brute force martial arts. There is 0 fighting in this game entirely. The fight scene is just trowing like 3 batarangs and when you use a grappling hook, the screen turns black and you appear at the spot you grappled. This game was a major disappointment and upsetting to be called an Arkham game.","Sep 9, 2020 at 6:45 AM",2, 43,
2022-05-28 14:52:45.428025,gregsead,there is zero fighting,wtf is a batman game without fighting ???????????????????????????,"Sep 5, 2020 at 4:06 AM",1, 38,
2022-05-28 14:52:48.526372,alyssia.ma,The definition of VR experience,"Maybe this isn't for gamers or intense DC fanboys, but I personally loved this game. The amount of detail in this world is so surreal (from Bruce's bloody hands, to the batmobile, to his gadgets, to being able to stick your face right in Nightwing's). True, it was only a 1hr experience, but from beginning to end my mouth was open in awe like a kid in a toy store. Don't buy it expecting challenging gameplay or a true-to-the-comics storyline. I bought it because I wanted to experience a world that meant so much to me ever since I was a kid. For me, it did that and more. Hope there are more experiences like this being developped!","Jan 3, 2021 at 1:15 AM",5, 38,
2022-05-28 14:52:48.541332,TheElite316,I was expecting more. (No spoilers),"So, I found this game to be somewhat dissapointing as a VR game. It took me about an hour to beat, which I find somewhat lacking for a $20 game. There are these challenges you can do after (finding clues in the campaign), which I haven't done (and personally, I really disliked the plot). Also, after completing the game, I have to say that the trailer for this game is very misleading. You aren't fighting bad guys, flying around, or even driving anywhere; its mostly just solving clues and looking around. But what I found really bad was that this game lacks certain basic VR functions that I like to see in VR games, which includes the following:
-You cannot move with the touch controllers, you ""teleport"" to certain spots using A.
-You cannot look around (looking left and right) with the touch controllers, you have to turn physically.
-There is no option to reset the view.
I have a small space to use my VR, but this isn't a problem if you have a bigger space for your VR (and possibly more sensors). The only good thing I have to say about this game is that they do an okay job at immersing you into the world of Gotham City, and the graphics and sounds are pretty accurate, but I feel overall, this game really isn't worth the money.","Jan 23, 2020 at 6:08 AM",2, 57,
2022-05-28 14:52:48.556292,MSUnman,,Game crashes anywhere between 5 to 15 minutes in.  Playing using Oculus Quest Link with AMD RX 580. Very disappointing to waste money on something you cant play. :(,"Jan 31, 2020 at 12:09 PM",1, 9,
2022-05-28 14:52:48.572760,Leonidas-I,Worth the half-price value,"(Would have been 3.5 stars, but that's not available)
I've been a Batman fan for a while now, and an Arkham fan for a few years now, having finished Origins, Asylum and City.  And because of this it was truly a great experience due to the true-to-self Arkham style and pure immersion.  It is obviously quite short with gameplay lasting only about two-hours if you were to be taking your time (as I did), though rushing through would likely be closer to an hour.  However, I don't hold this against, the developers as VR games generally have a high-cost to make with a comparitively small price-tag.  
Pros:
-Excellent graphics, I loved how Wayne's bare hands were even visibly bruised.  
-Fantastic attention to detail, from the vehicles to characters, the environment and beyond.  
-Feels familiar.  Actually felt like the Arkham universe, with familiar environments, gadgets, features, characters and grit that the series is known for.  
-Decent playtime for the completionist.  Now, I know that many people who play won't bother finishing the Riddler challenges, but I am currently only four challenges away from completion.  This increases playtime from one-hour to almost five, which is a huge plus.  
-Decent story.  The story was decent, although somewhat disappointing when coming upon the revelation from the final level.  

Cons:
-Some control issues.  The Batarang Riddler challenge is OBSCENELY hard, as the auto-aim only works below a certain height--meaning if you are throwing at a high-up target, good luck, as you will only have the janky throwing mechanics to use.  
-Puzzles were generally too simple.  Would have preferred much more advanced and common use of the grapple gun and batarangs.  Perhaps the addition of other simple gadgets, such as the cryo grenade would have made the puzzles more elaborate.  
-And finally, too short with too few mechanics.  Each major feature (crime-scene reconstruction, object reconstruction, Batwing takedown, etc.) was used only only once.","Sep 7, 2019 at 6:21 AM",4, 38,
2022-05-28 14:52:48.587720,Frosken,,"Buy it on sale, but not for full price. Its not worth the full price. Thank god i found this game on a sale and didn't buy it for the full price :)

The game is ok but its to short...","Aug 27, 2019 at 4:23 AM",2, 15,
2022-05-28 14:52:51.677135,PikusHUN,,"The graphics are super but that's about it. You can't fight, you can't drive vehicles. Full price I would not recommend it to anyone !!","Aug 23, 2019 at 4:11 AM",1, 9,
2022-05-28 14:52:51.693093,ron.labbe,"Great game, but glitches","Love the amazing quality and detail! One of the best I've seen, but several times I found a bug where it goes to black and white and I lose my controllers at the same time... have to reboot.","Aug 27, 2019 at 8:22 AM",4, 2,Hey Ron! Sorry to hear you ran into this. We'd love to get more details about the issue you encountered where you needed to reboot. Can you please put in a report at https://go.wbgames.com/DChelp so we can review? Thanks!
2022-05-28 14:52:51.708053,blindhigh,,What a waste of money.,"Aug 31, 2019 at 9:07 PM",1, 5,
2022-05-28 14:52:51.725007,ksn,Good enough for demo,"Honestly this is a demo, no more no less.
A quest game where you visit several single scenes moving by storyline. Every scene has several fixed positions you may switch between to solve puzzles or doing some actions. You got few devices you may use in scenes to complete missions.
You can't free walk around or interact with objects that don't belong to current main quest or side quests. Nevertheless immersive is good, story intrique and you have some sudden situations make you heart beats faster. 
And traditional riddler pazzles of course! But after completing main story ;)
+++
- Excellent Gotham atmosphere
- Descent graphics
- Strong game base
- Fun quests and puzzles
- Great music and sound
- Intuitive interface

- - -
- Poor touch pads implementing
- Almost zero interactive
- The game seems to be a demo
- Many in-gamethings/active surroundings have no use (seems to be prepared for full version)
- To short
- To short
- And again TOO short

Resume: the game is good enough for demo, but not for finished product. It seems to be discontinued (game site is down) so it's not like we get some more batman stories nearest future. You may have good enough experience for two hours or so completing main storyline (or much more if you decide to get achievements and solve riddler puzzles) still, but i'm not sure the price for this game could be more than 10 bucks max so i can recommend wait discount.","May 22, 2019 at 5:38 AM",3, 29,
2022-05-28 14:52:51.739968,Danguns,Amazing Experience!!!,"Blew me away! Like stepping into the Batman universe. Absolutely mandatory to own if u have VR. Graphics are amazing. One of my favorite puirchases next to Vader. Runs great on my AMD FX 9590 @ 5.08ghz, 16GB DDR3, 1080 GTX 8GB.","Jul 3, 2019 at 3:51 AM",5, 3,
2022-05-28 14:52:54.822374,Palieus,My thoughts...,"Really enjoyed this title. The graphics look amazing and the story draws you in leaving you wanting more. My favorite moment is at the end during the prison scene. No spoilers …. You really do feel like the Batman :P

Now a few Cons: It’s not a game, it feels more like an experience rather than a full fledge title. Which is okay but it should be advertised as such. Also, the vehicles … sorry you never get to drive or pilot any of those, sort of a letdown; Would have liked to experience that. 

Lastly and this is what bothered me the most was the tracking notification tringle that kelp popping up in the middle of my visor. My controllers are fine and track well with my other games but seems to have an issue with this title. I keep having to bring my hands in front of my face to make this annoying warning go away.

Still I'm looking forward for the next chapter in this adventure.","Oct 14, 2019 at 3:37 AM",3, 2,
2022-05-28 14:52:54.837334,Robbo_Iain,It's basically a demo,"Excellent demo, but it's not long enough nor immersive enough to be considered a game. I'm actually furious that I spent £18 on this.","May 9, 2019 at 6:55 AM",2, 14,
2022-05-28 14:52:54.852294,Mesyc,"Dvp, can you finish the game please ?","It's so short it looks like a demo. !

Graphics are good, story is OK, but you only do the first 3 chapter of a longer story plot. 

EDIT : 
It's really frustrating. The experience is immersive enough and the puzzles are fun to solves. I really wish it had some action in it. It could be one of the best game (the universe and the details are really good)

Imagine the same game + battle + car and air travel and few creative actions including hand/body movement...","Apr 17, 2019 at 1:58 AM",3, 20,
2022-05-28 14:52:54.867254,Mr_Wonderfull,Download,It takes forever and keeps pausing for me,"Jun 20, 2019 at 3:38 AM",5, 2,
2022-05-28 14:52:54.882214,Captain_Obvyus,"No action, no thrills...","Great graphics, great voice acting (Mark Hamill is always epic as the Joker), and that's it.  The gameplay in itself is beyond dull, absolutely zero action.  Don't get this game expecting to feel superheroic while playing it; the level of inaction for a Batman game is ludicrous.  Even though Alfred gives you the choice between the Batmobile and the Batwing, the devs are so scared to make someone sick that you won't even get to sit in those vehicles.  The guys that made this and Marvel Powers United should go play Windlands 2.","Dec 29, 2018 at 2:24 AM",1, 9,
2022-05-28 14:52:58.013965,taquitobuddy,Short but fun for 1 playthrough,"This was a tough one to review.  It was quite a good 30-45 minute experience, great voice acting, graphics, story, and WOW what a plot twist ending.  But for the price judge for yourself if 30 minutes is worth it.","Jan 2, 2019 at 6:23 AM",3, 5,
2022-05-28 14:52:58.028925,DanteMinaj,"Great graphics, decent story, too short","This game is only like one hour. Such a shame, as it has so much potential. Don't get me wrong, it's a fantastic one hour. But you wouldn't wanna play it again. The graphics will amaze you, especially when you go into the Batcave. Also beware, the size of everything will terrify you, especially if you've played the previous games in the series, as everything seems much smaller there. The story is really well thought out, and is canon to the other games which aren't VR, which is pretty cool. But a second negative is you don't actually get to see when you go in the Batmobile or the Batwing, but that actually makes sense why if you go deep to figure out the deeper story (I'm trying not to spoil it).
EDIT: Oh by the way that ""one hour"" of gameplay doesn't include the Riddler challenges (yes, they're still annoying like in the previous games, and yes, they're almost impossible).","Jan 6, 2019 at 11:43 AM",3, 6,
2022-05-28 14:52:58.043885,thejustchad,<1hr basic game wrapped great graphics,There is really not much to this game other than enjoying the graphics and the basic story. But it does do it very well. If this game had been a little more open and laster longer than an hour it would have gotten 5 star.  But for what you pay this game is very much lacking and feels more like something that should have been given away for free to promote a new movie or something.,"Dec 28, 2018 at 4:41 PM",2, 9,
2022-05-28 14:52:58.064829,harasimowicz,The game does not work,"I have a CPU ryzen 5, 8GB, NVIDIA 1070 and all the updated software, however the game never booted. I tried to correct the game, including with many tickets with the Oculus Support but I gave up, I only have to comment.","Dec 27, 2018 at 8:26 AM",1, 2,"Sorry to hear you're having issues getting the game to boot! If you haven't, make sure to put in a ticket at go.wbgames.com/DChelp and we'll look into it for you!"
2022-05-28 14:52:58.082781,stephen1976430,Short game,"too short of game works great I like playing full Batman games on pc, xbox one x","Dec 28, 2018 at 3:05 AM",2, 1,
2022-05-28 14:53:01.181143,Suprix,Extremely well made game,"This game was amazing. I was so immersed throughout the entire experience and got some chills down my spine during some off settling parts. The game is built on a kind of Escape Room esque type of gameplay where you find clues and try to solve relatively easy puzzles with your tools. 

A lot of people are complaining that it's too short. I was able to get through the game in about an hour and a half while making sure to try to see all the details that were put into the game. Regardless of the game only being about an hour or two hours, it was amazing all the way through. They integrated the concepts of virtual reality super well and I am definitely going to use this game as a demo to friends in order to show what virtual reality is capable of.","Oct 20, 2018 at 10:59 AM",5, 11,
2022-05-28 14:53:01.197100,DirkWinston,Great graphics. Decent storyline.,"I really liked this. It was not a long game but it was worthwhile given the high quality of the graphics. Maybe next segment they'll have added another device or two on the utility belt. Just having the bio scanner, batarang and grappler was sufficient here but it felt like something was missing sometimes in the way of devices. Small point, though. All in all a short but excellent game. Hope there's a sequel.","Dec 27, 2018 at 5:44 AM",5, 2,
2022-05-28 14:53:01.213057,JamesDunford,"not a game, its a demo","gameplay is under 1 hour even when taking your time, the combat is non existant, you basically are doing busy ""detective"" work, im so sick of VR developers being lazy and thinking the VR experience will carry the weightlessness of their content, not even worth it when on sale for $5","Jul 24, 2018 at 8:17 AM",1, 22,
2022-05-28 14:53:01.228017,wintereagle,,good game but short and i would like a lot more missions to do in the game instead of the same one over and over again,"Sep 2, 2018 at 4:36 AM",3, 7,
2022-05-28 14:53:01.243974,RuneSR2,Awesome experience - but short,"I only paid 5 bucks for this game, and it was truly amazing. In summer 2018 the graphics are still among the most impressive on the Rift. I cranked up super-sampling to 2.0 and the game performed flawlessly (90 fps) on an oc'ed 1080. Note that this is a short adventure game, so do not expect an action game. Take your time to enjoy all scenes and you may have about 1 hour of great content.","Aug 21, 2018 at 3:58 AM",5, 7,
2022-05-28 14:53:04.337831,KikiTay,!! JUMP SCARE ALERT !!,"I hate it when VR developers love putting jump scares into their game! It's like the cheapest way to get a reaction out of players and it totally destroyed my mood! I was aware of how short the game was from the reviews before I bought it but I never thought it was this short! The whole thing ended in what felt like less than half-hour to me. It's not even a game, it's just a demo in the form of a tutorial! You don't really have any choices and you won't need any skills either. Just follow the instructions to the ""ending"" where nothing is concluded! How can they publish and SELL a ""game "" that is just a tutorial? I feel bad for those who paid full price! I'm not happy paying $4.99 either! Granted the graphics and mechanics are great, but that is if you make it into a game. This is just a short demo and they should only charge full price after they made it into a full game. I'm just really disappointed. It has so much potential but for now it's just a cash-grab. I hope they make a part-2 and be actually worth the money this time. 1-star for the short demo with all the cheap jump-scares and 1 more star for the graphics and engine.","Jul 3, 2018 at 10:39 AM",2, 13,
2022-05-28 14:53:04.354293,DreamerO,Probably not the batman you wanted...,"The only reason this gets a 4/5 is because the graphics were so phenomenal. 
This is worth 9.99 but not 19.99 -- better to wait for it to go on sale if interested.

The game was about an hour, and your feet don't move. You only move around ocassionally by using a grapple hook on very specific spots. This killed the immersion. 

Best if viewed as a demo.","Aug 7, 2018 at 6:18 AM",4, 7,
2022-05-28 14:53:04.369253,davenel,Great... but short shor sho sh s done !!,The experience is great... but short... too short... WAY TOO SHORT for $20.  I have been playing other games for weeks now for not much more... this was done in a couple hours... that is $10 an hour...,"Aug 25, 2018 at 4:04 AM",2, 6,
2022-05-28 14:53:04.384213,RainMagma,For 5 euro it was a nice experience,"Almost didn't buy, even at 5 euro, due to the 1 star ratings.
However this experience is high quality, especially graphics wise, with some nice surprises but quite short in length.
I can imagine people rating it low when bought at full price, but at this discount price it is enjoyable and worth it imho.","Jun 30, 2018 at 4:40 AM",4, 6,
2022-05-28 14:53:04.400170,grekb,Very high quality,"I loved it! The game is an adventure not an action game. Technically the game is one of best in VR. Graphics are AMAZING, so is every feature or mechanic the game has. You really need to take a close look at those beautifully made character faces! I didnt really found anything in game that was sloppy or badly created. The story was twisted as it should be for a game about joker. Just terrifying with lot of dose of crazyness. But it is short! For some weird reason the devs created lots of good features for a full game but didnt bother to create content. Really bad decision from the devs. At least the game has LOTS of secrets that you wont find easy, so if you are playing it in a hurry it will be even shorter! So take your time and examine everything. I highly recommend it for a price lower than 10 euros","Jul 1, 2018 at 6:02 PM",4, 2,
2022-05-28 14:53:07.490489,wirelitesoft.dev,,I'm sad that you didnt get to fight any bad guys or drive the vehicles. Like the game would be awesome if there was actual gameplay. Where is the game play? this is more like an interactive short film. please add fighting and driving.,"Jul 10, 2018 at 5:26 PM",1, 9,
2022-05-28 14:53:07.505449,0xeb,Well done,"This game is well done. Lots of details and smart use of the VR system.

I enjoyed playing it, though it is a short play.","Aug 12, 2018 at 12:47 PM",5, 1,
2022-05-28 14:53:07.521406,M1cH3LL,nice but theres something missing,"All in all it looks pretty awesome and has beautiful locations. It could be much better if there where a batmobile ride included. Theres more potential in it, so only 3 stars.","Jun 29, 2018 at 5:24 PM",3, 3,
2022-05-28 14:53:07.536366,Friglord,,"really short, kinda clunky.","Aug 10, 2018 at 4:03 AM",2, 2,
2022-05-28 14:53:07.551326,chatbotte,,You feel like your feet are in ciment block,"Jul 8, 2018 at 11:36 PM",1, 4,
2022-05-28 14:53:10.666146,jere.karppinen,,I finished it in an hour. Just great atmosphere and mechanics made sense. I loved it that it was more of a puzzle game than action. Couple of nice scares too. Only 4 stars because it was short and I want MORE.,"Jul 2, 2018 at 6:04 AM",4, 1,
