scrapping_date,review_author,review_title,one_reviews_text,review_date,review_rating,review_helpful,review_feedback
2022-05-28 14:53:10.682103,Virtual-Reality-Ita1,NOT WORK,"Not work with Oculus Home 2, please update!","Jul 17, 2018 at 9:12 PM",1, 6,"Hi there!  During our internal investigations, we found a similar issue when our graphics card drivers were out of date, and was resolved by following the guidelines in the support section of the Oculus site: https://support.oculus.com/217157135500529/

If you could give this a shot and let us know if that resolves this issue for you, that would be great!  If you're still having trouble launching the game, you can visit the DC Games section of our WB Support site, and submit a ticket to our customer service team who will happily help troubleshoot this issue further with you: http://go.wbgames.com/support"
2022-05-28 14:53:10.699058,Velcro666,cannot get it to work,"ive bought this game, it will not work, i keep geting an error about d3d and a lot of writting, ive taken a picture of it, but cant upload it","Jun 16, 2018 at 9:28 PM",1, 3,"Hi. Sorry to hear you've been having D3D issues. Have you consulted Microsoft's guidance on installing the latest version of DirectX?

https://support.microsoft.com/en-gb/help/179113/how-to-install-the-latest-version-of-directx

We've also got some platform-specific calibration and settings guidance here: 

https://dcgamessupport.wbgames.com/hc/en-us/sections/360000193948-Batman-Arkham-VR

I hope that helps!"
2022-05-28 14:53:10.714018,profmjg787,,Enjoyed everything about it except it is too short.,"Jul 1, 2018 at 7:32 AM",3, 1,
2022-05-28 14:53:10.730972,Ryzu,Not worth the money,No game play no free roaming no driving vehicals soooo not fun and very boring whole thing last maybe an hour.,"Jun 2, 2018 at 10:59 AM",1, 6,
2022-05-28 14:53:13.840314,Martski2009,not bad,needs action,"Jun 30, 2018 at 6:32 AM",3, 1,
2022-05-28 14:53:13.855274,KetchupLover,Really...READ REVIEWS BEFORE BUYING,"Might last you about an hour. I mean It is a really pretty game but if I would have known that was all the content I would not have purchased it. I wont spoil anything except that there is only like 3 scenes that you actually do something that isnt a control learning scene. At the end I said to myself oh things are about to get really good.....then credits lol 10/10 on visuals, 3/10 on content. I was expecting some crazy rooftop fun or getting to drive or fly the vehicles. None of that either. Not even any fighting action. The one fighting schene was a black load screen with punching sounds...","Mar 21, 2018 at 8:39 AM",1, 17,
2022-05-28 14:53:13.872229,BMooreNatural,SHORT,"Loved being Batman but for the price of the game and how short it is, I'd suggest buying it with a grain of salt.","Apr 20, 2018 at 3:30 AM",4, 12,
2022-05-28 14:53:13.888186,AtlasP,,Great preview of what early AAA VR could look like in the next few years.,"Jun 30, 2018 at 4:39 AM",4, 1,
2022-05-28 14:53:13.903146,dylanmax,bat man,grat game  to short so can you guys make it biggre i will be glad to pay for eay up grads for this game if ypou do ti will be monny in your pocket  please have a go thanks.,"Apr 6, 2018 at 2:34 AM",5, 3,
2022-05-28 14:53:16.995010,donutlie,DONT BUY ITS LESS THAN 1H OF GAMEPLAY,"Its barely worth your money,the puzzle are way too easy and the end is ????

SPOILER!

the story isnt really interesting and the character are allmost all dead before you start making it really difficult the have any feeling about their death even if ur a batman fanboy","Jul 4, 2018 at 4:20 AM",1, 4,
2022-05-28 14:53:17.010967,kamal.berrada,,Very short and no fun at all. Very disapointed.,"May 8, 2018 at 3:58 AM",1, 4,
2022-05-28 14:53:17.026925,BioSafetyClean,,"Boring, You just stand around and put clues together. No moving around no fighting.","Mar 9, 2018 at 10:20 AM",1, 7,
2022-05-28 14:53:17.043879,alex.rios3030,was not a very good game,I was not happy with the way this game was made,"Jun 17, 2018 at 12:21 PM",1, 4,
2022-05-28 14:53:17.058839,chardali,Chardali,"Awesome game, but very disappointed in its length as i finished it in about an hour.  Just as thing start to get interesting and one is becoming accustomed to abilities the credits start to roll so the game and all about it awesome!  Length of game turns it into a vaccume cleaner!!!   Still worth th money; hope they make full content game for the rift.","Jan 16, 2018 at 9:22 AM",5, 2,
2022-05-28 14:53:20.175677,Jay_Le_Chardon,"Great game, just not enough play time","This is a grat game, its very immersive, the minute you put on the batman mask and see your reflection the inner child is delighted. The gameplay is good, graphics rock, but just as you think you are getting ready for your first boss battle it enters a 360 cutscene deneaument and rolls credits. Personally I found I felt cheated financially as there was nowhere near enough gameplay in this to warrant the AAAtitle price I paid for this at its release, sadly its been too long a time between me buying it and getting time to play through it to be able to apply for a refund. I would probably buy the next installment in the franchise, but I'd be wary of reading reviews to see how long the campaign is before commiting to the decision.

Great game, but it honestly so short that it feels like a demo, but one that you are charged AAA title price for.","Jan 3, 2018 at 7:46 PM",4, 8,
2022-05-28 14:53:20.191635,Teh_meeps,TOOOO SHORT,Fun game but right when things gets good the game ends :(,"Jan 22, 2018 at 8:55 AM",2, 5,
2022-05-28 14:53:20.207592,jbernady8,"Great start, but needs improvement","Great game, 3 stars because it feels incomplete.  When you enter a vehicle, screen is black until you reach your destination, transitions between custscenes are instant and movement between points is instant.  The game also feels a bit too scripted, almost like a movie with little player interaction needed.","Dec 18, 2017 at 11:36 PM",3, 3,
2022-05-28 14:53:20.223549,NielsNA,Too short,"not 20$ worth because it too short
but besides great game","Jan 23, 2018 at 3:20 AM",4, 7,
2022-05-28 14:53:20.239507,Unsmit,,For me it took a hour for it to load.,"Feb 1, 2018 at 7:58 AM",1, 3,
2022-05-28 14:53:23.332406,maka1870,Amazing,"This is a amazing tech demo prob the best out there, graphics are best out for the rift, wish they would make this into a full game, loved every minute brilliant experiance.","Dec 3, 2017 at 3:07 AM",5, 2,
2022-05-28 14:53:23.347366,neuoc,not short amazing,way way better than ithoght,"Jan 16, 2018 at 6:34 AM",5, 0,
2022-05-28 14:53:23.363323,LuluViBritannia,Easily the best VR game yet,"Batman : Arkham VR is a masterpiece. I know many people will argue : ""this is just a demo"", ""the gameplay is empty"", ""we can't move freely"".
All those complaints are true. Overall the game takes two to five hours to complete (depending on whether you'll rush it or explore and search the various Easter Eggs hidden around the different areas).
But despite the lack of actual gameplay, this game still offers among the best graphics for a VR game (obviously : this is Arkham after all!). Whether that be the textures, the models, or the reflection of the light, EVERYTHING is perfect visually speaking.
Sadly, there is close to no music at all, this is kind of a let down for me as the Arkham games usually offer us great tracks.
But a game, today, it's not just the technical aspect : it's also an atmosphere, and a scenario.
For the atmosphere, there is no argue here : we are definitely back in the Arkham saga. Everything is so grim! 
Story-wise, this is great but you have to know the Arkham games if you want to apprehend it. Indeed, Arkham:VR is tightly related to the other games! And, as nothing is easy for The Bat, nothing is explicitely said : you have to figure out by yourself what is happening, and when this game actually occurs in the Arkham timeline.
Besides, despite the few number of sequences, many of them are so enjoyable : whether that be the investigation on the crime scene in Gotham Streets, the inspection of dead bodies in the morgue, or the final act after the sewers, really, I don't regret playing this.

Finally, the puzzles were awesome. Some will argue that the game was easy ; I'll answer them ""how about you try decyphering the mystic radio message, by yourself? If you found it, that is..."".
So, in the end, this is Arkham VR : a poor gameplay (we can't move freely, and there is close to nothing to do, as the number of gadgets and their usefulness are limited), but a great story in a great environment. Definitely worth the price!","Oct 8, 2017 at 12:10 AM",5, 8,
2022-05-28 14:53:23.380279,bms1977,B the Bat,"The short experience and bare-bones gameplay is not much of an issue, because you literally are the Batman. This is one of those satisfying tech demos, that oozes quality, and tells you what the future of gaming could be like. If you could actually do some brawling in this, like the Arkham games, and had puzzles and a wider variety of missions, this could have been the best VR game out there. Too short and simple though.","Nov 11, 2017 at 6:16 PM",4, 4,
2022-05-28 14:53:23.396235,OculusArtemis,What VR Truly Is,"As someone new to gaming (VR is my first gaming experience) not only is this the most detailed VR I have experienced, it is also the most realistic.  WOW! It was worth every penny and then some.   I couldn't believe how 3 dimentional everything is and how I felt like I really was Batman.  Why can't all VR games be like this!? 

I only have one question? After the Asylum experience, is it complete?   I saw the ""Riddles"" On or Off, but wasn't sure what to do next. Please help!  Will a Batman game be coming out?  I will be the first one to buy it.","Nov 18, 2017 at 9:27 AM",5, 1,
2022-05-28 14:53:26.509045,mulbrich,Great!,Short but great!,"Dec 25, 2017 at 3:14 AM",5, 3,
2022-05-28 14:53:26.525002,patrickpilon,Really disapointing for the price,"It is more a teaser for Batman than an actual game... The short storie is extremely linear, you have to do one action after another in order to move foward. The graphics are good but I finished the game in 1 hour. 
If this is your first VR experience you might like it otherwise get a real VR game with your $.","Aug 20, 2017 at 4:26 AM",1, 8,
2022-05-28 14:53:26.539962,dcfreeman,Good stuff,"This is a decent demo. It is not a game. I felt like this was an experiment in what could be done in VR to move from game to interactive fiction. An excellent step by a major team, but everyone is still trying to figure this new medium out, so there will be bumps.  If you can keep that in mind, and forgive the interface clunkiness, it is a good time.","Sep 3, 2017 at 9:08 AM",4, 2,
2022-05-28 14:53:26.555919,lovaela,Wow!,"The experience was absolutely incredible, but I was so disappointed with how short it was! I want a FULL Batman game in the vr experience, it was fantastic! And creepy AFFF.","Aug 20, 2017 at 11:15 AM",4, 6,
2022-05-28 14:53:26.570879,blackhawkgrunt,Fun but way expensive and super short,WHy could they not develop a fuller game.  I would play 40 plus hours of this if i could.  This should only be a demo and should be free. charging people for this should be a crime.  About 20 minutes of game play.  thats a dollar a minute people.  looks beautiful and shows how good VR could be if it wasnt for lazy developers realeasing short as demos and charginf full game prices.,"May 21, 2017 at 6:32 PM",3, 19,
2022-05-28 14:53:29.676709,migus88,Too short!,"The graphics looks amazing, but I took me only half an hour to finish it. The name is misleading, so basically you are buying a ""Demo"" without knowing it. Not worth the money.","Jul 30, 2017 at 1:32 AM",1, 9,
2022-05-28 14:53:29.692666,berickphilip,"TOO SHORT, beautiful and promissing","This would be a very, very good game if it were a proper game and not a demo. It is really polished and interesting, but ends in a few minutes. Other games's free demos (in all platforms, consoles, PC etc) are longer, and free.","Jul 28, 2017 at 10:13 AM",4, 2,
2022-05-28 14:53:29.708132,bakuur,doesnt work,the game wont start after working for the first time. Can't get it to work and there is not a decent support for the game,"Jul 26, 2017 at 7:25 AM",1, 3,
2022-05-28 14:53:29.724089,Techraan,5 stars if it was longer.  So worth it,"I only gave it Arkham VR 4 out of 5, but it was still one of the greatest gaming experiences of my life, and I'm almost 50.
It's a dream of being Batman, come true.","Aug 7, 2017 at 1:56 PM",4, 1,
2022-05-28 14:53:29.741044,LowlyKnight,WHY YOU BOUGHT VR!!!!,"You're reading this because you spent an INSANE amount of money to be an early adopter of VR, and you did that to play THIS!  The short length of the game is honestly IRRELEVANT, you spent over $1,000 to have VR, do yourself a favor and spend $20 dollars so that you can BE BATMAN!!!  

Now for the game!  I had chills the entire time.  Graphics maxed out (I have GTX 1080 ti) and its the most realistic, beautiful, enthralling experience I have had to date.  After being Rick Grimes in Arizona Sunshine, and Neo in SUPERHOT, I finally got to live out my childhood fantasy of BEING BATMAN!

I would love for these guys to make a ton of money on this short experience and either make a full fledged game on their own, or have Oculus studios throw an insane amount of money at them to make a longer experience.  There's actually a story arc, there are gameplay elements explored that I haven't experienced in other games that are fantastic.  You feel like detective batman, which is my favorite batman.  The experience is phenomenal, and enthralling.  It's also much darker than I had anticipated, which was a pleasant surprise (parents be warned).

There is replay value here as well, collectibles and little secrets to go back and look for, which is a great excuse to spend more time in this beautifully dark world.

Do yourself a favor, treat yourself to this wonderful little gem, and vote with your wallet that this game would be wonderful as a full length experience.  Within mintues you'll find yourself tapping into you're lowest vocal registers and saying ""I'm Batman!"" ;)  CHEERS!","Apr 27, 2017 at 12:17 PM",5, 30,
2022-05-28 14:53:32.828939,L3xan,80% Bonus Content,"All I see about this game is that it's short and not really a game, so I was pleasantly surprised. The graphics, envorinments, puzzles, everything is AAA quality.  It is short as hell, even taking my time and really soaking it in, but there's also a large amount of Riddler puzzles.  That sounds bad, but I was actually having a lot of fun trying to solve them.  I think they make the game worth the price.","Jun 5, 2017 at 2:27 AM",4, 5,
2022-05-28 14:53:32.844896,jadewolfess,Wouldnt buy it,While i am a batman fan and was thinking this game would be amazing. It is like a demo and not worth the 20$ in my opinion it is worth maybe 5$ and even then it is stretching that 5$ so dont buy it,"Jun 24, 2017 at 11:13 AM",1, 5,
2022-05-28 14:53:32.861851,ghettopup,Amazing graphic and really really short,"PROS:
Graphics are outstanding. max all the setting out and you are in the world of Batman. Hand down the best graphics todate. and in some places so good i stepped back because i thought the joker was in the room for real. 

CONS:
-OMG short. THIS is more of a feeling of teaser status. just when it starts to get good credits roll. but there is bonus section to do the same story over and over and over to find easter eggs and then a match cards to unlock stuff. but its the same story over and over and ......
-You get to pick either car or plane and the screen goes black while you travel in said choice. WTF i cant drive either......
-Weapons = a grapple and CSI gizmo. 
-Some puzzles that are super easy. 
-$22 price tag. i mean come on this is what vr games are becoming? trailers, teasers. am i pissed at paying $22 for a game thats got F all for replay story... YES. i can only hope there is more coming. and free.
-ZERO fight scene you get to use fists, weapons. NOTHING.. you're more of the CSI batman then anything else. of find this bat xray that, grapple to plane you dont get to fly in, just a black screen and lots of cools sounds. Hey Grapple this!!!!
-Movement: just teleport and you dont get to choose they are premarked and very few spots.. no chance to explore the manor, cave nothing. 

this could be a 5/5 star but falls so short on its face. this is such a disapointment.

Over all, you want a exspensive thrill that lasts all of 30 mins. here it is at $22. aand believe me the graphics are just amazing. i will let friends try it just for that but, but at then end it will be the same responce. 

Was that it?!?!


Save your money wait for HUGE sale or update more content.","Apr 26, 2017 at 12:43 PM",2, 28,
2022-05-28 14:53:32.882795,user045,Best in class graphics,"When i was taken to the opening city screen i was in awe of the graphical style and sense of realism. The sound was immersive and helped to create a sense of really being there. The work and polish that has gone into this game (sound and graphics) really stands above the crowd. The game itself is pretty linear and I couldn't be bothered with some of the frustrating puzzles. I just wanted to see the next location and look around with that feeling of being in another world. Given the work that has gone into the AAA quality, incredible value for money. Plays a bit with the mind though which I'm not keen on. I wonder if developers consider that playing with the mind in this way has the potential to cause lasting distress. Otherwise I would have given it 5 stars. Being able to get to each scene faster would make this game better. I say game because you can interact and play around with things despite the story being linear. Very good.","Apr 1, 2018 at 3:23 AM",4, 3,
2022-05-28 14:53:32.901744,seele96,To short for its price tag,"This game is just 1 hour of gameplay. Dont give me that riddler scavenger hunt excuse, Its 1 hour, that's it. But its brilliant, beautiful and highly entertaining. It's FAIR price should be $9.99. Please do not buy this at anything above $9.99. Do not give studios the idea that they can charge anything above 10 dollars for an experience that is shorter than a movie.","May 8, 2017 at 2:06 AM",3, 11,
2022-05-28 14:53:36.015022,geoffmccabe,Not what I was hoping for!,Very disappointing game despite the very high attention to detail.  It's basically a series of puzzles that I found very boring.,"Jul 18, 2017 at 1:16 AM",2, 2,
2022-05-28 14:53:36.030980,FernandoCarrillo,BATMAN!,Cool game. Really makes you feel like batman.,"Nov 17, 2017 at 4:58 AM",4, 0,
2022-05-28 14:53:36.046937,cwag,not worth the price,first time i have paid for a demo. (i paid for it thinking it was a game; wrong) has promise if they actually had real VR game developers and not the laziest and cheapest they could find.,"May 29, 2017 at 3:04 AM",1, 9,
2022-05-28 14:53:36.061896,Habboub21,game keeps on crashing,"i just bought this yesterdayand after re installing it 3 times,batman vr still keeps crashing and wont let me even get to the main menu. please fix!","Jul 15, 2017 at 11:35 AM",1, 3,
2022-05-28 14:53:36.078851,RLSinCO,Read this = there is more value,"First off, I am writing this review on 5/4/2017 - ""May the fourth be with you"" date.  There is a reason - the joker could easily say ""May the Force be with you"" (a sharp eyed reader will know why in the credits!).
This game shows the potential and future of VR - it is stunning.  Yes, it is short but people are forgetting there is another experience after finishing the game by solving all of the Riddler's puzzles.  Once you solve a riddle/puzzle, you either unlock a character or vehicle which is very cool!  So overall there is more playability here than what others state.  Graphics are superb, - don't forget to go into options and turn up the pixel density.  Oh, and an undocumented feature: place your hand up next to your head and press the grab button - it zooms in to whatever you're looking at. Kinda cool albeit provides no functionality in the game... 
And lastly, I'll give you a more detailed clue why there is a huge Star Wars connection here...look at the credits and pay attention to  who voices the Joker in this game ;-)
A recommended buy for $20 and it ensures future development for a full length experience!","May 5, 2017 at 12:46 PM",5, 8,
2022-05-28 14:53:39.178186,Dropla,Expansion needed ASAP,"I don't really have an issue paying like $20 for a portion of a AAA game. This being said, it IS what it feels like, a portion of a game. Being that most AAA games are around $60, I feel like if they throw out expansions fast, before we all feel soured on it, they can save the game. I ALSO would love the option to see a driving/flying screen while Im loading rather than pitch black.  So ...ya...I needa be Batman summore.","Apr 28, 2017 at 1:04 PM",5, 10,
2022-05-28 14:53:39.194143,Miku29,Amazing but to short for price,"So like everyone else is saying this really is amazing and rocksteady did a fantastic job and it's one of those games / experiences you need to have in your VR library, BUT 14.99 is a bit much for how short it is. It kinda feels like playing a big demo of an upcoming game but sadly its not a demo. So to sum up it's amazing and a must try but its not a big game and the price is abit much for the length","May 11, 2017 at 3:28 AM",4, 3,
2022-05-28 14:53:39.210101,djdavies,This is not a game,"Its not clear youre paying $20 for a demo.  A nice demo, but come on!!","Jun 2, 2017 at 12:04 PM",3, 8,
2022-05-28 14:53:39.226058,StarWarder,Beautiful and as short as a demo,"The graphics quality was top notch. The scenes are beautiful and cinematic. The game length is like one hour. When the credits started rolling, I thought I completed a prologue and the real game was about to start, I kid you not. Joke's on me.","May 13, 2017 at 3:10 AM",2, 12,
2022-05-28 14:53:39.242016,VampireNZ,We need more!,"Remember - Always be yourself....unless you can be Batman, then you should always be Batman.

Awesome graphics/models and story, hopefully a sign of more to come...please! Plenty to go back and do after you finish the 'main' story with all the Joker stuff. I need me some of that 60's Batmobile action.
So many awesome Batmobile models - be such a waste to not use them for a full story,
I am throwing my wallet at the screen but nothing is happening...","Apr 30, 2017 at 6:06 AM",5, 3,
2022-05-28 14:53:42.345842,NG12,We all know what to expect at this point,"At this point, we all know this is a glorified demo. It is $20USD for about an hour of entertainment. If you are like me, you can share that entertainment with your kids or a friend. Much worst ways to spend $20. Cool way to show off VR but, so is Google Earth. Depends what you like. For Batman fans, it is worth $20 to be him for an hour and to see the Batcave for a bit.","Apr 30, 2017 at 1:04 PM",5, 11,
2022-05-28 14:53:42.361799,Soliptic,Very Short.....,"I think Oculus needs to get involved here and govern the cost of these games based on the actual game play. This game was amazing, but it was SOOOO short. Not worth $20. It was a short experience, likely worth $10.","May 4, 2017 at 9:04 AM",5, 5,
2022-05-28 14:53:42.377756,Wildcard999,Excellent,"Even though it is short, I will still give this 5 stars. The graphics were amazing and I was totally immersed. Well done. Please bring us more. That ending was amazing.","Apr 26, 2017 at 10:55 AM",5, 10,
2022-05-28 14:53:42.394711,nursenicky,Way too short,"While all the graphics etc are amazing, it's pretty underwhelming considering the shortness of the game. Way too short for $20.","May 8, 2017 at 6:36 PM",1, 8,
2022-05-28 14:53:42.411666,Jones,Impressive but very short,"One of the best looking games for VR so far, shows the potential that VR can look as good as monitor games! Unfortunately its just a short episode with very limited gameplay, would love to see more devs!!!","May 1, 2017 at 4:03 AM",4, 5,
2022-05-28 14:53:45.506560,Fun_Vampire,Fun but very short,"Pros: This graphics are amazing! The sounds, character models,  and overall feeling you get while playing are really great! You can play through muliple times to unlock hidden items.

Cons: Very short. When the credits rolled, I was expectating a whole bunch more. 

Summary: They put great work into creating the start of this game. Now they just need to add a few more hours of game play.","Apr 30, 2017 at 10:10 AM",4, 2,
2022-05-28 14:53:45.522517,AnotherCrazyCanadian,"Great graphics, bad length","This is a very good showcase to show fans of batman or just VR in general, but if you're looking for a good valued VR game, this isn't it. I'm perfectly contempt paying $23 for this as I know a lot of work went into it, but it's too short for me to give it a 5* rating. Perhaps if there are free expansions then I'll review this rating. If you enjoy VR and don't mind short length games (about an hour), then this is very much worth it.","Apr 29, 2017 at 8:59 AM",4, 2,
2022-05-28 14:53:45.538474,AliceTransWoman,True VR Experience,"DC,WB,Rocksteady, what more could anyone ask for when involving VR. This game is really short but comfortable experience. i was looking forward to how this was going to end. but now i really wish it didn't end that way, what happen to batman or did the jokers death make him crazy? if i had any requests catwoman model because she's awesome. poison ivy model & new act or combat simulation that has slow motion matrix style when breaking bones. also blocking with grabs be really sweet. I recommend this game! P.s you could also make the radio scanner give repeatable police missions.","Apr 28, 2017 at 11:22 AM",5, 2,
