scrapping_date,review_author,review_title,one_reviews_text,review_date,review_rating,review_helpful,review_feedback
2022-05-28 15:00:54.707827,F4CEpa1m,The Best VR Short Story on a Few Levels,"Hands down the best VR short story I've experienced.  Exceptional.

For the price (AU $10) it's more than worth it, easy to watch a couple of times, and a perfect VR story to show your friends or people who want to know what VR short story telling can do.

I was emotionally invested within the first 10 minutes and everything that unfolded in the story meant something to me.  This one sets a high standard and I'd happily pay AU $20 for an hour and a half movie just like this, and I'm sure a lot of people would.  For those whining about the price, get a grip, it's a large coffee ffs..

If you like any of the following:  VR, short stories, Sci-fi, then you should pick this up for sure.  It's polished, looks great, has AWESOME sound design and music (Junkie XL) with an 80's neo noir synth thing going on that I love.

Trying not to sound like an advert here but I can't fault it.  +1

x_0","Oct 11, 2018 at 9:36 AM",5, 6,
2022-05-28 15:00:54.723784,FunkyLasagne,Great stuff,"Good film.  Interesting story.  It is similar to the original short stidy with some important differences to make it its own thing - more ""inspired by"" rather than a film of.  Scale is a little small for my liking (I prefer life-size), but I can see why the makers made the decisions they did.  Some small technical issues towards the end - lip synch for one of the characters (and only one funnily enough) is out, but it doesnt detract too much.  Overall I really enjoyed it and at a fiver it is excellent value.","Oct 11, 2018 at 3:20 AM",5, 3,
2022-05-28 15:00:54.738744,nickladd,Worth Checking out,"I don't believe that this film has played to the strengths of the VR medium. I think it's an interesting short with a good production quality. But as a ""VR film"" it doesn't offer much that you wouldn't get watching it flat screen.

This is treated more like a regular film than any other VR film I've seen with hard cuts, changing angles, pans, etc. It doesn't usually work that well because it either makes the viewer feel a bit queasy, confused after a huge scale change  or disoriented. Other than taking in the environment there is little incentive to look around. The action is usually directly in front of the viewer. I felt more like I was a camera and not immersed in the world.

There is one shot I did really like where the two main characters climbed up a building each taking a different route. This was interesting because there were few cuts during this sequence allowing you to follow either of the protagonists. This can make for interesting VR storytelling and encourages rewatches to see areas you might have missed. I wish more of the film had been shot this way.

It's not expensive and if you're curious I'd say it's worth checking out.","Oct 11, 2018 at 9:25 PM",3, 2,
2022-05-28 15:00:57.843440,HurricaneZulu,Rated G for everyone,"A little boring, story is OK, not going to be as exciting as PG13 block buster. A kid would probably enjoy this, at this no ""thrill"" level.","Nov 28, 2018 at 10:42 AM",3, 0,
2022-05-28 15:00:57.859397,Anomalous2141,Marvelous Tech | Not So Great Story,"I'm breaking this review into two categories because the technology is still new:

The Tech: This is gorgeous to look at, and the way the story is told sets a gold standard future story-driven VR cinema should aim for.  Other people mentioned the shifting scale; I noticed it too, but assumed it was for resource management.  If there was another intended effect I didn't see it, but it didn't bother me much.  The world this story creates is fantastic to experience and I look forward to future VR films that put you in the world.  Bravo!

The Story Itself: I just wish the shiny wrapping paper disguised a better gift.  The story was dark, dreary, depressing: I did not enjoy it at all.  Not sure why this story was chosen or even what the takeaway is supposed to be.  It felt like reading a bad community college short story in beginner fiction.  I realize it's based on a story by Philip K [LAST NAME REDACTED; OCULUS THINKS IT'S PROFANITY].  I think the guy was phoning it in that day.  Call me crazy but I like to enjoy the movies I'm watching.  Still, I'm sure others enjoy a darker experience more than I do, and the pricetag is perfect if a little on the cheap side to be honest.  I was tempted to give this a three-star review because I hated, hated, hated the story, but what the heck: it was worth every penny.  All five hundred of 'em.","Oct 23, 2018 at 12:59 PM",5, 0,
2022-05-28 15:00:57.875355,Mandroid0,Wish it worked,"I have had an oculus for nearly 2 years and have dozens of titles. I purchased, installed, re-installed and still this will not play for me. Always just shoots me out to my home screen. Paid $5.99 for a frustrating afternoon instead of a 30 minute joy filled video.  :(","Oct 24, 2018 at 1:54 AM",1, 1,"Hi Mandroid0, we're really sorry to hear you're having issues with The Great C. We'd like to look into the issue and see if there is anything we can do. Please reach out to us at thegreatcvr@secretlocation.com and we can try to work through the problem!"
2022-05-28 15:00:57.891312,Lotom,Amazing VR Movie,"I am so glad they released this to the stores and didn't keep it just for the film festivals. This is a really good experience, especially with full cinema mode enabled.","Oct 10, 2018 at 3:03 AM",5, 3,
2022-05-28 15:00:57.906272,vdwtanner,Very cool experience!,"It was really neat to see an animated film in full 3D, and I must say that I was thoroughly impressed with the quality of the art and the amount of realtime lighting! I think I only had one or two hitches on my GTX 970, so hella props to the team! My only complaint with the experience was that towards the end the voices got out of sync with the mouth animations. Other than that it was really great though :) I watched it in the cinematic camera mode without getting any VR sickness, but if you are really prone to it they have a version that is supposed to reduce the chance of feeling ill. Enjoy!","Oct 13, 2018 at 2:23 PM",4, 0,
2022-05-28 15:01:01.005982,grekb,It was ok...,"It was ok but could have been a lot better.
Graphics: 5/10
Animation:5/10
Sound-Voice:9/10","Nov 12, 2018 at 6:13 AM",4, 0,
2022-05-28 15:01:01.021939,ratblast,,"What can i say , it is a half hour long movie . I found the first half to be boring to
the point that i thought of getting my money back. But the second half was better .
Yes it looks much better than what i have seen done by others but not worth the price for a single watch and than delete .","Oct 11, 2018 at 7:34 AM",3, 0,
2022-05-28 15:01:01.036899,RonnyBullet,awesome,how long til part 2 comes out? :P,"Oct 16, 2018 at 2:27 AM",5, 3,
2022-05-28 15:01:01.052856,shiinobi,Amazing,This movie is amazing....hope more movies like this is coming to VR...wondering if they gonna make a second part of the The Great C,"Oct 11, 2018 at 11:19 PM",5, 1,
2022-05-28 15:01:01.067816,AgentKain,A great watch and a must have.,The price is good and its nice to see virtual reality being used to tell wonderful stories. Highly recommend!,"Oct 12, 2018 at 3:10 PM",5, 0,
2022-05-28 15:01:04.167526,rodney6587,nomad,prerry cool little show graphics were cool but not long enough to be worth 6 bucks,"Oct 11, 2018 at 10:23 AM",4, 0,
