scrapping_date,review_author,review_title,one_reviews_text,review_date,review_rating,review_helpful,review_feedback
2022-05-28 14:48:07.323612,ccdeltabeta,My Alpha and My Omega,"Played on a i7-8700, 16GB RAM, GTX1070Ti with a Rift S. Observations are as follows:
- The game can be played on my rig on up to Medium Graphical Settings with no noticeable frame skips.  The graphics are more than serviceable, given my aging graphics card.  
- Game controls are adequate, and mostly do a solid job. The main complaint is the pitch control which moves at only one speed: fast. The roll capability is an absolute blast to use, and literally puts a new perspective on any level I am on.
- The game was stable from start to finish with no with no crashes, but did experience a few 'loading screen' pauses during gameplay.
- My first experience with PCVR was Lone Echo on a Rift, and what an experience it was. It literally introduced me into a new universe, and hooked myself to VR ever since.
- Nearly 4 years later, I am re-introduced to this universe, with feelings of joy and bittersweet sadness.  Joy because no one fleshes out a space opera like this developer; bittersweet because no other developer has done a space opera like this since Lone Echo I.
The game is quite enjoyable, is highly immersive, and begs further exploration to discover everything that has been created.  One down side is that the general gameplay mechanics did not evolve much beyond the original game, aside from a a few, new, neat tools.  It was unfortunate the majority of the game was doing 'fetch quests' in a absolutely gorgeous environment, but the immersion and scope alleviated this annoyance.
- When I mentioned 'space opera', scenes where I am playing Jack while literally between Liv and the Doctor, and seeing the emotions and expressions on their faces made me feel connected to this game in a manner few games have done. I started to feel like I have a personal stake in the game, and that a successful outcome is important to myself.
In terms of scope and majestic presentation, Lone Echo II delivers in spades. A magnificant finish to a wonderful series. Thank you, Ready at Dawn.",Nov 7 at 9:18 AM,4, 1,
2022-05-28 14:48:07.341565,Conr0n,2nd Best VR Game Ever,"I love this game, I really do. I love this studio. The first game is still the BEST vr game I've ever played. This game is an amazing continuation of the original and really expands on the lore of the lone echo universe (or I guess echo universe as a whole). It's neat seeing the echo combat units be involved as well as our favorite ship AI ;). Where I feel this game falls short though is it's gameplay pacing as well as the conflict. I constantly found myself waiting around for characters and dialogue to catch up. And it's not even that I was going fast it just felt like how much I could explore was defined and slowed by the characters. Also, the conflict in the story felt.. nonexistent; artificial. While it does expand on the time travel aspect a bit more I would have loved to have part of the game show the reality of life after the infection, rather than just hinting at it from time to time. I would have also loved more time with the combat units. That likely would have been an interesting side plot and I wish we could have seen more of that. I was never worried about any of the characters since bad things only ever happened when they WEREN't around. The ending (which I refuse to spoil) was a rather interesting twist that left a bad taste in my mouth; that waaas until after the credits which while it did cheer me up.. definitely had a few plot holes. Otherwise this game is amazing I hope to god that we can get some true closure on this series from RAD since the way this game ended is going to leave many unsatisfied",Nov 7 at 9:41 AM,4, 1,
2022-05-28 14:48:10.452848,Al_Poe,Wireless - even better than Part 1,"Part 1 was very impressing - one of the best VR games aside HL Alyx. Part 1 I played with Rift and cable, which already was a great experience, but Part 2 is stunning - I play with Quest 2 wireless and the graphics are gorgeous, no lags (RTX 2070 Super). There are are very few VR games that have such great collision detection and immersion.
.",Oct 22 at 5:50 PM,5, 2,
2022-05-28 14:48:10.471305,Punitive,The Best Money can Buy,"I have been waiting for this game to release for years since Lone Echo 1 first came out. After every delay I was dishartened and feared for the worst but that waiting has payed off in one of the best games I have played period beating any pc or console games. 

It has been a long time since I have gotten chills down my spine and squealed like a little kid which I did multiple times playing. You can tell how much heart was put into every aspect of the games and it pays off. The Art, Environment, Character models, writing, and everything is top notch and looks and feels amazing. This game was one of the first vr games that had new innovative movement and interaction mechanics with this sequel it only expands and builds on them. While Many old players will be familiar and comfortable with the game new enconters and puzzels will provide some new intensity and fun! (If you are looking for more narritive story it definatlly takes more of a forfront in this game)

This game is not without flaws which I can summarize is why it was delayed to the extent it was. THIS GAME IS GRAPHICS INTENSIVE my computer is pretty good and I play on my quest 2 with a link cable. Rendering times are a issue as well as sudden pop up loading screens (generally short). Also distant locations and objects are a little deformed. But other then that the game is absolutlly stunning espesially faces. (I have also heard about some trouble for language support)

This is a definate recommend for anyone that wants the best AAA vr experiance that can be purchased today.",Oct 13 at 4:47 PM,5, 3,
2022-05-28 14:48:10.489257,Mach13-13,Played on Quest 2 Air Link:  A-M-A-Zing!,"Loved Lone Echo 1.  This new version is just inspired...Its similar and yet feels very very new.  quality is exceptional, game play visuals are stunning as is the sound. Storyline picks up from LE1 yet it twists toward a new experience in an amazing way.
This has to be an award winning game.",Oct 22 at 8:51 PM,5, 2,
2022-05-28 14:48:10.507209,Tabbarn,10/10,"Not only is it the best VR game I've played but one of the best games I've played, period.",Dec 2 at 3:55 AM,5, 2,
2022-05-28 14:48:10.524163,Zachzul,Maybe the best VR experience of all time,"For me, Lone Echo 2 is one of the best VR experiences and also one of the best gaming experiences of all time - and I am playing video games since around 1980. This is a ""must buy"" for every VR gamer.
Yes, there are some technical issues, but nothing that's really game breaking.

To all players with performance and technical issues: Try to disable ""Adaptive Resolution"" in the settings. At least for me, this did the trick (3060Ti). It doesn't solve the problem with textures loading too late or not at all, but aside from that, everything ran smoothly for me after having deactivated this setting. Before, it was borderline unplayable.

It's really sad, if not tragic, that this is supposed to be the last RAD game for PCVR. Such an experience, unfortunately, isn't possible on the standalone Quest 2, and I doubt that it will even be possible on the next generation of standalone headsets...",Oct 21 at 5:00 PM,5, 2,
2022-05-28 14:48:13.603032,Tummie555,A W E S O M E,"Yes it needs a little patch for performance, but the scale and detail, the freedom to explore everything as long as you want, the thrilling story and believable characters, I actually feel like I have been to space because of LE and LE2. It's a masterpiece in (VR) gaming history.",Oct 18 at 8:01 PM,5, 3,
2022-05-28 14:48:13.620984,Final_,Amazing,This and Lone Echo 1 are probably the 2 most beautiful games I have ever played by far,Nov 23 at 12:41 AM,5, 3,
2022-05-28 14:48:13.637938,Can0123,Must buy for any new vr user,"I'm a very vr defendent person and when I played the first Lone Echo I was hooked, then this while later I see a youtube video labled ""Lone Echo 2 (Part 1)"" and I instantly got on and played. Once i was done with the first hour I could not stop. The game is about a 10 hour story not including the side missions, Personally I would like a lot more story as a lone echo 1 player but overall even if you didn't play/see the first game you can still play this no brainer.",Oct 20 at 7:07 AM,5, 2,
2022-05-28 14:48:13.655891,steveclarke2003,Have a 3 for crappy tutorial start,"Its been so long since Lone Echo 1 we apparently have to go through the whole tutorial of how to play Lone Echo again. God i hate long boring tutorials. We are obviously morons.  Glad it has no Spanish though! I think comandos was the last Spanish game worth anything and that was like yonks ago, Quit siesta and start tapping out a game if you are so concerned",Oct 16 at 11:57 PM,3, 3,
2022-05-28 14:48:13.675837,CasualCheetah,It's certainly more Lone Echo...,"It's certainly more Lone Echo, but the sequel doesn't change much of what we've already seen.

There's a truly excessive amount of dialogue throughout Lone Echo 2. Most of it is delivered via planning, directions, or affirmation instead of expressing emotions for a real story. Furthermore, it gets hard to stay engaged when every progressing event is preceded by a complication that's both horribly tragic and easy for the player to circumvent. 

The value of gameplay pales in comparison to the emphasis Lone Echo 2 places on its presentation. It was exciting to receive new tools, but even the sparse applications of these mechanics can begin to feel repetitive. The appealing idea of “space maintenance” doesn’t extend beyond following directions or looking around for objects. I would go as far as to say that there are no multi-step ‘puzzles’ in Lone Echo 2.

Despite all those complaints, the primary draw of Lone Echo 2 has to be its scenery and, pun intended, atmosphere. Being adrift in various complex sci-fi settings is a uniquely VR feeling. At a higher resolution on more powerful hardware, I imagine this sensation would be even grander. (The game also runs reasonably well on the original Rift with older hardware.)

Ultimately, the game is mostly an interactive ‘experience’ whose simplicity might be a perk for some audiences. If you're looking for more of Lone Echo's space-narrative and don't mind some mundanity, this sequel will fit the bill.",Oct 15 at 7:02 AM,4, 3,
2022-05-28 14:48:16.768682,DrFuLLAuTOSMG_on_TT,Worth the 4 year wait!!,"Although I have only had the oculus rift s for about 5 months now I had found some of the most addicting games that got me hooked on VR. I looked at Youtube videos explaining the best free games on the oculus store to get and Echo VR happened to be one of them. I play the game repetitively so much to the point where I am more than interested about the origins of the game that I eventually get into contact with people who had played on the ""original predecessor"" version of Echo VR. I was later informed that the game had first started off as a solo campaign about space exploration and the origins behind how Echo VR came to be and that the title in mind was Lone Echo. I had bought the game not knowing that it had LOTS of easter eggs hinting towards Echo VR before the game had it's multiplayer release indicating two teams colored in both blue and orange opposing each other as a well known 0-G sport. I then complete the Lone Echo campaign left on a huge cliffhanger, hoping that there might have been a second game already out I was sadly mistaken. Looking at videos all over the internet explaining the delays that Ready at Dawn had been experiencing i was more than happy to paitently wait for a game that had held me at a shocked state at how impressive the first game's experience actally was and soon enough the Lone Echo II release came out and I was surprised to see so many returning elements come back from Lone Echo and more or less had some outstanding reworks!",Oct 19 at 8:56 AM,5, 2,
2022-05-28 14:48:16.786635,ROCKET-,The best VR sequel to date!,"This game is absolutley mind blowing, there are no other words to describe it. The game picks up directly after the events of the first game and is packed full of refrences and connections, especially during the ending and the amazing post-credit scene. The game plays exactly like the first game, but feels different, it is a feeling unlike any other. The story was incredible and the scene where you get to play in a Combat chassis was done very well and was probably the most exciting part of the whole game. This is a must buy for fans of the first Lone Echo, the sequel was well worth the 3 year wait.",Oct 20 at 3:13 PM,5, 2,
2022-05-28 14:48:16.804586,jonas.evensen.9041,the game crashes,when i was in the pod to be able to respawn mission it crashed suddenly i deleted the jack_backed_up_radsave then the game launches and when i press play it goes into the main menu but when i press continue it doesnt load it goes into infinite loading witch is dissapointing i cant seem to find a fix,Nov 3 at 2:48 AM,3, 1,
2022-05-28 14:48:16.823535,akittsy,Brilliant game so far,I’m playing on a gtx 1060 on medium settings and all is good so far no crashes and enjoying it well worth the money now a couple of hours in this game is brilliant buy it you will not be disappointed 5 star,Oct 16 at 4:29 PM,5, 6,
2022-05-28 14:48:16.842485,Maej78,A worthy successor to Lone Echo 1,"The first Lone Echo blew me away as one of the first VR games I played. Years and many games later the expectations were high and Lone Echo 2 delivered. I was hooked right from the start and couldn't stop playing till the end. The story was captivating and the gameplay fun. It feels bigger and more open than LE1, there is also more variety, and a good narrative that unfolds as you play. The graphics even on the default low are breathtaking and the controls are sublime.

There are some issues though, nothing game-breaking for me, just a little irritating, but hopefully they will be fixed.
Sometimes objects would fail to load their HD textures making them appear as fuzzy amorphous blobs. This happened often with the base generator section for me, sometimes with the ship and asteroids too. I found it was usually fine at first but got worse the longer I played, so occasional restarts would help, though I never really found it getting in the way, just a minor irritation.
I also suffered from occasional crashes where the headset would lock up for a second then go blank and the computer would restart itself a few seconds later, though this might be my hardware as it turns out my Rift cable is damaged and spares are no longer available. This would happen perhaps once every 3 hours on average, so just a little frustrating really, not a game breaker.
The ending... well all I'll say is it's worth watching the credits to the end.

Overall I thoroughly enjoyed playing this game, to me this stands out as a beacon of how to do a VR game properly. A worthy successor to LE1 and absolutely worth the money.",Nov 3 at 8:24 AM,4, 1,
2022-05-28 14:48:19.940812,Dio,Stuck...,"I get the tram started and go to the destination once there the doors do not open. Tried like 10x now and the same thing.
Aside from that, nothing bad to say at all. It's a really great game on all levels !

EDIT: I re-started my game and it worked, the hatch open on the tram and I was able to continue. Maybe this will help someone with the same prblem I had.
So stuck problem fixed.",Nov 7 at 8:57 PM,4, 1,
2022-05-28 14:48:19.959762,Rahat101,One Of The Best Vr Games Out There!,"I normally do not review any games but Lone echo 2 was an amazing experience that I have to review. Everything about the atmosphere,visuals,sounds,story and characters is perfect.The ending of the game left me emotional which is a rare feeling that I do not usually get playing games.By the end of the game I felt like I truly  cared about olivia because of how much we've both gone through in both games. 10/10 It's a MUST BUY",Oct 19 at 1:16 AM,5, 2,
2022-05-28 14:48:19.976716,soistheman,PCVR needs more like this qualty games,"Great story, animation, voice acting, and graphic, but optimization isn't so great.",Feb 10 at 3:21 AM,4, 1,
2022-05-28 14:48:19.995665,vadzvnik,could be a great experience..,.. if all the blurry textures were loaded. 40% of the game looks creepy because of that. maybe some day...,Dec 11 at 2:18 PM,2, 1,
2022-05-28 14:48:20.013617,Hhawk2000,saves lost / graphic glitches,"I moved the game to a faster ssd.. and lost all savings.. have to start over again ...
A fast ssd avoid loading times but , ive a 3080 , and even all set to high, ive graphic glitches , los res images and stutters between levels.
After waiting so long... isnt polished...",Oct 15 at 11:31 PM,4, 3,
2022-05-28 14:48:23.110434,Sakkura,"Competent, but does not add much","It's overall a nice extension of Lone Echo I, but the fundamental formula does not change much. The game is still quite pretty but also very demanding. Textures seem to be a bit buggy at times, seeing a blurry mess next to a sharp texture is not unusual. The story was IMO slightly less emotionally impactful than the first game, but it was very nice to see Jack and Liv's journey completed. 4½ stars if there was such a thing as half stars.",Nov 2 at 7:30 AM,4, 0,
2022-05-28 14:48:23.128386,Syntax3rror,Realy bad performance with good pc,Realy bad performance with good pc. The Performance with lone echo 2 was much better,Nov 10 at 1:20 AM,1, 5,
2022-05-28 14:48:23.146338,ZimaPriblizhaetsia,Very Nice,"Very nice! Immersive and fun, this must have been extensively tested before release because I did not encounter any bugs. Given the game's level of excellence, my routinely received six scam calls a day were especially annoying, as they broke immersion. These scam callers owe me and the game developers money for those occurrences! Otherwise, Ready at Dawn Studios, congratulations and thank you for this fantastic game!",Oct 17 at 5:03 AM,5, 1,
2022-05-28 14:48:23.165287,Kynia,Crashes making the game hard to love,"Love the first game.  Was loving this game even more...until the crashes started.  After repeating one section four times because of crashes, figured it was time to write a review.

Devs, you made a phenomenal game.  Fix the stability issues and this 3-star review will easily become a 5-star review.

Playing on Quest 2 with Oculus Link cable.",Nov 1 at 9:06 AM,3, 1,
2022-05-28 14:48:23.183239,Alex_111009,I keep getting stuck on a black screen,"After i get through the booting up scene I keep getting stuck in a black screen. I've tried do it 3 times again. please, just please fix this so I can play, I played the first one and it was so good and I want to play the sequal but I can't because of a bug. (I think it's a bug)",Oct 25 at 3:56 AM,2, 2,
2022-05-28 14:48:26.279532,david.yarker,"1,000,000 / 5 stars","Probably the best story of any game that i have ever played. LE2 is genuinely the most immersive, interesitng and fun game i have ever played. It feels like everything that felt wrong with lone echo is completely fixed in this sequel. For example it fixes the somewhat isolatyed atmosphere in lone echo as well as your tasks being crucial to the story of the game in comparison to lone echo that dumps all the objectives on you and you essential act as what youre there to do, fix things.  The massively increased narrative scenes also make the game much more enjoyable considering i would say there is probebly 10X more ""story line"" scenes. The way the whole game flows together in amazing and the sequel has an intersting ending to. Also, make sure to wait for the credits to end unlike me!! and apart from the few crashes i wouldnt change a thing, its a shame i cant rate more than 5 stars :)",Oct 16 at 7:57 AM,5, 2,
2022-05-28 14:48:26.298480,roboman54,Great Game,"Over all a great game, from the gameplay to the story line, that ending blew me away. 12/10 In my opinion. Rather good ending I think with a nice little twist that makes it even better. Well done Oculus Studios!",Nov 2 at 4:09 PM,5, 2,
2022-05-28 14:48:26.316432,alucard8679,The Best Game Of VR no doubt,"i wont say anything else, just play and enjoy it, better than alyx alot",Nov 20 at 11:58 PM,5, 3,
2022-05-28 14:48:26.335382,Jacob12thman,Won’t load for me. Need help,I was able to play a little bit at first. But now it gets stuck on the loading screen and eventually crashes. It ran the first game beautifully. But for some reason it won’t run the second one. My graphics card is a Nvidia GeForce RTX 3050. Much more than enough for the bare minimum graphics. And I have a terabyte hard drive. And I update my drivers. Yet on the bare minimum settings it gives that red X on my drivers and a warning on my memory. I know it’s a laptop and not a pic tower. But with the specs it should be able to run it. What should I do? I will update this post once I can get the game to run properly,Jan 6 at 11:38 PM,2, 0,"Hey there, sorry to hear you're having loading/crashing issues. If you join the Lone Echo II Support Channel of the community Discord, we'd be happy to help you troubleshoot."
2022-05-28 14:48:26.352337,VM-Mark,Gave up (for now),"Can’t play! It has major graphic glitches and keeps crashing back to the menu screen!
Gave up trying! Needs patching.
My PC - Ryzen9 5900, 32g ram,  RTX3070",Oct 16 at 5:28 PM,2, 7,
2022-05-28 14:48:29.433703,Bellthen,Bug,When I first started playing the game i did the stuff the then I was booting up it on the part where the robot boots up and it went into a black screen on my computer and on my quest 2 please fix this. I would of give this a 5 star if the bug wasn't the but right now it a 2.   Update I just unistall in reinstall the game and it works great,Oct 13 at 4:10 AM,5, 2,"**Update: Glad to hear your issue was fixed!** Hey there, there could be a couple of things going wrong here to make you see a black screen. If you join the Lone Echo II Support Channel of the community Discord our Devs can help you troubleshoot this: https://discord.com/invite/vXbazs5"
2022-05-28 14:48:29.451655,NtsFranz,Best single-player VR game of all time.,"Haven't finished yet, but so far it is beyond everything else. Pretty similar to LE1, but slight upgrades all around. The movement system is what makes this game.",Oct 13 at 9:14 AM,5, 7,
2022-05-28 14:48:29.470604,forddieseltrucks,LIV STOLE MY HEART,"I know this is just a game and liv is fake, but the storytelling is soo good, I played the original lone echo 2 years ago and I develped feelings for liv, in part 2 I will admit, a tear or 2 dropped at the end from all the emotions this game will put you through.",Oct 20 at 12:24 PM,5, 2,
2022-05-28 14:48:29.489553,Sidekick,Need more traduction,Miss a french and others traductions.,Oct 14 at 1:15 PM,3, 23,"Hello, as we tackled obstacles in development, we had to make some tough choices. One of those choices was to not localize Lone Echo II and unfortunately we don't have plans on the roadmap to localize the game. Thanks for sharing your feedback with us on this."
2022-05-28 14:48:29.507505,Seleuco,Not even spanish subtitles...,"No locatization -> No AAA  :(

Sorry, Ready at dawn. Really good work. The game is fantastic, but not even subtitle localization is a facebook bad joke...",Oct 20 at 1:49 AM,1, 11,
2022-05-28 14:48:32.608328,CapriciousArt,Couldn't get the game to even start up,"When launching the game, I'm immediately greeted by an unknown error which crashes the game. I spent $40 on this game only for it to not even launch.",Oct 17 at 4:00 AM,1, 6,"Hello, sorry to hear you keep crashing on start up. The most common causes of crashes like that are due to overclocking or an antivirus blocking the game. If you'd like, our Devs would be happy to help you troubleshoot this in the Lone Echo II support channel of the community Discord: https://discord.com/invite/vXbazs5 ."
2022-05-28 14:48:32.627278,Quarz_,Dissapointing,I really enjoyed Lone Echo 1 so I was very excited for this game. But I guess I got my hopes up too soon. This game is unplayable. I can't even play for 15 minutes without it crashing. Very dissapointed.,Nov 14 at 5:57 AM,2, 1,
2022-05-28 14:48:32.645229,pepeseagames,Does not run,"So this gam literally does not run, and when it does it runs like garbage, for context I’m the guy who plays half life Alex with ultra specs on everything, and the pc was no even warm, so no not my fault. I’m just getting a refund. Don’t buy in current state!",Nov 10 at 12:07 PM,1, 3,
2022-05-28 14:48:32.664179,DashAndDots,Optimization issues,"My computer was well over the recommended specs for lone echo. or atleast is the recommended specs. And it ran...alright. And its the same here too. if youre going to play this game chances are you'll be met with low frames for around 80% of your gameplay. its not terrible but it can get unplayable sometimes. if that happens see if your airlink connection is stable. because it strains it a lot. playing this on airlink can give you a bunch of bad things. like <30 frames or just extreme latency issues. even if you set the graphics to like. 0 the game looks good. but even then low frames will be met. the game does look nice. but it can have its issues. i think it needs a back end update with some extreme optimization. other then that, story is good. and spoiler alert!

they give you extra power ups! how cool is that!",Jan 31 at 11:50 PM,4, 0,
