scrapping_date,review_author,review_title,one_reviews_text,review_date,review_rating,review_helpful,review_feedback
2022-05-28 14:46:32.390048,FutureShock_,Excellent game neglected by devs,"So this should be one of the most solidly five-star games in my library. It's a worthy successor to LE1 and builds on the former game's strong foundation to push the story and gameplay forward.

The experience itself, including the thick atmosphere, the voice acting, character design, and art direction are simply phenomenal. It's easily in the same category as something like Alyx despite having a tiny fraction of the playerbase.

The mechanics from the first game are expanded upon here not so much to add more depth but to give you more to do. This can sometimes feel like padding but the greater reliance on voice acting, set pieces, and visual diversity does a great job at glossing over the issue of repetitiveness.

Graphically and in terms of physics, this game has a lot more going on than its predecessor which leads me into why I removed a star and why I waited this long to review a game I was so hyped for prior to release:

This was the last PCVR title funded by Oculus Studios before their shift to mobile. Upon release, the game wasn't advertised much and there was almost zero support in the form of patches or updates. It made me a bit sad to see how many man-hours and love went into this only for it to be dropped like a cold potato onto the deprecated Oculus Store for PC. 

If there weren't any major bugs this wouldn't be a problem but the game has issues with memory / VRAM usage as it relates to texture streaming. This means that even on beastly rigs like mine, you have to play around with the settings a lot to hit playable framerates. 


In my case, using Virtual Desktop at Medium with the game settings at Medium did the trick. Air Link used too much VRAM on top of what the game was using. Link is probably fine but who wants to play a game in zero gravity with a tether? 

Now that I've got the game running well, the issues with texture streaming can still be distracting. High quality textures tend to load in way too late. 

Hopefully Ready at Dawn has some plans to update and fix this title. It really deserves better. It's an Alyx competitor hidden on the Oculus PC platform behind some bugs that should've been fixed in a day one patch.",Apr 14 at 9:41 PM,4, 61,
2022-05-28 14:46:32.405009,oscar_pojkarna,"Peformance is terrible, story is amazing","After about 2h the game started to have constant stuttering - even though neither graphics card, memory or CPU are fully utilized (rtx3070, ryzen 3600, 32gb ram, SSD, Rift S).

Several other seems to have this problem - this helped for me:
* Go to in-game settings and change the screen to ""windowed"", and minimize the screen mirroring on your computer screen.

This solved it completely for me, must be some bug. Please look in to this devs.
Still, the performance is far from optimal, textures are constantly popping in.

Wold be 5 star if the game would run better.",Apr 19 at 2:35 AM,3, 20,
2022-05-28 14:46:32.420966,Dantheman825,Do not buy this in its current state,"I'll say off the bat that this a good game, if you liked the first one, you'll like this one as well. But it's plagued with bugs and awful performance on hardware that should on paper fit the bill. 

I have a Ryzen 5 1600 and a GTX 1660 Super, it's below recommended specs, but should at least be playable at low settings. I had to turn everything down to the absolute minimum with resolution scale down to 50%, and even then, performance wasn't always perfect. Add that to some annoying texture pop-in that comes well after you've gotten close to said object, and it holds me back from really enjoying this game to its fullest.

from talking to others, I can gather that mileage varies tremendously per system, people with 3090s were only able to run this at Medium settings, while another with a 1060 could comfortably play at low, with a higher resolution scale than me. At best, this game is playable though unideal, at worst, it's pretty much unplayable. Devs say that overclocking causes issues, so turn that off if you can, but even without that, I think the issue goes deeper than that.

I want to love this game, but the bugs and performance make it hard for me. And after nearly half a year, this game only got one bug fix update, while EchoVR has gotten like 3 seasons worth of content, so it's pretty clear what the dev's current priorities are.",Apr 25 at 5:56 AM,2, 9,
2022-05-28 14:46:32.436923,dxawn,"Beautiful game, horrible support.","Lone Echo 2 for its beautifully written story is up with top games like BONEWORKS or HL: Alyx. Oculus released this with little to none spreadout of advertising making it a low playerbase game. The new controls and game mechanics are good, but you have to tweak the settings for it to be playable. There are bugs that should've been fixed like in a day one patch. No patches as its the last pcvr game, as Oculus switched to mobile on quest 2. Im dissapointed and this could've been a better game.",2 days ago,3, 0,
2022-05-28 14:46:32.451883,scoobynut,Immersive and moving,"I played Lone Echo and couldn’t wait for the sequel. I wasn’t disappointed.  The production values and quality of the game is fantastic- graphics, physics and story are a cut above. It’s more of of mini movie that you are a character in.

I didn’t notice any bugs that the reviewer mentioned, but I didn’t realise my graphics settings were on auto low until I finished. Even so I thought the graphics were superb.  Start up level loading could take maybe 30 seconds (it’s on an SSD) but there are rarely pauses to load when exploring unless you go a long way.

There is a main story where you need to save mankind, but there are also side missions which can be dipped in and out of in pretty much any order. You can also choose not to finish them all - however if you enjoy exploring I would recommend to do them (to get maximum value).  You will get to a point in the storyline where you cannot go into the side missions, and you are told that a few times by the characters.

The story unfolds and feels epic in scale in terms of surroundings (you are in space after all!).

There was only one place where I got stuck and could figure out how to get past the ticks - so I moved on as it wasn’t critical.

The plot is very clever, and at times Lone Echo is quite powerful emotionally. No spoilers.

I would recommend to anyone as Lone Echo and Lone Echo 2 are fine examples of how to make the most from VR.

Kudos to the developer team 👍",Mar 16 at 11:18 PM,5, 16,
2022-05-28 14:46:35.576103,luke.anker,"Currently 1 star, potentially 5 stars","Lone Echo 1 is one of my all-time favorite games. I wanted to give part 2 it a try, despite the warnings. What a cheek, especially given the price tag. I am sure that the content itself (story, voice acting etc.) is as beautiful as in part 1. However, one gets the feeling that the engine has been rewritten in Amiga BASIC. I’ve tried many things based on discussions on the net and in their discord channel, to get it running. To no avail. This release and the support around it is unacceptable. Asked for refund.",Apr 8 at 6:48 AM,1, 3,
2022-05-28 14:46:35.591062,Mur_Miau,Game from 5 stars category,"At first sorry for my english.
Game itself is fantastic, i like everything in it. But seems devs was under pressure to release it fast as can, so there is bugs from graphical to some mechanics and its for 40 euro? common. I personaly purchased it with discount and really glat of that. So for game 5 stars, for bugs -1 star. If you thinkig of playing it i recomend to play Lone Echo 1 part at first.",Feb 5 at 4:36 AM,4, 45,
2022-05-28 14:46:35.606022,Plantanoid,Couldn't Even Get Past The Main Menu,"Every single time I try to play this game, it asks me for the main settings, color blindness/subtitles, and then when I get to the ""turning"" menu and I hold start, all the music cuts and then doesn't start up the actual game. I've waited for like 15 minutes for the game to load and yet nothing.",Apr 1 at 3:10 AM,1, 3,
2022-05-28 14:46:35.620982,Moonkilz,Think I fixed the crashes.,"I added the game to the NVIDEA control panel and changed the power setting to preformance. I went on to the OCULUS app and changed the refresh to 80HZ. Once in the game I set the graphic settings to whatever the game wanted (default). I have an Intel I9700K and a RTX2080 as well as 32gigs of ram. I have played the game for over 2 hours straight without a single crash where I was getting crashes every 5 or 10 minutes before. Hope this helps someone else. The game is amazing!!! Oh I was also playing via the link cable, I have not tried airlink yet but hoping I get the same results when I do.",Jan 15 at 5:24 AM,5, 50,
2022-05-28 14:46:35.636940,Jos_VG,Almost ready...,"It could be one of the best virtual reality experiences. If it weren't for the serious performance and texture loading issues. In addition to not being dubbed into languages ​​that it was in the ""trailer experience"" years before.",Apr 23 at 4:22 AM,3, 0,
2022-05-28 14:46:38.752725,JoMoris,Not perfect but still perfect,"In Lone Echo II, I experienced 1 crash. Furthermore, if you join another zone too quickly, the game will show a loading screen which may take up to half a minute. However, this really doesn't bring the game down for me. After the first part, the beautiful story continues and it felt like coming home. Part 2 is at least as good as part 1 and at the end I really stood with tears in my eyes. This game REALLY deserves a 5 star rating. It really is my number 1 favorite game and I secretly hope that there will be another one in the future. Thank you for making this beautiful game @Ready At Dawn.",Mar 23 at 9:09 PM,5, 2,
2022-05-28 14:46:38.768683,andrew13427,black screen bug,right after the intro when the screen goes black my game crashes i feel like commiting suicide because of this I can't even play I SPENT $42 ON THIS GAME LIKE FOR WHAT A SCAM THE DEVS HAVE JUST GONE COMPLETELY SILENT IF THEY CARED THEY WOULD BE HELPING!!!,Apr 16 at 11:08 AM,1, 1,
2022-05-28 14:46:38.782645,your_echo,I love lone echo,I'm probably a bit to in to the game but I think it is an amazing game because of the view of the planet's and I'm in love with space and the universe the first game was amazing to (my username is from this game),Apr 19 at 9:00 AM,5, 1,
2022-05-28 14:46:38.797605,wowwphoenix,HOW DOES THIS GAME HAVE 4 STARS,bro this is one of the best vr game series i have ever played and i dont understand how this game has 4 stars. Lone Echo is a great game and i recomend getting it if you like space and combat of some what,Apr 5 at 8:06 AM,5, 2,
2022-05-28 14:46:38.813563,subsider34,"Exceptional, Aside From Optimization","Lone Echo II has an exceptionally interesting story and wonderfully engaging environment.  The dialog is well written, the characters, well animated, the visuals vivid.

However it does suffer from optimization issues.  No matter what setting you choose you'll have studders and occasionally be interupted by loading screens. 
 Oddly, I had a much better experience with my settings on Medium than on Low.  Perhaps they had more time to optimize the higher settings.",Mar 7 at 9:18 AM,5, 3,
2022-05-28 14:46:41.904916,MIKEY45230,"Constant Crashing, even worse than LE1","This game crashes so often it is unplayable after a certain point. I'm using a 2080ti, I9-9900, Rift S. Lone Echo 1 would also crash a lot, but at least I could usually get to the next checkpoint and reload. For comparison purposes, Half-Life Alyx runs perfectly well and never crashes. Actually no other VR game has ever crashed like this before. It's really annoying to me that the crashing issues from the first game have not been addressed.",Mar 13 at 7:42 AM,1, 2,
2022-05-28 14:46:41.919876,aurelag,"Good story, but...","it feels like they didn't have time to really spend time on optimization. Even with a pretty good computer, expect to have every parameter in ""low"". 
However, the story and VR interactions were pretty good. The voice actors are doing a great job at immersing us in the game. It's a shame it's the last pcvr game from oculus...",Dec 23 at 5:28 AM,4, 87,
2022-05-28 14:46:41.935833,StormChronicles,A must buy,"It's the best game there is on the Meta Quest in my opinion. Also for the first part Lone Echo..
Great storytelling, beautiful graphics.
The controls are magnificent, it feels very natural.",Mar 21 at 8:36 PM,5, 3,
2022-05-28 14:46:41.951791,E-rice,I love this game,"This has to be one of the best games i've ever played. It's got some jokes, its really fun, and i find myself really getting into the story because it is so good and detailed. It's like everything that happens makes sense. And at the same time, unpredectable. The first game was also fantastic. I cannot express enough how happy i was at the end of the game, when all was made right. I do hope they make another.",Feb 27 at 12:38 PM,5, 3,
2022-05-28 14:46:41.966751,Jagererk,Finnaly playable and awesome,"Finnaly after copule of mounths its playable and it works best at highest graphic quality (dont know why tho)
Its just freaking best game at oculus, no doubt, very immersive and the vievs of cosmos is really something! 
Story is interesting and i was very involved in ""relationship"" with captain and really cared. 
Meaby im very hyped after finishing the game but i recommend this and also e-sport echo game.

(old comment)
""In current state it is unplayable for me, crashes, glitches, fps drops, and i have RTX 3070 so... I will try when the game will be fixed""",Jan 28 at 7:11 AM,5, 11,
2022-05-28 14:46:45.068604,Orbifold,"Epic, fun, a bit glitchy","Crashes sometimes. Occasionally starts lightly hitching. Could use some more work.

It's mostly a continuation of the previous game. There are some new mechanics added, which is nice. But it doesn't feel particularly fresh overall. Same slow pacing, driven by exploration, story, and simple challenges in a zero-G environment. Slightly improved graphics, I think.

The interactions with the arm controls could also use some improvement.

Truly epic storyline.",Jan 28 at 3:45 PM,4, 12,
2022-05-28 14:46:45.084562,tt-,awesome,"this game is incredible and ive only played it for only 10 minutes and it feels like one of the best experiences ive played, Also i like how it gives you a exclusive “Vega X-3” chassis wich i thinck is great for arena and combat",Apr 1 at 9:40 AM,5, 1,
2022-05-28 14:46:45.099522,jerome_the_wise,Bad optimization,I am not an expert in computers but I'm sure this game is not well optimized. I really like the story and I love these characters. But this technical performance is unnaceptable. My computer can handle most modern games in high to ultra settings at 60 fps plus 2k display. I hope someone makes a mod to fix it or something,Mar 11 at 8:59 PM,1, 1,
2022-05-28 14:46:45.114481,TaunHawk,Absolutely love this series,"This is by far one of the best VR games available. Part two does not disappoint. Feels good to be back in Echo One's chassis again. The atmosphere and the go-at-your-own pace playstyle is wonderful. I have had no issues so far with any crashes or glitches. I simply installed the game and started playing. I am playing with Quest2 connecting wirelessly with Virtual Desktop. My PC specs are:
i7-6700K CPU @ 4.0 GHz (8 cpus), 16gb ram
Nvidia GeForce RTX 2070 8gb vram
Windows Pro 64 bit, DirectX 12",Feb 14 at 3:46 AM,5, 2,
2022-05-28 14:46:45.129441,raphael.bucher.549,"Great Story, atmosphere, feelings","Enjoyed lone echo 1, and 2 i like even a bit more. Had no technical problems apart from some few textures which didnt load in high resolution. Graphics overall were really impressive imo. The atmosphere is awesome, and the story really touched me even more than part 1. This game is in my top 3 list of the about 20 VR-titles I played!",Feb 6 at 9:34 PM,5, 3,
2022-05-28 14:46:48.229284,anthony101244,only english,only english,Apr 13 at 4:05 AM,1, 6,
2022-05-28 14:46:48.245241,GraemeMcD,Among the premium single-player VR Games,"The original game is still perhaps the only game that stands up to Half-Life in terms of graphics, voice acting, production & polish.
This sequal offers a slight graphical upgrade, perhaps because the original is still so accomplished in this area & has aged very well, in my opinion.
In gameplay, it offers an expanded range of tools & enemies which introduce new gameplay permutations. 
In story, it has an expanded cast of characters & voice acting that gives us a bigger picture of the events around the 1st game.
It remains atmospheric, single player & mostly slow paced. Again, in my opinion, this isn't a fault; it's simply the game it's meant to be.",Jan 23 at 6:15 AM,5, 4,
2022-05-28 14:46:48.270174,TENCUHTLI,Stunning game!,"11/10 Such a beautiful story with amazing characters, gameplay is full of puzzles and challenges, graphics are stunning even on my 980ti at low settings! 

Definitely a GEM on the Oculus library, do yourself a favor and buy it!",Jan 31 at 2:10 PM,5, 3,
2022-05-28 14:46:48.286131,Daefa,A great game for those who enjoy stories,"I read these reviews going in thinking, maybe it wont be as good as I was hoping. I was WRONG, and I can tell you for those who are just bored from the dialogue don't understand a cool story when its sitting right in front of their face (literally). Now I know everyone has their own opinions so I won't harp on them anymore, I for one think the story is AMAZING. I am only like an hour in and gotta say, I absolutely love sitting there and listening to the dialogue. It is like im reading a book but I am living in its visual concept. Gameplay mechanics amazing, stunning graphics, amazing story. 5 stars from me.",Dec 25 at 9:18 PM,5, 7,
2022-05-28 14:46:48.301091,zackspider1204,Devs please Read this,"It ends on such a cliffhanger you better not take years to make lone echo three if it’s coming out And now.
 1 day after for some reason it is not starting for me and one day I hope in action figure comes out of Jack",Feb 22 at 12:54 AM,5, 1,
2022-05-28 14:46:51.432333,SilentWraith174,"Completely unstable, constant crashing,","This game has become unplayable.
I have reset any overclocks, shut down any other monitoring programs, 
stopped geforce,
no oculus debug overclock, etc .....
updated to the latest update.
Having played Lone echo without crashes and Medal of honor, there is a significant problem with this game.
Playing on a RIFT S with a evga ftw 3080, i9-900k, 16gb ram, 
more than enough for this game.
UPDATE uninstalled and reinstalled. LOST ALL PROGRESS.....
Im done buying VR",Dec 31 at 2:59 AM,1, 8,
2022-05-28 14:46:51.448290,JamesDWestoby,Nice but TOO hard in nplaces,"This coming out forced me to finish Lone Echo, but... I don't mind idle wandering but some assistance please. 25 Second timeout for the relays is a killer - haven't got the speed ups and so many other things but now I just seem to be >only< wandering. Pleased I bought it but because of the 'stuckness' somewhat tempered. Great game with reservations. Oh well, back to random poking in corners (and getting killed) ....",Dec 30 at 9:36 PM,4, 5,
2022-05-28 14:46:51.463251,cam2557,issues with storyline progression,"Lone echo 2 is a great game and i would not change it in any way, though i do have one issue. the game somtimes breaks at spots and leaves me with no way to progress the story (i have watched videos on what i have to do) and the option of doing what i need is not there so i try and go to the lone echo menu to load my save and when i press the button / hold it it never pops up, on top of that when i restart the app it leaves me with a blank black screen that i cant fix unless i uninstall and reinstall the app which would then delete my save file and i would need to restart. other than that issue the game is quite enjoyable and the graphics are on another level",Dec 12 at 6:36 AM,4, 10,
2022-05-28 14:46:51.479208,RomRomOwO,A Story You'll Never Forget,"Game review: I recently purchased a Meta Quest 2, and Lone Echo was the first game I purchased. As it came highly recommended in my friend group. Two days later, I bought the second installment, Lone Echo 2. Cont.

Lone Echo 2 is by far the best VR game I have ever played. Hell, it might even be the best game I have ever played in general! The story was captivating, it had me on edge and wanting more and more at so many parts. And the ending, dear god the ending! This here, this extraordinary title. This is the only game that I have ever played that made me cry. I applaud you Ready at Dawn, I really do. <3

Peformance: Overall peformance was great. No stuttering or anything of the sort. I only crashed once, which was probably due to the fact that I have modified graphical settings on my headset. 11/10!!!

Note: I played this with oculus link. My GPU is a base GTX 1080. I had virtually no issues the entire playthrough. Enjoy!",Dec 5 at 10:29 AM,5, 17,
2022-05-28 14:46:51.494167,HorizonVR-,What could use improvement,"Great game! Though, the recovery recap from the first game was kinda... TOO obvious. Like, specific details dont have to be specified. I am not saying these voicelines should change, but I am just giving my opinion..",Jan 24 at 9:28 AM,5, 3,
2022-05-28 14:46:54.589515,dieterdisko,"Crashed and no other languages, but...","The game crashed after 30 minutes. The GPU is not supported according to the display in the menu as soon as I set just one setting higher than LOW ... that can only be a joke (RTX2080Ti; i7 11700K;Z590; 32Gb 4000 Ram, all drivers and Win10 are up to date). And sadly there is no synchronization in other languages (that was to be expected very differently after the LoneEcho2 trailer experience !!!)

I sincerely hope for a subsequent (atlas) patch with a German voiceover ... as it happened in part 1. (This was almost perfect) Otherwise a large part of the story is lost if you don't speak English as your mother tongue.

EDIT: Despite my initial disappointment with the missing translation, I played it to the end. Now I can say it's great! Despite the bugs with the textures and some crashes (4 or 5 times in the entire game time). I changed my rating to 5 stars. Should it really be the last great VR game from the Oculus Studios on the PC, that would be more than regrettable!",Dec 12 at 5:21 PM,5, 9,
2022-05-28 14:46:54.605472,ParadiseDecay,GOTY for me!,"4K Impressions Video, 1st hour of the game + Walkthrough Part 1:
https://www.youtube.com/watch?v=orOs04VfxvU

My Initial Impressions:
This title is GOTY for me, its bigger, better and more fleshed out.
The levels are bigger, there's more to explore and the puzzles have been quite challenging.
Also expect a few surprises here and there and a few NEW COOL tools to play with.
Giving this a 4 out of 5 only becuase I had some texture issues popping into focus.
But my only REAL NEGATIVE is.... Im REALLY dissapointed this could be the last big VR game for Rift S and PC. It's a sad, sad day.........",Oct 13 at 6:38 AM,4, 400,
2022-05-28 14:46:54.620936,BlackGlove,BUY IT NOW!,"This game is a masterpiece - right up there with Half life Alex in my opinion. 
I just wish ther was more games of this quality out there for VR, but they will come in the near future. Also is great the we have a sequal for for a previous title I hope to see many more for this also, oh and by the way if you have not played Lone Echo 1 then you must do so before you get into this title.
Well done to the Dev Team keep up the good work.",Dec 12 at 8:13 AM,5, 8,
2022-05-28 14:46:54.636894,Lv426HuDz,"Crash fest, unplayable","For me this game is just a massive crash fest. When it runs (which is rarely for > 10m) it is superb. I have a 10900k and a RTX 3090 and it runs amazing on highest details, but it just crashes so often it completely ruins it. This is the ONLY vr game I have issues with, HL Alyx no problem, DCS no problem etc etc. Please fix!",Dec 30 at 6:46 PM,1, 5,
2022-05-28 14:46:54.651854,Charlyplayman,Low graphics? Not spanish?,"The game is fantastic but i have a RTX 2080 and the menu recommend Low graphics settings???
If i set any setting higher than Low it shows me the GPU is not supported. I tried to forced it and the game crashed after 15 minutes (i don't know if this was the cause).
Played on Oculus Quest 2 with Air Link.

I also would like to have spanish translation",Oct 13 at 5:46 AM,3, 138,
2022-05-28 14:46:57.739177,quizheader,VR game of the year,"Outstanding game and vr experience.
I was expecting to see the second chapter after finished the first one last year.
The only cons would be a long loading time when starting the game and sometimes when loading other sections of the game.
This not a standalone game as the first chapter needs to be played in order to understand the story and the character but it's worth it.
Overall, a must have game for any VR gamer.",Dec 29 at 6:01 AM,5, 3,
2022-05-28 14:46:57.754137,dan.m.griffiths,Tense and wonderful experience.,"A great game with solid performances from the main cast.  Good mystery and some truly stand out moments with some awesome set pieces.  Lone Echo is a stunning game in its own right, and deserves to be played by everyone.",Feb 4 at 8:38 AM,5, 1,
2022-05-28 14:46:57.770094,cudenu,Good Part 2 ... but with bugs,"I enjoyed playing this game until the Research Factory ... the is a door called ""Test Wing"". In all the videos on YouTube this door will open, more or less remote from the team in behind. In my case, I tried to open it in any possible way. It stays closed  :(((   so I cannot get a ""laser"" to open web doors later. Disappointing
Update 02.2022
Meanwhile my problem is solved :)
As expected, the game is even better than the first part. Despite my school English, the game was easy to understand. So folks, go for it",Feb 19 at 9:33 PM,5, 1,
