scrapping_date,review_author,review_title,one_reviews_text,review_date,review_rating,review_helpful,review_feedback
2022-05-28 18:33:27.812950,Nimarus,Very good for an early access title.,"The Morrigan, based on the Celtic mythology of Morrigan, one of the triple Goddesses in Celtic mythology. She represents the circle of life and was associated with both birth and death. There is a lot of stories about Morrigan and you should check them out.

This game, like almost all VR titles, is kind of short. However, it's early access and the developers have stated that they intend to add more to the game.

Attention: game expects you to be standing during gameplay. Otherwise, you're going to feel short compared to other characters you see. I've also read that those with accessibility issues have encountered difficulties while playing. Such as not being able to pick dropped objects from the ground.

Movement: You can walk around like other games and has the standard 45 degree turning to minimize motion sickness. However, there are options to change turning to what you prefer.

Combat: Combat is fun and engaging. You start with your basic sword that you find in a dungeon. Good damage for slashing and stabbing. Axes deal no stabbing damage, but deal more slashing damage. The weapon type effects how you deal damage, so keep that in mind. Fighting feels authentic in some ways. You can't hold your hand out and wiggle the controller to deal massive damage very quickly. There is a break between damage that would be expected if your actually swinging your weapon. So, swing it like it's a real sword. Locations you strike recieve more damage depending on where you strike and if there is armor protecting it. Thus, you'll deal more damage to a skeleton's bare skull than one with a helmet.

Environment: All the environments look great considering the art style the game is aiming for. Each level changes things up a little. One minute your climbing a wall of vines inside a dark dungeon. The next, your walking around outside in a courtyard maze with occasional skeletons animated themselves to attack you.

It may be short for now, but it is fun for what it is now.","May 17, 2019 at 3:49 PM",5, 2,Thanks for the review and feedback. The latest update adds options to set your height if you are sitting and also adds a grab projection system to make it easier to pick things up from the floor. I just wanted to let you know that your suggestions helped make the game better - thanks!
2022-05-28 18:33:27.833892,theregoes2,Listen to drash,"I was going to write basically the same thing as drash, but he already did, so read his and multiply by 2","May 9, 2019 at 2:20 AM",5, 10,
