scrapping_date,review_author,review_title,one_reviews_text,review_date,review_rating,review_helpful,review_feedback
2022-05-28 17:19:02.595772,ash55,New features undermine fun of Ep. 1,"Gave it 3 stars because Episode II and III pales in comparison to the first Episode. The Lightsabre combat is Vader Immortal's greatest strength, however this fantastic system is wholly undermined by Episodes II and III, thanks to the introduction of comparatively overpowered, imprecise, and finicky Force Powers that feel unpleasant and unresponsive due to an ill-conceived delay when grabbing heavier enemies. The lightsabre becomes relegated exclusively to either a defensive tool for deflecting blaster bolts, or a projectile weapon that is nowhere near as precise or fun to use as a Blaster.

Episode III's dojo has some serious issues too. Using the Blaster is the fastest way to complete the tasks in the allotted time allowed due to their sheer power (which seems absurd for a Lightsabre game), but they don't respawn at the start of every round causing you the hassle of reloading the arena manually. To compound that, if you start a challenge by progressing from an earlier round, you are able to stockpile additional blasters from the previous round (and some of the tight time constraints it's almost as if this was intended.) Which feels like a strange oversight.

As for the final chapter in the campaign, it is really fun albeit brief. It has some of the issues outlined above - the Blaster and the Force becomes the superior option and overshadows the fun of Lightsabre combat. I would have thought the final showdown with Vader would be a longer battle that tested everything you had learned so far. But it doesn't last very long and ends with the VR equivalent of a story-driven QTE event which feels underwhelming.

I'm leaving a review because I hope the developers take some of the lessons learned, and continue to build on this resulting in a truly great VR Star Wars game with more specialisation (such as allowing the Jedi to remain Lightsabre focused by putting cooldowns on the Force Powers and perhaps separate ranged Blaster / Tech classes for Trooper, BH or Smuggler.)","Dec 1, 2019 at 6:29 PM",3, 5,
2022-05-28 17:19:02.611730,Ray.Watson26,Don't blink,there is about 15 or 20 minutes of actual gameplay even at $11 not worth it. was an enjoyable 15 minutes but not worth your hard earned cash,"Jan 12, 2020 at 1:41 PM",2, 0,
2022-05-28 17:19:02.627687,SUBZERO392,eh...not impressed.. :/,"The graphics are awesome...story too short seems shorter than 1 and 2. Its not very immersive due to the fact you are constantly having to wait for parts to play out before you can move again...u cant do much exploring, this is more of just an VR experience than a game. if u want a ""game"" i recommend Asgards Wrath or Arizona Sunshine...those are worth your money..not this..id wait until it goes on sale!","Nov 30, 2019 at 9:50 AM",1, 5,
2022-05-28 17:19:02.643644,Shake_N_Vac,Feels like a lot is missing.,"This is a great game but suffers from the same things as the second - way too short.  It feels like a load of stuff has been taken out and left on the cutting room floor.  Finally get to fight the big man, for all of a few disjointed minutes that jump around and literally feel like bits of cut scene and action have been haphazardly cut out.  You get raced through the story as if they were desperate to hit a target release date.  Gamplay is still top notch with some great moments but if this wasn't Star Wars I doubt people would be giving it 5 stars as it's decidedly average overall.","Nov 25, 2019 at 3:37 AM",3, 7,
2022-05-28 17:19:05.736374,BenJoo121,please help me,"this game is most likely awesome, but i cant play it when i click on the story it puts me in a pitch black room with a lightsaber but i cant see anything and its like a box i cant get out of. people say it starts with a audio. but i get dead silence and a lightsaber. the dojo works fine but the story doesnt. help me?","Dec 7, 2019 at 1:27 AM",4, 1,
2022-05-28 17:19:05.752330,Nexpert,The one we've been waiting for,"This is the most action packed, fun filled episode by far. And to top it all off, the lightsaber dojo has all the bells and whistles and once you have episode 3, it's the only dojo you'll really need to play. At this point I can only hope that another Star Wars game makes it to VR in the near future. Great job!","Nov 22, 2019 at 1:27 PM",5, 2,
2022-05-28 17:19:05.769284,Vader2019,Needs a bigger story!!!,"Love these games, but as every other VR game, it lacks substance. ALL Star Wars fans love a good story. A good game should follow that same principal, build a great story, then add all the cool abilities and weapons. This was an interesting story, but it could have been so much more! Take us into the bowels of Mustafar, show us the kaotic source of the lava flows where the ""brightstar"" can be found, not in some quiet tomb. Give me a MAJOR battle with Vader, with options to defy him or join him. Give me more history to discover about this place and what happened so long ago.  Let me use the force to fight, pulling down statues and pillars to take out large numbers of enemies. Let me build my own saber and choose its color, as well as my path. We want MORE!!!","Nov 30, 2019 at 11:09 AM",3, 3,
2022-05-28 17:19:05.786239,adam.poole.313,What a waste,"This is exactly what happens when you take a popular property like Star Wars for granted. Lots of positive reviews and I'm sure its selling well. But if this exact game were released as some other less popular property I think alot more people would be calling it out for being a pretty poor attempt.  There really isn't much game here you just use your saber to block lasers coming at you, and you don't really have to do anything except hold your lightsaber up in front of you. Basically just stand there the whole game and you will win. Look around and everything falls apart. Unfinished textures, characters not reacting properly... There is one sequence on a skiff that goes on and on and on and its obvious they were just trying to add an extra 5 minutes to the play time. And ultimately that's how the whole game feels, like they are just stretching the Star Wars license out to call it a game. I give it 2 stars for the Dojo which is fun for a while.","Nov 28, 2019 at 3:10 PM",2, 4,
2022-05-28 17:19:05.802196,snipersi,excellent,"a brilliant exciting, fun game to play","Jan 27, 2020 at 1:20 AM",5, 0,
2022-05-28 17:19:08.890935,MysticNinjaSoul,Great game but TOOOOO SHORT!,"I would think a game that is only 9.99 would be longer than 20 freaking minutes and this is supposedly the final episode yet it leaves so much unanswered. I feel ripped off to be honest. This should have been way longer and way more immersive that it truly was. All in all, good but still a big let down","Dec 3, 2019 at 4:02 PM",3, 1,
2022-05-28 17:19:08.906892,PitViper1,,"Games such as Lone Echo, Asgard’s Wrath and Arizona Sun are full length games with great to stunning graphics.  This third instalment of Vader Immortal is no match for these games. The graphics are good but by todays standards nothing too special.  The game is very short but what content is there is enjoyable. Some of the 5 star reviews convinved me that this was the best of the 3 games but I dont think it is. I would say its on a par with the 2nd game. Is it worth £7 .. maybe...Will I get the next game probably yes if the price is right. I would have loved to give this 5 stars but it feels like 3 stars to me.","Nov 23, 2019 at 6:28 AM",3, 6,
2022-05-28 17:19:08.922849,ToukkaZZ,,THE GAME WONT DOWNLOAD ANYMORE I HAVE DOWNLOADED IT SO MANY TIMES ALREADY M REALLY MAD,"Apr 23, 2020 at 7:40 PM",4, 0,
2022-05-28 17:19:08.939804,SystemsNerd,Getting Worse,"So, the first episode was great, the second was so short it made Call of Duty seem epic, but it seemed like a bridging episode to something grand.  Episode III hits and it feels like a slow theme park ride.  You spend the entire episode moving to the next little spot on the floor where you take out a few stormtroopers, rinse, repeat.  The main draw was that force sparkies were going to be in it, but it is gated behind a kill count and only available in Dojo III, nowhere in the main game.  In no other SW game have I ever seen force lightning gated behind kill counts.  Ridiculous.  The story ends abruptly and requires almost no skill to beat.  

The Worst:   The droid's attitude was fresh in the beginning but has gone full teenager in this one.  You can't move a few steps without a complete immersion breaking petulant comment that shouldn't exist in this galaxy.  I tried many times to saber Z0-E3 to no effect.  

The Good:    The blaster was a nice add but only really useful for taking out droids in the dojo.  All-in-all, I'm going to wait for several more episodes before buying another.  These last two releases have failed to live up to the first one.  Here's a tip: More Freedom Please!","Dec 2, 2019 at 3:33 PM",2, 1,
2022-05-28 17:19:08.955761,Sith_Spawn,too short,"This game could have been so much more if the fights weren't scripted to the slightest detail. Take it for what it is; you're playing through a storybook more than a game. The experience is very much on rails and there are a few wasted moments (like activating the droids and the unsatisfying Vader duel). PLus for interesting story, minus for annoying companion droid","Nov 28, 2019 at 12:46 AM",3, 2,
2022-05-28 17:19:12.039513,SpiderMatty8,"The best one, but still underwhelming.","Vader Immortal seems like a huge waste of potential. Instead of focusing on 1, medium sized $20 game, they decided to split it into 3 40 minute ""episodes,"" leaving a fractured story that is only harmed further by the mediocre plotline.  
      Episodes 1, 2, and 3 were very underwhelming, they focused on a rather mediocre generic fantasy story, instead of the combat. After the first REAL lightsaber fight, you'll be thinking ""Who cares?"" anytime the story interrupts. Speaking of story, the story is bogged down by its characters, which range from ""The Most Annoying Droid Since The Nasally Droid from Season 5 of Clone Wars,"" to ""Darth Vader but actually Episode 2 Anakin."" 
      The main selling point of episode 3 was the final duel against Vader, which is hollow. Vaders moves are badly animated, and very distracting due to the rest of the games great animation. On top of this, it is IMPOSSIBLE to die. I let Vader hit me every time, and never died. This could've been the best fight of the game, but sadly it's bogged down.
     However, the bulk of the game is found in the Lightsaber Dojo, which gives you what you REALLY came for, the Lightsaber combat, and it's a bit underwhelming. The best part is deflecting blaster bolts, which feels incredibley satisified, but sadly the saber vs. saber combat is limited to fighting robots. On multiple occasions I would find my saber failing to block, and the enemies attack phasing through my lightsaber. Don't even bother trying with just the force or a blaster in later levels, as you'll frequently find yourself trying to dodge blaster bolts and lightsaber swings from all directions.
      Overall, I would say Vader Immortal as a series offers too little content for the $30 pricetag. If you're interested in lightsaber vs. lightsaber combat, I would recommend Blade and Sorcery with the Outer Rim mod. However if you want a frantic experience, I would get only Episode 3 of Vader Immortal. The story is not worth the extra $20.","Dec 2, 2019 at 11:23 AM",3, 0,
2022-05-28 17:19:12.056468,mockim,,"Its like living a movie. I highly reccomend. Nothing you do will change the story, but experiences like this are amazing.","Jan 5, 2020 at 3:11 AM",5, 0,
2022-05-28 17:19:12.072425,LegoKnockingShop,"Dissapointing conclusion, great Dojo v3!","Ep II & III together are far more dissapointing than Ep I in scope and enjoyment. The finale felt underwhelming as an end to the story and overall while it was worth a once-through, my engagement with it was lower with each chapter. There's really not much to do content-wise... 
The Dojo Mk 3 is great! But it means that the previous 2 dojos are redundant. What I'm left with after 3 episodes, which combined are the  price of a full release, is a good-but-not-great 2hr (?) story that's a once-and-done experience, and 3 iterations of a Dojo mode where v3 is far and away the only one I'm going to play. In hindsight, it kinda feels like those 3 dojos would be best served combined into one big unlock-driven game, but there's no way to do that. I'm sure when it gets repackaged into 1 big game they'll do just that ...","Nov 29, 2019 at 9:27 PM",4, 0,
2022-05-28 17:19:12.088383,JashuHB,Underwhelming,"Story mode was so disappointing, the fight with Vader was just lame. time to finish the game is padded by a long repetitive chase sequence but still feels like the shortest of the 3. You never get any of the extra force powers from the dojo or dual wield lightsabers in the story mode. Buy the 1st episode for the story, 2nd for the dojo, get this one if you really want more dojo unlockables.","Nov 24, 2019 at 7:47 AM",2, 3,
2022-05-28 17:19:12.104340,Potaso,Love the game (but PC version Crashes),"Loving the game. Played it on my quest. Cool way to end the story, although i wish the final battle was a bit more ""epic"". However, I do not agree with any of the other negative reviews out there that complains about this not meeting ""their"" expectations. I mean, this is seriously the CLOSEST we have ever gotten to being in SW universe. Amazing. Job Well done. 

This being said, I am having issues with my PC version. Thank goodness for cross buy, otherwise i wouldn't be able to finish it. After about 3 minutes of playing, the game crashes. I hear a loud buzzing noise, screen goes completely black. I have to Alt F4 to quit the app. Oculus app itself works fine, but it seems to be the game. No other game is causing this crash, so it's not my Connection, or headset etc. Definitely a bug. Please help or fix. Thanks!","Nov 24, 2019 at 9:56 AM",4, 3,
2022-05-28 17:19:15.214023,Hanno_VR,Yikes.,"Stopped playing after 25 mins. Lots of hand holding, awkward controls, game system that tells me to return to the game area when I duck behind cover. Straight up not fun. If I could return it I would.","Nov 26, 2019 at 11:46 AM",2, 3,
2022-05-28 17:19:15.229980,HaradRoad,Yes 5!,"I loved 1, not so much 2, but 3 brought it all together and is a great experience and forgive 2 now which you need to play in sequence to fully enjoy 3 imo.  Yes, still under an hour but if you can get over that given the depth and price is cheap it is a awesome experience.  Fighting Vadar is priceless.  Making a game in VR that is as rich for 8 hours of gameplay like this is years out so for now I'll buy piece meal and grin all the way.  Nice job!","Nov 29, 2019 at 4:23 PM",5, 1,
2022-05-28 17:19:15.246935,mark garroutte,Top Notch,"This is so good that 40 min felt like 20, it's just that good! My cv1 and 2080 card with a 9th gen cpu made this so immersive I thought at times I was standing with actual beings. The background to closeup ratio provides so much depth it's unbelievable! I have all three so 2 hours of cinematic gameplay is wonderful, I hope the next will be more of a traditional game and longer.","Nov 29, 2019 at 8:38 AM",5, 0,
2022-05-28 17:19:15.264887,Tohbias,a great expample of what VR SHOULDN'T BE,yes this was visually striking and that is ALL that can be said about the whole series. its basicly a walking simulator thats 70% not walking and not moving just having exposistion shouted at you 20% walking and 10% easy and bland combats. there is a light saber and one for power. remember before episode 2 came out and they said it would focus on force powerS as in more then one. well that u can chunk mobs with one hand a slash with another both feel more like early wii controllers then the vr controls i have come to know from other games. the Dojo is this game ONE saving grace. and all you get for your trouble is a few colored crystals for the most part. yes at first its super fun to swing a lightsaber like we have all always wanted but we really need to be expected more bang for our buck it we ever want good vr titles. lets be honest if this wasn't vr it would be one star all around. we need to stop being suckered by a few striking effects and the star wars name alone. im honestly stunned at the fact this got ANY good reviews much less so many. how bout this by a 5 dollar lightsaber at walmart and swing it around while watching a playtrough and use the other 25 dollars you saved by not buying this garbage on ANY OTHER VR title. you will have a lot more fun.,"Mar 6, 2020 at 9:09 AM",1, 0,
2022-05-28 17:19:15.280844,thereallando,A good ending to the series,"I enjoyed this series a lot. It wasn't perfect, but it gave me a pretty good taste of what Star Wars in VR could be. I only wish it was longer. But given how these are really more like interactive experiences rather than full on games, it's probably ok as it might get a bit old not having a ton of freedon. I really hope they expand on this stuff and give us a real game. It's so awesome to feel like you're actually in the Star Wars galaxy. I think this episode was better than the second one, and the dojo in this game makes the other dojos seem so bland in comparison. They really give you some fun combat options (dual lightsabers, blasters, and thermal detonators?!). Highly recommended to any Star Wars fan!","Nov 22, 2019 at 11:21 AM",5, 3,
2022-05-28 17:19:18.391524,Tad_The_Bad,"Worst one by far, had high hopes","i was a big fan of the other two episodes in this series, but this one definetely did not live up to expectations. It felt way too rushed and the combat is pretty bad. The only good thing that i looked forward to was the Dojo tbh.","Dec 8, 2019 at 11:50 AM",1, 2,
2022-05-28 17:19:18.408479,Neuroview,,"Everything it was supposed to be - my expectations were simply that it would be what it looked like - a fun VR game with all my favorite star wars stuff in it, faithfully recreated and some fun lightsaber battles. The Force stuff made it way more fun also, good integration!","Nov 30, 2019 at 7:10 AM",5, 1,
2022-05-28 17:19:18.425433,Wirebrain,Jedi Dojo III could be a stand alone,"UPDATED: It's a minor complaint, but the Jedi Dojo III has 47 rounds. 47? Both episode 1 and 2 had multiples of 10 which seems fairly instinctive for a video game. But 47? I expected it to end at 50 like eps. 2. Hell even 40 would have been ok. 47 just sounds off. It's a weird number of levels and I was so surprised when I cleared the round and received the ending message. Weird choice from the devs. 

I personnaly do not enjoy the story mode. The droid is getting on my nerves and never stops talking. The Vader final fight is really stiff. It really feels like Disney Star Wars, far from the original movies. But the Jedi Dojo III is one of the best VR experience out there. This could easily be a stand alone wave shooter title. Best one so far. Dual wielding light sabers and shooting laser guns feels great.","Nov 27, 2019 at 5:40 AM",4, 0,
2022-05-28 17:19:18.442388,Prax4788,Not sure how it has good reveiws,"simply put its been unplayible.     dojo recenters mid battle resets     
items are getting stuck in mid air and no ammount of pulling will move them 

before you ask its not my setup  i do not have problems in the other two vader immortal games","Nov 27, 2019 at 3:41 AM",1, 5,
2022-05-28 17:19:18.460340,StormyDoesVR,Vader Simulator (Wait for the Bundle),"So, finally got the installation issues sorted, so... don't buy this.

I'm giving it five stars for a reason. As a huge Star Wars fan, I loved the experience. But it's an Experience, and should be priced as such. The entire series is 30$. It's barely worth half of that. Sure, the graphics are amazing, the lightsabers are cool, and the combat is ok. But the story (which enables the combat, lightsabers and graphics) is so terribly short, that I've beaten each Experience in under an hour! That totals about 3 hours total gameplay for the main storyline.

 And the dojo mode? Sure it might give you more to do, but it isn't a sandbox! You don't get all the lightsabers at the start, it isn't free locomotion, (at least the last two weren't, haven't actually played this one's dojo yet since the last two were so similar) so you're stuck in the middle of an incredibly detailed room, standing in one spot as a wave-shooter style of enemies come barreling down on top of you. You can't cover, you can't see all the lightsabers at the start (something this game sorely needs is a gallery you choose from) and the force powers, while yes, being fun when they work, are janky and only do what you want about 50%-40% percent of the time, at least for enemies.

For guns, they worked great, actually. I could force grab a pistol from a downed enemy like it was nothing. Loved that part. Kudos for adding the guns to the dojo, even if you do have to force grab them and can't holster them.

All in all, just wait for a bundle and maybe even a sale to get all 3 at around 15-20 dollars. You'll love the story, but you'll love it even more when you haven't wasted 30$ on a walking simulator, and a dodgy one at that. The main problem is this feels like something that was made to try and sell a larger experience, and there are even subtle hints at that. But it isn't worth paying 30$ to be hinted towards a bigger Star Wars game that may or may not be real at all.","Nov 26, 2019 at 6:10 AM",5, 0,
2022-05-28 17:19:21.533121,Cryosleeper,Thanks LucasFilm!!!!,"Loved the VR series! Ignore negative reviews. Can only describe it as a full canon playable movie. Played it using the Oculus Rift. Great graphics. Fun, immersive storyline. A MUST for Star Wars fans.  You get to use your light sabre  skills, plus pick up and use blasters, and the force this time around. Amazing to experience Darth Vader in VR. I can only hope this series is the beginning of many more Star Wars experiences in VR.","Nov 27, 2019 at 9:48 AM",5, 1,
2022-05-28 17:19:21.550076,RuneSR2,Liked Episodes 1 and 2 better,"I finished E3 last night and thought it was the worst of the 3 episodes, personally I loved E1 and liked the monster in E2, but E3 was kinda boring. Sure there was some cool stuff (no spoilers), but it was over with a blink of an eye. 
Also being unable to move when things start to happen - taking away control from the player - isn't something I prefer. It made E3 seem even more dated than the other episodes to me - it felt more like a tech demo than a game. I think it took me 30 min to finish.
E3 is so dark you'll see the CV1 spud effect clearly, so seems like this one was designed for oled. The spud was kinda annoying, would have been great with slightly elevated light levels to remove spud - and probably make the game look even better on lcd hmds. 
I'd rate E1 9/10, E2 8/10 and E3 7/10. 

PS. Performance was great - I used CV1 ss 2.0 and High details.","Nov 23, 2019 at 4:16 PM",4, 1,
2022-05-28 17:19:21.567031,samgiguere,,"The Episode 1 was fantastic but the 2 was a let down and so is the Third... it's way too short and feel repetitive, i'm sad cause the story started well....","Nov 22, 2019 at 3:20 AM",3, 5,
2022-05-28 17:19:21.583986,PearlDrums69,Holy cow!!!,"I haven't made a review yet for any episodes because i wanted to rate all three of them at once. In all, the three episodes where a success on my part. The force, the saber battles, and the way you can use the stormtrooper's guns, all where great! 
(SPOILERS!!)-> when Z0ey pushed off the admideral, and you looked down from where she pushed him, there was nobody. At the time, I thought they just didn't have time to add his body in or something of that sort. however, when you kept going and fought him again was smart thinking! I checked again to make sure  he was dead for sure, which he was, and they added the crash and everything.        
 (END OF SPOILER)
I would even make a paper on this it was that great of an experience! If I had more time to type, I would. However I don't got that. 
In all, with each episode costing $10, it was worth it. Heck, if they even bounced it up more I would still continue it. I loved how in the first episode, it focused on the sabers. Then episode II focus more on the force. And with episode III doing equally the same? It was smart thinking on their oart. Usually, I don't read credits as much but for this I watched every part, since the people who made need to be known to me. It was a great experience and I would totally recommend playing!","Nov 24, 2019 at 1:01 PM",5, 0,
2022-05-28 17:19:21.600940,Neo_33,Best Episode of the series,"Episode 3 has it all.  You use the force, lightsaber, and even blasters picked up from storm troopers.  I had so much fun and especially loved the final confrontation.  This episode is heaviest on Action instead of story telling.  There is some but most of the story is told in the first 2 parts.  If you played through the first 2 then you must finish the story with this one.  Highly recommend.  Thanks ILMxLAB and Oculus for a wonderful series.","Nov 24, 2019 at 5:25 AM",5, 0,
2022-05-28 17:19:24.680703,TheMOHAAMaster,We need more,Great game it was fun but still super short. The lightsaber dojo is cool but like twice as hard as the other versions and the telekinesis is still a bit wonky and wont grab things when it should. Im on the second round of the dojo and ill get super close to getting 3 stars and the game will just stop letting me grab something and then the timer runs out because it wont grab that last enemy. Still even with that its frusterating but fun and I am glad I grabbed it. I just wish we could get more since all 3 episodes were so short.,"Nov 22, 2019 at 9:05 AM",5, 1,
