scrapping_date,review_author,review_title,one_reviews_text,review_date,review_rating,review_helpful,review_feedback
2022-05-28 17:17:59.471607,NaronWayne,What a waste,"This was the first of the series where I was hoping it was going to end and thankfully it was short! The tie fighter scene was honestly the only cool thing in this game (the perspective and true scale you get is amazing honestly). Im glad I finished the series but I do not believe I will be replaying it unless it is to unlock the home items. Try it for yourself you may enjoy it, but hard core star wars fans beware this is not the game your looking for.",Feb 18 at 6:46 AM,2, 4,
2022-05-28 17:17:59.486567,Natn8r,ABSOLUTELY THE BEST!!!!!!,"The best vr game I've ever played.
Pros:
+Amazing force powers that make you feel like a jedi master!
+Amazing story mode that you can replay multiple times with legendary characters that stay with you
+Don't even get me started on the lightsaber dojo.  They perfected lightsaber and force combat in this game. I have at least 100+ hours in this and have all the lightsabers
+Requirments for pc are NOT demanding AT ALL. I have a terrible hp laptop and it can run with no lag at all (intel i5 GTX 1040 8 gigs of ram and ssd upgrade)
+Graphics are absolutly amazing for the specs it requires

Cons:
-Throwing lightsabers is a bit overpowered when dual weilding
-Thermal Detenators and blasters are kinda useless
-Third reason cuz I dont like only thinking of 3 cons lol",Nov 22 at 5:00 AM,5, 34,
2022-05-28 17:17:59.500529,DemoSenpai,Amazing,I didn't see that coming in the end but I loved it. This made me love Star Wars even more,Feb 9 at 4:15 AM,5, 3,
2022-05-28 17:17:59.515489,LordHeretic,worst star wars game I've ever played,"the ""game"" takes 10 minutes to complete and most of that is listening to the annoying robot taunt no one. vader sounds worse than when hayden christiansen played him. the dojo is completely stationary combat where every enemy is out of reach of sabers. mods for sword games do a much better job withnlightsaber and force combat. dont waste your money on this disney fail",Dec 6 at 7:30 PM,1, 5,
2022-05-28 17:17:59.529452,Celticpred,The final game perfects the combat,"The final game of the Vader Immortal trilogy perfects the combat by adding blasters and thermal detonators as playable weapons. This also adds way more options in the Dojo along with the best rewards from the movies like Kylo Ren's lightsaber, Luke's lightsaber and more! If you are a Star Wars just finish this game and play the dojo, each game's dojo is a different challenge and you will feel like a true Jedi!

My full gameplay of Episode 3 here: https://youtu.be/CWMw4RFNqiY",Jul 21 at 12:16 AM,5, 12,
2022-05-28 17:18:02.652101,justin.tenoever.7,sick,awesome,Jan 21 at 2:34 AM,5, 1,
2022-05-28 17:18:02.667060,eddie_who345,Perfection,"The story is absoulutley brilliant with a wonderful and dramatic 
I understand people wanting the story to be bigger but it would probably never be big enough for people to get bored of also I think we need to get the percentage of 5 stars two 66% instead of 65%","Jun 18, 2021 at 8:39 PM",5, 8,
2022-05-28 17:18:02.682020,harry.phillips.5059,Perfect,Just Perfect 11/10,Aug 17 at 8:12 AM,5, 3,
2022-05-28 17:18:02.696980,mookie17,short game,very short,Jul 4 at 8:30 PM,1, 7,
2022-05-28 17:18:02.710942,NanoSurge,Shortest of them all...,This one is a down right insult to players...literally like 30 minutes of gameplay.  What a rip-off...the credits roll might actually be longer than the game....,"Apr 17, 2021 at 6:51 PM",1, 20,
2022-05-28 17:18:05.820625,Dodge2008,Bruh,You should just make all 3 games one game. No one is going to buy all the games just to add up the story.,"Apr 15, 2021 at 10:15 AM",2, 10,
2022-05-28 17:18:05.835585,Marcuz_VR,"Dojo ... ""unlimited power!""","To quote the Emperor: ""Unlimited Power!""  As others have said, the campaign was short, but sweet.  It's the dojo mode that I keep coming back to again & again & again & again &... Working to better my scores on every level & enjoy using the force grip on troopers and droids until the Force electrifies them all through my fingers.  So much fun!  This is a great foundation for Star Wars to build from. ... Oh to imagine when they create a VR Battlefront!","Jan 24, 2021 at 5:48 AM",5, 35,
2022-05-28 17:18:05.850545,walterkerr5,to short,"thees 3 games are amasing ! but their is a prolbum. the games are so short         and its to much  $ for three GAMES!guss how much it is for the 3games, 10 FREAKING $ FOR ALL OF THEM","Mar 26, 2021 at 9:12 AM",3, 6,
2022-05-28 17:18:05.865505,Mike_Tsak,Awesome Game,"A really really well made game. The graphics are very good and the story is sweet

I had a lot of fun in the Dojo 3 also.","Apr 26, 2021 at 12:04 AM",5, 1,
2022-05-28 17:18:05.880465,IV97,Good but too short,The game overall is pretty goor but its way WAY too short and there are lots of sections where your just standing there not beeing able to move at all but when you get to use th elightsaber and the force is really satisfying all 3 episode should bt just one game,"May 28, 2021 at 3:50 AM",4, 0,
2022-05-28 17:18:08.995134,Woookus,Meh- MAKE THE IIII EPISODE NOW AHHHHHHHH,"Talking about the issues-. Issue is, ""Ligh saber Dojo"" Takes wayy to long comparing for the story. The story is short for the ones who have finished it.. ..I bet everyone not ""everyone"" Wants ""Vader Immortal Episde: IIII, Because ZO-E3 Considiring the Robot- Says theres This ""Gold Treasure Chest"" And also- IT WAS AWESOME FOR THE I II III  EPISODES THANK YOU FOR MAKING THIS IT IS AWESOME THANK YOU LOL. Yea, Its awesome just tell me about it!! Byeeeeeeeeeeeee :>","Jan 14, 2021 at 3:44 AM",5, 8,
2022-05-28 17:18:09.010094,C2ThaMax,Dojo All the Way,"So storyline is great and all. Really loved it truly. But the Dojo is what will occupy you for hours and hours. It's got a ton of different sabers to unlock which is cool and overall is just super fun. And 40 or so levels that are challenging enough the first time through to make you really earn it. Also, it's Star Wars and it has lightsabers. That's really all you need to know. The lightsabers could have been more powerful; you end up using different means to destroy the stronger bots because the lightsabers just take too long. And the remotes are a pretty dull enemy. It would have been a lot better to have a different environment or two to choose from. But overall it's a must play. It's like $15 and you can probably play 15 hours in just the Dojo alone. Unless you're some sort of natural Jedi Master and just plough your way through. Then my hat is off to you. 

I hate most when you take off the headset and have to actually walk over to things to pick them up. That's just the freaking worst.","Nov 15, 2020 at 11:20 AM",4, 42,
2022-05-28 17:18:09.025054,OversizedHC,Must BUY - Recommended,"I'm a very avid VR player, and through all the games I've played these 10 dollar Immortal games have the best combat system I've seen so far. The story is great, although short and I would have loved a longer story. However the Dojo makes up for the short story with hours of gameplay. The lightsaber combat is the first system I've seen thats smooth, you can perry well, not many bugs. I love the addition of force and throwing lightsabers. Overall an amazing game and if your considering it and have the money I would buy it, out of all the 20-40 dollar games I have I play this one a lot more. RECOMMENDED!!","Dec 8, 2020 at 12:15 AM",5, 14,
2022-05-28 17:18:09.040015,DumbsterJedi,DVD menu game,"Remember those ""video games"" they would put in the bonus menu of DVD's? Well this reminds me of those. Somehow this is the most unengaging vr game I've ever played and required almost no player input. The controls are buggy and the characters are annoying at best. Don't waste your money unless you only intend for a 5 year old to play it.","May 9, 2021 at 10:55 AM",1, 0,
2022-05-28 17:18:09.053977,Slick1984,It was going along just fine...,"Let's just say that I was disappointed in the ending. I don't want to spoil the ending for others, so I won't state the problem. Those that did finish, know.

It was again too short, but again, the quality is there. 

I want to be clear, it was fun to be ""in"" a Star Wars ""movie""(?) and to interact as a character. Maya Rudolf was enjoyable as ZO-E3. But, it was not worth the $29.97.","Nov 19, 2020 at 7:47 AM",3, 16,
2022-05-28 17:18:12.159671,noffke,So long,I have been waiting a long time but its still loading.,"Mar 7, 2021 at 6:21 AM",1, 1,
2022-05-28 17:18:12.176625,NKiel,What could improve,"If you buy this game don't even go play the story mode go for the dojo. If you don't know what dojo is it's a training area where there's different levels and it's really well made. Best part of the game 100%

Spoilers:
Anakin or Darth Vader tries to bring back padme, sometimes in the game you see him talking to padme which was really cool. What would've been really sick was padme being reborn and was able to physically move. She would then storm over to Anakin and hug him or something but instead you destroy the thing that was meant to bring padme back to life again. You don't even get to fight Vader fully and kill him with your lightsaber. 

Maybe my standards were too high for this game since the only other story vr games I've played is half life alyx and boneworks. Both really good games and if you have a powerful enough pc then buy both. 

The price should be lower for all games. 10 bucks is just way to high. I'm not done with this game, I will come back to the dojo however.","Dec 12, 2020 at 10:22 PM",3, 2,
2022-05-28 17:18:12.190588,SlamJester,3* for story or 4* for dojo,"the quality of the story is good but it is very short. the dojo is decent. not sure why this the largest of the 3 chapters, seems to have the least content","Dec 19, 2020 at 5:24 AM",3, 3,
2022-05-28 17:18:12.204550,brzu18,Great game with a couple bugs,its a really great game but i get stuck on level 42 for dojo because it doesnt stop when you win it,"Nov 21, 2020 at 10:59 AM",5, 6,
2022-05-28 17:18:12.218513,david.agerholm,just black,my game is just black i cant do the story,"Nov 28, 2020 at 8:41 PM",1, 1,
2022-05-28 17:18:15.307252,Guttenjoe,Wow,I really liked this game series mabey a bit to short but the lightsaber dojo makes up for it. I really liked the final battle against vader really imersive,"Oct 30, 2020 at 11:10 PM",5, 1,
2022-05-28 17:18:15.321214,Godofdoggos,fun game go brrrrrrrrrrrrrrrrrrrrrrrrrrr,fun game go brrrrrrrrrrrrrrrrrrrrrrrrrrrrrrrrrrrrrrrrrrrrrrrrrrrrrrrr,"Sep 21, 2020 at 1:51 AM",5, 17,
2022-05-28 17:18:15.336174,sgtslaughter603,"Best one in the series, despite ending","Finally nice to be able to use blasters and thermal detonators (although i wish you had more “ ammo” with the blaster) Also, the part where you got to use a turret felt like I was back in Star Wars Jedi Knight:Jedi Academy. Force controls were much much better than when they were introduced in the second one. The fight with Vader was... anti climatic. It was very short and should have been the high point in the series. However, I think all the other features of the game make up for it. This one feels the most like a game, where the others felt more movie than game. The dojo is also great in this one, as you can actually get to fight stormtroopers with blasters, the force, and a lightsaber","Jul 13, 2020 at 1:31 AM",5, 28,
2022-05-28 17:18:15.352132,Wezlez,"Great dojo, short story.","The dojo is by bar the ebst part of this game. I have in total 1 hour play time, most of which is spent on the dojo. I beat the story very quickly. Even though the story is short, its fun. I only have 2 problems with this game. 1 it felt very restrictive in the action bits, by making you stand still. 2 I wish there was more lightsaber on lightsaber combat. In the story there is only one part with you fighting someone else with a lightsaber and in the dojo, sure there are the bots but you also have to deal with the other enemies. I just wish there was a 1 on 1 lightsaber fighting dojo. So overall, its worth $10 becuase of the dojo.","Dec 7, 2020 at 3:38 AM",4, 2,
2022-05-28 17:18:15.374073,Poshy_Thor,it's worth 10$ for sure,the dojo is the only reason I play this game. you can unlock many lighsabers like Darth Mauls and even Asoka Tano's lightsaberes ( Which can use the backwards lightsaber form! ). I would say best (only) star wars VR game you can buy!!! :),"Aug 4, 2020 at 1:45 AM",5, 8,
2022-05-28 17:18:18.490737,whitk1,OMG,Absolutly fantastic. All three episodes. could have done with a longer and more interactive dule at the end with Vada but still fantastic. and the traning dojjo is suberb as well.,"Oct 2, 2020 at 8:00 AM",5, 1,
2022-05-28 17:18:18.506695,Angelina Starr,EPs 2 &3 Stopped Working,Worked fine up to a few weeks ago but now there is no video - only audio.  Fix this devs.  I paid for these.  I want them to work.,"Sep 6, 2020 at 12:07 PM",1, 2,
2022-05-28 17:18:18.520658,GeneralFailure_ch,,"About 30-45 minutes of gametime is too little. About 15 minutes is just standing around. The price should be for free or 1 $, because it looks and feels like a demo. I probably won't start it a second time. 
Graphically great, sound great, the rest ... well ... gigantic amount of room for improvement.","Jul 4, 2020 at 11:06 PM",2, 5,
2022-05-28 17:18:18.536614,ksn,Good ending of SW story,"As culmination of previous 2 episodes this episode amy be tagged as ""a lot of action"". No learning, new mechanics or something - running and killing using all abilities you've got along the way from first episode to the final fight.
As usual good SW atmopsphere, graphics and sound. Story is background this time, action is primary focus of this episode.
Worth of buying as final part of series.

Frankly i can't percieve three Vader episodes as separate games. It is solid story, one game. The game is simple enough, suits perfectly for new VR gamers or casuals. However it definitely worth of buying, expecially if you know SW universe and like it.
I hope we'll get next episodes someday.","May 31, 2020 at 7:05 AM",4, 22,
2022-05-28 17:18:18.550577,pheenomstrike,Luv the Vi3 Dojo ? Join Us,"Dojo is endless fun though does crash on occassion. If you are looking to knock out the big scores regardless of format, then check out our Dojo Facebook group; 
 facebook.com/groups/vaderimmortal","Jul 24, 2020 at 5:04 AM",4, 4,
2022-05-28 17:18:21.641310,Dev7,multiplayer,i would love to see some sort of multiplayer light saber duel because when you finish the campain there is not much left to do,"Aug 11, 2020 at 4:07 AM",4, 2,
2022-05-28 17:18:21.656270,natedogd2,SOO WORTH IT!,"When you watch the SW movies, you're thinkin, Jedi's are purty frickin awesome I wish I could be one...if you've ever had this dream before (which is a majority of peeps in my opinion) this game IS FOR YOU!! Sell your old DVDs, your yoyo you never play with, the vase your grandma bought you...ANYTHING to get this game! The whole experience is completely immersive, you just think ""Could I do that?"" and you do it!! The Dojo is probably my favorite part for the reason of endless waves of enemies and how creative you can get with emanations, the fun keeps on comin! Never felt closer to being a Jedi and being that much of a BA...maybe except for Beat Saber but that's whole different story. Well worth the price and more!","Jul 17, 2020 at 1:04 AM",5, 1,
2022-05-28 17:18:21.671230,wilsonfm,"Beautiful game, childish experience","Visual is great, but as I GAME, well... I felt I was in a 3D Disney ride. Almost no freedom of movement and not challenging at all. The light saber fights, for instance, are dull and you never lose, no matter how bad you play.","May 26, 2020 at 7:55 AM",3, 18,
2022-05-28 17:18:21.686190,kriegler630,There is a huge amount of opportunity.,"I feel like the Lightsaber Dojo is something they really need to focus on more of, it's great and fun. But there is soooo much more they could do with it. Allow for more customization. Just for example allow us to fight Saber wielding enemies where if you get hit once your dead, allow for different difficulties. 

Make really fun modes with in dojo, like Reflect- where you have to try and reflect as many blaster shots as you can and allow multiple enemies to fire at you at the same time. 

Make a force powers mode where you really hone in on how to use your stander force abilites. 

A mode where they have droids that fire blaster rounds and the saw droids come at you...

This is a huge foundation for what could simply be the best VR expierence to date. They just really need to take advantage of it, the dojo can only go so far before it gets to boring. im at like round 40 and it's just starting to get meh... 

Give the players more control over how they want their saber to look, which colours to use. I personally would want to use a Red saber with a Yellow or orange saber. But the game doesn't let me. 

Again honestly id recommend this game for anyone, but also let them know that it's a good story, but the dojo is only fun for so long..","Jul 12, 2020 at 3:06 AM",5, 1,
2022-05-28 17:18:21.701151,DucksEverywhere,"Underwhelming story, but awesome!","I was expecting the story to ramp up after episode II, but sadly it doesn't much. At the end I was thinking 'is that it?'. That being said, the lightsaber dojo and use of the force is where it's at with this game once you've played through the experience. Possibly a little expensive at £7, but it's not badly priced when compared to other titles.","May 9, 2020 at 10:01 PM",4, 12,
2022-05-28 17:18:24.778918,TheGreatCondor,Wow!!!!!,The best til so far..,"Aug 11, 2020 at 11:15 PM",5, 2,
2022-05-28 17:18:24.793878,TheRealSelectGaming,BEST VR GAME,When you first get this game don't expect a long game this is more of an interactive expeience rather than a whole game! My personal favorite part is defo. using the force and the lightsaber battles! This games is so much fun and worth the $10! The light saber dojo is a very fun place to practice using a lightsaber and the force! Never thought I could become a jedi but now you can!,"Apr 5, 2020 at 2:52 AM",5, 16,
2022-05-28 17:18:24.809836,Belwin.Ec,Fulfilling my life long dream...,"of wielding a lightsaber in VR.  Can't really say enough good things about it, though there was no challenge, the experience is worth every penny.","Jun 25, 2020 at 12:05 AM",5, 2,
2022-05-28 17:18:24.825793,desiree.morrison.75,MORE,Its so good and its only 9.99 and you don't really die so you don't need do over and over,"Jun 28, 2020 at 4:46 AM",5, 1,
2022-05-28 17:18:24.840754,WeakenedApe8277,great,you must be very skilled to play the higher levels but once you get good the light sabers are great looking and the opponets are very fun to fight against overall great game.,"May 4, 2020 at 2:13 PM",5, 5,
2022-05-28 17:18:27.956420,PrinceoftheWest,Absolutely Fabulous,"Stellar visuals, world interaction, audio design, ui interface, and level design. One of the finest VR games I've played.","May 13, 2020 at 10:57 PM",5, 5,
2022-05-28 17:18:27.971380,De-Focus,"Overall great, but....","This game covers all the basics of what makes VR so much fun. It has beautiful visuals all throughout the game that are just WOW. The user interface is a good mention because it's simple and to the point with cool user customizations. Each individual game might lack content, but put together they make for a really stunning interactive VR movie/game? 

The Dojo
The real game is in the Dojo where you train and train and train your jedi and lightsaber weilding powers. You can really tell they put a lot of thougt into the mechanics of it. From using the force to the random opponents/challenges/extras you get from completing it all. What's the entire point of it all though besides being an arcade game? The Dojo could be maximized in so many ways with online challenges or connecting/battling other people. 

Overall I think $30 might have been alright for the price. I would've felt better paying $20 for a movie and arcade game though. If you're a star wars fan I would suggest getting all 3 and enjoying being a part of the universe. If you are just looking to have fun and play as a Jedi then just pay $10 for the 3rd installment and have fun killing storm troopers.","May 11, 2020 at 3:04 AM",4, 1,
2022-05-28 17:18:27.986340,BillBoss2008,The review is on the first episode,go to the first episode to see the review,"Jun 28, 2020 at 1:00 AM",5, 1,
2022-05-28 17:18:28.001300,Kpeterscr,A small taste of The future of Star Wars,"These whole series is a great experience,Episode 2 is the weakest link as short as 3 or shorter but not as interesant. The dojo on 3 is great as well as the story which was very enjoyable. Gets me excited about all the possibilities that VR could bring to the Star Wars universe. It's doable Valve just did it with HL Alyx now we just need that in Star Wars universe. 4 Stars just because its too short.","May 5, 2020 at 11:32 AM",4, 1,
2022-05-28 17:18:28.016260,gregsead,It's actually amazing,It just is so much action and it's just you have to play,"May 25, 2020 at 6:11 PM",5, 3,
2022-05-28 17:18:31.097020,Balimaar,Great Trilogy spoiled by lacklustre end,"I loved the first two installments of this series. While I enjoyed the 3rd part as well it was too short and seemed too easy. Vader was too easily defeated here and being saved by NPC at the last second just before Vader would kill you ruined the end for me. In the end, you achieve your goal with Vader...... welll kinda helpless which ruins the mystique around his lordship.

He had a menacing air in the first two games and in the third? The saber duel is lacklustre, youre saved by plot armour bs and the story is far too short.

The dojo is epic though so I'll still get my moneys worth... but I was here for the story and this final portion of an otherwise great trilogy left me disappointed.

I am, however, encouraged for the future. I would love to see the Star Wars universe be developed into a full fledged VR game in the future. Hell even have an online PvP arena would be great!","Apr 2, 2020 at 2:47 PM",3, 3,
2022-05-28 17:18:31.111980,Tread_Dong,"1/10th gameplay, 9/10th dialogue","Nobody likes paying for a game just to sit there and watch people talk (any turn based RPG ever). But This whole series is just that. In each episode, there are no more than 15 minutes of actual good gameplay: vader chucks a rock at you, you catch it, cool, 5 mins max total. now here's 20 minutes of dialogue. Slash a few things with a saber, cool, 5 mins max. Heres 30 more minutes of more pointless dialogue. Repeat that for 3 episodes and BOOM, you got Vader Immortal. The only positive thing I have to say about this game is that it looks nice visually. This whole game reminds me of those arcade shooters with the plastic guns. Exact...same...style...of...gameplay...

It sucks to see games like this with HUGE potential to be groundbreaking and nostalgic to all of us who love the story of Anakin turning into Darth Vader (spoilers), get ripped to shreads because a company wants to squeeze as much money out of you as possible and sell you a half-assed game.","Mar 19, 2020 at 12:44 PM",1, 3,
2022-05-28 17:18:31.127937,The_Bald_Guy,Unbelievable. (Maybe Spoilers),"Please please please make a 6 hour long star wars story like lone echo. Ive played all 3 episodes of vader immortal and its just breathtaking. using the force or light saber is just insanely fun. The story through the 3 episodes is like a sidestory in the lore of SW and its impressive, like i dont know..Star wars shadow of the empire? Its awesome to have a story completly indepented from the main lore. no luke, no laia. just your path. 
Please developer i am begging you to give us the epic vr saga we probably all want. 5 out of 5 for this epic piece","Dec 29, 2019 at 10:22 PM",5, 85,
2022-05-28 17:18:31.142897,Slipknotmaggot44,The dojo mode is worth the 10$ alone,"The campaign is very entertaining, although it feels more of a guided tour in some respects and over all across all the episodes is very short. The training dojo is where you will spend more of your time. This mode offers a fun and challenging wave shooter exdperience where you have a blaster, a lightsaber and some grenades. You also have to force at your disposal where you can hurl enemies around. The lightsaber feels and sounds incredibly authentic, making the melee fights in the game feel weighty and satisfying. With 100 waves and over a dozen different enemy types there's plenty of challenges to adapt to. 
I only wish there was a larger map variety, like Hoth or Atop a temple in Yavin. A progression system where you can earn and equip certain force powers/blasters would be an amazing addition as well.


I think this game is a good sign for more starwars vr titles to come. Easily worth the money.","Jan 27, 2020 at 2:17 PM",4, 11,
2022-05-28 17:18:31.157857,SquidPuncher,SPECTACULAR GAME! but one request,"TOP NOTCH GAME! the lightsaber phycics are amazing and the story mode is the BEST! but one very important question devs. CAN YOU MAKE IT PVP OR MULTIPLAYER! i ask this question because i thought it would be fun to do Co-op or 1v1 pvp, i just think the experience would make vader immortal more fun! Anyways, that all i have to say. bye!","Feb 17, 2020 at 11:58 AM",5, 14,
2022-05-28 17:18:34.241610,Caruto04,Won't start,"I got this game 2 days ago and at first it was working and I had a blast playing the game but the next time I try starting it, it doesn't it shows the loading screen and it won't start, is there anyway to fix the loading problem?","Mar 24, 2020 at 10:48 AM",3, 1,
