scrapping_date,review_author,review_title,one_reviews_text,review_date,review_rating,review_helpful,review_feedback
2022-05-28 17:18:34.259561,Name110,really good game,ok so i really really like 2 and 3 but the first one is really bad because there is no left handed setting and it just annonys me so if you are ever gonna make another game MAKE A LEFT HANDED MODE.,"Feb 26, 2020 at 2:07 AM",5, 3,
2022-05-28 17:18:34.274521,cakolukiam,"""The circle is now complete.""","If you loved the previous ones, just buy it instantly. If you haven't played the previous episodes yet, than buy them first and then buy this one immediately. It has everything I (or the communitiy) wished for: the story is just like the others (40 min.), the dojo is even better and harder to complete than the previous one, it has more much awaited cosmetics (more iconic lightsabers e.g.: Darth Maul's, Ashoka's, Kylo Ren's etc.) and I like the new gloves too. You will have a new forcepower in the dojo and you can use two more weapons (E-11 blaster and thermal detonator). So don't read too much ratings here, just go, buy, download and be part of the story. You will be pleased. :)","Nov 22, 2019 at 5:20 AM",5, 197,
2022-05-28 17:18:34.289481,Panda_King,Story Mode doesn't work,"Went to try and do the story mode today and after the loading screen all I got was a black screen/room. I could hear my movements and it was possible to move about the room, I could even draw my lightsaber and ignite it, but no matter how long I waited I was never pulled from the black room. I've uninstalled and reinstalled the game twice and have had no change. Very disappointed and would like a refund","Jan 11, 2020 at 6:25 AM",1, 7,
2022-05-28 17:18:34.305439,AlCreon66,"Still Good, But... (spoilers)","Nowhere near perfect. I understand why everyone praises this episode, the dojo actually requires some skill now, but there are aspects it could improve upon. The only new enemy you face here is stormtroopers, and it's cool, but only the first few times you fight them. There is a boss and one glorified cutscene at the end. 

I don't want to kill Vader, but there should be some sense of danger in that fight. Darth Vader should be a hard boss fight, but the fight lacks spirit in this. The explosion and time freeze make it feel too easy. I consider myself a huge Star Wars fan and it was cool to see and fight Vader, but it should have been difficult. There should have been a sense of danger throughout the whole series. I'm a bit disappointed. Sorry. 

PS. This doesn't change the rating at all, but ILM, please patch so that Vader is the final wave in the dojo. That was a missed opportunity. Am disappointed in that too, but that didn't change the rating I gave it.","Jan 28, 2020 at 1:06 PM",3, 3,
2022-05-28 17:18:37.380215,ParadiseDecay,My favorite EP so far!,"After my initial ""Wow"" factor with EP I and being a big Star Wars fan, this was my favorite episode by far. I really enjoyed the blaster combat which I thought was lacking in Ep 1 and II. Also fighting against the iconic Star Wars vehicles was pure cannon for me.
Taking all 3 episodes into consideration, this was one of the best Star Wars experiences I have played in VR to date.
Superb Stuff.

Gameplay Video // Oculus Rift S // GTX 1060 (6GB):
https://www.youtube.com/watch?v=B8pKNXC4sE4
(Please Note: Links might not work from Oculus so please search YouTube for 'Paradise Decay VR Vader Immortal III')","Nov 23, 2019 at 12:46 AM",4, 61,
2022-05-28 17:18:37.395175,Phexen,Secret Gameplay!,"My second day with Quest. I bought Vader. For all those who complain about a too short gameplay, i found a way to extend. In the 2nd or third scene with Vader, go on his side and whisper in his ear: prince of darkness, i wanna play longer. He pulls out a secret cube. Stick that cube in the back of your lightsaber and you can play 3hrs longer with 4 extra scenes","Jan 18, 2020 at 4:03 AM",4, 6,
2022-05-28 17:18:37.410135,Prominence191,"Fun dojo, but no campaign","The dojo is great fun and challenging, but I can't actually play the story. Whenever I launch the campaign I mind myself in an empty dark room and can see literally nothing, when I put my hand on my right hip I can find my lightsaber and shine it around, but everything is still black, even the walls.                                                Only 3 stars for such a huge bug that doesn't even have solutions on random help forums and Oculus Support.","Feb 11, 2020 at 3:41 PM",3, 0,
2022-05-28 17:18:37.426092,RickySpanissh,Just WoW!,"I don't give out 5 stars because no game is perfect, but it is definitely 4 1\2 stars.

Playing on Rift CV1
Ryzen 2700X
GeForce 1660GTX
16GB DDR4 3000mhz

I have episode 1 & 2, but i'm writing my first review on this game for Episode 3.

First off, the sound and visuals are amazing. So many games have very bland graphics to allow for better performance, but after seeing the graphics in this game and it's perfect performance, there is no excuse that other games can't compete. 

The sound is amazing and absolutely adds to the feeling of BEING in the SW world. Very authentic sounds and i'd expect nothing less from ILM. There's nothing like holding a lightsaber next to your head and hearing the hum.

The story mode is short, but these are EPISODES, so that's completely fine. $10 per episode is good. If they make one more that's $40 for a great game. Let's hope they make more than 4.

The story is great. It's different and interesting to see more about Vader's thirst for more power. It does seem more like a guided tour than a campaign mode, but i'm good with that.

Now for the best part (for me) The Lightsaber Dojo.  This episode adds Dual wield sabers (FINALLY), more colors and hilts. It also adds the E-11 Blaster Rifle and Thermal detonators (only at Dojo level 10 so far, maybe there is more to come?) More enemies in the form of new training remotes and stormtroopers (still more to come at higher lvl?)

I'd really like to see all of this technology and effort put into a larger fully fledged FPS in the SW universe. Possibly multiplayer saber battles. Although VR is still kind of niche, if something larger was produced with this kind of love, i think more would get into VR.

I do wish there was a way to run this game in Mixed Reality for video, like Beat Saber. Maybe something to think about adding devs?","Nov 22, 2019 at 9:41 AM",4, 49,
2022-05-28 17:18:37.442049,Rizopal,Why 3 stars?,Let me tell you why this gets 3 stars it gets 3 stars because I'm hungry and when you're hungry you don't want snack sized gourmet tasty treats even though they taste amazing I want the meal but so far I've had 3 very big plates with one rice grain in the center of each covered in some of the best gravy I've ever tasted and you're getting the 3 on the count of I'm still hungry I could have had taco bell and I'm 30 bucks in that's the price of a full game,"Nov 22, 2019 at 12:34 PM",3, 159,
2022-05-28 17:18:40.521812,Xyyth,,"I really enjoyed the Vader Immortal series but feel like they should have completed it into one full game for like $25.   It's basically a showcase VR game that you can share with friends and family to try out VR.

As far as the VR game industry, development is really slacking.  I look at the catalogue of games on the Oculus Store and most are the same ol' same ol' from years ago.   I'd rather have good games than no games or cheapo indy games that aren't any fun.    Software will make or break the VR industry.   Where's more good stuff?","Jan 24, 2020 at 1:23 PM",4, 2,
2022-05-28 17:18:40.536772,Landmate,Waste of money,"When I started playing this game, I understood why it costs three times less than other games. This is a rail shooter. Most of the time, you stand still and fight off enemy bullets with your lightsaber. Then you move to the next position provided by the scenario, and again you can’t move from the place and fight off bullets. In addition, the game is very short (about half an hour) and boring. Only the graphics are good. At the beginning of the game, I see a black screen. I can hear sounds, but I can't see images. I don’t recommend buying this game.","Feb 5, 2020 at 11:03 PM",1, 0,
2022-05-28 17:18:40.551732,OrionInHades,Loved it!,"AWESOME game! We need more Star Wars VR games please! Oh, and it would be  fantastic to get Vader in the dojo, or have a one-on-one saber and force battle with him!","Feb 17, 2020 at 5:34 AM",5, 2,
2022-05-28 17:18:40.567689,TheLegion_,Why? Just why?,"Story may be a bit short, still interesting though and has a lot of action. Vader seems a bit weak to be honest but thats okay. Theres just 1 tiny little thing that annoys me to such a high degree, im giving the Game 2 Stars because of it. Why. Why in the hell do you make a nearly impossible Lightsaber Dojo??? And why do you hate Kylo Ren so much you punish the people that like him? All i want is the Kylo Ren Lightsaber and it is literally impossible for me to get because i cant get 3 commendations. I am so done with this game ive started practicing Lightsaber combat in Blade and sorcery because there i can at least have the Lightsaber i would like >:(","Jan 28, 2020 at 6:56 AM",2, 1,
2022-05-28 17:18:40.583647,Wzky,"Good, but has it's issues.","This game is very fun, the ending of the story however felt a bit short and anticlimactic in the end. Still good, jut not as great as I hoped for.

The biggest issues I have with the game is the scenes in darkness feel a bit too dark and hard to see, and that using the force isn't very reliable, especially in high end Dojo rounds.

I'm stuck on round 45/50, and the only reason I'm having issues is because I can stand looking right at a blaster for 25 seconds and have my hand ready to force pull it to me, and nothing will happen, leaving me way too vulnerable and often causing me to die, I just feel it should be a bit more sensetive to where my arms are pointing to actually grab things? This happens to me in Vader Immortal 2 as well. It's not a case of me not holding the button long enough, but more that I don't even get the prompt to start with. If the force were a bit more fleshed out in this way, I'd really be enjoying it.

(Also, this game has great Oculus Home items.)","Jan 27, 2020 at 2:16 AM",3, 0,
2022-05-28 17:18:43.658423,LucasRizzotto,Worse than Ep. 1 and 2 in all ways,"The dojo is unbalanced and destroyed the flow state that you'd had in ep 2. The story action sequences are terrible and feel straight out of a VHS game from the 90's. Truly disappointed.

Worse is that you get some glimpses of what it could have been, specially in the final scene.","Jan 30, 2020 at 11:55 PM",1, 1,
2022-05-28 17:18:43.674380,Sl0thz,too short,Story is way too short with really annoying cringy characters. Didn't feel like Star Wars at all. Not worth the $,"Jun 9, 2020 at 2:46 PM",2, 0,
2022-05-28 17:18:43.689340,Pepewise,Very good story,Everything about this game amazed me from the story mode and the dojo but if they added a freeplay where you can do stuff like quests find pieces and sell them like the junkys these characters are it would have been 10x better,"Feb 5, 2020 at 8:12 AM",4, 1,
2022-05-28 17:18:43.704300,Gunter_deBohun,Won't install on Win 10,I have episodes 1 and 2.  Awesome!  Three downloads but won't install.  It thinks my anti-virus is blocking it.  I don't own third party anti-virus.,"Feb 20, 2020 at 1:08 AM",1, 0,
2022-05-28 17:18:43.720257,citizenzero,Short but sweet.,I got this game about half hour ago and already done with it. As with all of these Star Wars VR games... The Light Saber Dojo is really what is replayble.,"Feb 18, 2020 at 2:40 PM",4, 1,
2022-05-28 17:18:46.797028,Neqiro,I'm so disappointed.,"The first episode started off promising, the second gave you the ability to use the force for the first time which was cool, but this one? I don't know... It was basically just walking a linear path and blocking blaster shots for half an hour with no story whatsoever.
Meanwhile it locked you in position every two seconds and limited your interactions with the world. It's a VR GAME, not a movie. Let me interact with stuff. Let me move. I want to dive into the Star Wars universe and play a role in it. I don't want to be shown the Star Wars universe and be forced into a strict role and position in it.
The game apparently doesn't even care if you play properly. I completely messed up in the final boss fight. The fight just progressed as if I was slaying it.

A Star Wars VR Game - Sounds like a dream come true. You could explore planets, fly in a starship, become a jedi, become a sith, build a lightsaber, fight with a blaster, move as agile as force users are usually portraied to move, have a great story. The possibility are endless and sound amazing.
This ain't that. This is a clunky experience that doesn't let you do ANYTHING for most of the time, that moves you through a very simple linear story.

So in conclusion: If you're a Star Wars fan, obviously you're gonna play this. And you should. It's a Star Wars VR Game afterall. And I really hope there will be more. But I also hope that new games will be made by people who understand the spirit of VR and live up to it. This does not.

Sincerely,
a disappointed Star Wars Fan.","Jan 18, 2020 at 6:41 PM",2, 0,
2022-05-28 17:18:46.813983,FortifiedGHQ,"$5 Experience, $5 Star Wars Brand","This will be copy pasted on all 3 chapters.

These chapters leave something to be desired. It is a great thing to experience Star Wars in VR especially to have something that expands on the world but for $30 I could've gotten something more of a game than what we got with these tech demos. I'm a diehard Star Wars fan and have been doing my best to keep up with the new canon and this, while we do get confirmation of some myths being true, leaves so much narrative to be desired. I would kill for another game like the Force Unleashed but in VR, or even a choose your own adventure type game.

In each chapter they are short and are purely just interactable movies which.... is disappointing sadly. I was really hoping for more of a game than a giant cinematic for the price I paid.

It really wasn't worth the price they ask and I hope at least that this game can show the potential of the franchise in VR.","Dec 25, 2019 at 5:45 AM",2, 13,
2022-05-28 17:18:46.829940,appolyonm,,"Awesome graphics, decent story. It's super short, and interactivity is by far the worst part. No movement during battles is alowed, and you can only block lasers and use the force. It's a really shallow game, I am actually very dissapointed in the creaters. Should be a free game. Total rip off...","Jan 16, 2020 at 6:30 AM",2, 0,
2022-05-28 17:18:46.845897,Deytow,The same thing,Somehow this is shorter than the last two episodes but with less content. Finished the game in 40 minutes which wouldnt be too bad if 30 of those minutes weren't cutscenes where you just stand there waiting for stuff to happen. 1 puzzle 4 fight scenes and thats it. Will not bother getting any more Star Wars VR games if it will be held to this quality.,"Dec 30, 2019 at 6:00 PM",1, 7,
2022-05-28 17:18:46.861855,Stakiller,Make another one,Amazing! Beautiful! Please make episode 4,"Mar 5, 2020 at 2:42 AM",5, 0,
2022-05-28 17:18:49.936631,dillz1.0,not what's deserved,"this game could have been amazing, but really the first episode was the only one that acomplished anything revolutionary with each other episode forcing us to buy them. Additionally, they didn't even add the sights to blasters each time tyou look through them it's just darkness. They manipulated users who got hooked off of the first one and made two half-decent episodes after, this game should have been approached differently and dojo is not the game it's just the excuse and a poor one. I would love to see a full scale version of this style of game that are not sold apart.","Nov 26, 2019 at 8:19 AM",1, 9,
2022-05-28 17:18:49.951591,madhunter1,Level not loaded correctly,"I have been playing the story mode of the game and I enjoy it so far. But I have not been able to complete it, because whenever I quit the game to sleep I get back on it loads the level but I can't see anything. I can turn on the lightsaber and see that but everything else is black.","Jan 6, 2020 at 9:25 AM",3, 3,
2022-05-28 17:18:49.967548,RambunctiousDuck,Good but very little story content,"I loved every second of this game, it was gripping and fun. I just don't see it being worth £8. If they took the 1hr of content in this game and extended to atleast 8 hrs so it was somewhat worth the price. But I see how being a new VR title this is the price of new tech.","Jan 14, 2020 at 7:39 AM",3, 0,
2022-05-28 17:18:49.985501,NoxLunaUmbra,fix the grip reeeeeeeeeeeeeeeeeeeeeeeeee,"i love this game but i hate how sometimes the force grip doesnt register, i failed 3 stars on 47 due to it seemingly not letting me force grip anything for 8 seconds or so at the end and i finished 3 short","Jan 22, 2020 at 5:25 AM",5, 2,
2022-05-28 17:18:50.007442,Callaghan88,Lots of Potential,"A great story, visuals, and many of the gameplay mechanics a so close to perfect. One very frustrating thing however is that you must remain stationary in so many situations such as when in a character needs to say a line or when you get into combat, I really hope in any future Star Wars VR Games that this is not the case as it ruins immersive so much. Something else that would really help with immersion and is more interactables with the force, some of the coolest parts of the episodes were when you are interacting with force objects and puzzles.","Apr 13, 2020 at 7:26 AM",3, 0,
2022-05-28 17:18:53.118122,taquitobuddy,For star wars fans only,"Like the other ones, this is a short (~15) movie type thing with not much interaction, and what interaction there is is mostly repetitive.  Big star wars fans will probably enjoy it, but not much else here on offer aside from the IP.","Apr 24, 2020 at 10:02 AM",1, 0,
2022-05-28 17:18:53.134079,ElijahRio,Good Conclusion,"The story is a good conclusion, nothing to be dissappointed about there. However, the tracking that I sighted as an issue last time is worse here (especially with the gun in the hangar). 'The Force' seems a bit better here, probably due to the lack of use. The idea that this can be classed as a game is even more streteched here as its more of 'an experience'. It is an alright one though but like I said for the others, it is a bit expensive.","Apr 9, 2020 at 4:28 AM",3, 0,
2022-05-28 17:18:53.149038,MLTBlackDragon,One of the best Star Wars experiences,"If you love Star Wars, this is what you have been waiting for your entire life. To wield a lightsaber and feel its vibration in your hands, its an experience like no other.","Jan 30, 2020 at 7:24 AM",5, 0,
2022-05-28 17:18:53.164996,Tellusce,why so short?,"you saw the title, why? idk if im in the wrong giving a low rating but, the story is literally less than 15 minutes long, the dojo is, good, but very hard. i wanted story, and i got 15 minutes and then a dojo.","Jan 17, 2020 at 9:36 AM",3, 0,
2022-05-28 17:18:53.180954,GeneralMorningWood,,"Froze the first time I got to the Tie Fighter so I needed to close the game and reopen it, then I kept losing tracking on my hands when I fought the tie fighter and vader but most of the time it happened with my right hand. I don't know why I kept my right hand in front of the headset the entire time and didn't do anything fancy. Besides these few take aways the game was amazing","Apr 7, 2020 at 4:00 AM",4, 0,
2022-05-28 17:18:56.262711,NebDaeman,2 scenes is a demo not a game,"If episodes 2 and 3 were of the same quality and length as the first one this would be great. But they weren't. In fact I'm going to guess they were rushed out the door early. Why? It takes longer to activate the droids than you have control of them for. I can't help feeling theres a whole other scene with you commanding them that was left out. And the tunnel chase was just some of the worst immersion runing perspective of any game so far. 
After chapter 2 I should have walked away. But the publishers banked on peoples hope that the 3rd would be as good as chapter one. Well done, you got me - I guess there IS one born every minute.","Nov 26, 2019 at 6:32 AM",2, 15,
2022-05-28 17:18:56.277671,arby80,Worst of the three by far!,"Super gimmicky, and the annoying fembot was there the entire episode ruining the immersion.  It's voice and dialogue were completely out of context and have no business in this universe.  The frozen movement is also super annoying.","Nov 22, 2019 at 8:30 AM",1, 7,
2022-05-28 17:18:56.293628,DeltaFalcon,The best is yet to come,"I have never written a review for any game but can tell you this is the best game I   ever play.
Hope you guys keep making more starwar games I'll keep buying them.","Jan 19, 2020 at 9:05 AM",5, 0,
2022-05-28 17:18:56.309585,tuomaspap,Went from Excellent to .. meh,"Part I was excellent  , groundbreaking and also provided an element of freedom.
Part II turned into a non stop loading cuscene adventure that lasted less than 30 mins and could have been part of I or III (money grab).
Part III concluded as an epically scripted game where nothing you do makes any diffrence as the story is set to play out no matter what . 

Very dissapointed in how this title had so much potential and yet each episode just worsened and shortened in time yet kept the same price :/ 

3/5 for the effort","Dec 14, 2019 at 12:21 AM",3, 4,
2022-05-28 17:18:56.325543,Coolio124,Great Game,There is a lot of content in the lightsaber dojo as well as the campaign. You could get darth maul's lightsaber all the way to kylo Ren's.,"Jan 23, 2020 at 6:59 AM",5, 0,
2022-05-28 17:18:59.428244,leopunkhrcore,To short!,"was the most short of all episodes, fight Vader was fine, but like 1 hour of gameplay whit all and cinematics, i think i move and figth like 40 min, i dont think could recomend it, any way was amazing the short time, if you release a full game of at least 20hours of gameplay definitly will pay $60","Nov 27, 2019 at 12:30 PM",2, 3,
2022-05-28 17:18:59.444201,vibrantnebula,Disappointing & anticlimatic,"-Poor AI and stormtrooper animations. 
-Overall poor combat choices - most of this episode is reflecting blaster shots back towards storm troopers.
-You loose the ability in the campaign to throw your sword. That's a huge UX element in Ep2 - to loose it without explanation is weak.
-Mutsafarian skybox is low resolution
-Vader bossfight is short and anticlimatic

Overall I'm suprised at the turn this series took. The Dojo is fine but the campaign itself was underwhilming and seemed unpolished compaired to the first two episodes.","Dec 20, 2019 at 8:00 AM",2, 1,
2022-05-28 17:18:59.460159,MacMillan333,"Anticlimactic, but dojo is still awesome","You can finally fight Vader, but it's very scripted and underwhelming. As with the previous episodes, I'm buying this game for the dojo, and it's freaking awesome.

This time they finally added everything I could ask for: dual-wield sabers, bidirectional sabers, blasters and thermal detonators. Back in Episode II I complained that the Force was overpowered, and I'm glad to see that this time they balanced it with two more equally efficient ways to kill enemies.

First is the blaster. Some enemies can resist the Force for a few seconds, but with the blaster you can make it as fast as you can shoot. It's powerful too, as very few enemies can withstand more than 3 shots. That's not to say the blaster is absolutely overpowered, because you still have to aim well, and there's limited ammo, so you may need to Force-grab additional blasters from Stormtroopers.

Second is dual-wielding sabers. With one lightsaber you get the same defensive capabilities as always, but now with a second saber, you have the freedom to slice stunned enemies twice as fast, or immediately deliver a riposte with your spare hand after a parry, or hold both sabers up for an impenetrable guard, or throw and recall the second saber to attack and defend at the same time.

All tools considered I have developed three distinctive fighting styles: defensive saber + Force, defensive saber + blaster, dual sabers. They each have their pros and cons: the Force can take out enemies in pairs, but it takes time; blasters are fast, but there's ammo anxiety, and it can be difficult to grab additional blasters when surrounded; dual-wielding is agile, but it's less efficient for ranged enemies. Because of this I actually have to swap fighting styles back and forth to adapt to the ever-changing enemy layout in later rounds, and I enjoy this very much.","Dec 4, 2019 at 1:10 PM",5, 8,
2022-05-28 17:18:59.476116,FaZeWookie,,"I absolutley love star wars but this game was £8 for a 40 min story and a 2 min fight with darth vader that was the main selling point for the vr game, disappointing.","Nov 24, 2019 at 7:56 AM",1, 10,
2022-05-28 17:18:59.492073,ElCuco68,"Good, except for one supremely frustrati","No matter what I do, no matter whether I use in-game or Oculus re-centering, every few minutes there is a button or lever that I simply cannot reach because my floor is in the way! I've tried everything, including re-setting my three trackers; no dice.","Dec 26, 2019 at 12:32 AM",3, 0,
2022-05-28 17:19:02.579815,martin.melich.52,Great game,"If you are a Star Wars fan, you will love the game (series).  If you aren't, you will like it but think it's a bit short.","Jan 21, 2020 at 6:22 AM",5, 0,
