scrapping_date,review_author,review_title,one_reviews_text,review_date,review_rating,review_helpful,review_feedback
2022-05-28 18:33:32.570224,Oberon101,Satisfying shooting wrapped with CoOp.,"**UPDATE**
The issue I was having with the shotgun has been resolved with the latest update. Shotgun now almost works flawlessly with my pump vr gunstock, the travel distance required for pumping is quite long. If it was a little shorter it would be great. 

Measuring the distance required between games such as Pavlov and Contractors the pump distance is around 6cm. While games like Resident Evil and After the Fall are in the 20cm area. If this distance could be shortened it would be great. 

With the addition of character skins and a new map to play on, me and my group of friends are excited to dive back into some Snowbreed blasting.

Now if we could get some sort of MP5 smg in here it would be a cherry on top of a very delicous cake.

Five Stars!

**OLD REVIEW**
Been looking forward to this one for many years now.

Me and my group of friends are thoroughly enjoying ourselfs working our way through the higher difficulties and gathering Harvest and rarer Floppy disks to upgrade our equipment.

Only gripe so far has been with the pump on the shotgun. It on occation will not shoot because the pump is not fully extended and hence the case eject bay slightly open. 

If the sensitivity on the pump could be lowered slightly so it would not pick up the small incriments when just aligning the controllers to aim.

For me a shotgun is the most iconic Zombie/Snowbreed/Horde slaying weapon and it would be great if it was more reliable.

Hopefully it´s something the developers can patch sooner rather than later.

The cross platform play is also great, even at the sacrifice of cool lighting effect it is great to be able to share the experience with the Quest crowd.

Great game and a recommended purchase.",Mar 26 at 5:32 PM,5, 17,
2022-05-28 18:33:32.585184,dsuzuke,Unplayable solo with AI,"This game is soo good! like a LF4D but with the same problem, AI are overstupid and you will alone on final stage,  you can play the first two scenarios but three+ need human players or your are alone. two stars for they  said  ""single player"" and for unusefull AI. i'll wait for AI or/and Solo mode upgrades.",12 days ago,2, 0,
2022-05-28 18:33:32.600144,TheAllStarr,Must have for VR,"The support this game receives and the relayability and the community. Wow, great game. One of the couple of games I consider equal to a PC experience. If you like horde shooters then this is gonna be one of your favorite games.",Apr 30 at 7:04 AM,5, 0,
2022-05-28 18:33:32.615105,tasos.leo,Left 4 Dead,If you ever wated to play left for dead in vr with friends then this game does that limited levels but lots of replay apeal personaly i love this game,May 1 at 3:58 AM,5, 1,
2022-05-28 18:33:32.630065,lobley73,VERY GOOD  GAME,"BOUGHT THIS ON QUEST 2 AND ALSO HAVE A RIFT S  ,BOTH CONNECTED TO SAME ACCOUNT , WE CAN BOTH PLAY AT SAME TIME BUT CANT PLAY TOGETER BECAUSE BOTH HAVE SAME USER NAME , WISH THERE WAS A WAY TO CHANGE PLAYERS NAME IN GAME SO  PEOPLE WITH MORE THAN ONE HEADSET CAN PLAYER MUILTI PLAYER  
REC ROOM YOU CAN AND ALSO COOK OUT
BUT THE GAME IS GREAT PLEASE ADD A WAY TO CHANGE PLAYERS NAME IN GAME

THANKYOU FOR A GREAT GAME",Dec 10 at 4:04 AM,4, 147,
2022-05-28 18:33:35.744734,WillieMcBride,"Controlls buggy , losing weapons","It is a goddamn shame that after the Fall not kept their promise of fast newcontent, the game is still unfinished and buggy as hell.
The gun holstrer does from time to time not even work, switching guns trhen means losing them in the middle of a battle.
The access to the in the sleeves stored boosters also doesnt work all the time and you even dont recognize that an enemy from behind eats you alive, not even a noise to hear or a optical warning that would make it possible to react.
All in all, i regret it that i spent money again for an unfinished game. Stop the madness, never buy alpha or early releases anymore.
Finish a game then sell a working copy, comprende senor developer.",Feb 7 at 3:01 AM,2, 4,
2022-05-28 18:33:35.761689,WhyKlef,This title is one not to miss. 4* Update,"<update> I've knocked one star down for now, after playing 5+ hours. The amount of glitches is quite astounding, and not positively. I thought Steam Discussion (who warned players of such) were playing an older build but nope, it's riddled with bugs. </update>

SUPPORTS CROSS-BUY!!

With cross-play between PSVR, Oculus and Steam, we are more likely to find a community for a long time. The game promotes weapon progression so yes, while it is similar to a Left 4 Dead, it offers far more replayability. The shooting is extremely satisfying and overall there isn't much to fault this game on.

It's an amazing display of VR shooting multiplayer and one that is not the old rehash wave formula that we've seen over and over.

In fact, this game reminds me of a very underrated VR title which unfortunately, released way ahead of it's time...

This game gives me Gunheart nostalgia, versus which it offers less progression. However, it is more polished and uses a winning formula (zombie) versus one that can be ""hit 'n miss"" for some (sci-fi planets w/ giant bugs). Still, this proves that if they were to re-release the other title, it'd probably be extremely successful as this is very close in spirit.

Anyway back to After the Fall, it was worth the wait, it is early to sing it's praise, however this game has the potential for a higher retention rate than most VR games. It's fun, yet simple enough to pick up, but also with great multiplayer implementation, matchmaking, crossplay, in-game voice, in-game friend list with intuitive and easy ways to add people, lobby... They nailed the online portion which is fundamental, plus the game will release on Quest 1 in 2022.

Congratulations Vertigo Games, if Arizona Sunshine was somewhat of a ""proof-of-concept"", you showed your experience as developers with this title that improves on almost EVERY aspect.",Dec 14 at 10:52 PM,4, 56,
2022-05-28 18:33:35.777646,McNugget6750,Needs several fixes rather urgently!,"Dear Developers,
The game is indeed a lot of fun. So far, we did one session only. However, it took my group of friends about 1h to get everything set up and running together.
Here are a couple things that really stood out that need fixing pretty much as soon as you can:
- When people join a party in the lobby, voice chat is a must. It's impossible to coordinate otherwise. We spent almost half an hour to figure out why we cannot hear or see each other in the lobby even though we were all online and there. - MUST FIX
- Reloading in advanced mode is seriously broken: I oftentimes wasn't able to get the magazine into the gun without physically crashing my controllers into each other. The mags often end up outside of the pistol instead of the mag slot. In addition, many times my mags just fell to the ground or flipped back into my holster for no apparent reason. During the heat of the fight, this is kind of game breakingly frustrating! Cogging the weapon should be either trigger finger or both grip and trigger. Currently it's grip button only, which seems extremely counter intuitive. Often, the weapon then just changes hands because people were still pressing the grip button on the weapon hand, too. - HIGH PRIORITY
- Jumping of a level to another level from one frame to the next is extremely irritating as there is no feedback about what happened. I get that it might make people slightly sick when falling is done at a realistic speed but I'm sure there is a middle ground and that would be configurable in the settings! - Medium priority
- There should be a warning that you and some of your team members are connected in a party with voice chat in the oculus quest environment when entering an in-game party. This causes other people to not be able to hear the ones that are using Oculus voice as the microphone is already in use. This was a major issue and caused us to abort the first game as we could not hear all the party members. - also High Priority",Dec 12 at 11:06 AM,3, 42,
2022-05-28 18:33:35.792606,ClarkyTheSharky,"Incredibly fun, amazing potential","I'm a long-term gamer. I started gaming on the Apple II and Atari 2600, long before NES. I've played more games than I can count. After The Fall is one of my very favorite games.

Is this really a 5 star game?  My opinion is yes, if we mentally edit the game title from ""Launch Edition"" to ""Early Access"".  I view early access as a practical way for indie game studios to continue development.  It's rediculous for huge companies like EA or Activision, but very understandable for indie studios.

After playing for about 16 hours (12 on PC, 4 on Quest 2), here are my opinions:

The good:
- Very enjoyable gameplay loop.
- Plently of replayability.
- Amazing visuals on PC, surprisingly good on Quest 2.
- The guns feel good and are fleshed out (can chamber check, etc).
- Plenty of weapon mods and color/skin options.
- Ammo quantity adds another dimension of fun, forcing you to strategize and swap weapons.
- Frantic, exciting gameplay. No other VR game compares. Much more frantic than Saints & Sinners.
- The difficulty levels feel well tuned, and the gameplay is challenging without feeling unfair.
- Decent variety of enemies (slow zombies, fast zombies, floor/ceiling crawling zombies, explosive enemies, slow bullet sponges, and a monstrous boss).
- Getting this running on Quest 2 was an epic feat of engineering.
- The 5 maps are a good length and decently varied.
- It's cross buy (get both the PC and Quest 2 versions).
- Matchmaking is usually very fast.
- Automatic co-op, party co-op, and single-player are all fully supported.
- Actually has a story!
- Cross play.
- FPS is buttery smooth.
- Accessible but very high skill ceiling.

The okay:
- Could use more weapons, enemy types, and environments.
- No skill ranking.

The bad:
- If the host leaves/drops then all progress from the run is lost.
- Needs more maps and story.
- Can't pick your avatar.

This game is incredibly fun as-is, and I'm confident will grow into a must-buy.",Dec 16 at 12:49 AM,5, 33,
2022-05-28 18:33:35.807566,Kaishen,Awsome!,"Just had my first few sessions on this, Fantastic game..Rift and quest 2 player here, you can play on both headsets, same time on one account, but...you have same user name so cant play together..Please devs, give us the ability to have seperate user names so we can play with a mate. :) Also, keep up the good work! Anyway to change our in game Avatars?Ooh! Ooh! and Melee! please! ,lol. we can hit crates etc, let us smack a zombie or knock em back?",Dec 10 at 7:03 AM,5, 34,
2022-05-28 18:33:38.892315,EthicalGoat,Almost Everything You Wanted,"It's not difficult to see that AtF has some potential to be a 5-star VR zombie shooter...but between the egregious amount of bugs and limited content, it's far from what it could be capable of.

Map clipping, server issues, weapon and item glitches...there's a lot of work that needs to be done before AtF really blossoms. Admittedly, when I first start playing, these setbacks don't seem so bad (perhaps I was blinded by the lustre and excitement of a new game)...but they can really make a difference when you start to play at higher difficulties.

Speaking of difficulties, the easier game settings lose their appeal if you're a decent shot with some minor weapon upgrades. The 5 maps are easy to memorize, and enemy spawns quickly become predictable. However, Master and Nightmare (!!) can still provide a surprisingly challenging atmosphere even for the most familiar of players and sharpest of shooters.

Despite AtF's long list of setbacks, it is enjoyable and exciting for a few hours, but is not something to write home about. With some TLC from developers, it could turn into a must-buy.",Jan 31 at 11:22 PM,3, 2,
2022-05-28 18:33:38.908273,xXxAussieBxXx,Big let down,"This game had big expectations. Super wonkey, the same thing after an hour or so of play. Very reptitive, not a long term game just something to try out.",Feb 11 at 2:12 AM,2, 4,
2022-05-28 18:33:38.923233,NodnarbDB,"Will be great, but some big flaws now.","So upon launch I'll say the game is just about up to the hype.  I have some things I’d like to see improved to really keep me coming back.  It’s worth the price, but I think it’s more of a good foundation than a completed game.    
Pros:
* yes it’s fun and awesome and plays well.  
* good gun upgrade system – unlocks higher difficulties as you upgrade and improves experience 
* maps are good overall, not a bad start.
Cons:
Folks have mentioned the bugs in more detail – no lobby chat, AFK party leaders get people stuck in lobby, if party leaver leaves a match everyone loses progress etc.  Yes those need to be fixed.

HERE ARE MINE: 
* THE INVENTORY SYSTEM IS FRUSTRATING.  Keeping items in your wrist is terrible trouble for a fast paced shooter – especially frustrating when you can’t hand rifles from one hand to another.  Trying to grab something from your off hand can be a clunky juggle of death when THEY SHOULD JUST BE ON YOUR BELT  
*no physical interaction with enemies other than shooting them – can’t push away or hit them..
* Needs a few more objectives to run through as you progress in difficulties.  Right now the only reason to want to play higher difficulties is that your guns level up and it gets too easy and to level up your guns more you need to get the disks in the harder modes.  THAT’S IT.  So the game will be hard, then easy, then hard then easy then hard...then easy..  It’s the same over and over with only some locations changing of where stuff is and where enemy waves get triggered.
** SO, have a few objectives cycle through like rescueing a lost survivor (one player unfreezes while others have to fight off waves then have to give them a weapon and keep them alive).  Repairing harvest route (blasting through ice blocking the way while waves come, forcing team to split up to coordinate an effort), Restock (have to carry boxes in one hand through to marked areas eliminating ability to carry extra stuff in hand).  Stuff like that could go a long way.",Jan 4 at 3:24 AM,3, 4,
2022-05-28 18:33:38.939190,MaXiMuM-V,4.5 -> Changed to 3,"Waited a bit before writing this review. I pre-ordered and I was waiting on this one since I got into VR and bought the Quest1. World did not make it past the 80's ? I am sold.

For me this title lives up to my expectations (mostly). They got all the hard stuff right and true crossplay is just awesome for VR in general. 

The game is fun an varied, every time  I play a level again I am constantly surprised when I think I know how a stage is going to go, and it throws a curveball at me. In some cases the change is subtle and you really have to know what your looking for, very organic high replay value.

I have played on PCVR and Quest Native and honestly the only thing I miss is the flashlight (greatly) from the PC version. 

The ""line"" is  a good example of what a Meta Portal could be, its pretty bare at the moment but  you can see the barebones framework that has many possibilities with additional updates. I think would be cool if you could free chat in the lobby, If all titles had and area like this and you could Jump between them, in an organic fashion you could really start to create the feeling of in being in the ""Metaverse"". 

Shooting in this game is satisfying and I love the advanced reload, and the fact you get better harvest for using this mode. 

Hopefully there will be a ""80's Mall"" map in future DLC/Updates. I can envision it being a bit challenging however if you freeze 80's and you don't get to harvest a mall, life is not worth living :-) 

Yes there are bugs, and a few dropped matches before you get into one. Hopefully this area can continually be improved/optimized. Its frustrating to get into a map and either its over because someone drops or ""kicked"". 

Update: 1/10/22 Changing to 3 stars until they update, this game drove me back to xbox for a while. There is nothing worse than wasting time just to have host leave, game crash etc, seemed worse after the last update.

maybe after a couple patches I will consider giving this title my time again.",Jan 12 at 4:53 AM,3, 7,
2022-05-28 18:33:38.954150,Glenn-Tidbury,Yet another broken vr game,"Can't even complete the tutorial, because the weapon crafting table is broken. Won't hold my gun. Total waste of 20 quid, waste of my 30% code, and yet another broken vr game. Literally only use vr for walkabout mini golf and table tennis, everything else is so broken. No wonder people are abandoning vr lately.",Jan 22 at 11:48 PM,1, 2,
2022-05-28 18:33:42.052862,sebby.lombardi,Holy Hard!,"I've only made it to the first harvest level, but so far a really great game. I'm generally really good at vr FPS So I hopped into nightmare mode thinking the difficulty was Similar to Arizona Sunshine but I was completely wrong. My team and I froze before even entering the arcade. I'd say this game has very heavy Left 4 Dead Vibes.",Dec 10 at 6:43 AM,5, 9,
2022-05-28 18:33:42.067822,edgecrush3r,The most thrilling game you get!,"I really hope this game will set the bar for all future VR games. The graphics on both PCVR and Quest 2 are really amazing. The fact that this game is crossbuy AND crossplay was already pretty impressive. But this game actually also keeps all your progress in cloud, so unlike other games you dont loose any progress when switching. However there are only 5 levels right now, the levels them selves are at about 25-30min each, really decent and longer then i expected them for this type of game. The way that co-op is implemented in this game is really good, and because its crossplay there will be plenty of people to join your squad. Gameplay and sound design really makes this game AAA, and the co-op is incredibly well done (better than any other VR shooter at the moment). If this game came with 8 or 10 levels it would have been a 5 star, but i hope that the devs have already plan on doing more seasons. Often this game is compared to Left 4 Dead in VR, but this immersiveness is just sooo much better then you have experienced.",Dec 18 at 12:17 AM,4, 6,
2022-05-28 18:33:42.083779,jayrock55,What a mess,"This game in its current state is a complete jank fest. I dont know how people are giving this 5 stars. Does it have potential to be a 5 star game? Absolutely. But right now the game has so many bug the game feels like it's still in beta. But with a finished price tag.The biggest problem right now is that the end game here is all about collected currency and upgrading your weapons so that you can advance to higher difficulties. Problem is, the upgraded guns keep reverting to their basic form every time I enter a new game. Yet my currency is gone. Complete waste of time. Mics are all echoing, enemies rubber banding , you can get stuck on certain terrain, fall though the map, If the host player disconnects everyone's game disconnects. I appreciate what the devs have tried to create here, but I think they bit off more than they can chew on this one.",Dec 12 at 2:42 PM,1, 17,
2022-05-28 18:33:42.098739,itskolby,"Fun, but needs some bug fixes","This game is really fun. Its a lot of fun to play but there are some serious flaws. There are 2 ways to reload your gun. Option one is to move your gun hand towards your body and press a button. Like an old arcade game you played as a kid. Option 2 is a more modern VR way and makes you eject the magazine, grab a new magazine from your belt, put the new magazine into your gun, then rack the slide of the weapon. Option 1 works great. Option 2(the manual reload) does not work at all. 50% of the time the magazine I reload ends up empty, so i reload twice, or I end up grabbing some random item during my reload and have to drop it, try to grab from my belt again, then try to insert. Also there is a bug that when you try to rack the slide AFTER you insert a new magazine, you just switch hands. So here you are, trying to rack the slide but you just keep swapping the gun between your right and left hand.",Dec 11 at 9:52 AM,3, 7,
2022-05-28 18:33:42.112702,CDawes,Really fun game - but needs more.,"This is a really fun game, reminds me of zombie time crisis. Time flies so fast. The cross-buy support is great and I wouldn't have bought this without it (as I use both PCVR and the quest 2).

The game is quite new and expansions are coming, but it currently doesn't have a lot of re-playability as there are only 5ish maps and 5 weapons. For £30 I would have expected a bit more, but it is good that the launch edition has more content coming for free.",Jan 9 at 1:35 AM,4, 2,
2022-05-28 18:33:45.223382,DethBuny,So much fun!,"I was having so much fun, but my husband couldn’t take it lmao! I thought I was going to have a hard time with jump scares or the enemies being too scary (I don’t really like playing horror games), but surprisingly I thought it was funny. I got a few jump scares, but it was all in good fun. The only thing I wish is you could pick what character you want to play as. If there is an option I didn’t see it. I love how fast pace it is. Headshots are soooooooooo satisfying. The way they fall apart is great too. The mini bosses are cool to looks at, but scary good fun. I love that run actually is a run, in a lot of games when you run it’s just a tiny bit faster than walking, but not in this game. I love that you can adjust your height at anytime too. I would like a crouch button, like in Zero Caliber Reloaded, other then that this game is hands down in my opinion the best zombie shooter out there!",Dec 19 at 12:10 AM,5, 4,
2022-05-28 18:33:45.238342,Krikn,First impressions,"Im playimg on quest1 linked to my pc,
The gunplay feels good, especially with manual mode.
The combat feels quite responsive and I've had a blast so far.

Concidering this is a coop vr game i were quite suprised of how well it worked. 
No gamebreaking bugs so far.
I'd reccomend this if you're into vr shooters.
Probably most fun played with friends, random groups are usually ok aswell.",Jan 18 at 3:12 AM,5, 1,
2022-05-28 18:33:45.254299,071W,30H + Review,"If you like L4D then this definetly a must have on VR! I play on the PCVR and the game looks really good, runs smooth too on gtx 3070. Coop with others is always fun! You get 5 mission runs, each is divided into 3 sections depending on the difficulty it can be 15-30 minutes per run which great for a quick game for a single run or you can do a couple of hours marathon on all Runs if your squad agrees.

Weapon selection is nice, 2 assault rifles, 2 pistols, shotgun and uzi. I hear there is more coming which is great. Cough cough LMG? cough. Each gun has modifications you can find during your runs and better ones can be found in more difficult runs. 

There are a few bugs that can be annoying but the dev team is working on patches to fix them and I am confident they will smoothing things out as they listen to community.",Dec 20 at 6:40 PM,5, 3,
2022-05-28 18:33:45.269259,Beans1985,Amazing Potential,"I would have given 5 stars if not for some of the bugs.  My main complaint is the constant dropping out of games.  There are things that could certainly be improved, and I'm sure they will. (Update: I have reduced my opinion of the current state of the game due to mechanics.  The game itself is great, however the difficulties need to be better balanced, the glitches need fixed, and most of all   they really need to fix the group finding feature.  Its hard for me to find a game where the lobby leader does not just drop out and kick the whole team.  Players should be able to join mid game as well.  I also hate the constant ""gear shuffle"".  It's not a fun way of completing anything.  It's just silly.)",Jan 9 at 10:41 PM,2, 2,
2022-05-28 18:33:45.285216,MrKappa,Level of detail is A+,"Level of detail is astounding on pc .. the flashlights are awesome 

I see you can knock pics off the wall .. shoot toilets .. move chairs .. bugs on the floor .. all the little things about an environment 

Hats off to the world builders .. the gun detail and little hand rocket is right up there with Half Life Alyx 

Idea : possibly hide higher end discs behind pics .. in chairs .. in toilets that can only be found if shattered .. or add other environmental items outside of drawers and fridges that can be manipulated to find higher end discs 

Idea 2 : more guns",Jan 10 at 12:07 AM,5, 1,
2022-05-28 18:33:48.366974,dredgeho,Game ends and you lose all progress,"Game ends and you lose all progress when someone leaves server.  It wouldn't be so bad if you didn't lose the progress but trying to play two games and wasting 20 minutes for nothing and no progress at all is not worth even playing the game.  Two games disconnected one after another... happens way too much.  NOPE

Forgot to mention the AR-15 gun sways when you move... in VR.  It has a sway.  You can't keep it steady.  It's really dumb.  

Cheaters glitch the game and ruin the game for others trying to play the game normal.",Dec 25 at 9:55 AM,1, 2,
