scrapping_date,review_author,review_title,one_reviews_text,review_date,review_rating,review_helpful,review_feedback
2022-05-28 18:33:48.382931,Delamonte,The game is amazing! But...,"The game is amazing! But it needs some work. I will not list bugs and so on, but I will only say what was important to me.
In fact, I have only two complaints, this is the angle of the weapon and manual reloading.

1. Gun angle settings. It's a MUST HAVE. 
This is a very important thing to feel and enjoy playing. Since I played a lot of Pavlov and pistol whip. And I have a big surprise when first launch ""Arizona Sunshine"" and a gun was tilted 20 degrees up. Fortunately, there was an option to tilt it ""right way"". I can say that the ""correct"" position of the pistol in the game, changes quite a lot, in terms of feeling (For now, the pistol orientation is about 5 degrees up from the ""normal"" position), I'm used to a certain position of the pistol in the game. And if you can configure it so that it matches the position of the hand in reality (I searched through all the settings, but did not find this parameter, maybe I'm just stupid, tell me where it is.) it will be very good.


2. Manual reloading... Please, ad option to chenge it to triger button. I don’t know who suggested this, that you need to use grip button to take out the mag\shell and to cogging the shutter. But he\she needs to knock on the head. (no offence) . It may be convenient for someone, but in this case, add the ability to change to the trigger button.

I understand this is just a launch and maybe in the future you will add a lot and improve it. And I hope my feedback somehow influences it.
Best wishes for the development of the project.

And I apologize for my sloppy english.",Jan 6 at 10:41 AM,3, 1,
2022-05-28 18:33:48.397891,pestylucas,thought I'd spark the discussion,"so uh... no one's said anything yet... thought I'd just, push it along.",Dec 10 at 2:35 AM,5, 38,
2022-05-28 18:33:48.413849,Ur_Round_Next,This sure does need some patches,"The amout of times iv jummped down to the next part of the map and got stuck iv lost count.

All the enemeys seem like there all twin brothers no variety in them at all

Everyone that does talk always have a echo

Iv spent and lost a few weapns thats iv brought on a return

This hopfully will be a good game after about 10 updates , I have my fingers crossed",Dec 17 at 8:26 PM,3, 2,
2022-05-28 18:33:48.428809,TomatoeJoe,Amazing game!!!,"After a few hours of play, I can definitely see this game becoming one of my favorites. The gameplay is great and the content isn't bad. It's astonishing how good this game looks on the Quest. The devs have already confirmed they'll be pushing regular content updates for quite some time too. If you want to kill hordes of zombies with your friends, this is definitely the game. I never expected this type of game from the Arizona Sunshine crew. Great work!!! 

(Also, it's great that there's cross buy & cross save support for quest/oculus!)",Dec 11 at 10:03 PM,5, 2,
2022-05-28 18:33:51.538491,xxxXaLiVeXxxx,Great game but....,"Pros
1. Graphics - some of the best graphics ever seen in quest 2 
2. Gameplay - very addictive and a challenging
3. Multiplayer - easy to connect with friends after figuring out how to work everything
4. Story - Good once you figure out you need to speak with the girl in hub.

Once the cons are addressed I will revise back to 5 stars. Love the game and only want to see become the best it can be. It's amazing and worth the investment. 

Currently it's my favorite game on quest/rift.

Cons
1. Getting stuck in walls or doors ( stairs etc.) Causes screen to turn black and stop you from moving. 
2. Party chat must be fixed to allow voice communication while in hub or coordination is impossible.
3. If you enter a game while in the Amory you lose your guns. 
4. If disconnected from game after purchasing health or pipe bombs ... Harvest is lost.",Dec 16 at 12:53 PM,4, 2,
2022-05-28 18:33:51.554449,The.Real.Mr.Breeze,Literally the best VR zombie shooter,"I've got about 5 hours in and completed the first 4 harvest runs in group play and I can honestly say that this game is fantastic.  The gunplay and movement feels really good.  No motion sickness but I do play a good amount of VR.  Using manual reload despite the extra money you receive is feels quite challenging while you're trying to kite around snowbred and can cause some panic moments :)  The harvest hordes and monsters feel paced properly and while sometimes the hordes can be overwhelming the game is a blast and feels fairly well balanced on easier levels (Haven't tried harder ones).

The handheld rocket launcher is awesome and the accesories and the upgrade/crafting are simple enough to be engaging but not too complex to slow the game down.  Would like to see some form of melee make it into the game at some point but more as a CC like Left4Dead and not like an OP zombie grinder like Back4Blood.  The bots are also not too bad on the easier difficulty settings.  I had just gotten my hands on the Carbine on my last harvest run and am excited to try it out next play.

It does have some bugs like when I got my rocket launcher and went into the next run, I lost all my guns for some reason.  The smooth movement via stick sometimes (PC Oculus as I haven't tried the Quest 2 standalone yet) feels like its moving forward and sideways and not straight forward.  This creates some confusion when trying to move a specific direction when being overrun by a hor de.  I thought it might be me but when I play Contractors, Zero Caliber, Onward, etc. movement is correct.  Pulling down on the right stick to turn 180 and sprint away from a horde is a game-changer instead of trying to angle turn or physically turn 180.  While the game has its issues and ""seems"" light on content so far, it's a lot of fun and I know with updates this game has a ton of potential to get even better.  Kudos devs!  I am actually enjoying this more than AZ Sunshine but it could be I enjoy this genre more!",Dec 10 at 12:55 PM,5, 2,
2022-05-28 18:33:51.570406,NukeJockey,Phenomenal Cooperative Shooter,"Excellent game, looks and runs great on modest hardware (GTX1070 on a Quest 2). game has several difficulty levels which are very challenging and fun. There are a bunch of weapons all with a heap of upgrades that you unlock through playing, with the idea being that you are a runner, you start in a subway below the ground, which acts as your lobby, you can see dozens of other players running around and interacting with the world while you are there too. You can then join a public match or create a private match where you can invite friends. The gameplay loop early on is already rewarding and addictive. Can't wait to play more. Very solid game all around.",Dec 10 at 11:45 AM,5, 2,
2022-05-28 18:33:51.586363,Raishiwi,VRs BEST NEW MULTIPLAYER GAME,I don't write reviews. I have been playing VR since the launch of the HTC vive in 2016 and since then have played 70+ VR games on different platforms. This game is hands down the most replayable multiplayer game for VR ive ever played. All the charm of L4D and Back for Blood with all the immersion and anxiety that VR can bring.,Dec 25 at 11:15 AM,5, 1,
2022-05-28 18:33:51.602321,joshoftheflame,love it. needs some polishing.,"Love this game so far, however, there are a few issues I should point out. There are a lot of player lobbies that never start because of an afk host. very annoying. also solo AI could use a bit of a combat tactics buff. and a few glitches here and there like a graphics glitch or getting stuck in a wall. aside from that I enjoy the weapons and the game mechanics. Love the level design. Personally, I'd love to see more weapons in the future. I enjoy being able to tweak weapons. might I suggest the ability to zero sights in the future? might be fun, idk lol. thank you for making the game devs =)",Dec 22 at 10:41 AM,5, 1,
2022-05-28 18:33:54.688067,NaturalBornKiller,best 4 player zombie co-op around,"If you like Left 4 Dead, and you like VR shooters, rest assured that you will like this. It's almost too good. Hope you like blood..",Dec 10 at 8:22 AM,5, 8,
2022-05-28 18:33:54.704024,Nacoao,Need to fix bug,I’m first play on Quest2 in normal can do missions. but I’m try on Oculus pc it same id I see my friend but i can’t start mission by myself only can join party but don’t get anything when mission complete.,Dec 12 at 11:48 AM,1, 4,
2022-05-28 18:33:54.719982,Mrmadnesscombat16,best fun i ever had,this game is soo good i love it! tho you may wanna play with a limit but its till amazing!!!,20 days ago,5, 0,
2022-05-28 18:33:54.734942,Kravitch_cz,Good game but...,".. to much bugs..

- AI members are stupid. The constantly runs in your line of fire. And they often do nothing. Just standing and watching being killed. So game is unplayable in solo on higher difficulty.

- Sometimes your gear can completely vanish after you return to hub. And not only weapons, your harvest can vanish too.

- I already unlocked top tier upgrade (red floppy) laser sight. But it is not available ingame :D",Dec 17 at 5:28 PM,3, 1,
2022-05-28 18:33:54.750900,runs on knees,Incredible,"don't hesitate buying this game, it's the bees knees. First match was with 2 randoms and a bot named Jimmy. We had a blast joking the whole way through.",Dec 10 at 8:31 AM,5, 6,
2022-05-28 18:33:57.825676,30xis,ANNOYING LOADING TIMES!,"Fix the long intro loading time. It kills the motivation before I begin. The same with the Quest version.
It's effing anoying tbh.",Apr 24 at 3:42 AM,1, 0,
2022-05-28 18:33:57.841632,bkuschel,Fun Game,"Make sure to a have a good wifi connection. Using with AirLink, no issues.",Dec 17 at 11:57 AM,5, 3,
2022-05-28 18:33:57.856592,SirCraggy,No ingame options menu,"Does anyone know how to open the ingame menu? It's apparently the right stick, but it does nothing  - literally unplayable without being able to change any settings.",Apr 1 at 11:11 PM,1, 0,
2022-05-28 18:33:57.872550,VRicken,The Best Version of This Game!,"Finally, a good PCVR version of a post-quest-2 VR game, thank you Vertigo Games & I hope you continue supporting the PCVR platform as well as you have with ATF!",Dec 13 at 4:19 AM,5, 1,
2022-05-28 18:33:57.887510,Lagge82,Fight the hordes of snowbreed,"Fought the snowbreed, then stomped to death by smasher. 5/5",Dec 17 at 9:58 PM,5, 2,
2022-05-28 18:34:00.970265,Redd_Kraken,10/10 Must buy,If your a fan of L4D get it now.,Dec 10 at 11:07 AM,5, 3,
2022-05-28 18:34:00.986223,Lectoor,Fun!,"Really enjoy this game, i usaly get motion sick but not in this game :)",Mar 27 at 11:38 PM,5, 0,
2022-05-28 18:34:01.002179,Brendogg,Great Game: Great VR Social experience,I played for a while with two guys and loved playing it.,Jan 25 at 11:45 AM,5, 0,
2022-05-28 18:34:01.018137,Azi_Founder,Just wow,"Game has very nice graphics, amazing shooting and most of all multiplayer!",Jan 11 at 12:43 PM,5, 0,
2022-05-28 18:34:01.034095,AndyTheMedic,A must have for anyones VR library,Challenging & fun. Even in small space/sitting this is very playable.,Dec 13 at 1:02 AM,5, 0,
2022-05-28 18:34:04.111862,SeniorMas,Fun!,Its a good time! only going to get better!,Dec 12 at 1:37 AM,5, 1,
