scrapping_date,review_author,review_title,one_reviews_text,review_date,review_rating,review_helpful,review_feedback
2022-05-28 13:38:12.410950,marciot,Adjust your expectations...,"The game is not as difficult as some reviewers make it out to be. You are not racing against the clock. Except for limited outdoor environments where your suit unexplicably leaks, you *do not* spend oxygen by breathing or looking around, you only spend it for propulsion. So take it slow, plan your moves carefully and then use microbursts of trust to drift slowly towards your targets. The faster you try completing this game, the worse you will do. This is not an action game, this is a game of precision; it is very calming and beautiful once you realize that there isn't a rush -- mastering fine control and inertia becomes a rewarding experience in itself. The few outdoor environments, where time *does* matter, provide an occasional adrenaline rush and time you spent practicing precision indoors will be of tremendous help. My conclusion is that this is a excellent, relaxing game. If it feels like an action-survival game, you are doing it wrong.","Dec 23, 2016 at 1:34 PM",5, 10,
2022-05-28 13:38:12.426907,vr_fly,can not open the game,"After installed, when I open the game, running  about 2 seconds, then the game disappeared! Who can tell me the reason, and how should I do?","Mar 10, 2017 at 4:33 PM",1, 0,
2022-05-28 13:38:12.441867,AlexLen,,Anoying gameplay while gasping for air ... so far,"Jul 30, 2017 at 6:54 AM",3, 0,
2022-05-28 13:38:12.460817,lmiksche,"Nicely done, but a bit stereotype","Graphics look good, the EVA contol is excelent, but except going thto the station interacting with computer stations and grabbing oxygen cans, u dont do much else.","Feb 19, 2017 at 10:36 PM",3, 1,
2022-05-28 13:38:15.539212,Leonard_Powers,Needs touch support,"You cannot look further than your helmet and the game will snap your view into place if you do crane your neck out, which happens too often.
There is no way to enjoy the space station without oxigen limitation once completed and the movement controls are akward at best.","Apr 17, 2017 at 4:58 AM",3, 3,
2022-05-28 13:38:15.555170,PathlessNomad,Pretty buy shallow,"This is a very pretty game. The space station has great art design and the graphics are very nice. 

Sadly that's as far as it goes. The levels in the space station are very repetitive. That isn't helped by the fact that you have to visit the same place multiple times. Then you have the nearly non existant navigation aids. It is very difficult to tell where you should be going. Your helmet obscures objective markers on the screen, so if it isn't directly in front of you, you can't see it. And the map just gives you a vague direction.

That whould all be ok if the game was interesting. It's just go from place to place, hold X, and repeat. Every so often you might have to avoid some dangerous areas, but mostly you are playing against the navigation.

And to add insult to injury, this is the only game that's ever made me sick. I mean, take off the headset and go lie down for an hour sick.","Dec 27, 2016 at 2:15 AM",2, 4,
2022-05-28 13:38:15.571127,ThreeBirdBeard,Touch Controller Support?,Is it coming?,"Dec 27, 2016 at 6:43 AM",3, 19,
2022-05-28 13:38:15.586087,Azazel08,Beautiful,This game is better than starring in the movie Gravity.,"Feb 17, 2017 at 9:43 AM",5, 0,
2022-05-28 13:38:15.602044,Excentrik,Pretty cool game for showing off vr,"And for making your friends motion sick lol, seriously though this game isn't for people that get motion sick easily","Jan 3, 2017 at 9:18 AM",4, 4,
2022-05-28 13:38:18.698881,Temkins,Changing my review,Technical issues were on my side. The game is awesome!,"Feb 12, 2017 at 9:58 AM",5, 0,
2022-05-28 13:38:18.714839,rabbitovsky,A fascinating but flat experience,"--Reviewer Note: I am still in the middle of the game--

This title is at times awe-inspiring and at others frustrating.  From a VR standpoint the chance to play out your own ""Gravity"" movie is drool worthy.  The lack of real interactivity doesn't by itself take away from this 'experience', instead being overshadowed by an almost non-existant level navigation system that occasionally leaves you utterly confused about where to go next.  This headache makes it much more difficult to push past the nausea that can be induced by this 'could have been great' zero-gravity title.","Dec 7, 2016 at 10:14 AM",3, 2,
2022-05-28 13:38:18.730796,Greyhawk101,Excellent,Very easy to master. Key is precision flying and dont rush. There is a reason its called Adrift not Jetpack!,"Jan 4, 2017 at 3:34 AM",4, 3,
2022-05-28 13:38:18.747751,m0bius,Puke-o-rama!,"I have a pretty sturdy stomach for VR, but this one did me in quickly.  There are several reasons why motion sickness is such a big deal here:

1) Because you're in microgravity, there is no up & down.  No frame of reference = bad juju

2) Acceleration and deceleration happen quickly.  Strike two for VR integration.

3) Because you are in space, there is drag to slow you if you end up in a roll or spin.  Strike three.

4) If you didn't already need another reason, there's this bug that tosses you around in virtual space at random.  I think it's a head tracking issue rather than an avatar position issue, but it's definitely a nasty bug.

In addition to the high barf factor, I found it difficult to line up with certain objects in order to use or grab them (like oxygen tanks).  

I'd like to go further in the game, but there are too many negative factors to want to continue playing any longer.  Sorry, this looked like a promising game!","Dec 5, 2016 at 1:04 AM",2, 2,
2022-05-28 13:38:18.762710,conn0,Mostly Beautiful VR Experience,"The environment and the overall aesthetic of the game is amazing. This is however the first and only game I've felt sick playing, this is not due to the game being in virtual reality but due to the controller constantly vibrating. There is no way (as i know of) to disable this feature. I have tried playing with gloves but it doesn't do much to stop the numbing in my hands.  Played around 30 minutes, what I did play was fantastic. I just wish it was possible to disable the vibration feature, until then I patiently wait before I play this game again.","Dec 16, 2016 at 5:41 AM",3, 2,
2022-05-28 13:38:21.877538,yellownumber5,,"Hard to play for too long. They get some things right, but then follow it with some nauseating nono's. The helmet works well, but i have to lean forward, reset my view, then return to my seated position to see the full HUD inside the helmet. Camera control is frequently taken away, once in a while with an animation, but abusively common by constantly bumping into floating debris, which is everywhere, making you spin around. An ocassional bump is ok, but the turning! Also if your feet (which you can rarely see where they are) drag against something you are spun forward.  This happens almost every doorway I go through. Not good in VR, and makes it a dizzying nauseating chore to get around.  They were so close to making something special here.","Nov 23, 2016 at 4:27 PM",3, 3,
2022-05-28 13:38:21.894493,foresterr,,"Oozes atmosphere (see what I did there?). Also a good title to test your VR legs on.
Bit of a pity it does not have Touch support, I think inside the station most obvious way to propel yourself would be to push away from various handles, not fiddle with EVA suit thrusters.
Also, the camera skips in an unpleasant way if you physically turn around too much. I understand not wanting to show you the backside of your helmet, but still, it's just not nice.","Dec 5, 2016 at 3:12 AM",4, 1,
2022-05-28 13:38:21.909454,chmodseven,Prepare to puke,"While the graphics are great and the stranded-in-space concept is certainly interesting, this game is not in the least for the nausea-prone.  There's very little gameplay too, by the look of what I saw during the brief period I was able to play before reaching for the barf bag: float between doors and oxygen, and pixel hunt and backtrack through levels until you find whatever you missed that unlocks the next section.  I wanted to like this game, but 
even if you have steady VR legs, it'd still be tough to recommend.","Nov 27, 2016 at 6:33 PM",3, 2,
2022-05-28 13:38:21.926407,falken76,"If you like feeling sick, this is for yo","This game made me feel sick as a dog.  No refund policy on Oculus, I wish I bought it on Steam I would have asked for a refund.  Just the thought of the game makes me not use my rift because I associate it to being sick. DO NOT GET THIS GAME if you are prone to any motion sickness.  It could cost you your entire VR experience.","Dec 1, 2016 at 1:48 AM",2, 1,
2022-05-28 13:38:21.941367,underhill,Beautiful and engaging,One of my favourite VR titles.  Played it from start to finish in one sitting (~5 hours).  I did feel mildly nauseous  in a couple of spots but managed fine using the in-game comfort mode for a little respite.,"Dec 17, 2016 at 4:51 AM",5, 1,
2022-05-28 13:38:25.030189,pieroman,Awesome visual experience but...,"Not the smoothest with standard hardware, and game(play) is meh.","Jan 6, 2017 at 5:09 AM",3, 0,
2022-05-28 13:38:25.047144,slev,Motion sickness,"I know the comfort rating says Intense, so it's not really fair to dock this for VR sickness. Still, I can play some other Intense-rated games just fine, but can't take more than a couple minutes of this. So this will remain almost entirely unplayed for me. I wish there was a way to demo games or refund them, for situations like this. Avoid this if you're not certain you can handle intense VR experiences without nausea.","Nov 5, 2016 at 1:29 PM",1, 0,
2022-05-28 13:38:25.063101,profd78,Underwhelming and very repetative,"Underwhelming and very repetative, avoid until very cheap as the controls are poor and the gameplay simple and repetative.","Nov 23, 2016 at 4:57 AM",2, 2,
2022-05-28 13:38:25.078061,jabrown41,,"Excellent game! It was the first game I tried with Oculus, it ran great, controls where awesome, made my GTX 1080 fans work hard, for sure a very intensive graphics game.","Nov 25, 2016 at 5:57 AM",5, 0,
2022-05-28 13:38:25.093525,anthonyg818,waste,i payed my money and it wont load. I have a gtx 1060 and i cant believe it does not work. I want a refund!!,"Nov 23, 2016 at 1:58 PM",1, 1,
2022-05-28 13:38:28.225478,Jones,I love this game!,"You really feel like a lonely atronaut surviving a fatal crash, very good graphics, freedom to move, not to short - a must have if you have mastered motion sickness which is no problem for me anymore;)","May 1, 2017 at 4:08 AM",5, 0,
2022-05-28 13:38:28.241436,jon,Beautiful,"A beautiful game, not originally intended for VR that works - though some might get sick from analog locomotion.  My chief complaint is that while beautiful, the underlying game is kind of boring.  No real replayability.","Oct 30, 2016 at 5:59 AM",3, 0,
2022-05-28 13:38:28.258389,Huxley133,Amazing experience,"You pretty much are inside the movie ""Gravity""! :O","Nov 13, 2016 at 10:01 PM",5, 2,
2022-05-28 13:38:28.273350,Wildt,,"Quite enjoyable exploration game, let down by unclear objectives and horrible performance.","Nov 20, 2016 at 7:44 PM",3, 0,
2022-05-28 13:38:28.289307,Heggem,,Fantastic visuals and atmosphere!,"Nov 28, 2016 at 11:54 PM",5, 1,
2022-05-28 13:38:31.383125,BTheConsiderable,*Vomiting Sounds*,"Pay close attention to the ""Intense"" comfort rating!","Nov 14, 2016 at 3:19 AM",4, 4,
