scrapping_date,review_author,review_title,one_reviews_text,review_date,review_rating,review_helpful,review_feedback
2022-05-28 13:37:37.452096,Drkwingz,Really ????,"Well folks, I just threw away 10.00 on a hopeful game that won't even boot. Guess I should have read the other reviews first. Lesson learned.",Apr 27 at 7:06 AM,1, 1,
2022-05-28 13:37:37.467056,Cyberchaos,Keeps crashing  - doesn't load,"Been trying to play this game again wanting some nostalgia, but it won't load in either desktop or VR mode

Crashes immediately - What's going on? 

And it's quite apparent that im not the only one either to experience this either.",Sep 23 at 4:25 PM,3, 17,
2022-05-28 13:37:37.482016,MarkT46,What's going on?,"I had sent an email to the developer of this alleged space station game and I would now like to WARN anyone thinking of purchasing it - DON'T! My email to their 'website' was ghosted, meaning that they have IGNORED and unable to REPLY. This now tells me that it is a scam and NOT a professional and legit website. If it was genuine, then of course I would have heard from them. I strongly recommend that if anyone is to buy any game through this medium; Oculus stores ( Oculus Store is genuine) is to now head to the website of the actual game you want to purchase ask if their game is genuine BEFORE you buy! If you don't hear from them NEVER buy the game from the Store from this platform Oculus.  (If the developer of ADR1FT) has any queries about this message and disagree with me that they are genuine, then they SHOULD get in contact right here, because at the end of the day, it is only themselves to blame if they lose custom.",Oct 13 at 10:23 AM,1, 10,
2022-05-28 13:37:37.497974,DelapierceD,"Gorgeous, Immersive, Needs Direction","Extremely easy to get lost in this. Which is fine if you want to just float through space, but to actually complete the objectives, you need to know where you are going, and the game offers very little guidance in where to go next

I personally find this design choice annoying in that it tries for realism in a misguided way. If you were living on the space station, you would know which way to the power station or whatever you needed

All that said, it is a lovely time to float through and look, once letting go of the urgency to accomplish the tasks","Mar 9, 2021 at 6:15 AM",3, 15,
2022-05-28 13:37:37.513442,NeoTechni,Does not boot,"I remember playing this on my old Win7 PC, but it no longer boots in Win10. Just flash a logo on screen then closes. The dev reviewing their own game is dirty pool. I will try the Steam version in VR and see if it works that way.","Mar 28, 2021 at 12:07 PM",1, 12,
2022-05-28 13:37:40.641181,Sailorboy1228,Not supported,"I really enjoyed this game when I first installed it a yer ago and wanted to visit it again.Now it just won't run and can't get a refund. Ripoff, don't buy.","Mar 19, 2021 at 4:46 AM",1, 12,
2022-05-28 13:37:40.656141,SolidRustle,Not worth your time.,"This is an impressive game only in terms of graphics, it is breathtaking and very good looking game for its age.

Other than that, it is a numbingly boring walking (zero g walking) simulator, there is nothing exciting about it, the objectives are repetitive and the gameplay only consists of navigating zero g control which is nausauting due to the poor performance of this game even when im on 1660ti i5 9300H 16gb SSD...you just float and collect O2 tanks and go to panels after panels. 

Personally I have no problem with using xbox controller due to lack of motion control support, still don't like the arogant post by the developer rating his own game 5 stars giving lazy excuse about the game not having motion control support just because it didn't exist when the game launch tho, plenty of other devs have put time into introducing motion control update to their games by pouring their heart into it, this one simply just dont have the passion. 

Overall this is not worth any of your time.","Feb 23, 2021 at 10:16 AM",2, 3,
2022-05-28 13:37:40.671101,Malloc64,Not worth a buy - get Lone Echo instead,"This was a very early VR game and it really shows.  1. It does NOT support touch controllers.  You have to use an Xbox gamepad.  2. The movement is not refined and can be super nauseating to many players.  The overall gameplay is just so so.  Graphically interesting, but not worth buying.  Play Lone Echo instead.","May 25, 2020 at 9:19 AM",1, 22,
2022-05-28 13:37:40.686061,Rico_T,ITS A SH...,"The are a sh.. dont buyet its not compatible with oculus cannot change full screem or lenguage.

no compres este juego no compatible con oculus nose puede cambiar a pantalla completa o el lenguage.

shop inte det här spel det passar inte med oculus program.","Jun 4, 2020 at 2:43 AM",1, 2,
2022-05-28 13:37:40.701021,fotokiebro,For oculus,"Pretty poor only graphics little immersive 
Oculus controls 🤔","May 20, 2020 at 5:21 PM",2, 3,
2022-05-28 13:37:43.818292,adamorth,Thanks | Touch Controller Support,"Thanks for all of the kind reviews. Greatly appreciated!

We weren't able to implement Touch Controls for ADR1FT simply because they didn't exist when we made and released the game (Rift launch title). We all moved onto new things shortly after and our publisher wasn't interested in financially supporting the work needed to do the arms/touch controls properly. Sad, but that's life. We'd do it in a second if we could. We talk about it all the time. Maybe someday...

I made this game, so I'm giving it 5 stars.","Oct 11, 2019 at 3:06 AM",5, 68,
2022-05-28 13:37:43.834249,Cyion,,This game is visually stunning and the controls of the EVA suit feel genuine and I feel that was a key feature in this game.  The story is moving and without spoilers I would say you can take away moral lessons from it.  My only complaint is some parts of the game were repetitive but overall I am very happy with this game.,"Aug 9, 2019 at 11:38 AM",5, 12,
2022-05-28 13:37:43.849209,musicgt8,,"Good game, graphics are really good, only crappy thing is the annoying music. But it is pretty fun. The ending could of been alittle more in depth though.","Oct 15, 2019 at 5:35 PM",3, 1,
2022-05-28 13:37:43.864674,DinkyDilan,Not What It seemed,i thought it would use touch controlls but it does not i hope the update it so we can switch between gamepad and touch,"Sep 11, 2019 at 2:10 PM",2, 4,
2022-05-28 13:37:43.879634,Ewizard,Awesome game please bring to quest,This game is awesome. I wish the devs could expand on it and use touch controllers as well as port it to oculus quest. It’s too good not to have it be portable!,"May 31, 2019 at 8:08 AM",5, 10,
2022-05-28 13:37:46.964044,XtremeHardcoreGamer,Up there in space immersion.,"This game doesn't have Touch support (you don't use your hands to interact with stuff)--- that said, the production value is up there with AAA content. The visuals are amazing. For VR, there is Lone Echo, then this game--- that really places the player in outer space. Yeah- it's a ""walking"" simulator, but a high quality one.

Update: I beat it and it was worth it. Great experience.","Apr 9, 2019 at 1:50 PM",5, 8,
2022-05-28 13:37:46.979003,Reaper,Amazing Experience,"I Found this game awe-inspiring, just looking around in zero g was great Experience hope they do version 2. 
Thanks to the developers for this top game and supplying me with a key on the oculus home store as i purchased it on steam.","Jan 11, 2019 at 7:44 AM",5, 2,
2022-05-28 13:37:46.993964,Metamorpho,Mixed review,"This has excellent graphics, cleanest I have seen yet. I got it when on sale. And it is good for the sale price. I don't know the history of this game. But it seems it was created during the days of xbox controllers, since you cannot use your hands in the VR other than through pure button press. I think some of the performance issues is purely because the author is pushing the limit of the graphics. It's not bad though.  I wouldn't call this a demo you could show to a newbie because they would have a hard time using the pure thrust controls. It's good for 5 bucks but if you already have lone echo your not going to be impressed. two years ago this might of been the cat's meow. But o how fast we all get jaded by progress :)","Nov 16, 2018 at 10:41 AM",3, 10,
2022-05-28 13:37:47.009921,Refrizor,One of the BEST VR games!,"Heya, ignore the bad reviews. They are just complaining about performance issues (read the specs) and remotes not working.

First off, touch is NOT compatible. But that doesn't matter!

I had an amazing experience playing on a keyboard/mouse with the Oculus Rift! Graphics and quality are downright BEAUTIFUL. The developers did a fabulous job with this game.

The story, graphics, scenery, and quality are like 10/10. I HIGHLY recommend it!
* Xbox One controller and keyboard + mouse are supported. Again, touch is not. Had one of the best VR experiences, ever, with this game! <3

Pssst, to those people who are complaining about motion sickness, I don't think you read the comfort level. Don't buy a game if it says INTENSE and then you complain with a review because your motion sickness was intense. :P

Overall: 10/10","Aug 14, 2018 at 5:27 AM",5, 20,
2022-05-28 13:37:47.024881,Firefly7411,Generally a very good game,"But unfortunatly to slow and without touch support.
The graphic is very good and the controller work fine so far.","Jan 6, 2019 at 4:22 PM",3, 2,
2022-05-28 13:37:50.150147,xAstroBoy,"Ugh, controller doesn't work!",It doesn't even recognize the A button .-.,"Jul 10, 2018 at 8:12 PM",1, 11,
2022-05-28 13:37:50.164110,abindvi,,Do not download,"Aug 28, 2018 at 2:06 PM",4, 0,
2022-05-28 13:37:50.180068,Maaco,Motion sickness!,"I own a lot of (also intense) VR games (in which I never use the teleport option but always free locomoion if it's available), but somehow this is the only game (so far) I cannot play  without getting severe motion sickness (after a couple of minutes!) It feels like the image in the HMD has some form of lag.","Jun 16, 2018 at 2:20 AM",2, 8,
2022-05-28 13:37:50.195027,monsterdobbs,"Would be the best experience ever, but..",This would be the best experience ever if it weren't for the fact that you cannot use the touch controllers.,"Jun 28, 2018 at 3:10 AM",5, 1,
2022-05-28 13:37:50.210985,themerote,,"This game is freakin awesome, like a real life lone echo or the movie Gravity but visually better looking than both, it blow me away. YEs it would be better with touch support but that would make it too easy as you basically controller your suit like its a spaceship. it would have still been cool if you could move your hands aboud just for show but maybe a future update. I got this and Robinson in the sale and boy was I glad I did coz they are both diamonds in the rough and show of what VR is about (realism) Now we just need those touch controllers implemented a bit better but dont let that turn you off this game, that was what made me stall from buying this before but I'm glad I got it now and at a great price.","Mar 25, 2018 at 2:37 AM",5, 6,
2022-05-28 13:37:53.305322,dennisvanderpool,Great experience,I bought the game when it just game out (CV1 and game). Finished the game and now playing it another time.,"Jul 31, 2018 at 4:30 PM",5, 0,
2022-05-28 13:37:53.325267,Fitskoo,Awesome Custumor Support,"Bought the game on steam a while ago. Emailed the support to ask if it is possible to get a Oculus Home key (included proof of purchase). 10 minutes later got an email with my code for Oculus Home.
Best. Support. Ever.","Mar 7, 2018 at 4:11 AM",5, 5,
2022-05-28 13:37:53.340228,Gallican,"Misses the mark, don't spend your money","having played Lone Echo I was drawn back to try this game again. Controls are really awkward... if it could get a reboot where you could actually reach and grap then this might be brought back to life... but as it is now, its antiquated 1st try in VR stuff.","Mar 23, 2018 at 2:09 PM",2, 2,
2022-05-28 13:37:53.355187,Karan5196,ecdfv,rvgerfvgreh,"Apr 30, 2018 at 6:18 PM",5, 3,
2022-05-28 13:37:53.370147,FxMcloud,The control does not work,The xbox one control does not work.,"Apr 22, 2018 at 6:59 AM",1, 0,
2022-05-28 13:37:56.495903,stealthkk,Missed opportunity,"The story is cool and the premise is fine, but this was a huge missed opportunity to be as cool as Lone Echo. Why someone made a game for VR where none of the normal VR controls are there eludes me. You can't grab anything like you would in a normal VR game, using the grab button. X is the grab button, it's just automated. And you have to boost yourself around with really unintuitive X, Y, Z controls. I love how Lone Echo lets you grab things and throw yourself from them and the arm boosters are aimable etc. This game is nothing like that. Also, I'm a hardcore Comfort:Intense player, I play all games on smooth turning and non-teleport and never get motion sick. This is THE ONLY game that makes me motion sick! Coulda been good but they messed up the control scheme.","Jan 6, 2018 at 8:00 AM",2, 10,
2022-05-28 13:37:56.510864,rh_galaxy,In need of oxygen,"The graphics is nice, and it's a big space station. But so far all I have done is refill oxygen, a bottle lasts way too short so you have to fill constantly. It's hard to steer, and often when you are getting close to a bottle you have so short arms that you often bump into it instead of grabbing it, making it sail away. I'm ok with the steering, but I can't play the game because I haven't got the patience to retry and retry.","Dec 21, 2017 at 7:54 AM",2, 2,
2022-05-28 13:37:56.525823,LamJam20,Bought game and won't stop crashing,Bought this game a while back and never had the chance to play it as it crashs from the boot screen. No one has reached out to help fix as I keep sending report and contacting oculus and dev,"Jan 7, 2018 at 4:36 AM",1, 6,
2022-05-28 13:37:56.551754,Zendule,Awesome VR Game - Motion Sickness,"Let me start off by saying this game is awesome. I love the quality of graphics the feeling of being in space etc. I will have to say that I get motion sickness playing this game. I just take 1000mg of Ginger root before playing to account for this because it is worth it. Also, the game is pretty demanding so if you do not have dedicated controllers for your USB oculus you might experience issues. 

Even after having to get Ginger Root for motion sickness, new USB controller card for the oculus, this game is amazing, and I recommend it.  I always wanted to be an astronaut, and this makes me feel like one!","Dec 19, 2017 at 7:01 AM",5, 1,
2022-05-28 13:37:56.566714,oandroido,"Loved it, mostly.","Long story short: gets a bit repetetive, but some of the moments floating around seeing the earth below while you drift between parts of the station... really nicely done. Not perfect, would give 3.5 stars, but giving 4 since it's better than a 3. 

Main reason it's not really a solid 4 is due to the repetetive stuff, some lazy modeling (leaves floating in perfect rows), and a somewhat incoherent story (you'll see...).

Also fairly easy/casual, but that's OK.

But: if you like ""space stuff"", get it, play it.","Oct 29, 2017 at 7:14 AM",4, 4,
2022-05-28 13:37:59.684534,louie.horwood,Turns off sensors?,"Every time I play this game (And only this game) my sensors switch off... no idea why but thats life.
I'm going to request a refund","Dec 15, 2017 at 8:59 AM",1, 0,
2022-05-28 13:37:59.701489,SpaceGandi,Fantastic!,"A great game, the feeling of isolation is unreal!","Dec 16, 2017 at 1:10 AM",5, 0,
2022-05-28 13:37:59.716448,a1ex3d,Oculus Touch Controllers,"Beautiful graphics, but do you plan to add Oculus controllers to control game? Uncomfortable experience without head and hand tracking... I Think to bring money back if no.","Oct 15, 2017 at 1:14 AM",3, 8,
2022-05-28 13:37:59.733406,Kneelb4me,Got Sick,When playing this game I felt my head was going to implode and then explode. I felt soooo sick. If they fix the locomation issue then I will play again but for now its a big no for me.,"Oct 13, 2017 at 11:23 PM",3, 3,
2022-05-28 13:37:59.749361,AlexFling,Windowed mode only issue,"Not sure why, but this excellent simulation/game stopped working and now only opens in PC windowed mode using Oculus. Happy to take any suggestions to fix, as previsouely I was amazied and impressed to 5 start levels.","Oct 15, 2017 at 2:20 AM",1, 0,
2022-05-28 13:38:02.853161,MarquisDeSang,Still relevant post Lone Echo? F.. Yeah!,"Although I felt uncomfortable during the whole 6-8 hours, It was totally worth it. It's not a game, but a simulator with a more adult rithm and story. It never get old to maneuver in zero-g. It's more realistic than Echo-One and it's a full on simulation down to the smallest details. I never wanted it to end. This thing is constant mental orgasm. Don't expect any action nor congratulation for your actions,  you are alone and on your own. It's a crazy feeling thrusting into the space and realizing you may not have enough air to get to your planned target. But don't worry the game is not punishing with timed air, you get more that you need. I cried at the end because I did not want to return to earth. I will definitely start another game, but now I feel like the world is spinning. For people complaining about motion sickness, VR is not the problem here, this the reality that astronaut have to deal with during space walk. My only complain about this game is that you never know exactly where to go, the map is mostly useless.","Aug 27, 2017 at 11:17 PM",5, 10,
2022-05-28 13:38:02.868121,FeO2,,"Nice graphics, but unplayable with Touch controllers...","Oct 23, 2017 at 6:46 AM",1, 7,
2022-05-28 13:38:02.884078,WhitesideVFX,"Might be really good, but I felt sick","This game made me more sick than anything else i've tried. Had to quit after 5 mins. 
I'd say it has something to do with the momentum of movement.","Sep 7, 2017 at 8:19 AM",3, 3,
2022-05-28 13:38:02.899038,beverdam,Phenominal experience,"I really felt like an astronaut, great experience! The only reason why it is 4 instead of 5 stars for me is this game made me feel a bit sick when playing more than 30 mins because (didn't have that with the IS demo, it might be because you can't use your touch controllers to get around?)","Jul 21, 2017 at 7:59 PM",4, 1,
2022-05-28 13:38:02.914995,WhyKlef,"Sad... *OCULUS, HEARD OF PARAGRAPHS???*","It seems like the people developing this game had one goal, make money and run away with it. This game aims for a very specific goal, put the player in perspective of an astronaut and that it does well. Yes some people will get nauseated and yes it aims for a more extreme experience but get this, that is what this title is about. Not so much a game but instead, an experience, built towards putting people in a situation where every second feels like your last and yet, you carry on the struggle of seeing through a daunting, near impossible task.

So why 2 stars? Let me answer that by a question, why the lack of support devs? You are launching on a new platform, a new era, wouldn't you want to tailor your game as the market constantly defines itself? Where is the Touch support? Heck, where is even controls support? I booted my game, my touch does not respond, neither does my Xbox One controller... I had to play this game with my keyboard and mouse... How sad is that? 

Of course, I probably ran into a bug/glitch of some kind but should the devs be there to support their games, I'd see them respond to some of the reviews, and I could also expect them to eventually respond to mine but nope, that company decided that supporting it's own product was too much to ask for. 

You know, the truth is that maybe the company closed because it didn't make money, or maybe it did and wanted out. Either way, it's bad practices for consumers because I was drawn into purchasing that game after the company was no more, I would expect them to have been paid for that at that point in time so it feels off regardless.

One of the few UE4 VR titles that ran quite superb for me. Too bad really...","Jun 2, 2017 at 6:39 AM",2, 20,
2022-05-28 13:38:06.046724,treeml,Unbelievable that there is no touch,"They should intergrate touch, it would make this game so much better. It has some beatufiul visuals, some of the best on the rift at the momement, but the clunky controller mechanics take away any presence.","May 1, 2017 at 6:31 PM",2, 25,
2022-05-28 13:38:06.061684,mesher,Sickness inducing,I was looking forward to this one but just can't play for too long.  Frame rate drops too low too much and induces nausea pretty fast.,"May 16, 2017 at 6:36 AM",2, 6,
2022-05-28 13:38:06.076644,GaryOpt,Beautiful game,"This game is really well designed, I wish they would update to make use of Touch, that's what's holding it back big time.. at least in my opinion.","Apr 4, 2017 at 4:20 AM",3, 12,
2022-05-28 13:38:06.093106,jayhawk,A Needy Game,Early on I realized this game was needy. The frequency you need oxygen canisters is way too often pretty much consuming every aspect of the game. Played it for a while and ran out of oxygen at one point then realized I have no desire to keep the fiasco up. Never went back. I'm not one of those that think a VR game that uses only a gamepad is inferior to one that uses Touch though. Sometimes it's nice to just sit back and chill in VR.,"Mar 30, 2017 at 10:10 AM",2, 2,
2022-05-28 13:38:06.109063,C1V1LWAR,Remember gamepads?,Adrift still does. With Lone Echo on the horizon featuring touch controls and floating in zero G there is no reason to recommend this game.,"Mar 24, 2017 at 1:03 AM",2, 10,
2022-05-28 13:38:09.220349,nikx130,Needs update badly...,I really thought this game was gonna get a touch patch when I bought it back in january.I will add stars if support is good and comes in soon (edit) still no update months later. Very sad game has potential. Devs gave up on it though.,"Apr 7, 2017 at 5:09 PM",1, 6,
2022-05-28 13:38:09.236307,Mazzarin,,"Most boring game ever, if you would even call floating around from one visually indistinguishable room to another a game. Because that's this is, all while grabbing some very conveniently placed oxygen cans along the linear route.","Mar 31, 2017 at 3:16 AM",1, 2,
2022-05-28 13:38:09.252264,wibbilus,Some right but a lot wrong,"The graphics are fantastic, you really do feel like you are floating in space.  A note to all those complaing about nausea, it's called virtual reality and not virtual arcade for a reason, astronauts train for months and years to deal with the motion sickness that floating in space can create, if you don't want to experience that, play it on a normal monitor, and to the reviewer who comlained about being spun around when bumping into debris, that's what you'd expect to happen. That being said it does feel like a bad port of a 2D game, turning your head should turn your helmet, you shouldn't need to use a joystick to look around.  The game would massively benefit from adding touch control to it and a rework of the navigation system so you had at least some clue of where to go would be good.  One reviewer noted that you don't lose oxygen if you are just floating around, you use it from thrusting which if true (I have no reason to doubt that this is the case) seems a ridiculous idea from the game designers, if your suit is leaking oxygen then the levels will drop constantly anywhere, this is part of the reason that people are struggling as they are trying to do things quickly as they have already been warned that the suit is leaking.  All in all a good immerse VR Experience but certainly not a good game.","Jan 6, 2017 at 5:43 PM",3, 9,
2022-05-28 13:38:09.268221,Higg,The best VR experience I have ever had,"I'm a day 1 Rift user. Still this is the best experience I've had to date. If you want to FEEL like you are there (and THERE is in SPACE by the way), get this. EVERYTHING is right about it. You can even look around inside your suit. Which is exactly what you would really do if you were wearing a space suit, but you have no idea that is the case until you play this. So trust me. 500 stars.","Jan 23, 2017 at 4:55 PM",5, 3,
2022-05-28 13:38:09.284179,thekjun1,Love the game\hated the VR Sickness,"Love the game, the graphics, sound, and concept. But be warned do not be in a rush playing this game, take your time, slow movements. first time playing was feeling sick for most of the day, after that took my time and really enjoyed it. good game for the price","Jan 30, 2017 at 11:28 PM",4, 3,
2022-05-28 13:38:12.394993,Macalyn,HMMM...,"It's okay I guess as long as you don't actually intend to play the game. i have tried everything. i got a gtx 1060 and tried to run it on windows 7, tried to run it on windows 10, got a gtx 1080 and still wont run, did a full reinstall of windows 10 from a bootable usb drive still nothing. all it does is launch in desktop mode and not vr mode, what am i doing wrong? i really want to play it on my oculus but i cant and i dont know how to refund the game","Dec 29, 2016 at 10:03 AM",1, 9,
