scrapping_date,review_author,review_title,one_reviews_text,review_date,review_rating,review_helpful,review_feedback
2022-05-28 12:47:56.740797,DangerousFiend,This is not an arcade game.,"If you have no imagination and want your progress through game laid out for you then go and play COD or watch a film. If you can remember, as a kid, being sat in a card board box and it WAS a space ship, then this game is for you. You do have to roll play a bit and become your character, but that is what makes this soo good. I am CMD Dangerous Fiend when I play. I bought my Rift just for this game, thats how good it can be.","Jul 5, 2017 at 12:13 AM",5, 6,
2022-05-28 12:47:56.761741,MX5Roadster,Must Own,"Great VR expieriance, the reason i have the rift is due to this game","Aug 22, 2017 at 2:26 AM",5, 5,
2022-05-28 12:47:56.781688,TurtleManHawks12,This is worth the price of Oculus,I love this game and to do it in VR is the best,"Sep 29, 2017 at 5:41 AM",5, 0,
2022-05-28 12:47:59.885431,xxxmina,Excellent Space SIM!!! not much more,"Fun Space Sim, best we have for now...","Sep 28, 2017 at 2:24 PM",5, 0,
2022-05-28 12:47:59.906375,jkastrinos,Love it!,"This is by far my favorite and the most immersive of all my VR games.  Total freedom to travel around the universe, land and drive around on planets, fight, explore, mine asteroid fields, complete missions, pirate other ships, or just shuttle goods betweens systems.   They've done an incredible job on the visuals and truely enormous stations that you can fly into and dock your ship. It is a persistent online universe that continues to live while you are not playing BUT you don't have to play online if you don't want to.  There are tons of YouTube videos for beginners to get you going quickly and the game provides step by step tutorials that you can play as many times as you need.  After playing for awhile, I took the advice of others and bought a HOTAS ""hands on throttle and stick"" that completed the last piece to give me the feeling that I am coming home from work to fly a space ship.","Jul 24, 2017 at 8:47 AM",5, 6,
2022-05-28 12:47:59.927319,perny4711,I want a refund!,"Wow...this game is so not ready to be advertised for a VR experience...come on guys, when I select Oculus Touch as controller, I don't want to see any ""press 1"" messages!
Plus, left and right hands are mixed up...plus, the whole setup process to begin with...plus, why am starting the game sitting BEHIND my freaking seat!? Why would I want to sit just 20 cm away from my sensors? This feels like there has almost no effort been made in order to make this the VR experience as advertised compared to the original game. Very dissapointed","Sep 4, 2017 at 3:45 AM",1, 1,
2022-05-28 12:47:59.947266,CapSMAK,Game not working,"So I bought my OR pretty much for this game alone. Set it up yesterday and purchased ED. Now I am running with a ASUS 1070 GTX and I7 CPU and nothing. All I get in the headset is sound. I have uninstalled and reinstalled and the same message in headset "" Sorry, Elite Dangerous: Commander Delux Edition is taking a while to load... If this issue persists take off the headset and try on your desktop"". Pretty peed off at this tbh and is a total waste of money!","Aug 9, 2017 at 6:01 PM",1, 3,
2022-05-28 12:47:59.968210,Terriblecookies,Not working,"tried reinstalling and going through troubleshooting fourms, it's a clean install doesn't work with oculus right now it seems or at least mine and a few others I've been noticing. Must be an update or something that is causing this. ""Elite Dangerous is taking a while to load..."" If someone finds out a solution please put it in the comments or update your review, thanks!","Aug 14, 2017 at 1:44 AM",1, 1,
2022-05-28 12:48:03.061546,BeastyBaiter,Shallow but pretty,"I bought this years ago when it was in open beta and the Rift didn't exist. It was fun for a few hours but got old fast as the gameplay is extremely shallow. I gave it another try in VR and though astonishingly pretty, especially in VR, it still has that same shallow gameplay.","Aug 19, 2017 at 11:24 AM",3, 1,
2022-05-28 12:48:03.082490,CaballoLeche,Don't buy through Oculus,"Besides O.R.'s no return policy the game can be acquired for much, much cheaper through steam or a gamekey site and the code redeemed within the account for oculus.

Don't be surprised by the key validation loop bug in the launcher... Even the devs don't bother to tell you that you have to verify the website account before you can validate the launcher key. If you get stuck in a validation loop then go to the frontier site and log in/activate first. Don't complain because you don't know how to use google.

All that aside this game is exactly what I've been waiting for in VR; ""replayability"". If you want to feel like you ARE a space cadet, you NEED to get this game.

I have been a huge fan of simulators of every flavor for years, and that was my intent when I bought the Rift... To be immersed in simulation. With a full HOTAS rig, rudder pedals, and voice attack software. This game goes FAR beyond any other space combat sim. Star Trek Bridge Crew has NOTHING on the complexity and immersion this game offers.

Now if Frontier would just fix the galaxy map controls for VR they would have one of the only games worth $60 on the oculus store... *HINT HINT, NUDGE NUDGE.*","Jul 4, 2017 at 11:28 PM",5, 12,
2022-05-28 12:48:03.103435,grekb,Bad port is bad,Wow! i have no words for these thieves! They made a port from PC game and spend 0 minutes to make it playable on VR... Amazing! STAY AWAY! Probably the worst game i have played in VR. Also reporting the fake accounts that advertise the game content. Its hillarious!! You can spot them because they are  just listing every aspect and content of the game on their reports.  Real players dont do that... Oculus need to do something about it. Also requesting REFUND!,"Sep 15, 2017 at 5:11 AM",1, 1,
2022-05-28 12:48:03.124378,armoden,Really?,"Who coded this game?  Seriously what a hassle just to get started.  I like games with steep learning curves and all, but it's a pain just to set up the controls.  How many people have given up before they're through the tutorials?","Jul 15, 2017 at 12:16 PM",1, 8,
2022-05-28 12:48:03.145322,eric.hormann,,Seriously. Buy it. Stop hesitating and just buy it.,"Sep 5, 2017 at 6:33 AM",5, 3,
2022-05-28 12:48:06.229218,Burstup,My favourite VR game,"I played the original Elite in the 1980s. And I was dreaming of something like this. Elite Dagerous is exactly what I want from a space sim. It doesn't force you to play in a certain style. You can be a tourist exploring the galaxy, a trader, a  pirate, a diplomat.... You can play solo, with friends or in open play. It's beautiful, complex and amazing. It doesn't take you by the hand though, you need to be willing to deal with a steep learning curve, to explore and to find out stuff yourself. Thanks David Braben for making Elite Dangerous.","Jun 18, 2017 at 5:10 AM",5, 4,
2022-05-28 12:48:06.249165,Dustpuppy107,Great Game,"Amazing game. Trade, fight, explore, it's up to you.","Aug 29, 2017 at 6:21 PM",5, 3,
2022-05-28 12:48:06.271106,Wo1fHound,(Some) Missions are so boring,"(Update: It's better now that I've stopped taking Adventure Missiond from Harm Sys.  Beware Gentil Station has multiple 400,000 Ls runs.)    Edited Original: I'm currently flying right now.  It's my 4th stop on a site seeing adventure which started at 0.92Ly; I still have 0.88Ly traveling at 1519C with an ETA of 5 more hours. The 2nd stop was 400,000LS out so I've invested most of the evening on this mission so far.  It's apparent I've wasted yet another evening on an unrealistic mission that must be abandoned.  No way to predict these runs as a scan is required.  I already own all three (Anaconda, Corvette and Cutter) so I've been screwed like this many times before; first time I write about it while I sit frustrated and boared.  Well I might as well get back to the game and abandon it as I'm still 4 hours out at 1767C...","Jul 18, 2017 at 2:17 PM",4, 1,
2022-05-28 12:48:06.292050,Biffes,I really hate Elite Dangerous....,"I hated Elite on C64 for being so complex
I hated Frontier Elite II on Amiga for being so boring. 
I hated Frontier on PC for being so outdated
I laughed at Elite Dangerous in 2014 and the ""grind to death"" reviews.
I bought a rift an gave the game another chance out of pure boredom... and Dude... this game was made for VR and the DEVs put it in VR.  
Things to do: Take a ship - use a docking computer and land on a huge station. Stand up and take a walk on the bridge of your ship while the landing is completed. Play some Rocket Man from Elton John and run through an asteroid ring and shoot some pirates.
Things you`ll need: A joystick (Hotas!)
Things you wont like: the grind is still there - but you will forget about while jumping in a system with a white dwarf or trying to do a mission with a 15.000 lys travel distance","Jun 30, 2017 at 1:11 AM",4, 6,
2022-05-28 12:48:06.312994,Wen90,Superb,Working great with VR !,"Aug 30, 2017 at 4:31 AM",5, 3,
2022-05-28 12:48:09.437224,Angelpew,,"best space game out there, so sweet in vr","Aug 24, 2017 at 3:52 AM",5, 4,
2022-05-28 12:48:09.458168,fineman,THE ultimate VR experience,"This is not a game.  This is you, flying a spaceship. In a faithfull replica of our entire galaxy of billions of stars with billions of planets to marvel at, and in many cases land on and drive around exploring.  The sense of really truly being somewhere else doing something incredible is astonishing.  For VR a joystick and throttle are more or less essential and it takes a while to learn your way around but it is well worth it","May 31, 2017 at 3:42 AM",5, 6,
2022-05-28 12:48:09.480110,hitchhiker54,,*The* VR gaming experience :),"Aug 17, 2017 at 10:19 AM",5, 4,
2022-05-28 12:48:09.500056,susej114,,"Requires a HOTAS joystick to fully enjoy, trustmaster hotas X is fairly cheap and functional, keyboard will occasionally be needed to use galaxy map. Amazing game if you are patient and wish to engage with others on the frontier and steam forums.","Jul 11, 2017 at 9:47 PM",5, 2,
2022-05-28 12:48:09.521000,DylanJMork,"Best game, devs need to fix basic bugs.",This is the best game in the store. but i have to give 3 stars because half the time it won't evem recognize my xbox controller ingame.,"Aug 2, 2017 at 5:47 AM",3, 0,
2022-05-28 12:48:12.624824,WhisperKicker,,Less of a game and more of a way of life.  This is a game that you can spend hundreds of hours in if you are one that can find your own things to do.  If you need a story/dialog that pulls you through a game you should probably pass on this one.  If you want to try out diffrent jobs in space (simplified and sped up to be a bit more aproachable) then this is a game for you.,"May 12, 2017 at 6:34 AM",5, 9,
2022-05-28 12:48:12.646766,sam_rufinus,"it doen´t even install on rift,f++k it.","it doen´t even install on rift,f++k it.","Nov 30, 2017 at 3:37 AM",1, 13,
2022-05-28 12:48:12.666713,RexKibble,,"Nope, gets one star from me because it falls at the first hurdle. I paid a lot of money and I can't play it until I surrender my emails address, so now I will probably get spammed to hell!

So, after taking my money, I have to give over my email address, first and last name, then I have to log on to the 'desktop launcher', which I can't do because I need a verification code, are you guys having a laugh? Usually we just pay for a game and play it, this is a joke. Refund please!","Jul 1, 2017 at 5:06 AM",1, 11,
2022-05-28 12:48:12.688654,leo1954au,Not Installing,Gets to 99% of installing update then fails because of antivirus software so I uninstalled the hole game then ran the install again and it seemed to work,"Sep 29, 2017 at 7:25 PM",1, 14,
2022-05-28 12:48:12.710595,MAFIANAGAMING,i cant see anything,just payed 64 and all i can do is hear music no video,"Aug 8, 2017 at 12:32 PM",1, 7,
2022-05-28 12:48:15.804432,koiliok,why touch can‘t use,why touch can‘t use in oculus home 1.17,"Aug 5, 2017 at 3:04 PM",5, 3,
2022-05-28 12:48:15.825376,KawboyZX10R,Awesome,"This game was built from the ground up with VR in mind.  It's immersive, realistic and deeply involved.  There is a learning curve, mostly due to the realism, but there are so many ways to play this game that's it's astounding.  Be a galactic trader, a pirate, an explorer or an interstellar miner.  Run taxi missions, try to figure out the best routes to make money trading, or just kill someone and take theirs.  It's an open ended sandbox, just waiting for you to choose what you want to do.  If you change your mind, that's ok too.  A few minor mods to your ship is all it takes to outfit it to do something else","May 3, 2017 at 7:04 AM",5, 9,
2022-05-28 12:48:15.847317,rdl2727,money out the window,I've played many games over the years but getting this running and setting up the controls -- which at this point don't work -- is ridiculous. .. I'll never pick this game up again.,"Jul 23, 2017 at 4:20 AM",1, 2,
2022-05-28 12:48:15.868261,hippopotomonstros,GARBAGE.,"THIS GAME IS UNPLAYABLE. Not only do you have to deal with the BS that the other 1 star reveiws tell of, you actually have to take off your headset because you have to use your keyboard while in game. WTF? Is? That? Why didnt they have a functioning keyboard in the cockpit?! Oh, there is one to your left but it is for decoration apparently. What stupid design and a terrible learning curve for such an expensive game. I want my money back. Absolutley terrible experience right out of the gate. I give it ZERO stars.","Jul 9, 2017 at 11:29 AM",1, 3,
2022-05-28 12:48:15.889205,inceptional,This game is f'n torture.,"Seriously, I have two hours to play a game and decide if I want a return (after that I no longer have this option as a consumer). But I can't even get past the first two f'n training missions in this to game to figure out what it's really like--it's that complicated and convoluted to just get the basics down. Now, maybe I'm just missing something, but I've tried to warp to that first planet in training mission 2 and I just keep getting stuck once I arrive. After that absolutely none of the instructions make sense; I just can't get the ship to go to wherever it's supposed to go next--presumably a station or something--and slow down to the correct speed and whatever else. I honestly wanna f'n smash something right now. Games are supposed to be fun--this game is f'n torture.","Jun 25, 2017 at 11:20 AM",1, 6,
2022-05-28 12:48:18.994994,Worpath,epic,VR in space is just so fun well done.  Not a game you just play for a few minutes here and there though.  Serious learning curve warning as nothing is on rails...you should read starting tips on line before attempting.  We need 4k so bad to bring out the visuals but all things considered it makes you feel one with your ship.,"May 14, 2017 at 1:40 PM",5, 4,
2022-05-28 12:48:19.016936,GerySithis,Well,"It's a spaceship and galaxy simulator. Edit:
And after playing a week I can say it's a very cool simulator, but you'll need to watch some tutorials to learn much of the things quick and find good things in the space, like your own homeworld (you need a permit to enter the system).","Jun 5, 2017 at 11:20 PM",5, 3,
2022-05-28 12:48:19.037879,Fahli,Hard,"Its a very hard game to play, but i think its worth learning it! 
btw.: Buy the normal version on Steam (its only 25€), and then you can convert your steam game key into a Oculus Game Key on the webside of the game, you dont have to buy that usless Deluxe edition","May 25, 2017 at 12:52 AM",4, 13,
2022-05-28 12:48:19.058823,lordneep,The Grand Daddy of VR,"Nothing will take as many hours away from you as this game. You will listen to podcasts. You will get reacquainted with old music you loved, and if you're smart, you'll find new music that fits the game well (Youtube for the band Elder, album Legend. Thank me later) You'll start researching stars, figuring out which ones you can scoop fuel from (Types KGB FOAM, fyi) Buy yourself a HOTAS. You can find cheap ones on ebay. The game plays great with a xbox pad, but you'll be lacking a few buttons. Not a problem in 2D as you can have a keyboard handy. VR..... not so much. Snag a cheap x52 and prepare to venture into the stars. Nothing comes close to giving you the feeling of owning your own star ship quite like this game. Just remember to pace yourself. The game is constantly evolving, and you can definitely over-do the game. My advice is to not grind, but to have fun. There's plenty to do to have fun, but setting specific goals for yourself that stray from the goal of fun will set you down the grind path, too much of which can burn you out on a beautiful game.

NOTE: To points other reviewers have made: You can recenter the view if it's off through the home menu, or by hitting F12. Yes there's a season pass you'll have to buy to land on planets. It's an expansion. There's no monthly fee for the game, they sell expansions and cosmetic items. It's really not bad. And to the guy complaining that it's not a sim because there's no inertia, hit Z to turn off flight assist. This takes your ship out of the normal mode which corrects for zero G mechanics and makes it like you're in an atmosphere. FA off lets you pull crazy moves but takes a lot of practice. It also shows off the simulator aspect of the game engine, there'll be more inertia for you to deal with than you'll want to deal with lol","Apr 26, 2017 at 3:04 AM",5, 9,
2022-05-28 12:48:19.080764,CycloCyanide,Best VR game with out a doubt.,"Played Elite from the launch day, but when i finaly got to play it in VR, OMG. just none of the other VR games come close and now I cant play Elite out of VR.","Jul 1, 2017 at 4:58 AM",5, 4,
2022-05-28 12:48:22.159640,marmosetp65,Update,"I was hasty with my previous review. The customer support team at oculus and Frontier responded fairly quickly, not at all days later like some forums indicated. So far the game appears to be installed and functioning correctly. Will update after a few hours of gameplay.","Jun 25, 2017 at 4:36 AM",5, 0,
2022-05-28 12:48:22.181581,florianbro,Black screen after intro,"Black screen after intro -no menu, i have test on STEAM and OCULUS HOME. Please debug","Jun 17, 2017 at 12:12 AM",1, 8,
2022-05-28 12:48:22.204521,PhoenixSpyder,Top of line Space simulator,"After getting my Rift & touch and trying tonnes of VR titles...and loving all of them, I find ED is as good as it gets for VR immersion. It's built from the ground up to support VR and it really shines. Most people who play consistantly, are into this kind of simulation...those who say they get bored are usually only wanting to blow up things or not wanting to spend the time to learn how to actually play it. It has an incredibly steep learning curve...but think about it...NASA astronauts spend months if not years training to go into space...to learn what to do in all situations. ED is based on real science and real simulations...so to really learn how to do things in ED, it will take much more time than your average game, don't expect to learn everything over night. If you are into Simulation games...GET IT!!! If not, look elsewhere. There are easier games out there but nothing with the immersion level this brings.

You definitely have to get a Thrustmaster HOTAS X flight stick (minimum) to really play this game. It is the cheapest one available and is very well built for the price (+/-$70).

Also, I highly recommend getting Voice Attack & A.S.T.R.A Voicepack for use with ED. This gives you the ability to speak to the game to do things that are hard to do with limited buttons on your flight stick. A.S.T.R.A is an in game AI that is an add on and it doesn't disappoint. It will speak back at you as it responds to your commands...commands that are streamlined to work for you to free you up to keep doing other things in the game. Your voice becomes an extention of the flight stick. Plus you can also enable interactive mode that allows you to ask questions and have conversations during long space flights. 

If you don't get bored by tedious things you should have lots of fun. ED is as close as it presently gets to actually going into space and travelling the galaxy...trust me...it's very real...so real, you might forget it's only a simuation.","Apr 11, 2017 at 7:55 AM",5, 14,
2022-05-28 12:48:22.232446,GwennyDaKit,Terrible support,I got the game downloaded it i made an account getting ready to play the game saw i needed a product code to play so i look everywhere but no codes where given to me so i ask for help wait about 2 days get a reply bassically saying we cannot help you we cannot give you a code you can't play thank you for giving us money for no product,"May 12, 2017 at 5:31 AM",1, 9,
2022-05-28 12:48:22.253389,maestropan,This game could sell VR on its own.,Without a doubt the best cockpit simulator out there right now.,"Jun 10, 2017 at 11:56 AM",5, 7,
2022-05-28 12:48:25.343764,darkesco,F*ck this game!,"Gone are the days when you can just play a game. First you must register to play!, then the game must be launched from a desktop app. Then the logo... has it crashed? Is it loading? Who knows! Game loads finally and you are in the back seat of a spaceship with no logical control to recenter the view. And requiring an actual keyboard in VR is rediculous. Fix this buggy sh*t!","Jul 1, 2017 at 4:19 PM",1, 8,
2022-05-28 12:48:25.365704,Edmundus3,The only truly BIG game in VR,"If you invest the time, this game is second to none on VR and you can play indefinitely.  It is the only game to which I keep returning.  It made the cost of the headset worth every penny.","Apr 27, 2017 at 2:49 AM",5, 16,
2022-05-28 12:48:25.387645,DamnImDeadAgain,Don't buy from Oculus store,"So I bought this game from the Oculus store.  In order to play, you must register with Frontier, and the only way to do that is by launching the game from the Oculus Store and going through a couple of steps, which I have now repeated 24 times, as well as re-installing the game twice and oculus home once.  Buy from Steam, where they will give you your key, and you can register it manually on Frontier's website.  I will not buy anything from this store again that I can get elsewhere.  This has been my worst experience with a gaming purchase in 20+ years of computer gaming.  I presume the game is good, but I wouldn't know, and you might not either if you purchase here.   
Oh, and the first thing in Oculus support's email to me was that all sales from their store are final.  Steam allows refunds within 14 days and less than 2 hours of gameplay.","Jul 1, 2017 at 6:04 AM",1, 12,
2022-05-28 12:48:25.409587,dsmall417,Best experience that I can't recommend.,"If you love space and have ever wanted to feel like you are actually flying a space ship, then you need Elite: Dangerous.

I've been playing it for over 2 years on both a flat screen and VR and I'm the kind of person who enjoys it either way because I'm a huge fan of space and this game is a 1:1 scale of the Milky Way with everything we know about it included in the game. But once you are actually sitting in the pilot seat, it changes everything.

You're not looking at it from a 3rd party perspective. You are actually the pilot and you need to learn all about what the dashboards around you are all about. You can stand up and walk around your cockpit, though the early ships are a bit of a tight squeeze.

You can travel at your leisure to over 400 billion star systems, some of which have still yet to be discovered & if you find them, you can have your name permanently attached to them. If you get tired of flying around, you can land on a planet and travel around in your SRV and collect some resources you'll need for future upgrades.

If you prefer to fight, then you can upgrade to a battle ship and fight until your hearts content. You even get paid for doing it for missions as well as any bounties they have.

You do what you want, how and when you want, however:

It's a grind to gain achievements and the learning curve in every aspect of this simulator can be overwhelming. You must also have a lot of time to play it or at least understand that it is something that never ends and will likely take months to years to reach top levels.

This is the best VR experience right now and the absolute best experience ever for space enthusiasts. I want more people to enjoy this experience, but I can't recommend it because so many people won't get past the learning curve in the first few hours of play time.","Jul 3, 2017 at 2:33 PM",5, 11,
2022-05-28 12:48:25.431528,Eulenauge66,Incredibly exciting - or boring,"I spent now a couple of hours in Elite Dangerous VR, maybe 15- 20. I know - for an expert almost nothing. The question is if I really want to spend more.

I even bought a HOTAS flight stick for this. And the feeling of sitting in a space ship, cruising between galaxies, is fantastic and real. The first 1- 2 hours might drive you mad. Landing on a space station is a pain in the ***. But then you master this, then the next thing, and soon you fly with elegance.

And then? You can trade, bounty hunt, mine asteroids, even be a tourist ship. And then there´s the neverending hunt for improvements on your ship.

Besides that - not much. The universe feels real, but also very empty. No settled planets, just some trade stations on barren rocks. 

I think I will return from time to time to Elite, but only to relax, cruise a bit between the stars and get that great feeling of sitting in your ship. But investing too much time - I think not.

By the way: I played the original back then on a Amstrad CPC. Funny enough, even with the incredible VR surroundings, it kind of feels the same like 1989.","Apr 3, 2017 at 4:41 AM",4, 6,
