scrapping_date,review_author,review_title,one_reviews_text,review_date,review_rating,review_helpful,review_feedback
2022-05-28 12:45:15.082297,OmegaJesus,Hands down my favorite VR experience,As of right now this is the best VR experience imo.  It is extremly immersive when paired with a HOTAS setup.,"Aug 4, 2019 at 11:39 AM",5, 2,
2022-05-28 12:45:18.176626,ernie0167,Mixed...,Great game marred by too many updates that just take too long to install,"Aug 7, 2019 at 5:43 AM",5, 0,
2022-05-28 12:45:18.193580,Palieus,My thoughts,"Short answer, this game's incredible. You set comfortably flying from system to system in a spanking new ship, picking up missions from station hubs ranging from collecting bounties, passenger transport to mining minerals.  

My only beef with the game is … WHERE IN THE HELL IS EVERYONE?!? Its so lonely. Seems for new players you only interact with Npc's and unless you know anyone else who plays its gonna be like that. 

There needs to be ways to communicate with the community in game. It would be nice to implement a way to talk or locate other players who are in the same system as you. An open space chat If you would like calling it that. Just something...... its sooooo cold out here in space. Needs human interaction","May 4, 2019 at 9:49 AM",4, 23,
2022-05-28 12:45:18.209537,Buschlord,controls are horrible,"i rly dont understand why i have to learn about 50 keys. no joystick in the world has that many options. this is vr, so it should have been possible to press keys with touch-controller. but no, im forced to switch between keyboard, joystick and mouse all the time. maybe its fun somewhen, but you need to configurate for days.","Jun 2, 2019 at 5:39 PM",1, 6,
2022-05-28 12:45:18.225495,Raxe,In HMD LCD screens it does not look good,"There are viewers that have LCD screens (Rift S and others). In these viewers, blacks are dark gray. I think the developers could better combine the colors so that the space looks more intense black.","Jun 28, 2019 at 2:50 AM",2, 2,
2022-05-28 12:45:18.242449,thesmith_de,,"You have to consider some things before buying this:
1. You have to be aware, that you will defenetly be frustrated in the beginning due to controlls!!! They are over complicated. If playing this with oculus touch (like me) you MUST change some controls in the options menu to get it running properly! The tutorial helps some, but is not enough either. In the beginning I had to quit several times and google some problems i had. Learning curve is tough...
2. AND, you will defenetly be frustrated in the beginning due to the missions as well!!! Explanations are poor and trial and error occurs often. Experience is the key and i recommend to accept the missions acording to the commanders level. Learning curve is tough...
3. You will never, ever in your entire life experience all, this game offers! The game map (if you can call it like that) is simply our entire galaxy!!! Everything you do, has an effect on the entire system in some way, but what is one humen in a universe with billion of stars, planets, npc's and other players. You feel important at first with the biggest ship under you command, but in fact you are a nothing! You might feel unimportant after a while.

So why 5 stars?
1. This is the mother-of-all of the open world! You can travel wherever you want. You can do whatever you want. You can set you own goals and fulfil your dreams.
2. This is the real galaxy, the one we live in. Somehow you feel home, even though in real life theres no such thing like space travel. But you find places thinking ""i heard or read about this"" and even though its only in the game, it gives you some kind of satisfaction.
3. Theres so much you can do. You can trade, deliver goods, be a courier, scavenge, mine, head hunt, steal, hack, retrieve, explore, construct, loot, raid, transport passengers or simply fly around and visit places.
4. The VR experience is awesome. Space travel in 3D:  OMFG!!!
5. For an elite veteran like me (since C64!) its a dream come true!!! An absolute must buy!","Apr 20, 2019 at 1:07 AM",5, 26,
2022-05-28 12:45:21.339305,Spitznaz,"Amazing, HOTAS required IMO","This game is nothing short of stunning.  A truly beautiful thing to step into.  To have full immersion, however, I recommend a throttle and joystick setup.  I personally place the stick and throttle where they are in relation to my view and it's like i'm truly there.  O.O","May 9, 2019 at 9:06 AM",5, 3,
2022-05-28 12:45:21.355262,TRealFreshNoob,Waste of money,The controls didn't work nor did the experience resemble anything that is shown above.,"Aug 4, 2019 at 7:29 AM",1, 0,
2022-05-28 12:45:21.372217,Gildersleeve,The reason to get VR,"I'm not sure what I can say that hasn't already been said. But this experience is magical. Flying around space with my HOTAS setup, seeing the stars....it's still amazing. I love this game, and in VR, it stops being a game and simply another dimension I exist in.","Sep 6, 2019 at 1:57 AM",5, 0,
2022-05-28 12:45:21.388174,1ce_man,The Galaxy is a big place here...but...,"What to say about this game? Playing this in VR reminds me of playing Subnautica VR, not really VR supported. The touch controls only act a a gamepad instead of tracked motion controllers. I would give this game a higher review if they fixed that. Also I find the various screens constantly get in the way as they lock controls when looked at. Those two things alone makes this game not worth the price.

There are a lot of good things to say about this game. It has a massive galaxy, making money to buy better ships and upgrades is fairly simple, you can explore some planetary surfaces with your  SRV (hopefully it opens up to more planets as some look really neat). There are a large variety of stations and ships out there, I personally really loved actually flying into a station and docking manually at a launch pad. Found that to be a really nice feature. The systems do not feel like copy and paste systems, each certainly seem different and very large. The distance between objects is better then I would expect, certainly takes time to get around (which to me is a great feature). There is a choice to opt out of the multiplayer galaxy, but it wouldn't matter as its hard to find other players anyway. Not sure where they're all hiding.

Talking in this game is something I can't seem to figure out in VR. The game features a standard ingame chat system, VR users typically don't use a keyboard for communication. There is suppose to be a voice chat system, but I can't find any players to test that with yet, so.... On the plus side, you can play off the oculus store in standard desktop mode, but why buy a VR game that doesn't properly support VR? Hopefully the issues I've mentioned get fixed and I can give it a higher review. Right now if they just give it better VR support I would be happy.

If you're looking to buy this, I would wait until it went on sale.","May 14, 2019 at 12:59 PM",3, 3,
2022-05-28 12:45:21.405128,joel.kist,Best VR GAME IMO,"When you put on the oculus and start up elite and see this huge ship there that looks beautiful! Then you look around a bit in AW Until proceeding to the menu to set your profile because if your not using a Joystick/throttle then your missing out on the the best part! It puts you in the cockpit! Granted its not perfect by no means but its better then anything ive seen so far! You then geat a ship and start your journey in the milky way galaxy, and theres so much to do ohnestly you feel lost, Stumbling a bit until you grasp the concept! Then your on to making millions and getting different ships and builds and fighting pirates or the aliens or PVP! Hours and hours of gametime but then ENDGAME can be a bit daunting because there really isnt any you just fly around finding stuff/planets or blackholes no one has been too. So hopefully they fix that but everything up until that point is the best game ive ever played! Thank you Elite !!!","Apr 25, 2019 at 8:43 PM",5, 6,
2022-05-28 12:45:24.489026,OculusTuff,So far it sucks.,"It worked for a while, but after a few updates it will not let me log-in. Ive contacted their support a half dozen times but no help. You can never talk to a real person and they will not call you.
Ive got $1300.00 invested with controllers and all, and haven't been able to figure out why I cant log on. theres nothing worse than being hung out to dry after they get your money. Piseed off customer.","May 2, 2019 at 7:15 AM",1, 1,
2022-05-28 12:45:24.504983,Ryan19908,,Cant wait for the next era,"Jun 21, 2019 at 5:48 AM",5, 1,
2022-05-28 12:45:24.522935,ParadiseDecay,One of the best VR experiences!,"Back in the good old days of the Commodore 64 I could never have dreamed that one day I would be playing this classic game for REAL, yes you feel like you are in an Awesome spaceship with unlimited space to explore. Superb!

Rift S Gameplay Video // GTX 1060 (6GB):
https://www.youtube.com/watch?v=YzANspLPi50
(Please Note: Links might not work from Oculus, so please search YouTube for 'Paradise Decay VR Elite Dangerous')","Aug 4, 2019 at 10:05 PM",5, 1,
2022-05-28 12:45:24.538892,klipsch27,trash game,"before you play the game you have to create an account.took forever to finally getting a verification code through your email so you buy their crap before playing the game.im running a 9900k with a 1080ti and the game ran horrible.i were getting motion sickness ,frame rate were terrible.can i tell you i hit the unistall button fast.so much crap to go through just to get into the game and it runs like gargbage.","May 13, 2019 at 5:06 AM",1, 0,
2022-05-28 12:45:24.555847,Highway_UK,True to the Original 1984 classic,"I was a big fan as a child playing it in 1984 on Spectrum and C64, then later Amiga, and various PC sequels.... this version is without a doubt the best version in the series, VR support was phenominal from day one, the sense of space is gobsmacking. Best VR game available.","Apr 24, 2019 at 3:10 AM",5, 3,
2022-05-28 12:45:27.636427,Longinus1987,Amazing!! But...,"Absolutely incredible! visually, there is nothing like it (that I've experienced in VR). Definitely a strong learning curve... and not for the oculus controllers, which i learned after the purchase. Despite this, the experience is very in depth. Several times through each tutorial mission i started to get the hang of it, and then....

An update came available. Now it won't let me play!","Apr 27, 2019 at 4:38 AM",4, 0,
2022-05-28 12:45:27.654378,CarloFromMilkyWay,"this is not a game, it is a universe","Describing this game, Scott Manley said something like: ""forget to become Han Solo. You will be that unknown person who piloted his spaceship while the others saved the galaxy."": this is the best review for this game. With Elite Dangerous you can understand what human beings will experience if they ever manage to colonize the galaxy. Despite the updates are slowly making everything less frustrating, this title is still missing a story that makes me feel the hero or at least part of something. But from a simulative, realistic, technical point of view, this game is a real gem. If I were in Frontier Developement, I would hire a writer and concentrate on building an adventure around this fantastic ""engine"". With a real adventure truly playable, Elite Dangerous would become the best game in the world.","Dec 24, 2018 at 11:30 PM",5, 255,
2022-05-28 12:45:27.670843,VCabrown451,Still will not update properly,"have to remove and reinstall to force the update in Oculus rift library,Reached max ranks in both Emire and Federation Navy It is a fun game to play ,love the srv and the lore of ED, really talented people to create this alt life and yes it is like living an ALT Life","Apr 16, 2019 at 12:38 AM",4, 2,
2022-05-28 12:45:27.686800,MAC_MAN86,Best game in life!,"However, for Joystick 16000M, the Slider if on full/off OR moving prevents Mouse appearing in GalMap. We need to set it at 90% Axis to then view the Target Circle.
Fix this and add Quality Of Life elements to tie-in all possibilities within the game.","Mar 30, 2019 at 4:40 AM",5, 3,
2022-05-28 12:45:27.703754,norsoulnet,"Best game in VR, best Space Sim game","Elite Dangerous by itself, outside of VR, is a very good game (4/5 Stars).  It is by far the best space sim on the market in that regard.  It has a very steep learning curve with a minimal tutorial (including tutorial videos and familiarization missions with scripted voiceovers).  It has a vast library of youtube videos and a dedicated community.  

It is space flight simulator style game that takes liberties with physics to make the game fun and playable (i.e. ships have a maximum speed in space, but that prevents space battles from happening at tens of thousands of meters per second and across huge distances by radar only).

There are no space legs like in No Man's Sky or Star Citizen, which keeps the user experience tighter and more streamlined.  The flight model and combat is second to none (less visceral than EVE Valkyrie but far more complex).  The ships and weapons are all well balanced.

The game is more than combat, however, as you can choose to explore the galaxy (a 1:1 simulation of the Milky Way, with distances faithfully re-created where possible), smuggle illegal goods, trade goods between systems with complementary economies (i.e. make a profit by hauling ore from an extraction economy system to an industrial economy).  With regards to exploration, no other game comes even close to Elite Dangerous.

Missions are randomly generated and generally un-inspiring.  Underlying game mechanics (called the Background Simulation, as factions vye for power over star systems) are needlessly complex.

This game is a game changer in VR.  Ship sizes come to life as you suddenly realize just how HUGE your ship is!  The largest flying ships are larger than modern nuclear submarines.  Outside of VR everything is shrunk down to fit into your screen, but in VR you are engulfed by your cockpit, which is a tiny window on a huge ship.  Planets and stars will bring tears to your eyes in VR.  I bought the Oculus for this game, and don't regret it one bit.  Worth every dollar.","Jan 16, 2019 at 10:38 AM",5, 47,
2022-05-28 12:45:30.812057,Thyphoon,Might Be Good in Two Dimensions,"I really wanted to like (or love) this game.  But try as I might, I can't.  I have a 
Saitek X52 Pro controller, and I've spent a great deal of time over the past several weeks trying to get the controller to react with the VR game.  I've studied the .binds xml files until I can just about recite them from memory.  I've updated drivers for the controller and done my best to find workable bindings on the internet.  When I'm prompted in the training missions, for example, to deplay hard points, the control I have programmed does nothing.  Even the keystroke (""U"") doesn't work.  Just flying around and docking works just fine, but trying to do anything more seems impossible.  I've worked so hard on it that I'm worn out.  I would not recommend this game to anyone who has not mastered the concepts on a 2 dimension version.  And you don't need Oculus for that.","Apr 1, 2019 at 6:09 AM",2, 0,
2022-05-28 12:45:30.830009,cmangusso,Very good space sim in VR,"I have been playing this game now for almost two years and it is still my go to game in VR.  I don't play this game with the Touch controllers becuase I have the x56 HOTAS and voice packs.  For the people that do play with the Touch controllers one thing that might help with getting all the controls in the game to work is to use Voice Attack with HCS Voice Packs, the voice packs add another layer to this game and are alot of fun.  With my setup I have 6 packs running and they are all controlling different things for ship operations.  All I have to do is speak a command and it is then executed, very cool.  Now that I have the voice packs and HOTAS I never have to touch the keyboard, I can still do commands from the HOTAS if I want though.  If you are interested in these voice packs just let me know and I can help with the setup.  Fly safe commanders, o7.   If you are ever in game look me up I am CMDR Cmaximus47.","Oct 19, 2018 at 11:45 PM",5, 79,
2022-05-28 12:45:30.848958,Riotsu,,"Realistic futuristic space simulator.  Its difficult, and you need a great PC to run this at a good framerate, but it is every emotion you can feel.  Awesome stuff","Apr 15, 2019 at 10:53 PM",5, 2,
2022-05-28 12:45:30.864915,CursingBubbles,I have high hopes,"I can not get this game to open properly on my rift, it opens and has me login and then its just a black screen, if this problem gets resolved I will update my review as i play the game on my xbox, so i can say it's fun, it would just be better if it worked on vr","May 31, 2019 at 1:25 AM",1, 0,
2022-05-28 12:45:30.882375,ZeeTheWarrior,Epic,This is among the most complete games you can play in VR and it's a doosie.,"Mar 21, 2019 at 5:14 AM",5, 3,
2022-05-28 12:45:33.965743,Ghost_Maker,so oculus updates break audio mirroring!,"Almost a year later and audio mirror still not working. Not to mention the games just keeps says its updating and them nothing.Come on, no sound in rift headphones.","Feb 21, 2019 at 3:55 AM",1, 4,
2022-05-28 12:45:33.982697,Tristan03141,Only review you really need :) 2in1 spec,"2 STARS
Couldnt even get passed the training because of controls being over complicated and limited with touch. i thought it was gonna be like ST bridged crew where you can actually move your hands around and access all the controls need to play.....nope...nope nope.....not like that. bottom line unless a thorough tutorial is created to optimize my touch controllers to play this game in a smooth fashion (without having to take my headset off to press keys breaking my immersion), this game rest in the unplayable section for me :( theres dark souls 3 hard, theres ""getting over It"" hard.....then theres ""learn curve BS E.D."" ridiculous. you make me sad >:( bottom line 2 stars for game performance and graphics, really nice.

now 5 stars
If you got this far, this is an update two days after i posted the first paragraph. learning curve is steep, but this game became worth it. im switching my review to five stars because this game has rightfully earned it. To help you get passed the learning curve, few things to keep in mind: Keyboard and mouse (with VR headset) works way better than oculus touch and doesnt break immersion, if your keybinding doesnt ""bind' when you're setting up comfortable controls try to set the keybinds in the second slot option instead of the first. if you are having trouble really starting off, find a mentor in the game, you just need to press ''2' to open up chat, scroll down and join another ship with experienced people. lastly, power through the control adjustiong and learning, this game gets really good.

oh yeah pro tip: take advantage of your shift keys, it can be really useful for combo keybindings like (SHIFT+W) is my 100% throttle) while just W is forward throttle. things like that make the game sweet as pie. crazy first day playing i wouldnt buy this game on sale, 2 days later im glad to pay full price.","Feb 11, 2019 at 5:24 PM",5, 6,
2022-05-28 12:45:33.999651,Prime1965,reason i brought a CV1!,"It seems like such a long time ago i purchased this game and it was indeed the only reason (at that point ) i got an oculus rift.

PROS:
excellent intergration with my CV1
Graphically excellent and how a space game should be played
excellent compatibility with all controllers i have tried (finally decided on the Hotas X)
Replay value is endless 
If exploration or combat is your path you are well served in this game.
Great fun if you join a group or play with friends

Cons: 
Always (almost without fail) have problems installing updates .
Can be a little boring if you are constantly just flying around and are not in the game with real players.
Each update brings its own extra problems (at this moment disconnects randomly).
Although the game has seen an incredible amount of updates since release they do not make any significant differences to gameplay.
Choosing your path of exploration or combat etc  does not change the fact its all about earning credits .","Jan 3, 2019 at 11:45 PM",4, 7,
2022-05-28 12:45:34.017603,Bisse_B,This!,"This game is magnificent. It's got mindblowing grapichs. It's enormous, relaxing and exciting. This is where you want to go. The VR integration is almost perfect, and it's one of the most immersive VR experiences I've had so far. Three thumbs up!

We have come a long way since Wing Commander :) 

Learning curve is steap, but setting up my x52 was a walk in the park, compared to EVE: Valkyrie. Also, this game is a lot less shooting at everything that moves and much more of a proper space simulator.

I can't believe the scale of this game, and the depth. Like some people say: It's the Milky Way, in full 1:1 scale, and that should be more than enough. You still have to hyperjump between starts, and JUST WOW!!! the first time you do that :)

Being an amateur astronomer: The attention to astronomy details are just mindblowing. The first time I entered the Galaxy Map, and noticed the Horsehead Nebula and stars I knew, was awesome. Kind of like being at home, but far far away. The graphics are a lot less Avatar style than No Mans Sky, and much more realistic. Proper colors and red nebula, thanks.

The first time I saw Jupiters rings for real through a large telescope, my heart jumped. I had the same feeling in Elite Dangerous the first time I recogniced Bernards Loop in the distance, while approaching some minor spacedock in the middle of nowhere, delivering two boxes of beer to some miners.

Take your spaceship and look a litte closer on what the different stars are like up close. Don't get too close though, as this will fry your equipment quickly!

A can highly recommend this game. Thanks to the developers for an excellent job!

To newcomers like me: Start in Solo mode AFTER doing the Training Missions. Fly around, don't start fights (hehe) and do some transport missions to get into the spirit of being a Space Commander. I have only experienced fighting, when I occasionally bounty hunted, and it seems that you can get along with most spaceships you meet.","Jan 24, 2019 at 9:31 PM",5, 9,
2022-05-28 12:45:34.033561,MaximusWhiticus,Can't play this game,"Bought this game last night, after installing it I had to make an account.  After making the account I tried logging in to play and it said that I needed to buy the game.  Even though i just bought it, still would not let me play.  Opened a ticket with Frontier and Oculus, neither have replied with help.  Now, the account i used to open the ticket is not authorized to login to view the ticket.  Save yourself a headache and just don't even try this game on oculus.","May 2, 2019 at 2:31 AM",1, 4,
2022-05-28 12:45:37.132934,Gamer_JYT,Amazing! 😁,"Deserves 5 stars it is so good. But there is only a few problems. Pros: amazing, so accurate if you said it was real life I would fall for it 😂 and they bought the database of the Galaxy! Cons: well these aren't really cons but more like suggestions. It's annoying you have to buy paint. 🤬 But I think there should be at least one free. Idea: add planatary landings to atmospheric Bodies. Other idea is add space legs. Other than that, this is the best space game ever!","Feb 10, 2019 at 8:30 PM",5, 0,
2022-05-28 12:45:37.150886,drjohngraner,Can't get it to run on Rift.,"When I attempt to play this game, which I purchased via Oculus for the Rift, I cannot use the controls. I see that other people have the same problem. The suggested fixes that I have found refer to an earlier version of the Rift or something, because I can't find any of the fixes they mention.","Mar 9, 2019 at 3:34 AM",1, 1,
2022-05-28 12:45:37.167840,billy.attaway,Amazing,"One of the best games I've played in VR. Elite Dangerous is great on its own, but a VR headset just changes the game. Graphics and gameplay are amazing and immersive. Dont hesitate to get it.","Jan 18, 2019 at 3:39 PM",5, 5,
2022-05-28 12:45:37.183797,caledonia69,Best Vr space sim ever,Game take little time to setup and get to know controls but after that man this game is so fun.  Started doing trade runs good cash now into mining making good creds may buy me a fighter and start fighting im in no rush 2nd week playing. The Vr experiance is mind boggling. I could not go back to desktop play after experiancing vr. Just crazy how good it is.,"Jan 3, 2019 at 12:13 AM",5, 2,
2022-05-28 12:45:37.201750,jamisonmiller,Si-Fi Dream brought to life!!,"after 2 years, i am surprised i havn't written a review.this is without question my FAVOURITE game in VR!!! It doesn't take much to understand why.

The game (if you can all itr that) is basically a real time living, breathing universe! with more content than stars in the sky (quite literally, as all 400 billion stars are visitable!!!) 

Some quick notes: 
- You will Love this more if you are a fan of Si-Fi themes and atronomy! 
-A joystick of sorts is recommened (I use the X52 Myself) for maximum comfort and performance!
-The game can be very daunting when you start! I was not joking about the content, if you try it all at once your head will explode!!! :D
Other than these points. You will have the adventure of your life!!! 

You WILL get your money's worth (even at full price!) as the game is endless and ever evolving (Massive content drop coming at the end of this year!!) 

This is a definate MUST HAVE for anyone interested in streaching the limits of VR!","Nov 23, 2018 at 7:44 AM",5, 8,
