scrapping_date,review_author,review_title,one_reviews_text,review_date,review_rating,review_helpful,review_feedback
2022-05-28 12:46:27.832496,JamZam,Hands down best VR experience I've had,"I have well over 600 hours in Elite Dangerous at this point, probably half of that time spent in VR. It's a TRULY immersive experience, especially if you get a HOTAS (aka joystick) to play with. This game won't hold your hand, you are the commander of your own ship and the milky way galaxy is your playground. You can choose to trade, or you can choose to hand-craft your vehicle for dogfighting. You can be a pirate, or an explorer. You can even choose to be a miner. Or do all of the above. There's so many ways to play Elite Dangerous and after 600 hours, I still feel like I'm just scratching the surface. It's alot to learn in the beginning and you might feel frustrated, but once you get into it... I couldn't recommend it enough.","Feb 7, 2018 at 7:07 PM",5, 9,
2022-05-28 12:46:27.850953,KroganRebellion,"Not a VR-first experience, and it shows","Since Elite Dangerous is in the Oculus Store, you would expect that you can just install the game and play it.  Unfortunately, this is not the case.

If you use Touch, which comes with every new Rift, then you start each game looking through the floor while the game menu floats above your head.  Elite doesn't detect that anything is wrong, instead you have to Google the solution, and you find out that you need to press F12 each and every time you start the game.

Text is blurry, and the comms panel is very difficult to read. When viewing mission boards, the load time becomes frustrating because you can't look at anything but that loading screen.  Why these aren't loaded behind the scenes when you dock, I have no idea.

The game will not adapt its graphics to keep a constant 90fps, instead you have to manually adjust graphics settings if your GPU isn't keeping up.  Not even the ""VR"" graphics settings do this.

Aside from the VR aspects, Elite feels very much like an MMO with many of the appealing aspects removed.  There is no in-game story to speak of.  I wanted to like this because it involves spaceships, and Privateer was one of my favorite games growing up.  But there's just not enough here.  And too many MMO time sinks.","Jan 2, 2018 at 3:50 AM",1, 12,
2022-05-28 12:46:30.958723,mk1020,trash,would not work,"May 7, 2018 at 7:37 PM",1, 2,
2022-05-28 12:46:30.977180,955i,Trucking in space,"Surpisingly adictive, in theory bland, in practice what you make of it. prepair to bleed time. Nice implementaiton of head tracking for menu display. Xbox controller works well enough but drawn to a Hotas in the end 'cause i've never userd one. Tried a t-flight x it was relatively cheap - enjoyed using it- so must be getting old

Alwayes lovced 3d. and whilst this game is not up there with the genually new  taylored  to VR experiance Lone echho  it is just darn good in its own way.  Be warned though you are just space trucking or bus'in.","Jan 14, 2018 at 8:14 AM",5, 6,
2022-05-28 12:46:30.997126,evdheide1971,One of the best VR games there is,"1st some remarks about several 1 star reviews.
Offcourse there is no Oculus Touch option. This game was not made for Oculus Touch. It is made for VR though. Frontier, who developed this game, developed the game with the VR option from day 1. Even if you didn't buy the game via the Oculus Store you can ad it to the Oculus library afterwards. The remark that this game was not made for VR is wrong. This game is a spaceflight sim. For the best gameplay you do need HOTAS system but it can be played with a normal joystick and the X-box controller. Another option to make it even better is a third party voice control program. With that you can give voice commands to push keys or even key combinations. There are several options on the internet available for the best experience. One thing is for sure. This game was deffenitly developed for VR as well as 2d screen mode and I love it","Dec 30, 2017 at 6:21 AM",5, 11,
2022-05-28 12:46:31.016076,cpenfold,Downloading...,Took me at least 14 hours to install (which is fair enough considering the size) however after installation Oculus Home refused to launch the game. I downloaded ED Launcher and fixed the game files and this seemed to work (after another 4 hours of downloading)... until it decided not to launch in vr anymore after only an hour of gameplay. Now I have to reinstall everything to try and get it to work again. So far my experience has consisted of watching a little blue bar go from left to right which is really only fun for 15min. Would recommend to anyone who enjoys downloading sims.,"Jan 29, 2018 at 10:15 AM",2, 3,
2022-05-28 12:46:31.035025,Big-Boss-Man,worst touch integration possible.,"When using the touch controllers, the menu changes in game are all button combos. The left thumbstick is steering and the left grip button is decelerate.  Combine the 2 and you get chat menus, disabling all ship control inputs.  No input equals straight line flight.  Any easier target?  None that I know of.  This means that left thumbstick and left grip may as well be self destruct.","Dec 25, 2017 at 2:22 PM",1, 13,
2022-05-28 12:46:34.122378,Blaubarsch,Elite,Great space sim if you like games like X3 you may like this one to and don't let you fool by the negative reviews they come mostly from people with the wrong input device or the lack of brain to set up control's right...,"Feb 1, 2018 at 2:20 PM",4, 4,
2022-05-28 12:46:34.140330,milkchugg,Am I missing something?,"This game is literally unplayable. It's completely buggy, the menus don't even load in the right location, it requires using a mouse and keyboard to get set up, and once I was finally able to get into the game past naming my ship (again, had to take off my hmd), it couldn't even do anything - none of my controls worked. I tried to do the training and I was hovering over my player's body and it wanted me to use my keyboard again for it. Wtf is this?","Mar 10, 2018 at 2:31 PM",1, 7,
2022-05-28 12:46:34.159279,faifuder,Horrible Insatllation process,"I've been trying to get Elite to work with Oculus CV1 for 5 days now no luck, The Oculus software works well on its own but cannot load Elite Dangerous in VR. my PC more than meets all requirements for ED in VR.","Feb 1, 2018 at 3:24 PM",1, 6,
2022-05-28 12:46:34.178229,graeme.moignard,Bought an Occulus a few days ago..,"Played the game 2D since it came out, wow VR is nice (apart from the setting up and getting things ""how I like them"" though!)

A tip - to make reading game menu text a little clearer; and to get a sharper picture, on the game video settings turn up Super Sampling and HDR a bit, keep changing and checking. If it gets laggy (as in side views get choppy) turn one or the other down a notch. On my 1080Gtx I have SS on 1.50 and HDR on 1.75. Much better all round picture quality and I can now read the text easier. 

PC version -  you can change your cockpit colours, go and google how, pick a nice dark green or purple base colour set, much better in VR than the standard cockpit colours. 

I can't use the Galaxy map though, still cant figure out how to select the planet I want. VR noob here ;)","Dec 31, 2017 at 4:57 AM",5, 7,
2022-05-28 12:46:34.196181,KildenZ,"Super Hard, Fustrating and Superb","Despite all the hype for a HOTAS to play this game, I play it using Touch and Voice Attack. It takes time to setup (read: 4-6 Hrs), it is NOT userfreindly, but once you get it set up, and start flying your spaceship around the Galaxy in VR, this games is so unbelivable nice. Expect fustration Expect hardship, Expect Superb Space Simulator/combat/trading/exploration -what ever you like. But it will not come easy. Watch Youtube, get Voice attack, set everything up. Only then will you be ready to truly enjoy this game.","Feb 3, 2018 at 6:30 AM",5, 4,
2022-05-28 12:46:37.308983,Claymore.WP,Far beyond better with VR,"This game is hands down meant for VR. I originally bought the game when first released and was disapointed to say the least. Just too much going on and incredibly boring. Then again more content has been released since then. But still, having the ability to look around really immerses you in the game and makes managing your systems much easier. 
5 stars would be earned if there was more to do. This game is a ocean thats an inch deep. I have yet to see anything resembling factions or guilds, player property or structures, business, management, things of that nature. Basically all that extra stuff that EVE has. Or even a player market would be nice. But for what its worth ill take it.","Jan 19, 2018 at 2:35 AM",4, 9,
2022-05-28 12:46:37.328931,WatsBlend,Absolutely breath taking,"One thing going in to this game every new player should realize is that it is a space sim. You don't have a specific objective, you do not have a player centered story. What you do have is an actual galaxy sized galaxy to explore with never before seen content everywhere. You make your own story, you make your own path and you decide for yourself what is important. Most games that attempt this end up feeling bland or because of the massive amount of content the content it has ends up feeling empty. Not this game, ED: Horizons feels like a thriving galaxy. 
Not at all beginer friendly and that is honestly what makes it amazing. Once you get past the initial phase of running into everything and making every mistake possible, you'll find yourself doing things that are amazing, and discovering new mistakes you didn't think were possible. 
At first it's disappointing there is not touch controller virtual hand support but honestly it begins to feel pretty natural after awhile","Jan 5, 2018 at 10:24 AM",5, 14,
2022-05-28 12:46:37.347879,JuicyFruit40,Outstanding!,"This is by far the best space flight VR game on the market right now hands down. The level of detail they put in to this game is phenomenal imo. The huge space stations you manually fly in to. Open play is great because you see other real pilots not just AI. I have not come across any ""pirates"" as of yet. I am also a veteran of space MMO's such as Eve Online and i can tell you now that this game blows all others out in to space dust! So far all i have done is trading but of course i plan to branch out. I can see how using a joystick would be the most optimal way to play but mine doesn't respond well like it use to and honestly the keyboard and mouse control scheme is really not all that bad at all. If you are a sci fi fan, space cadet or just a VR enthusiast, this game is most certainly for you!","Dec 15, 2017 at 5:32 PM",5, 9,
2022-05-28 12:46:37.366828,Jolid63,This is how VR gaming should be!,"I have played Elite from release in 2D, tried some streaming apps for Gear VR and thought it was very cool in 3D. I took the step and bought a Rift, and man, is this a great game or what!? It's all I want in a game, and I can choose when I want a calm trading run or some combat action. Very nicelly done Frontier!

PS. You better get a HOTAS or some joystick with a LOT of switches for your control. I have an X-55 that's just perfect for me.","Dec 30, 2017 at 7:57 PM",5, 7,
2022-05-28 12:46:37.384780,veldren84,Your go-to for a VR space flight game,"I mean, it works great. I've had Elite for a long time and jumped into VR seamlessly. If you can get ahold of a throttle and stick, this is one of the most immersive games out there!

If you're having trouble with orientation - your view is different than where your body should be - the default command to re-center your view is F12.","Feb 2, 2018 at 8:37 AM",4, 1,
2022-05-28 12:46:40.481139,Mr_Krinklez,"Amazing game, if you learn the controls.","Mouse and keyboard is tough since you can't look at the keyboard, but xbox controller/gamepad works fine, as does a HOTAS (throttle and joystick, most ideal). No one on the Oculus store mentions the xbox controller, but it is a well-known fact that it works great for this game.","Dec 27, 2017 at 4:00 AM",5, 6,
2022-05-28 12:46:40.500088,fate_wulluf,Haven't even been able to get in game.,"For whatever reason, the game makes my display settings go haywire when launching in desktop mode.

It changes my monitor setup so the monitor to the left of my main monitor is only accessable if I move the cursor down like I have them stacked vertically, no changing them back does not stick. It boots my HMD even though it's supposed to be in desktop mode, runs windowed, and when put in full screen goes to a black screen with glitching audio.

I've never seen such an abomination upon install of a game.","Mar 3, 2018 at 5:06 AM",2, 1,
2022-05-28 12:46:40.519037,XtremeHardcoreGamer,You want a long VR game?,"Then this is the one to get. It is also very detailed and immersive. You are in friggin' outer space, don't be so jaded hard to impress guy.","Jan 20, 2018 at 11:52 AM",5, 5,
2022-05-28 12:46:40.537986,Spiritof66,,"This is a must have VR game. Ive been with it since the start but needed to install the oculus version  so I could use VLC in dash while playing. Dont be disapointed if the touch controlers dont work so well in game.If you can afford a rift you can afford a joystick, prefereably a HOTAS type . This game rewards you for what you put into it .At first it can seem a bit daunting, with all the commands etc, but give it time. It all becomes second nature. Graphics are great gameplay is great I highly recomend it","Jan 8, 2018 at 10:25 AM",5, 7,
2022-05-28 12:46:40.557933,meuliano,,"Very difficult to use from the oculus store so far. The user interface simply doesn't seem to be VR compatible in my opinion and the only way I can get the audio out of my headset is to set it as default in windows. Im sure its a fabulous game, but I am just not able to start it. The only way I can login is by disabling my firewalls to allow the game to launch from its host network.","Feb 19, 2018 at 8:48 PM",2, 2,
2022-05-28 12:46:43.668240,heretowatch,Simply the best VR experience...,"...if you know what you're getting into. This is a space sim. There isn't a really deep story line (although there is plenty of lore coming out of the 1984 Elite series), but what you choose to do in the game is entirely up to you. This is a sandbox: the devs gave you an entire galaxy, some awesome ships, and really fun gameplay mechanics, and it's up to you to decide what to do with all of it.","Jan 5, 2018 at 3:55 PM",5, 2,
2022-05-28 12:46:43.690181,gridcaster,"Great VR experience, mediocre game","Great VR experience...maybe the most beautiful for me yet.  It is incredible how real and responsive the VR feels in the cockpit of these ships.  Totally worth experiencing.

As a game itself, it is mediocre.  Once the luster of the VR experience wore off I found the game to be a total grind and hardly an mmo at all.  I essentially became a virtual space trucker, which was cool for many many hours...but ultimately became entirely repititive as I found myself locked into a grind without much purpose to it.  If I was going to really get into this game I think I would need to do it out of VR so that I could easily tab out and watch things in other windows.

I still keep this game installed to show off VR to my friends.","Nov 12, 2017 at 10:58 AM",4, 21,
2022-05-28 12:46:43.708133,patmason,,Best VR game to date.,"Feb 11, 2018 at 8:42 AM",5, 4,
2022-05-28 12:46:43.728080,greg_the_raze,,game play is very good but when you're jumping 90% trying to look for one mission for about an hour or two just to fill your tank of gas it gets a bit annoying and repetitive,"Feb 9, 2018 at 3:47 AM",3, 3,
2022-05-28 12:46:43.746032,kpbendi,Version 2.4.09 does not start anymore,"Game updated itself to 2.4.09 and now it hangs up at start.
Even have to use taskmanager to close it.
Uninstall-install did not solve the issue. Do not buy this game or at least not from oculus store, because you'll never now when will an update make it useless.","Jan 1, 2018 at 9:19 PM",1, 10,
2022-05-28 12:46:46.846323,Orbifold,Unplayable,"Unplayable with keyboard and mouse. One of the worst experiences I've had in VR.  Horrendous user experience. I get to look at a headless figure sitting elevated in the middle of my room nowhere near my computer, while I'm between its legs and a floating console flicks on and off right in front of my eyes. I had to look at the settings to find out which keys are supposed to perform what functions. If I hold my head back far enough, a couple of keys work to increase and decrease the throttle, that's all I can do. If I'm not careful, I wind up accidentally navigating some menu way off to the left with unreadable text. Is this supposed to be a game, or a pre-alpha tech demo? Even registration is a terrible, difficult experience. Maybe controls work better on a gamepad? Still wouldn't be able to sit in front of my computer and play it. 

Also, it should *really* support Touch controllers. 

No wonder this thing is on deep sale - you get what you pay for.","Jan 31, 2018 at 1:33 PM",1, 6,
2022-05-28 12:46:46.865272,CrimsonCatalyst,Space Sim's in VR are a given,"This game is without exception, better in VR. Flying around, with full movement of head makes it so much better. That said. The dev team couldnt figure out how to impliment touch controls properly. Flight controls are understandably delegated to an xbox controller like, configuration. I feel like that was the right choice. But when it comes to menus. It doesnt take long to find many games out there that have done it better. You should only need to reach out to touch a button to access the mission log, or start a way point path. Instead you are moving around menus by pressing buttons. Not all together bad. I was okay with it until I found that the Galaxy menu, had not been configured properly. Some buttons were double bound, causing an inability to use the whole menu. Aside from looking around in space. Which is indeed beautiful by the way. And the issue is easy to fix. And if you find it difficult, there are forums online that have many posts with fixes. That aside. I find that I am shelving this game for a month while I wait for a HOTAS controller. As it is without a doubt the best way to play. If you are on the fence, check out the community. There is a friendly group or 5 on the forums and in game youll see them around. Careful not to shoot anyone close to a station. ;)","Dec 10, 2017 at 2:57 AM",4, 5,
2022-05-28 12:46:46.885218,term_vr,HORRIBLE.,"GARBAGE.

I'm shocked this game is getting anything more than 1 star.  My game will not launch in VR mode.  It ONLY launches in desktop mode, where all the controls are keyboard controls, and I have to be STANDING to play?

Was this QA'd at all? I want my money back.","Mar 19, 2018 at 8:06 AM",1, 2,
2022-05-28 12:46:46.903171,Keritar,Best VR game but ...,"you have to be willing to spend a lot of time in setting up. You will need Voice Attack because Keyboard is just not enough. A HOTAS would be nice too and setting up all the controlls can be tireing. BUT once you are set up dive into a vast galaxy that grows through continued developement. Sure sometimes it might be grinding to progress but there are so many ways to do so, that you'll not get bored easily.
So please don't let yourself get demotivated in the first hour because it maybe doesn't work the way you want. Set it up right and it will be worth every cent and more.","Dec 25, 2017 at 3:37 AM",5, 9,
2022-05-28 12:46:46.923117,photonsid,Very good!!!,"A very good VR game (can be played in desktop mode too). Yes, it is a complicated, yes it will take time to learn and yes you will get frustrated many times. Do the training missions and it will teach you basics and you are good to go. Rest is like any other complex game, you will have to figure out by trial and error or online guides. It does come with a long manual if you want to read it. Game pad (like xBox controller) is a must! I did not have to change controller key binds at all. It was key bound perfectly. I started playing in VR but then went to desktop mode to learn a few things. Once I got the hang of it I went back to VR mode and having a LOTs of fun. Play it in whichever mode you like, it is a great game. Got it during winter sale and I have already put in 60+ hours. Oh and buy a docking computer! It will make things much faster but make sure you do that after you learn manual docking, otherwise you will be in trouble if you don’t know how to manually dock and your docking computer is damaged and not working. Highly recommend this game to anyone who likes futuristic space based combat/trading simulator. 
In a way, it is similar to eve online but in the pilot seat not a top down view and solo mode if you don’t want to pvp. Also, if your ship gets destroyed then it is gone for good so pick your fights wisely! Insurance dose cover most of the cost but it is not a free respawn like other games if you die. 
If all this is too Elite and dangerous for you then you should stick to world of Warcraft and candy crush! ;)","Jan 3, 2018 at 2:52 PM",5, 4,
2022-05-28 12:46:49.995967,tox1309,a good reason to buy VR,"played  Elite Dangerious since launch , use HOTAS joystick and throttle + voice attack 
By far the best game experiance in VR","Feb 1, 2018 at 2:28 AM",5, 6,
2022-05-28 12:46:50.015914,gaguilar,Best ever space sim ever created,"The simulator is great. Something I loved from the old versions is the hability to dock on planets. Now not only have this but also a ranger to go through the planet and mine. Not to say about the incredible VR system that makes it awesome. Touch is not available unfortunately but the rest is so great that I don't miss it. 

Play during hour without pause. And buy great ships, grow your fame or discover new world. You can loose your live inside. ;-)","Jan 5, 2018 at 7:57 AM",5, 1,
2022-05-28 12:46:50.043841,Enda,Incredible,"I have played this game for many more hours than I care to mention. It is by far one the best experiences you can have in VR.  It is hard to master but very, very rewarding.","Jan 1, 2018 at 12:57 AM",5, 4,
2022-05-28 12:46:50.063786,Apollo2012,This is definitely not native support,"And because of that I want nothing to do with it.  Buggy, glitchy, awful controller 
 setup, and ZERO native support with oculus + touch.  When I play a VR game...  i expect to be able to download the game... jump in... and go (native support).  This is nothing of the sorts.  Thanks but no thanks!","Feb 7, 2018 at 3:16 PM",1, 4,
2022-05-28 12:46:50.082735,MattMcGyver,Just wow.,"This game is the bees knees in VR. There's nothing like it. I find myself just floating through space or skimming planet surfaces, admiring the experience of it all. It feels as close to what I can imagine piloting a personal space craft could be. No Pay-to-Win so thats really great too. You know whoever you encounter has worked for what they've got. One piece of advice: Don't crash into anything too fast. You'll go spinning out of control and want to throw up on yourself.

Goodluck out there, Pilots!

Edit: For anyone having trouble initially getting in, just keep trying. I had to send myself like 6-8 verification emails before the game finally accepted one and let me log in. Also, be sure to click the ""Save Password"" option when you log in the first time or it will be annoying to remember to put it in every single time you open the game.","Dec 22, 2017 at 8:57 AM",5, 5,
2022-05-28 12:46:53.183030,icehawk55,Interface is horrible,I've spent the last 20 minutes just trying to get the game to work with the Oculus and controllers. This game interface SUCKS!! I'm walking away before I throw the controllers through the screen in absolute frustration.,"Dec 25, 2017 at 7:28 AM",2, 7,
2022-05-28 12:46:53.201980,Formation214,Brilliant fun in VR,"In all sincerity, this game has been on my personal watchlist for years now since its initial release. Constantly debating with myself whether to buy it and being turned back by negative reviews. Finally found the special edition on sale for a solid price and just went all in. To say the least, its awesome. The Scale, the adventure and the clean futuristic HUD just all works smoothly. The sounds are incredibly well designed. BUT BEFORE YOU BUY: Get a HOTAS. do not play this with a keyboard. Keep in mind, what those negative reviews say are true, but you will not find an experience like this anywhere else on the VR market.","Dec 21, 2017 at 9:26 PM",5, 6,
2022-05-28 12:46:53.220929,MartinezSK,UNBELIEVABLE,To pay for this game was the stupidiest idea I ever had.,"Feb 9, 2018 at 2:07 AM",1, 3,
2022-05-28 12:46:53.239878,KidGold,a complete technical mess,"constant freezes, audio only works sometimes, i'm hardly ever positioned where I should be to fly the ship (sometimes my body is outside the ship while its flying), occasional crashes.

this game is unplayable. i've never had any of these issues with another vr experience, this is just garbage.","Jan 30, 2018 at 4:17 PM",1, 3,
2022-05-28 12:46:53.258828,MindofDave,,"Played the game many different ways; keyboard mouse, controller, and joystick with HOTAS.  Oculus and Joysticks just throws you beyond game play. It is insane!","Dec 18, 2017 at 5:18 AM",5, 6,
2022-05-28 12:46:56.359596,Dalryth,You Have To Use Keyboard And Mouse..,Or a controller..,"Mar 5, 2018 at 2:32 PM",1, 8,
