scrapping_date,review_author,review_title,one_reviews_text,review_date,review_rating,review_helpful,review_feedback
2022-05-28 12:44:15.044138,AdapaZiusudra,Terrible Trouble on startup with login,"I played on Oculus Quest 2 and i cant start up this game. When i open it, i see only login screen with my mail and verification code. When i wrote code from mail from your store-company, login screen see the text ""not purchased"". what? i buy it form oculus store and i cant play!!! I tryy login one month, its terrible. Contact me pls for helping this trouble. thanks",20 days ago,1, 5,
2022-05-28 12:44:15.059098,spawn0again,Superb Game All Round,"Ive loved this game since the day i put the headset on and flew out into space. anyone having issues with the latest update stuck and not installing, go to your library on your oculus app, click the three ... dots under the apps picture and click resume update. worked for me hopefully work and help others. Peace!",Feb 12 at 11:01 PM,5, 19,
2022-05-28 12:44:15.074058,Yenah Atsuma ,Can't play it! don't buy!,"When you buy it, it forces you to log in through the Frontier website, then when you sign in it says game not purchased/redeemed. you can play but purchase through steam or frontier site not through the oculus store it doesn't verify the oculus purchase. instead of launching it from the oculus desktop app, it force loads up from the Frontier launcher and since i didn't buy it on frontier it says i can't play cause the game isn't purchased.",May 2 at 10:32 AM,1, 1,
2022-05-28 12:44:15.088020,SolidJupiter283,Update to .9.02 completely broken,"Yes, update is hung and won't install - can't pause or cancel; have been running ED in Oculus Rift for years but completely broken now for update.  Cannot launch the game or continue the update.  Betweem Frontier (Elite Dangerous) and Oculus this appears to be an Oculus problem, see the Oculus forums.",Dec 25 at 4:53 AM,1, 18,
2022-05-28 12:44:15.102981,ZacMoney,Unplayable.,"First you have to get lucky for the download to even work. Then you have to jump through hoop after hoop in order to play the game. After an hour of screwing around, giving my billing address and signing up for stuff i still cant play. All because the key they gave me to enter on there website for ""game activation "" isnt vaild. No idea how to fix it and no results online. Dont waste your time trust me.",Mar 31 at 7:13 AM,1, 9,
2022-05-28 12:44:18.236239,ezbleezy,Can't even install...,"Do not waste money on oculus, purchase through steam or something else. You can't even install the game. Download just keeps stopping.",Dec 15 at 10:59 AM,1, 37,
2022-05-28 12:44:18.250202,TheWinter_W0lf,Installed from Oculus store,"So, I bought it from Oculus store. Did all the things to set up the launcher, and now it's making me buy it a second time when I try to login to the launcher?! If anyone can help me please let me know.",A day ago,1, 0,
2022-05-28 12:44:18.265162,sukithc,update issue,cant UPDATE,Mar 31 at 2:03 AM,1, 1,
2022-05-28 12:44:18.279124,roxyjungle,Stuck,"Can't install update  since months. What happening ???
It was one of my favourite , but I can't play novadayz . It's sad an frustrating.",Dec 27 at 8:28 PM,1, 5,
2022-05-28 12:44:18.295082,WarriorKamuix,Game changer,"Was burnt out after 2k hours. Being able to see while looking right left, up down completely changes everything. Everything in the game looks so much better visually. Theres nothing like standing up for the first time and looking around a ship.",Jan 9 at 2:49 PM,5, 4,
2022-05-28 12:44:21.398922,Redron357,Quest 2 from Rift,"I purchase your app for my Rift, works great.  I replaced my Rift with a new Quest 2. it is mental to think someone is going to repurchase your app for a newer hardware, but same system (Facebook). I refuse to purchase it again due to newer version of the quest 2 I have. I would like my purchase moved to my lol same Facebook account under my quest 2. BTW I had to replace my rift due to Oculus not supporting the purchase of new Headset cables.",Sep 6 at 5:54 AM,1, 55,
2022-05-28 12:44:21.415878,Joeldt,Great in VR BUT 1 major bug ruins it,"The game is great and I could play in VR for hours on end. But the game sometimes freezes if just for a moment causing sound to cut out and not come back. It requires you to shut the game and the oculus app all the way down and relaunch. Its frustrating when it happens once. But expect to do this 4 to 5 times before you get a launch that doesn't produce the glitch. I have reported this many times. But Frontier and Oculus aren't fixing the issue and I don't expect them to. It is amazing when it works and I love it. But this issue is so frustrating I am not only gaming back on my monitors, but looking at other brands of VR to replace my Oculus. Perhaps I will have better luck with the HTC.",Aug 7 at 12:12 PM,3, 5,
2022-05-28 12:44:21.430837,nez.armstrong,Exceptional,For those saying Odyssey isnt available on Oculus: How have you got through life so far with no problem solving solving skills?! Odyssey can be purchased from the Frontier store then it becomes available to install on your game launcher. The most amazing game in the history of.. games. Been an Elite player in various formats since 1984 and Elite Dangerous is a masterpiece. It has a very steep learning curve and is unforgiving at first but persevere and you will be rewarded.,"May 20, 2021 at 3:25 PM",5, 70,
2022-05-28 12:44:21.447792,MJ1942,A nightmare to login,"A true nightmare to login despite following up all their support link articles regarding the login issue. It says I need to purchase the game even though the key is already in my frontier account. I wanted to open a support ticket, but they need me to write my lifetime story in it (too many data to be filled, can't be bothered).",Aug 28 at 5:53 AM,1, 5,
2022-05-28 12:44:21.462752,SpudHead,Best VR experience ever.,"i just passed 800 hours of game play. what else can i say?

Update: Just passed 1500 hours. Truely the best gaming experience of my life.

2nd Update: well over 5000 hours, still going strong!","May 29, 2021 at 8:22 PM",5, 57,
2022-05-28 12:44:24.534774,Selwinson,Elite dangerous vr,"elite dangerous is the best spacesim for vr to my knowledge
the free dlc horizons expanded on that even futher.
with odyssey however vr is not suported as such yet, frontier wants to ensure the same quality to vr as in horizons and the basegame, they have not forgotten it and probably will add it in a later update when they have more faith in a good experience.
for those of you wondering how to solve the oculus touch limitations i point towards Voice attack, go look it up on google and be amazed why you didn`t know about that also l;ook  for hcs voicepacks that realy add a new experience to elite dangerous especialy when using vr","May 22, 2021 at 12:39 AM",5, 23,
2022-05-28 12:44:24.548737,Bird_Sage,Imposible To Set Up,I have tried for two days now to set this game up and it just doesn't work. I have done the verifying and registering and when i load the game up again in vr boom same black screen! Please fix this because at this point i ether want this fixed soon or my money back.,Jul 8 at 5:48 AM,1, 19,
2022-05-28 12:44:24.564694,bigmike20vt,beware buying this,"its a good game but the next DLC wont be supporting VR putting the oculus version at a dead end development wise :(
i would say wait for a sale and buy... but on steam that way you have options to get expansion albeit not in VR.  It goes without saying most VR players have expressed their annoyance to FD.","May 16, 2021 at 3:24 PM",3, 34,
2022-05-28 12:44:24.579654,gjenck,"Horizon +++ , Odyssey ---, at least VR","Iplay Elite since couple of years and one of the best sim ever.
The real(ness) is awesome, and i jumped and bought the oddysey in preorder to support the devs for keeping this awesome sim updated , But fortunately it comes a huge dissapointment for me , as im a VR Only player it was a huge drawback to release odyssey in 2D :)) :(
Not to mention the lots of bugs which before was good without them , and the biggest issue is the huge stutters close to surface :(( it is awfull
Unplayable at all , even with 2000,3000 series gtx cant handle so dont tell me frontier to reduce graphics or upgrade gpu as horizon with a gtx 1070 on ultra in vr it was flowing smooth everywhere even in big battles , so you should do something abaout as it looks that it is some bug affecting that huge stutter.

About the game update from oculus client is a pain in the @ss , 3 days i just installing installing , again over and over , neverending story never got to finishing its bugged the whole update process, not to talk about that its hardly with tricky to start the update from frontier launcher as its just has the option to close launcher , so i still hope that frontier will soon release VR support for odyssey and sorting out the bugs , specially the stutters.
Dont kill my faith in you FRONTIER 
just think about how mindblowing was in 1984  and keep up that mentality and dont loose that in this new modern era.","May 28, 2021 at 4:23 AM",5, 5,
2022-05-28 12:44:24.593616,Knobul8r,Surely you can do better devs!,"This is certainly the most difficult game I have ever encountered to actually get running.

Seriously people, a game should just run without  complicated instructions.... Take your headest off,  check this box, close the window, start it again, whoops! it just looping around again through the same process. WTF!  Its should just work!",Jul 16 at 7:10 PM,1, 7,
2022-05-28 12:44:27.696385,Przemo-c,Odyssey has no VR support,"With Odyssey expansion we're faced with flat projection when on foot. This is unacceptable ""VR"" Implementation.","May 21, 2021 at 3:41 PM",2, 6,
2022-05-28 12:44:27.711346,Skull0ne,Switch to steam,"As we can't buy Odyssee on Oculus, you can go on your account on Frontier and ask for a third party key for steam, and reinstall the game for free on steam","Mar 17, 2021 at 10:10 PM",3, 27,
2022-05-28 12:44:27.727302,Dex_08,Game didnt work,couldnt get to work after buying:(,Jul 9 at 7:07 AM,1, 3,
2022-05-28 12:44:27.743260,DrangPo,Where is Odyssey?,"Great game, it is true that just using the oculus touch controller's makes the game very hard to play, but I bought a ThrustMaster TFlight Hotas X and that made all the difference.   I really enjoy the Horizons update.   But now if I want to play this new 2021 update I have to buy the game all over again from steam.   I mean come on now....","Jan 13, 2021 at 4:48 AM",4, 73,
2022-05-28 12:44:27.758220,ryan.carey.7773,DO NOT BUY THIS GAME!!!!,"Before you can even play this game you have to jump through a series of frustraiting hoops by registering the game that you paid for,  and after registering it, it either says you still have to register it or it crashes. I've spent over a hour trying to get this game to play with no success. If it is the frustraiting to even start the game I can't imagine how frustraiting the rest of the game experience will be\. I want a refund and I'm never buying any thing from the game developers again. Here's a tip, if you want people to buy your games, then don't make the experience of just starting the game aggravating","Mar 3, 2021 at 8:14 AM",1, 18,
2022-05-28 12:44:30.831613,bigmike2020,Bias towards VR players,"I use oculus quest link and rift s. The oculus touch controllers has bare minimum options. Example: Open Galaxy Map. Theres no way to type the system names in VR or enter the route navigation on galaxy map and system map.  This is fustrating and ridiculous. There should be a virtual keyboard, pointer, and kiosk touchscreen. i rather use my virtual reality hands to interact with the game. i will not make any further purchases to odyssey unless devs fix this issues. we are customers and deserve better gaming structures for the prices you charge us for this game","Dec 26, 2020 at 11:15 AM",1, 104,
2022-05-28 12:44:30.846572,oreallyous,dosent work anymore!,dosent let me acesss a game i bought...!,"Apr 13, 2021 at 2:47 PM",1, 2,
2022-05-28 12:44:30.862530,DoG_Duggy,Fantastic Space Sim,Elite Dangerous is by far the best space sim i have played. In VR it takes the game to another level of immersion. It really feels like your inside the cockpit of a ship/srv and is the most fun ive had in VR. There is a steep learning curve to the game but if you persevere with it you will be rewarded.,"Feb 13, 2021 at 3:35 PM",5, 9,
2022-05-28 12:44:30.877490,cookwer,Cannot play,"Why this is so complicated? I purchased the game, I downloaded the game, now when I open the game it is saying I need to log in in desktop launcher. then I started to google where is this desktop launcher and totally no info! How I can play this game???

On the frontier store the login does not work at all, I tried to reset my password, but that don't want to let me login. so bad","Dec 8, 2020 at 2:51 AM",1, 85,
2022-05-28 12:44:30.892450,chuckyx113,Unable to Register,After purchasing the game and registering with their wesite and linking my new account i have found myself in a never ending loop of register and link. I have yet been able to accually launch the game.,"Apr 22, 2021 at 11:57 PM",1, 1,
2022-05-28 12:44:33.988803,pierredavidbelanger,Infinite register/login loop,"I am stuck in an infinite loop of browser registering page, close the windows, start the launcher, pop the browser login page, close the windows, start the launcher, pop the browser login page. I will try to ask a refund and buy from steam.","Jan 19, 2021 at 9:56 AM",1, 24,
2022-05-28 12:44:34.003763,Bell_GodOfChaos,cant log in,"everytime i press link account it says all that stuff, like go back to the store area and start the game which just brings me back to logging in the website only for it to do it again when i enter the info","Mar 14, 2021 at 10:57 PM",1, 4,
2022-05-28 12:44:34.018723,yasunaz,"Can't even play the game, I want refund","Total garbage, DO NOT BUY. I can't even play this game. It tells you to login from browser, which I did, it just a loop of that.  NO WAY, Devs done some shameful job.  Get a new developers!","Jan 12, 2021 at 12:32 PM",1, 21,
2022-05-28 12:44:34.035186,SgtRespawn,Does Not Launch,"Purchased for Occulus Rift. Game Continuously opens a web window for Occulus registration even after it's registered. Very Frustrating, customer support is useless. uninstalling.","Feb 13, 2021 at 1:31 PM",1, 8,
2022-05-28 12:44:34.050146,Bone1462,please fix the login problem,I bought the game on the oculas store made an acount and did excactly what the thing told me to do but won't let me play. please fix,"Feb 8, 2021 at 3:30 AM",1, 5,
2022-05-28 12:44:37.158430,Flyingsailor,Registering seems broken on Oculus,"Registering Elite Dangerous seems broken in the Oculus Store and goes into an endless loop. Also if you are signed in on the Frontier website it doesn't work.

Please fix!","Jan 24, 2021 at 7:07 PM",1, 9,
2022-05-28 12:44:37.173390,kinChelo3,Won't Install - Oculus wont respond,"I have over a TB of free space, 600 mbps download speeds (steady), it's the only game that won't install.  Getting my money back.  Plus to my benefit... this game is only $7.49 on Steam... it installed fine there.

UPDATE: Got it to install finally but had to use a VPN??  WTH Oculus!?  Now the game won't load... send me in an endless loop of asking me to register.  Oculus has not responded me on this and it's impossible to speak to anyone at Frontier.  DON'T WASTE YOUR MONEY AND TIME.  Buy this on Steam!

Stop giving Facebook your money. But games on steam","Jan 7, 2021 at 9:59 PM",1, 10,
2022-05-28 12:44:37.188350,Resylt,Can't log into the flipping thing,"Every single time I start up the app, it tells me to register an account. I do that, close it, try to start the app again, and it tells me to register again. I think I've registered about 10 times now. 

Thanks for the virtual paperweight and waste of money.","Dec 18, 2020 at 10:14 AM",1, 32,
2022-05-28 12:44:37.203310,RISE-slight,id giveno stars if i could cannot log in,stupid  log in loop preventing me from playing the game,"Apr 1, 2021 at 12:25 PM",1, 4,
2022-05-28 12:44:37.219267,roy.viar,Broken,Game is stuck in an endless registration loop. fix this.,"Feb 3, 2021 at 11:27 AM",1, 7,
2022-05-28 12:44:40.327582,Noah-Hayes,It wont let me play the game,I have made an account and i try to play the game and it needs me to log in so i do but it closes the game and i need to close the browser to reopen the game and i have to do the same thing,"Jan 18, 2021 at 6:44 AM",1, 11,
2022-05-28 12:44:40.342542,Friday51,Good Luck Getting it to work,Their are so many steps to do when setting up an account to play this game and it would be worth the time IF you can make an account. The login system is broken for frontier and support appears to not care and the oculus support is no better at solving that problem. Thus making this game unplayable and just a waist of time and money.,"Dec 19, 2020 at 8:54 AM",1, 15,
2022-05-28 12:44:40.357502,DravenRayne,Amazing game that keeps getting better,Elite dangerous is awesome while it's a VR port of an existing game it's done well and keeps getting better with updates.  It one of the few games in VR that you can pour hours into. Plus they have a big content patch scheduled for 2021.,"Dec 5, 2020 at 2:10 AM",5, 9,
2022-05-28 12:44:40.372462,gerranscub,unable to get this to work,"Have downloaded, linked my account, and now caught in an never ending cycle. Every time I launch the game I am asked to link the account. Have now purchased this game from Oculus, Stream and direct from Frontier, nothing is working. Very disappointed.","Jan 1, 2021 at 2:35 AM",1, 13,
2022-05-28 12:44:40.388420,q8qmail,Beautiful & powerful game but !!!,"Elite Dandoures is a very beautiful game, you can forget your self there, but it's design to be played with keyboard and mouse, or with HOTAS (hands on throttle-and-stick) so you can't play it with oculus touch controller especially when you are using the galaxy Map.","Aug 23, 2020 at 11:48 AM",5, 62,
2022-05-28 12:44:43.474797,Madcap22,Absolutely the best,"The is no more to add. I have played several and this one tops the lot, always has done ever since it came out on the BBC MICRO .","Oct 21, 2020 at 2:13 AM",5, 9,
2022-05-28 12:44:43.490755,Summer_17,Good graphics and feel but too in-depth,"Addendum, just come to play this game and found I have been locked out of it, was this for only giving them 3 stars, !!! I paid for the thing in the first place and now seemingly lost my money... Scammers! Now they get one star! Played for several hours in total. For me - I have just lost interest really. Too much real life outside of this sim, for me to really give it the time it needs. You really do have to invest alot of time learning the controls and way the game works. Why couldn't the (continual) space travel be simpler?? Soe newer games like Discovering Space 2, are way simpler to control in the cockpit and just as engaging.  After all, all you need is to get from A to B, pick some stuff up and blow up other ships...! I'm frustrated  as I expected this to be more fun. But its basiclaly a huge spacecraft sim. There is so much learning to do, don't expect to enjoy it for the first week or so..at least.  That's if you have all that spare time - and can bare a VR headset for many hours, just learning stuff. I give it three stars as its a huge piece of gaming work. For for pure enjoyable gameplay .. naaa.","Sep 27, 2020 at 8:02 PM",1, 15,
2022-05-28 12:44:43.506712,R8DX,Good game - Could be great...,"I've played Elite: Dangerous since beta.  I've been here through all of the broken updates, the nerfs and more nerfs.  Frontier has had a huge opportunity on their hands and without at minimum, player trading, this game is going to stay low population.  You can rather quickly reach a point, where you have nothing to do.  

That being said, flight model feels good, but again, it's just missing a lot of elements to really feel like a full game, it feels very single player in it's current state (and previous 6 years).","Nov 5, 2020 at 2:22 AM",3, 1,
2022-05-28 12:44:43.521672,redman18752,ONE WORD......GREAT,ONE OF THE BEST UNSTOPABLE VR ACTION. LAID BACK IN SPACE...;,"Oct 2, 2020 at 5:12 AM",5, 2,
2022-05-28 12:44:43.537629,Arwkin,"IMHO, the best space flight game for VR","I've been playing Elite Dangerous since the first year it was released.  I've played it in VR on and off over the past 18 months.  (My total game time is over 2000 hours.)  I'm only going to review my VR experience, but I need to at least add that Elite Dangerous is not for everyone.  Even with the tutorials and ""newbie"" area, anticipate at least 25-50 hours of game play before ""getting into the groove.""   If you're still interested after hearing this, you may have ""the right stuff.""  

The official VR rating is ""intense"" but the only ""intense"" play I've encountered was during a very rough drive in my SRV one day.  A few VR options exist to reduce this kind of ""intensity.""  I now have those options enabled (!) and I haven't had a problem again.

I don't recommend trying to play this game with VR controllers. There are just too many controls. I suppose if you are very determined to use them, then install VoiceAttack which adds voice-activated commands and macros.   The best experience (IMHO) is to play using a HOTAS (e.g. ThrustMaster 16000M + TWCS Throttle) and use VoiceAttack.

The most clunky VR implementation (again IMHO) is with the galaxy and system maps. Maybe I'm more used to using my mouse when I'm not using VR, but navigating around the maps in VR feels cumbersome.

Final thoughts: Frontier recently announced their Odyssey expansion (release ETA is early 2021).  At this time it has been said VR will not initially be supported for it.   There are more details Frontier needs to reveal, but it can be safely assumed they aren't removing VR completely from the game. (that would be silly)  All we know at this time is that Odyssey is going to add first person shooter gameplay. (Honestly, at this time it isn't confirmed what else it adds.)   I personally will never attempt (again) to play a FPS combat game in VR.  I tried once and felt sick for several hours.  (I'm not talking about something like Robo Recall -- that's a lot of fun with no dizziness.)","Jun 11, 2020 at 12:38 AM",4, 26,
2022-05-28 12:44:46.617007,dmcelhenny,I love this game! VR makes this better!,There are a few complaints about the newest DLC not supporting VR at launch.  Don't let that distract you from what this game brings to VR.  The flight portion of this games is a must in VR.  The first person shooter aspect is not in VR but that doesn't mean that they won't bring that to the table at some point.  I would recommend this game to anyone who loves space and would like to explore it in VR.  There is plenty to do in the base game and the horizons DLC.  Let's cross our fingers about the first person shooter dlc support for VR.,"Jun 6, 2020 at 7:08 AM",5, 26,
2022-05-28 12:44:46.632964,Eyoldaith,Very immersive,"+ The game looks amazing in VR and is highly immersive. Makes up 90-95% of my total VR playtime.
- Might as well be renamed to space grinding simulator.
+- Only sitting VR.

VR comfort:
While in space, the game is pretty mild since there isn't really much of a background, but when driving on the ground in an SRV it gets pretty intense.

Other notes: Would recommend running it with a dual joystick setup.
Odyssey will not have VR support while on foot when it's released, but is supposedly not removing VR support from current content. Would assume VR will still work as long as you select Horizons in the launcher.","Jun 17, 2020 at 10:27 PM",4, 9,
2022-05-28 12:44:46.647924,Einkoro,Odyssey update drops VR support,"Previously the one and only reason for VR for me. And dropping at least a grand on VKB gear with no regrets until now.

With the announcement of Odyssey aka space legs dropping VR support I can no longer recommend Elite Dangerous or ever go back to playing in pancake mode. As a lifetime pass holder I can't think of any other game that has left me feeling so burnt from a purchase.","Jun 5, 2020 at 8:02 AM",1, 36,
2022-05-28 12:44:46.663881,JackDiddley,Outer Space Sandbox,"I had this game in my library for a year before I really started playing it.
It is complicated to get the hang of, it is huge and deep, and a lot of fun.  I play it with an Xbox controller, and it works really well.

You'll hear a lot about an upcoming DLC that won't have VR support (at first) but this game has been around 5 years on flat screen without that DLC, since I'm new to this game I don't care about the DLC.  I have enough FPS games in VR but this is the only free traveling outter space game I have so I'll be playing this one for a while.

Not easy to learn but totally worth it!","Jun 18, 2020 at 5:16 AM",4, 3,
2022-05-28 12:44:46.678841,triborg1024,best game on oculus but...,"this is by far the best game ever on oculus the way the sun works, the graphics, the shaders, the small details, everthing is amazing but there is one thing that ruins it all how you cant enable anything in the galaxy map menu that means you can activate fastest routs fsd boost or jet cone warp which really is a huge problem please let us enable stuff","Jul 1, 2020 at 4:01 AM",3, 3,
