scrapping_date,review_author,review_title,one_reviews_text,review_date,review_rating,review_helpful,review_feedback
2022-05-28 12:37:56.023520,zetswei,It looks good,"Not a huge fan of this game since it doesn't seem to size you correctly into your player space. When playing I show that I'm behind the body of the racer, and he has no head and it's kind of frustrating. Other than that it seems like a decent game outside VR. If I could refund it I would","Sep 13, 2017 at 3:04 PM",3, 3,
2022-05-28 12:37:56.040475,GV_Jamie,Awesome,Its awesome! Works great with VR and xbox controller. Gokarting is super fun. You can also just run the exe in the game folder if you don't want to use the vr headset.,"Sep 13, 2017 at 12:04 PM",5, 2,
2022-05-28 12:37:56.056432,Marcoaster,a lie,it is a waste of money. DONT MAKE THE SAME MISTAKE I DID. graphycs are awfull and cars are uncontrolable,"Sep 23, 2017 at 11:57 PM",1, 3,
2022-05-28 12:37:56.072390,Temkins,not for xbox/touch controllers,Don't buy if you have no steering wheel and other racing controllers - waste of money,"Sep 10, 2017 at 8:55 AM",1, 3,
2022-05-28 12:37:56.089344,danish1234567890,so bad,uncontrollable cars and unusable vehicle views,"Sep 23, 2017 at 3:26 PM",1, 3,
2022-05-28 12:37:59.171198,user045,VR Sickness,Racing games make me feel sick in VR compared with other games. You might be ok but worth checking first before expensive purchase.,"Sep 7, 2017 at 5:19 AM",1, 1,
2022-05-28 12:37:59.188153,antonin.lavigne,good game no multiplayer,"Since the steam and oculus version can't crossplay, you're essentially buying a solo game here","Sep 8, 2017 at 12:58 PM",3, 3,
2022-05-28 12:37:59.204110,Aboomah,,"Wow! On my high end PC, the graphics, speed, sound, everything is totally awesome.","Sep 7, 2017 at 11:42 PM",5, 1,
2022-05-28 12:37:59.220067,Khufu,Oculus home version has no multiplayer,"This game is all about multiplayer and the oculus home version seems to have completely disabled all multiplayer support.  Cant connect to any lobbies and there isn't even a leaderboard.  most of this game is broken, buy the steam version.","Jun 7, 2017 at 2:19 PM",1, 10,
2022-05-28 12:37:59.237022,niknak6000,Runs fine on my 1070,"Once I upgraded my graphics card this game came alive. It's very absorbing and you become completely engaged in the race, it's the most immersive VR I have played yet. I would give it 5 stars but the menu system is not as smooth as it could be.","Jul 1, 2017 at 4:06 PM",4, 3,
2022-05-28 12:38:02.361264,Cavediver,Terrible.,"1070 graphics card and an i7 processor... great Logitech wheel, but the menu interface is horrendous.  Also, fun glitch here, more than half the time the car will not turn left (ie not respond to the wheel).  Oculus had the awesome suggestion to ""reinstall the game"" and ""reinstall Home"" - I'm hoping for a better solution.","Jul 2, 2017 at 9:57 AM",1, 4,
2022-05-28 12:38:02.378217,Dan-Cainenstien-1,Frankenstien Cainenstien,"Forza will work with steering wheel and F-1 racing will not work with wheel, on the same x-box. In the menue has a wide pick of steering wheels works on the computer but not with the game,( insane ), missing drivers or just bad? Try adjusting died zones in menue. I have Thurst Master steering wheel and  my computer is a over kill on this game. Hand controll oculus x-box  controller good.  I don't race in rain or nite on any game so waist of hard drive space. But I will tale you this it's in your face and to bumpy..Dirt Rally the car is bumpy not you. Started with an ad saying computer problem. Reinstall and good to go. JUST LOSS MY REAR  END CAN'T GO!!!  Try to restart and restart no gas.( to much time spending whats wronge now )=( no gas )=( press on the gas start going backwards )=( reinstall again )=( It a pain trying to find menue to set the car up.) Can be a very nice game. Formula one open wheel racing deals with racing over 230 m.p.h.. Set high braking, tire toe for sharp turns, set wings low for long straights and high for short tracks. The developer need's to do more other then passing the game on. ""This one almost for the pro's physics more work then play."" Dirt Rally is more fun physics. Don't plaim the game if your brain is not WIRED for this game.  >>>If your new to this sport , fast repeaded taps on the braking before the turns and fast repeaded taps on the gas in the turn going out of the turn- this helps trackion more controll of the racing skills needed just to keep in place. Next learn how to pass cutting into inside lane late hard braking passing turing car outside LANE without wecking. <<<. YOU DON'T BUY A PLAY STATION OR X BOX GAMSE FOR A COMPUTER. .  Vets has a nice back end bumper display for the driver seat ! hint . Not played allmost a year .  Set menue to oculus X-box hand controller and will not work with X-Box  hand controller now no gas will not turn. STAY WITHIN REFUND Policy. It's  needs to stay with play station.""  im done.""","Jan 7, 2019 at 6:53 PM",1, 4,
2022-05-28 12:38:02.394174,Capt.Catastrophe,Blown Away Awesome!!!!,"I hesatated buying this game due to the low scoring reviews that I saw and seeing it run on my friends Alienware PC (i5-6400, Nvidia GTX 970 4gb, 8gb ram).  
This game hands down is awesome!  I dont know if there have been an update or if its my PC (i5-6600k, AMD rx480 8gb, 16gb ram). All I have to say is BlOWN AWAY AWESOME! The coolest driving game I've ever played!","Jun 19, 2017 at 9:26 AM",5, 8,
2022-05-28 12:38:02.411129,hammersmut,trouble with FFB,"Everything loads great, and looks wonderful. Just having trouble with the responce of my wheel. I don't think it's a software problem though. No multiplayer BTW.","Jul 28, 2017 at 6:10 AM",4, 1,
2022-05-28 12:38:02.427086,Balazsgosi,Do not take it!,"So why do you dare to ask for money ??? It has to be stopped, the resolution is not good, the head camera does not work well, it keeps positioning somewhere else!","Jul 4, 2017 at 8:39 PM",1, 3,
2022-05-28 12:38:05.524410,Bullgear,I love it!,"Running it on an AMD 6300 six core and a GTX970, and although I'll be upgrading soon it already runs and looks great! Pitty my usb has some issues and the x-box controler stops working now and then.","Jul 7, 2017 at 4:07 AM",4, 1,
2022-05-28 12:38:05.541366,GTR886,Just play this on desktop mode.,don't waste your time playing this in VR.. it will make you sick and the graphic is just soso.... i would must rather play this in desktop mode.,"Jun 9, 2017 at 4:44 PM",1, 5,
2022-05-28 12:38:05.557322,Oculus_USN,,"Dont buy, doesnt work","Jul 19, 2017 at 10:52 PM",1, 1,
2022-05-28 12:38:05.573281,rexmundus,,i really dont know how the app went wrong for others but it is absolutly a blast its as real as it can be    i use to race methenol go carts  very realistic.. ive been climbing my way up the ranks for a few weeks now love..get yourself a g29 wheel by logitech has to be calibrated properly follow step as req. and or google your problems . because it really sucked at first for me untill i figured how to start it up properly now its best app ive got and i have about 2000.00 worth of apps stored in my oculus PC....i bought an oculus PC and nothing else but oculus is loaded,"May 10, 2017 at 11:42 PM",5, 3,
2022-05-28 12:38:05.589237,mphotog,total piece of crap!!!!! DO NOT BUY!!!!!,"Total piece of crap. it does not work with oculus. will not recognize the headseat, does not recognize the G920 wheel. The pedals are backward. Only works with gamepad. Oculus should be ashamed for adding this game to there list!!!!!!! Only gave it on star because you can't give it anything less.","Apr 9, 2017 at 3:01 AM",1, 7,
2022-05-28 12:38:08.704066,jezfvee,Ridiculous,"It wont enable me to set up headset or pedals or steering wheel, no access to options within the app !"" I downloaded the oculus version thinking (mistakenly) that this would work, it does not !! £32 down the drain, sort this out Oculus please! this is giving you a bad name ! my friends are laughing at me, and i can only keep the faith for a limited time,","Mar 24, 2017 at 3:45 AM",1, 13,
2022-05-28 12:38:08.721020,ThatThereTim,The worst VR game ever - DO NOT BUY IT!!,"Do not under any circumstances buy Project CARS VR.

It is awful, barely functional software.

The control system in VR is awful - look and hold your look at something to basically press A on it. I had an xbox controller and a G25 steeringwheel plugged in - neither of them had any input or control in the menus... so just navigating the thing is awful.

It crashes in the unskippable (yes thats right) intro video 8/10 times.

It disabled keyboard input when you run it in VR... but you have to input your name to start the career... Class A bug. Well done lads!

In the options menu it said the G25 was the default controller... finally managed to get in to a solo race (with an exhuasted neck due to looking at the back button in the top left corner to navigate through menus)... and the G25 had no input... nor did the xbox controller... nor the keyboard.

It also looked horrifically low res in game too.

It is the absolute worst of all VR games I've played. After spending 2 hours getting it working, and figuring out how to navigate the menus... 0/10. VFM: £Dont buy it.","Apr 8, 2017 at 10:19 PM",1, 12,
2022-05-28 12:38:08.737975,kbyte9001,Fun game that runs perfectly,"I have read many reviews on this game through the Oculus store, and it definately seems mixed.  I originally downloaded the Pagani free edition from Steam to test this before i bought and it worked well enough.  Once this went on sale as the full version here, I jumped on it.  I run an i7 4790, 32GB RAM, SSD, Nvidia 1070, Windows 10 and a Thrustmaster TMX forcefeedback wheel and pedals(about a 200.00 wheel).  I set the graphics level to medium overall on my first try and everything was smooth, will try to bump that up and see how it goes.  As for controller setup, I had no issue getting things configured, used the included Xbox controller to initially get through the wheel configuration, however if you are going to play with the Xbox controller, you probably shouldn't have to do any extra configuration.  As for some people stating that if you stare to long at one point, yes it will select things, it's not horrible, it's meant for those who just want the ability to look and select with the headset, that's it.  Overall this is a very immersive game (especially if you have a wheel and pedals), and it looks pretty good.  One other nice thing is watching replays in VR, gives a different perspective. As someone who has been gaming for years, it's odd to be able to look around during the replay, but in a good way.  For 26 bucks give or take, this is a really good title, just dont expect it to be an arcade racer, this is more of a serious driving game.  Hope this review helps people out!","Apr 1, 2017 at 8:37 AM",5, 11,
2022-05-28 12:38:08.754930,9tnine,DONT BUY THIS GAME,They are so lazy they dont even let you use any other controls other than look controls. even if you have a controller it wont turn off so if you are reading things or looking at something too long without pressing buttons randomly on your controller it constantly looks the wrong way. ruins the game makes it play like garbage and if you mess up the controller layout because you are trying to read what everything is set to there is no reset to defaults option. really poor choice on their part. also whereever your head is facing when the game starts is where the game centers the veiw on and if your head is turnned to the left or anything your out of luck because there is no set key to center veiw and in the process of trying to make one you will probably reset every other control while your at it because anything you look at it will click on. the most horrible controller scheme ever. whoever made this you should be ashamed for making a set up so horrible to use.... holy cow.,"Mar 30, 2017 at 6:54 PM",1, 4,
2022-05-28 12:38:08.771885,StillLong,predownload (UPDATED!)**FULL,"i also purchased thinking i could use my rift hand controllers, i hope update in future. ""currently downloading""

im that guy and eating words.. alot of them
VR takes a few times to get used 2, but projectcars makes the oculus worth turning on, driveing or ride.

*full damage most interactive i have seen"" nothing like it to really compare 2..invaluable, 50 is a gift","Sep 9, 2017 at 5:46 PM",1, 3,
2022-05-28 12:38:11.871747,0x0BADC0DE,SLI Not!,"Project Cars on the desktop supports SLI. However, this version dosen't use SLI. Recently I lost all video to my headset and after trying a number of ideas to get video back... I found that disabling SLI, I have dual 1070s, the video worked again on the headset. I ran project cars and the settings didn't change and the game ran just fine as before. The desktop version I can use SLI and set everything to ultra and it is super smooth. For VR I have to trun down many things and somethings off completely. If it were not for the sense of scale you get with VR, I would be upset that I had to turn things down. Now if they could get a headset that didn't have such a bad screen door effect.","Mar 18, 2017 at 8:15 PM",3, 2,
2022-05-28 12:38:11.888701,spartano21,where is the spanish language?,The game is good but before buying it says that it has several languages including spanish but after it is not in spanish.,"Mar 20, 2017 at 6:09 AM",1, 5,
2022-05-28 12:38:11.906653,drtimjm,wut the hutt,"I cant even get pass the part where you select the difficulty. I pressed every single button, but no luck. plz help meh","Apr 3, 2017 at 6:01 AM",1, 4,
2022-05-28 12:38:11.923607,DGK2800,:),I wanna go fast!,"Apr 3, 2017 at 5:08 AM",5, 2,
2022-05-28 12:38:11.939565,MarcusRatz,"Don't buy this here, buy it on Steam.","You can't play this Oculus version online with everyone else that has this game.  Buy it on Steam.  The Steam version works with Oculus and you can play online with everyone else.  If you buy it here, when you go into multiplayer, you'll be all alone.","Apr 6, 2017 at 11:38 AM",1, 10,
2022-05-28 12:38:15.042891,Mazzarin,,"I'm not really into circuit racing, but this is a great experience. Well-made and a lot of fun with a steering wheel controller.","Mar 4, 2017 at 4:23 AM",4, 0,
2022-05-28 12:38:15.059844,The-Fish-Stick,Doesn't Work...,"It worked once and now I get the loading Project Cars screen, then it fails back to the main menu.  Tried uninstalling and reinstalling and same problem.  Brand New maxed out Alienware so thats not the problem...WTF?  Test your software before selling it to us.  I recomend buying a Vive and shopping on the Steam store.  This is crap.","Jan 18, 2017 at 9:57 AM",1, 5,
2022-05-28 12:38:15.075802,Traydog97,,works with my rx 480 graphics card but oculus screen frequently blacks out. i dont have any issues like this with eve valkrie or any other games. does any one know why this might be ?,"Feb 20, 2017 at 12:56 AM",2, 0,
2022-05-28 12:38:15.092756,Jacob1z,Graphics was a let down,"The gameplay is overall good, but I thought the graphics could have been better, I would like to see some type of Motorcycle added too, that would be lit!","Feb 25, 2017 at 11:17 AM",4, 0,
2022-05-28 12:38:15.109711,Overwolf1000,Installed My First VR Race Car. WOW!!!!!,"I've just finish installing game played it a few times, turn computer on, off several times, game starts right up no issues as of yet, game came with bundle. Didn't think much of it till I saw all the negative reviews figure what the heck see if it loads up, have slow broadband did take a while, not much of a race car gamer, so I didn't have high hopes for this game, But when game :STARTED: the Sound , VR Graphics, I look around all looks as real as VR Tech. can offer as of yet. Excellent Scenery, Graphics  ""WOW""!!!!!!  well define, Dev's sure did an OUTSTANDING JOB on this game. Hope all find a way to install and play game, wish you all the BEST...","Jan 10, 2017 at 3:02 AM",5, 5,
2022-05-28 12:38:18.219026,SteveyScotBoy1580,VR Headset not connecting?,"I can see that the game plays alright when I see iut on the desktop. The only problem is that I can't see anything displayed on the Oculus VR headset I own. Basically, there's some bug that prevents the game from bheing played on the headset, and is restricted to the desktop screen only. If there's a fix to this solution, please let me know.","Nov 26, 2016 at 11:38 AM",2, 15,
2022-05-28 12:38:18.234984,Arkanoid1,Doesn't work!!!,"Launches first time after install but won't save level setting then crashes. Second run doesn't launch at all. Seems to remove a lot of the files from the install directory. Error from the Windows logs 25/01 16:27:06.982 {!ERROR!} [os/file] 
Unable to open file '\\?\Volume{23a83081-733e-4d84-8931-042a9bd4b900}\Program Files\Oculus\Software\Software\bandai-namco-entertainment-project-cars\Tools\TweakIt\TweakIt.exe': [3]
What a rip off!!!!! refund please.","Jan 19, 2017 at 7:31 PM",1, 0,
2022-05-28 12:38:18.251939,Huwapeton,Not impressive,"I expected a totally awesome experience. But, even with a GTX1070 I was not allowed to run at more than 60fps on the Oculus Headset. Graphics were overall underwhelming and am currenlty looking for a refund option.","Jan 25, 2017 at 1:19 PM",1, 2,
2022-05-28 12:38:18.267896,InsaneFirebat,,A realistic race simulator that may be too difficult for novice players. It runs really well on min-spec hardware and has plenty of graphics tuning options that you expect from PC games. I would highly recommend playing this with a race wheel setup as the (Xbox) controller is not great for driving with precision.,"Dec 8, 2016 at 8:07 AM",5, 2,
2022-05-28 12:38:18.284850,futuregamer_1,Won't install,Purchased this game as part of a bundle and it is the only one that won't install. If there are any updates please let me know. I too would like a refund on this game if there is no immenent fix.,"Jan 9, 2017 at 6:32 AM",1, 2,
2022-05-28 12:38:21.389584,Crabash,Very poor,"Horrible physics, over hyped, clearly bought race driver reviews. I am quite tolerant of poor menus as this is pretty normal in racing sims, few have good ones, hence I have learned to look past them if the sim is good, PCars is not though. Compared to other racing games, I suppose it's ok, but it's not a sim, not even close. If you think it is a good driving sim then you really need to try the likes of Assetto Corsa, rFactor 2, even iRacing if you need to empty your wallet. All work well in VR and are far superior driving/racing sims.","Aug 5, 2017 at 6:51 AM",1, 1,
2022-05-28 12:38:21.406538,Chet357,Wont Work,"I am having the same problem with this specific game. Mine states ""that it is taking more time than expected to load. If problem persists try closing the app and reloading""<<--- maybe not 100% accurate.
Is this where you are at as well? If you get it to work let me know what the fix is. I would like to know how to go about getting a refund on this if possible?","Jan 8, 2017 at 12:44 AM",1, 2,
2022-05-28 12:38:21.423493,theanonymouse,Uhg,Maybe I just suck at car games(I never buy them) but I wanted to try out one in vr... Whoops.,"Dec 23, 2016 at 12:05 AM",2, 3,
2022-05-28 12:38:21.439450,LionCat565,,"I am unable to get a street view, The view i get does not show the street, so I cant see where im going","Dec 2, 2016 at 6:10 PM",3, 3,
2022-05-28 12:38:21.457402,mattyj1974,Good game but I find the career to slow,The graphics are good and the racing is fine. I am just find dirt rally to be more interesting and challenging than whizzing wound and round a track. The career mode progresses at a snails  pace with too may rounds conducted in the same country with similar tracks. Needs more variety in the career mode.,"Nov 13, 2016 at 4:42 AM",4, 0,
2022-05-28 12:38:24.570778,kirottus,Great,"Although I'm not a fan of the calendar/seasonal campaign style you often see with sport games, the actual racing is still solid and fun.","Dec 14, 2016 at 7:49 AM",4, 0,
2022-05-28 12:38:24.587732,Coronox,Buggy at Best,"Bought this game with high hopes, but no matter what I try, it refuses to load on my headset. Looks fine on my monitor, but WILL NOT run on my headset. My computer is overspec in every category: twin 970s, i7-6700k @ 4.8 GHz, 32gb of drr4 3000 ram..... no idea what the issue is, but it's a frustrating 30ish dollar bath that I'm taking.","Dec 24, 2016 at 2:19 AM",1, 13,
2022-05-28 12:38:24.604687,kickicsama,Not much,"Game play is very difficult.
And it is dizzy.","Nov 25, 2016 at 10:49 PM",1, 5,
2022-05-28 12:38:24.623637,mbarekzy,,i like it !,"Dec 29, 2016 at 9:54 AM",3, 0,
2022-05-28 12:38:24.646575,Benandrews8,I want a refund,Game doesnt load and support team is terrible,"Jan 31, 2017 at 2:51 AM",1, 7,
2022-05-28 12:38:27.746927,Khaos253,Once again!!! Game won't work,I wish I wouldn't have bought this game!!! I feel like 1 out of 3 games is a dud and won't load or just won't work. I feel ripped off. I bought a $2k computer just for rift and 1/3 of the games I purchase don't even work!,"Jan 7, 2017 at 1:38 PM",1, 2,
2022-05-28 12:38:27.763882,Sun121,Not support T150 Thrustmaster,There is no button assigment for enter/select for the T150 profile.,"Oct 21, 2016 at 4:29 AM",1, 0,
2022-05-28 12:38:27.780837,lds1explorer,lds1warrior,"love the game but the software has issues and the devolpers are not willing to fix or admit to the issues their having, I hope theres a fix in the works in the mean time I have requested a refund","Jul 26, 2016 at 6:45 AM",2, 17,
