scrapping_date,review_author,review_title,one_reviews_text,review_date,review_rating,review_helpful,review_feedback
2022-05-28 12:37:24.422895,higrego,love this race simulation!,"I can not figure out how anyone could give this a bad review. The quality of the simulation, graphics, atmosphere, number of cars and number of tracks, all of it together, make it worth every penny. Other games like this nickle and dime you to death wanting you to pay for every single extra car or track. 
This game installed without any trouble and once I assigned my control options to my Saitek controller as a steering wheel and my CH rudder pedals as accelerator and brake pedals I have had a blast. 
I have zero regrets for purchasing and thank the design team for this excellent VR racing sim.","Jul 12, 2018 at 9:32 AM",5, 5,
2022-05-28 12:37:27.506759,troggdorr,Amazing,"Playing with a G27, one of the best racing sims I've ever seen, an amazing VR experience. Career mode is so much fun, starting out on the crazy fast go-karts.","Aug 29, 2018 at 8:13 PM",5, 9,
2022-05-28 12:37:27.522716,Jeracuda,Worst VR UI in history,"I spend more time constantly resetting my view as I work through the menu options than actually using the settings. I can't even type in a first name due to this terrible UI. If there's a way to turn of gaze cursor, I can't find it and it needs to stop. This game is way too UI heavy to have such a cumbersome and clunky UI. #shame","Jul 1, 2018 at 2:22 PM",1, 7,
2022-05-28 12:37:27.538673,Simo_Ivy,Not working,"Not working, can't reinstall...garbage.","Sep 5, 2018 at 1:01 AM",1, 2,
2022-05-28 12:37:27.554630,CMDR_Liella,,"Game constantly resets resolution, won't respond to Alt+Enter, incredibly unintuitive for anyone new to racing sims. Have to exit out of races/practice to change any tiny setting, makes the whole thing tedious","Jun 27, 2018 at 8:45 PM",1, 7,
2022-05-28 12:37:27.570588,Masterloc,"Some are lucky, some are not...",I'm one of the lucky ones that can play the game.  Took a chance when it was on sale.  It works.  Great graphics for a VR resolution.  Didn't play with it much back then I purchased it.  Now that I have a thrustmaster ts-xw wheel with th8a shifter.  Been playing with it a bit more often.  This is more of a sim than an arcade racer.  Which for me grows old fast.  Will probably play with it more often when I get a motion setup up.,"May 25, 2018 at 8:19 AM",5, 4,
2022-05-28 12:37:30.691387,MagnesiumAmmonite,THIS GAME SUCKS WASTE OF MONEY!!!,"I ALWAYS READ REVIEWS LIKE THIS AND DECIDE TO SEE FOR MYSELF. I END UP SAYING ""NOT TOO BAD"". WELL.... GOT NEW FOR YOU THIS GAME SUCKS! ITS EASIER TO JUST TELL YOU THE GAME IS TRASH!","Jul 4, 2018 at 1:41 PM",1, 2,
2022-05-28 12:37:30.706346,Paul163,Superb game,I want to encourage people that the negative reviews in my opinion largely come from people who should persevere with the settings until they get the controls right. I love this game and would certainly recommend it. I have played GT and do enjoy it very much but I think this is better in certain regards. Great game at a great price at the moment.,"May 13, 2018 at 4:08 AM",5, 13,
2022-05-28 12:37:30.722304,johanpruys46,The Best of the Best!,I simply wished I had a motion sim. Sitting in a car just listening to the rain and watch the sun come up...... This is just the best!,"May 10, 2018 at 8:36 PM",5, 9,
2022-05-28 12:37:30.738261,MarQc,Really not realistic and hard to play,"First I'd like to say I recently boughr a T150 thrusmaster setup with all the kit, I've been playing Dirt Rally a lots since I got it and I decided I wanted to play something else then AC or Dirt, so I bought this, wow what a horrible job on the gameplay even after setting all the configuration, the deadzone the FFB way to F up in this game, I was finally able to play it right and it took me like 2 hours to get somthing that work fine.

But the worst part in that is the fact the it feels like rolling on ice that's clearly stupid, there's just no way to finish a freaking race without a crash at least one time because if you lose your grip there's no way to get it back LOL.

Anw for me it was just a bunch of non sense and waste of money, maybe if you're playing with an xbox controller it's better but still except the weather that's amazing you got a really bad arcade style like game and I would like if I can to be reimburse.

Sorry for my grammar english is not my first language.","Apr 1, 2018 at 2:11 PM",1, 10,
2022-05-28 12:37:30.753221,Yocaptonyo101,All around amazing racing sim,"Coming from someone will not much interest in cars, but played many Forza and Need for Speed titles amongst other games. (Beam.ng and Project cars etc.) --This is a stellar VR experience to sit down and enjoy.  It isn't too punishing for beginners and makes for a great experiene even if you lack a whole racing wheel setup.  Personally wish there was Oculus Touch support but overall everything ran fine on a 1080 and 4770k setup.  Just figured I'd throw a review in here that was positive after seeing some people saying to stray away from the game bcz of the inability to start the thing... (There is a refund policy if things don't work for you personally).  **Only gripe I have** There probably is replayability here, with the vast amount of tracks selectable, cars, a multiplayer and career mode present, but for some reason I found myself playing it for two days and then putting it down.  Maybe racing sims just aren't for me, but I feel as though other games have held my attention much longer.  Thinking back to the hours spent just roaming on Need for Speed on the PS Vita or hopping into impromtu races on Forza and other titles, customizing and unlocking new parts for my cars, finding secrets around the world..  This is a much more grounded and realistic game, and in THAT way, I felt like there was just not much to do.","Apr 26, 2018 at 12:50 AM",4, 9,
2022-05-28 12:37:33.846597,freelivorno,Language,"In detalls there is italian language, but my game is olny english!","May 13, 2018 at 5:49 PM",3, 8,
2022-05-28 12:37:33.862555,SquirrelMasters,Touch controller support not included,"I am really dissappointed that this game does not provide support for the Oculus Rift touch controllers. The graphics look great, but it is unplayable.","Mar 5, 2018 at 12:19 PM",2, 31,
2022-05-28 12:37:33.878512,Stephen_hansford,just bought it project cars,i have been with Iracing for 3 years  so have just downloaded project cars i will leave my opinion when i have given project cars a good testing.,"Jun 20, 2018 at 9:00 PM",1, 2,
2022-05-28 12:37:33.893472,caseymac1,,VR racing rocks! You don't have to have a wheel. I am using an xbox one game controller quite successfully. You do have to reduce the controller sensitivities  which smooths out the analog sticks. I use both analog sticks for steering and throttle/brakes. There are extra DLC packs available. When will we see them for purchase at the Oculus store?,"Mar 15, 2018 at 9:53 AM",5, 3,
2022-05-28 12:37:33.909430,tonyfromsyracuse,man you're there!,"One of the best examples of the power of VR. you are IN that car and its really a blast to be screaming down those tracks, of which there is a tons of variety seriously, the sun effects on the road and the lens flare really is beautiful. 
only gripe.....I wish these games would allow for a total straight track....even if unrealistic, they give you these cars and great graphics but its kind of a drag after awhile to have to constantly turn and ruin the groove...man, I just want to open her up fast on a straight away and move around the cars all around me rather than speed, slow down, speed slow down speed slow down! maybe have a straightaway with long slow turns rather than sharp.","May 12, 2018 at 8:29 PM",4, 3,
2022-05-28 12:37:37.003342,B1llGallagher,,good fun runs great on my pc no lag well worth the cash enjoy and with xbox controller all good. just got logitech g920 and stand now we are talking stunning game play .,"Aug 4, 2018 at 2:25 PM",4, 1,
2022-05-28 12:37:37.019300,Faber,Oculus does NOT stand by return policy,"I picked up several games over the holidays and when I returned the ones that were awful or just would even install from the Oculus home marketplace I was denied a refund even though I had not even played the game ( or even was able to install it). 

here is how Oculus treats their customers:

Hello,

Thanks for reaching out to us.

After review of your account, we've identified that you have requested a high number of content refunds within a short period of time.

As a result, your account has been flagged for potential abuse of the policy and this refund request has been denied.

For more information on the Content Refund Policy, please visit https://www.oculus.com/legal/rift-content-refund-policy/

If you believe this decision has been reached in error, please let us know.

Thank you,

Oculus Support﻿","Jan 2, 2018 at 1:42 AM",1, 76,
2022-05-28 12:37:37.036254,Wembley808,The Good & Bad,"I bought this as it was 50% off... stated I needed a Xbox controller... I have one but wasn't prepared to pay £60 for one with a blutooth adapter for Pc.. so got a usb cable instead... not this issue... I pretty crap at racing games and set everything as a newbee... set my settings to ultra crap racing driver with every aid turned on however on a free play auto braking failed.. no assistance at all.  I also suffered great motion sickness from this from all angles... which I don't usually suffer from.. The grahics are good, relative to the cars and tracks, sound is also great... 
I guess this is a horses for courses game, either you love it or your feeling sick.  Looked at options to try and reduce MS but nothing that sticks out.","Jan 24, 2018 at 7:02 AM",2, 7,
2022-05-28 12:37:37.052212,aisepos,Awesome game!,"I don`t understand all this negative feedbacks.... :(
This game is just great in terms of VR graphics, feedback (steering wheel) and driving sensation overall.
If one has motion sickness with this game,  for sure its not the game`s fault. I for one I have non, in neither view options. I enjoy every sec of playing.
Finally a game where you can enjoy VR !

oh.. and I use steering wheels with pedals, I think for this game is a must.","Jan 7, 2018 at 6:57 PM",5, 11,
2022-05-28 12:37:37.068169,chentegonzalez,Expected more,I was trying to use the VR controllers and realized I had to use my keyboard with the VR headset. I actually got pretty bored after playing it for like 10 mins. This should have been a free game in my option.,"Feb 22, 2018 at 12:40 AM",1, 14,
2022-05-28 12:37:40.205950,Nisarg012,,enjoyed playing,"May 12, 2018 at 1:20 PM",3, 2,
2022-05-28 12:37:40.221907,SteveG7RTA,,"Bought it just last night with it being on offer.
Wow! I love it!  I struggled at first using my keyboard to steer, which is no good at all. You need a steering wheel or joystick at least. I have now managed to get my old CH Products flight yoke to work as a steering wheel & its actually working quite well. I've got all the graphics on full & they are amazing. I do have quite a high spec pc (i7-7700K @ 4.2GHZ & 32GB ram plus GTX1080) but I'm sure you dont need this much power. It's so fluid & stunning.
I admit I havent played too many racing games over the years, but this is certainly the best I've ever seen. The list of tracks available & the cars you can drive is huge.
One track that's sadly not included is Dunsfold Aerodrome (aka Top Gear Track) but that can't be helped apparently. 
After reading someone else's review I changed the weather conditions to heavy rain. WOWWW!  It's so realistic! With the raindrops trickling down my helmet I actually started to feel cold & wet LOL  & as for the large puddles everywhere.. so realistic.
Overall it's a fantastic simulator & the VR experience is second to none. I haven't had any motion sickness unlike some, just sheer enjoyment!","Jan 28, 2018 at 1:29 AM",5, 10,
2022-05-28 12:37:40.238862,CodeMonkeyAlpha,Awesome,"Wow this is a great game, the range of cars and conditions makes it a challenge and the combination of a VR headset and a force feedback wheel is probably as close as you will get without getting on a track. I didn't get any motion sickness, it is intense, but in a frantic wheel spinning throwing it up the inside kind of way.","Feb 7, 2018 at 9:35 AM",5, 3,
2022-05-28 12:37:40.254819,venom690,,"I don't know why the bad reviews, the game is best driving game i have played in VR , first of all my specs 4790k i7, gtx 1070 32 gigs of DDR3  solid state drive PCI-E, so hardly a top of the line PC, yet I can play on everythign on Ultra, the physics are a bit tricky since I play it in pro with a xbox controller, I have done track days on my motorcycle and raced a bit in cars in canyon roads, but these cars feel unruly , it is easy to lose the tail of the car and once you do (unlike a real car) there is not getting it back, you are going to go into a wall, but after a few hours I have gotten the hang of at least the tamest cars , I recommend the FRS rabbit (Turbo) it is one of the funnest cars to drive since it only has 370 horses so it does not behave too bad, the interior of the cars look great, the roads.. well, oculus suffer with long distance VR , a price to pay until we get high rez VR, i take out a star for noone being online ever...","Jan 11, 2018 at 3:24 PM",4, 4,
2022-05-28 12:37:40.271774,XJ05HUA,Wheel and pedals not working,"I have got the pedals and wheel that the game says it works with( it is in the preset settings atleast) and i have set them up as the game says to but when i go into a race and i use my pedals and wheel, nothing happens.","Jan 7, 2018 at 2:53 AM",1, 10,
2022-05-28 12:37:43.361152,KyalandGeda,Only for the most intense,Only if you have been trained to go up in space or fly aircraft well beyond mach 5 do not buy this game. I can do a lot of rating intense games but this is beyond intense it is the double black diamond of ski slopes if it was down mount everest and you were riding a tiger while the earth was splitting in half. It is so ridiculous I could hardly get through a lap and I was so immediatly done. So buy at your own risk...,"Dec 27, 2017 at 12:57 PM",1, 25,
2022-05-28 12:37:43.377109,kirk1580,joyous if you have a wheel,Get a wheel and you will enjoy it,"Mar 15, 2018 at 7:31 AM",5, 7,
2022-05-28 12:37:43.393066,AndrewR,Of 20 games - Only Sever VR Sickness,"I knew the risks, but my body betrayed me.  I had such a bad case of VR Sickness following my first two attempts to drive the go-cart around 3-laps, that I broke out into a cold sweat from head to toe and was nauseated for three hours afterwards. I literally tore off my headset off during my 2nd set of 3 laps.  This is the only game that I deeply regret because of the unstable horizon, shaking chassis, and overall experience.  I realize there are some advanced settings in the .INI that I can use to stabilize the horizon, but I'm genuinely afraid to ever launch this particular game again.  I've had better VR experiences on VorpX emulation of non-VR Games.  This is the only purchase that I genuinely regret.  I love racing games.   I don't blame my hardware, because I have a high-end PC (i7-6700k @ 4.4GHz with dual GeForce GTX 1080 SLI).  The framerate was not the problem.  I've never had such a violent physiological stress response to anything.  I had sweat poured out of every pore of my body such that it soaked my shirt and pants.  Because of that reaction, I really haven't even put my headset back on for the last two months.   Prior to this, I was playing nightly for 2-3 hours.  I attempted a refund after the 14-day period (because this was such a profoundly sickening experience), but it was rejected.  The graphics were good.  The car control was challenging (even for just the go-carts at training levels).   However, the vibration and horizon made me violently ill.  The closest analogy I can make are some of the migraines that I got when I was younger.  The Migranes would cause intense nausea and vomiting.  After playing, I ended up taking a cold shower and laying down in the dark for three hours. I realize how ridiculous this sounds, but I can’t control how my body responds.  Some reviews warned of this.  I took a chance and lost.","Nov 19, 2017 at 12:22 AM",1, 26,
2022-05-28 12:37:43.410021,rob.upson,,"Way better than I was expecting, a true racing VR experience with pretty much no setup issues although if you've not played it before you may find the menu's a little odd, thankfully I havn't experienced any motion sickness just a pure adrenilin rush. Highly recomended especially as it's on sale atm.","Jan 11, 2018 at 2:35 AM",5, 3,
2022-05-28 12:37:43.425485,Astharian,How to update?,"I bought Project Cars from the Oculus Store and the game is installed as version 10.0.0.0.1233, how do I update it? This version of the game doesn't keep track of my lap times, the career mode crashes when I pick the class I want to drive and I have no access to multiplayer games.
--EDIT update--
The career mode seems to work now. After doing some research it seems like it is a well know issue that the game does not record any of your lap times ever, somehow it still exists. There's still no multiplayer games shown when I select browse games, maybe no one plays this online anymore?
Pretty awesome game though, buy it if you get a good deal on it. Otherwise save your money for Project Cars II.","Jan 9, 2018 at 7:15 AM",3, 1,
2022-05-28 12:37:46.545239,ParadiseDecay,See my 1st Impressions video below!,"https://www.youtube.com/watch?v=GuiwoPAlLlk

Superb VR racing experience that everyone with a VR headset needs to experience! - Enough said.","Feb 5, 2018 at 4:41 AM",4, 4,
2022-05-28 12:37:46.561197,xgoldxbox,Motion sickness? Here's a tip:,"It is a driving simulator. I played it at one of my friends with a driving seat, and it was awesome, now I own an Oculus, and we're yet to try combining the two of them. First time I tried it with Oculus, it gave me motion sickness straight away, but I realized, you get motion sickness, if the ""camera"" moves, when your head actually doesn't. So my advice is to everyone, if you're using a VR headset with this game, simply turn off the head movements and reactions in the settings. That greatly reduces the actual cause of the sickness.","Oct 22, 2017 at 9:25 PM",4, 33,
2022-05-28 12:37:46.577154,Finnaw,DO NOT BUY THIS GAME,"I got the game a very very VERY long time ago and have tried everyting to get it to run time and time again, still the game won't start. For the love of god keep your money and spend it on something worthwhile.","Apr 15, 2018 at 1:14 PM",1, 10,
2022-05-28 12:37:46.593111,Real_Sun,Great Game.,I am going to recommend this game to all of my friends who are in to game like this. I think it is a very smooth game (with occasianal bad luck but thats just me) that is very easy to pick up and play a few rounds online or do the campaign. Overall 5/5,"Dec 18, 2017 at 3:07 PM",5, 2,
2022-05-28 12:37:46.609068,GregTampa,no support,"support sucks, only uses controller to play.. the menu is displayed on top of everything so you cant see to playt he game correctly.
if they make it so they support the touch controllers ill change this review.","Dec 19, 2017 at 1:17 PM",1, 8,
2022-05-28 12:37:49.694433,Twisteddigit,Good times!,"You definitely need a wheel.  If you have one, the Oc Rift VR experience is fantastic!","Jan 8, 2018 at 11:34 AM",5, 1,
2022-05-28 12:37:49.710390,Zerkini,What Motion Sickness?,"A lot of complaints about motion sickness. But I don't get any motion sickness. Perhaps I'm a rare case. 

However, I do have other complaints.
There's never an online game available?? WTF is the point in playing a racing sim if not to play against other people? Can't play against other people, useless. 

The option to stare at a specific menu option is available, but you can also use the controller to select menu items. Problem with this is there is way to turn it off that I've found, and I've gone through the menu options one by one hoping to find the option to turn it off. I don't have time to read the information on screen before it selects some random thing that the cross hair happens to be pointed at. 

E-Brake ~ There is an E-Break, but it doesn't break at all. This just means you can rev your engine while stationary or moving, it doesn't hinder movement ~AT ALL~ So no whipping around really tight corners. You're just going to go off track as all it technically does it put you in neutral. I was pointed uphill and used the ""E-Brake"" but the car started rolling downhill (it could barley be called a ""hill"") 

Using a controller ~
I have a controller, there is no ""slightly turning"" it's like their controller settings are designed to fixed degree points. Which forces you to over/understeer. Likely better with a steering wheel, but I already spent the money on the game and wanted to make sure that I liked the game before investing the money into a steering wheel. 

This game doesn't feel like a simulation to me, more like a cockpit viewed racing game (other view options are available) with a VR headset that lets you look around. I in no way feel like I'm actually there. Random ""bump"" noises when traveling at low speeds while easing on the throttle. I would rather play The Crew on PS4 as a simulator than this. 

Totally not worth the investment, specifically without the online races being available.","Nov 14, 2017 at 6:01 AM",1, 5,
2022-05-28 12:37:49.727345,ch4ron,Disaster.,This game has been ported to Oculus. And it suck$. Going throug menu (which you see as screen in front of you) is pain in the a$$. You must stare at one piont for three seconds keeping crosschair at manu item. But sometimes crosschair disapears. So you shake your head hoping that it will bring him back. Another problem is support for steering wheel. I've got Logitech G29 which should be OK. But it's not. Sometimes it works OK but mostly it's configuration becomes random. You go through all the pain with menu just to find out that you car starts going backwards at full speed at no reason. Or it doesn't going anywhere despite your efforts with steering wheel and pedals. If you thinking about buing Project Cars knock your head on your desk and buy Asseto.,"Nov 5, 2017 at 3:43 AM",1, 9,
2022-05-28 12:37:49.743303,grekb,Better than i expected,"First let me say that this game is car SIMULATION. Now, the graphics of the game are the best i have seen in VR especially with rain effect witch is just UNBELIEVABLE! You should buy the game just for the weather effects, seriously. Obviously the game cant be played for long since you get motion sickness because of the... guess what, motion. Still one of the best games on my collection","Oct 5, 2017 at 9:51 PM",4, 9,
2022-05-28 12:37:49.759765,HannesAusBerlin,very bad VR adaption of a great game,"Only Gaze control on the menu, no support of touch controllers, etc., etc.","Dec 18, 2017 at 5:52 AM",2, 6,
2022-05-28 12:37:52.844158,Octofart,Do you like sims?,"I was expecting a simulated driving experiance but this is a race simulator. Sure you can drive nearly uncontrollable cars but it seems to me this game is all about simulating races and race seasons. Fantasy racing league? To me, purchasing this game with the intent to play it, is like playing fantasy football while expecting to actually play football. Very dissapointed in this purchase. If you want a driving simulator, this is not it.","Oct 20, 2017 at 8:03 AM",2, 3,
2022-05-28 12:37:52.861113,robvanhoose,Amazing,"For many years I've driven the amazing SimBin racing titles (realistic, not arcade) and jumped at the opportunity when they offered the Nürburgring. The big deal was how much detail they put into the survey and accuracy.  Well, I just ran through it several times in Project Cars. Amazing. My throttle and braking reflexes carried right over. 

Regarding the VR bit -- I'm really impressed with the font -- it's easily readable, much more so than the fonts in Elite Dangerous.

About control -- I have an Obutto + Logitech G35 sitting next to me but just played with the Oculus and Xbox One controller tonight, still felt amazing.

I think some of the negative reviews might stem from this being closer to a simulator than an arcade racer. You will have to be very touchy with throttle and braking to keep these cars where you want them. This is not Need For Speed.

Thoroughly worth every penny I spent.","Sep 25, 2017 at 1:09 PM",5, 8,
2022-05-28 12:37:52.878067,jaguth,Intense Motion Sickness,"I was excited for this game, but it gave an intense motion sickness.  some of the other reviews mention uncontrollable cars, which i also experience (but i also thought maybe i'm just bad at driving games). perhaps that increased the motion sickness as well; incorrect physics?","Sep 27, 2017 at 3:14 PM",1, 5,
2022-05-28 12:37:52.896020,Stinger0625,WOW from a long time sim racer,"Downloaded, plugged in my Logi G25 wheel. Loaded up and simply go to quick race, everything assigned, settings are great. Off to the races!!!!  Few laps at one of my favorites Brands Hatch and was having the best racing experience I've ever had going back to Gran Prix Legends!  Yea the menus are cumbersome but after about 15 minutes had them down.  Sorry for those having problems getting it to run but if you do and you have a good wheel you're in for some fun.","Aug 28, 2017 at 4:40 AM",5, 4,
2022-05-28 12:37:52.917960,Tesox,,"Don't buy !!! Today I started the game as usual and my savegames are all gone. 
This game is a joke .....","Sep 24, 2017 at 6:32 AM",1, 4,
